timestamp,source,title,link,published,content
2025-09-09T01:21:11,MarketWatch Top,Obamacare tax breaks could get extended in government-shutdown fight. Here’s why.,https://www.marketwatch.com/story/obamacare-tax-breaks-could-get-extended-in-a-government-shutdown-fight-heres-why-9fe96daa?mod=mw_rss_topstories,"Tue, 09 Sep 2025 01:09:00 GMT",
2025-09-09T01:21:11,MarketWatch Top,Nebius’ stock is surging. Why Microsoft just inked a deal with the cloud company.,https://www.marketwatch.com/story/nebius-stock-is-surging-why-microsoft-just-inked-a-deal-with-the-cloud-company-ec97b00a?mod=mw_rss_topstories,"Tue, 09 Sep 2025 00:21:00 GMT",
2025-09-09T01:21:11,MarketWatch Top,I’m 43 with $450K in my 401(k) and $270K in one company’s stock. Is this a risky plan?,https://www.marketwatch.com/story/im-43-with-450k-in-my-401-k-and-270k-in-one-companys-stock-is-this-a-risky-plan-21d1edde?mod=mw_rss_topstories,"Mon, 08 Sep 2025 23:20:00 GMT",
2025-09-09T01:21:11,MarketWatch Top,What investors should expect from stocks after the Fed’s September meeting,https://www.marketwatch.com/story/what-investors-should-expect-from-stocks-after-the-feds-september-meeting-68af2876?mod=mw_rss_topstories,"Mon, 08 Sep 2025 23:05:00 GMT",
2025-09-09T01:21:11,MarketWatch Top,"My parents promised to split their estate 50/50, but my mother gave my brother real estate. Is that fair?",https://www.marketwatch.com/story/my-parents-promised-to-split-their-estate-50-50-but-my-mother-gave-my-brother-real-estate-is-that-fair-ec30343f?mod=mw_rss_topstories,"Mon, 08 Sep 2025 23:04:00 GMT",
2025-09-09T01:21:11,MarketWatch Top,Worried about Nvidia’s stock? This analyst has a $2 trillion reason to remain calm.,https://www.marketwatch.com/story/worried-about-nvidias-stock-this-analyst-has-a-2-trillion-reason-to-remain-calm-07463ae2?mod=mw_rss_topstories,"Mon, 08 Sep 2025 22:57:00 GMT",
2025-09-09T01:21:11,MarketWatch Top,"GameStop earnings are coming, as bitcoin looms ever larger for the OG meme stock",https://www.marketwatch.com/story/gamestop-earnings-are-coming-as-bitcoin-looms-ever-larger-for-the-og-meme-stock-32c244c2?mod=mw_rss_topstories,"Mon, 08 Sep 2025 22:55:00 GMT",
2025-09-09T01:21:11,MarketWatch Top,Why U.S. companies could see closed markets and higher costs as globalization ends,https://www.marketwatch.com/story/this-growing-risk-to-your-stock-portfolio-is-new-volatile-and-here-to-stay-2bbb5150?mod=mw_rss_topstories,"Mon, 08 Sep 2025 22:55:00 GMT",
2025-09-09T01:21:11,MarketWatch Top,SpaceX deal sends EchoStar’s stock soaring. Why Elon Musk is buying $17 billion in wireless spectrum.,https://www.marketwatch.com/story/echostar-clinches-a-17-billion-spectrum-deal-with-elon-musks-spacex-and-the-stock-soars-again-fdf3962d?mod=mw_rss_topstories,"Mon, 08 Sep 2025 22:31:00 GMT",
2025-09-09T01:21:11,MarketWatch Top,Opendoor’s stock flashes ‘bearish engulfing’ chart pattern. Is the rally over?,https://www.marketwatch.com/story/opendoors-stock-flashes-bearish-engulfing-chart-pattern-is-the-rally-over-1276f0da?mod=mw_rss_topstories,"Mon, 08 Sep 2025 22:31:00 GMT",
2025-09-09T01:21:11,CNBC Top News,Potential Trump tariff refund bill could top $1 trillion as Supreme Court fight looms,https://www.cnbc.com/2025/09/08/trump-tariff-refund-trade-treasury-bessent-supreme-court.html,"Mon, 08 Sep 2025 21:10:33 GMT",
2025-09-09T01:21:11,CNBC Top News,Ex-Meta employee files whistleblower suit for alleged security flaws at WhatsApp,https://www.cnbc.com/2025/09/08/ex-meta-employee-whistleblower-suit-alleged-security-flaws-whatsapp-.html,"Mon, 08 Sep 2025 21:14:32 GMT",
2025-09-09T01:21:11,CNBC Top News,"Japan's Nikkei crosses 44,000 to hit fresh highs, extending rally after Ishiba's resignation announcement",https://www.cnbc.com/2025/09/09/asia-markets-nikkei-225-kospi-nifty-50.html,"Tue, 09 Sep 2025 01:09:38 GMT",
2025-09-09T01:21:11,CNBC Top News,What to know about the Hyundai-LG plant immigration raid in Georgia,https://www.cnbc.com/2025/09/08/hyundai-lg-immigration-raid-georgia.html,"Mon, 08 Sep 2025 16:24:52 GMT",
2025-09-09T01:21:11,CNBC Top News,Trump Epstein letter and drawing from 'birthday book' released,https://www.cnbc.com/2025/09/08/trump-epstein-birthday-book-oversight.html,"Mon, 08 Sep 2025 23:31:12 GMT",
2025-09-09T01:21:11,CNBC Top News,Nebius' stock soars 60% on multibillion-dollar AI infrastructure deal with Microsoft,https://www.cnbc.com/2025/09/08/nebius-stock-soars-on-ai-infrastructure-deal-with-microsoft-.html,"Mon, 08 Sep 2025 21:58:02 GMT",
2025-09-09T01:21:11,CNBC Top News,Here's how to get a better mortgage rate as the 30-year fixed nears a 1-year low,https://www.cnbc.com/2025/09/08/how-to-get-the-best-mortgage-rates-as-30-year-fixed-nears-1-year-low-.html,"Mon, 08 Sep 2025 20:07:57 GMT",
2025-09-09T01:21:11,CNBC Top News,"Trump raised the SALT deduction cap to $40,000: Here's what it means for taxpayers",https://www.cnbc.com/2025/09/05/salt-deduction-effect-homeowners-national-debt.html,"Fri, 05 Sep 2025 18:24:28 GMT",
2025-09-09T01:21:11,CNBC Top News,Jim Cramer reviews recent Wall Street fears that were overblown,https://www.cnbc.com/2025/09/08/jim-cramer-reviews-recent-wall-street-fears-that-were-overblown.html,"Mon, 08 Sep 2025 22:38:52 GMT",
2025-09-09T01:21:11,CNBC Top News,Trump loses bid to overturn $83.3 million judgment in E. Jean Carroll defamation case,https://www.cnbc.com/2025/09/08/trump-carroll-defamation-appeal.html,"Mon, 08 Sep 2025 18:28:29 GMT",
2025-09-09T01:21:11,CNBC Top News,Traders see a chance the Fed cuts by a half point,https://www.cnbc.com/2025/09/08/traders-see-a-chance-the-fed-cuts-by-a-half-point.html,"Mon, 08 Sep 2025 19:16:12 GMT",
2025-09-09T01:21:11,CNBC Top News,Cognition valued at $10.2 billion two months after Windsurf purchase,https://www.cnbc.com/2025/09/08/cognition-valued-at-10point2-billion-two-months-after-windsurf-.html,"Mon, 08 Sep 2025 21:50:34 GMT",
2025-09-09T01:21:11,CNBC Top News,Nvidia's Huang joining Trump on UK state visit next week,https://www.cnbc.com/2025/09/08/nvidia-huang-trump-uk-state-visit.html,"Mon, 08 Sep 2025 19:19:16 GMT",
2025-09-09T01:21:11,CNBC Top News,Trump appears with Rolex CEO at U.S. Open even as 39% tariff set to pummel Swiss watch imports,https://www.cnbc.com/2025/09/08/trump-us-open-invitation-rolex-tariff-switzerland.html,"Mon, 08 Sep 2025 21:14:23 GMT",
2025-09-09T01:21:11,CNBC Top News,"Falling bond yields support the tech trade, and what BlackRock's latest deal means for earnings",https://www.cnbc.com/2025/09/08/falling-bond-yields-support-the-tech-trade-and-what-blackrocks-latest-deal-means-for-earnings.html,"Mon, 08 Sep 2025 19:05:58 GMT",
2025-09-09T01:21:11,CNBC Top News,Robinhood shares soar 15% after getting long-sought addition to S&P 500,https://www.cnbc.com/2025/09/08/robinhood-shares-soar-14percent-after-getting-long-sought-addition-to-sp-500.html,"Mon, 08 Sep 2025 20:04:29 GMT",
2025-09-09T01:21:11,CNBC Top News,"StubHub IPO: Ticket reseller aims to raise up to $9.2 billion, pricing at $22 to $25 per share",https://www.cnbc.com/2025/09/08/stubhub-stub-ipo-stock.html,"Mon, 08 Sep 2025 17:54:09 GMT",
2025-09-09T01:21:11,CNBC Top News,Worker confidence in finding a new job hits record low in New York Fed survey,https://www.cnbc.com/2025/09/08/worker-confidence-in-finding-a-new-job-hits-record-low-in-new-york-fed-survey.html,"Mon, 08 Sep 2025 18:59:56 GMT",
2025-09-09T01:21:11,CNBC Top News,$1.787 billion Powerball jackpot winning tickets sold in two states — one could pay a bigger tax bill,https://www.cnbc.com/2025/09/08/powerball-jackpot-winning-tickets.html,"Mon, 08 Sep 2025 17:42:46 GMT",
2025-09-09T01:21:11,CNBC Top News,The U.S. is losing travelers. Here are the countries that stand to benefit,https://www.cnbc.com/2025/09/07/where-are-travelers-going-if-they-arent-going-to-the-us.html,"Sun, 07 Sep 2025 23:00:01 GMT",
2025-09-09T01:21:11,CNBC Top News,Chinese EV maker Xpeng eyes global launch of mass-market Mona brand in 2026,https://www.cnbc.com/2025/09/08/xpeng-plans-global-launch-of-mass-market-mona-brand-in-2026.html,"Mon, 08 Sep 2025 14:47:18 GMT",
2025-09-09T01:21:11,CNBC Top News,Here's how  to handle your student loans after losing a job,https://www.cnbc.com/2025/09/08/how-to-handle-your-student-loans-after-losing-your-job.html,"Mon, 08 Sep 2025 15:26:18 GMT",
2025-09-09T01:21:11,CNBC Top News,Private equity giants raid Wall Street as fundraising talent wars heat up,https://www.cnbc.com/2025/09/08/global-private-equity-firms-talent-analyst-jobs-hiring-spree-deal-drought-wall-street.html,"Mon, 08 Sep 2025 10:08:22 GMT",
2025-09-09T01:21:11,CNBC Top News,Dan Ives to become chair of company that will buy Sam Altman-backed Worldcoin for its treasury,https://www.cnbc.com/2025/09/08/dan-ives-to-become-chair-of-company-that-will-buy-sam-altman-backed-worldcoin-for-its-treasury.html,"Mon, 08 Sep 2025 18:40:29 GMT",
2025-09-09T01:21:11,CNBC Top News,"Serena Williams invests in women's basketball league Unrivaled, now valued at $340 million",https://www.cnbc.com/2025/09/08/serena-williams-unrivaled-investment-league-value.html,"Mon, 08 Sep 2025 12:42:25 GMT",
2025-09-09T01:21:11,CNBC Top News,The FAFSA officially opens on Oct. 1—but you can apply for aid now,https://www.cnbc.com/2025/09/08/fafsa-officially-opens-october-1-but-you-can-apply-for-aid-now.html,"Mon, 08 Sep 2025 13:00:01 GMT",
2025-09-09T01:21:11,CNBC Top News,China's shipments to U.S. plunge 33% in August as overall exports growth hits a 6-month low,https://www.cnbc.com/2025/09/08/china-exports-growth-in-august-drops-missing-expectations-.html,"Mon, 08 Sep 2025 06:06:31 GMT",
2025-09-09T01:21:11,CNBC Top News,AppLovin and Robinhood added to S&P 500,https://www.cnbc.com/2025/09/05/applovin-robinhood-sp-500.html,"Fri, 05 Sep 2025 23:02:13 GMT",
2025-09-09T01:21:11,CNBC Top News,"Highly likable people follow one simple rule—it has nothing to do with being 'fake nice,' says communication expert",https://www.cnbc.com/2025/09/08/the-most-likable-people-follow-simple-rule-its-not-about-being-fake-nice.html,"Mon, 08 Sep 2025 13:34:01 GMT",
2025-09-09T01:21:11,CNBC Top News,"AI's impact on the workforce is ‘small,' but it’s not ‘zero,’ labor economist says",https://www.cnbc.com/2025/09/08/ai-artificial-intelligence-workforce-impact.html,"Mon, 08 Sep 2025 13:30:06 GMT",
2025-09-09T01:21:11,Investing.com All News,"Aquestive therapeutics (AQST) COO Jung Cassie sells $310,900 in shares",https://uk.investing.com/news/insider-trading-news/aquestive-therapeutics-aqst-coo-jung-cassie-sells-310900-in-shares-93CH-4255483,2025-09-09 01:20:08,
2025-09-09T01:21:11,Investing.com All News,"Dageville, Snowflake president, sells $5.57 million in shares",https://uk.investing.com/news/insider-trading-news/dageville-snowflake-president-sells-557-million-in-shares-93CH-4255482,2025-09-09 01:04:08,
2025-09-09T01:21:11,Investing.com All News,MicroStrategy at H.C. Wainwright: Bitcoin as Digital Capital,https://uk.investing.com/news/transcripts/microstrategy-at-hc-wainwright-bitcoin-as-digital-capital-93CH-4255481,2025-09-09 01:02:08,
2025-09-09T01:21:11,Investing.com All News,Serve robotics CFO read sells $74931 in stock,https://uk.investing.com/news/insider-trading-news/serve-robotics-cfo-read-sells-74931-in-stock-93CH-4255478,2025-09-09 00:52:09,
2025-09-09T01:21:11,Investing.com All News,Murdoch family trusts to sell 16.8 million shares of Fox Corp,https://uk.investing.com/news/company-news/murdoch-family-trusts-to-sell-168-million-shares-of-fox-corp-93CH-4255477,2025-09-09 00:52:08,
2025-09-09T01:21:11,Investing.com All News,Murdoch family trusts to sell 14 million News Corp class B shares,https://uk.investing.com/news/company-news/murdoch-family-trusts-to-sell-14-million-news-corp-class-b-shares-93CH-4255476,2025-09-09 00:50:08,
2025-09-09T01:21:11,Investing.com All News,"Serve robotics chief hardware officer sells $133,591 in SERV",https://uk.investing.com/news/insider-trading-news/serve-robotics-chief-hardware-officer-sells-133591-in-serv-93CH-4255475,2025-09-09 00:44:08,
2025-09-09T01:21:11,Investing.com All News,Form 144 CLEANSPARK For: 8 September,https://uk.investing.com/news/filings/form-144-cleanspark-for-8-september-93CH-4255474,2025-09-09 00:38:08,
2025-09-09T01:21:11,Investing.com All News,QuantumScape CTO Holme sells $1.9m in shares,https://uk.investing.com/news/insider-trading-news/quantumscape-cto-holme-sells-19m-in-shares-93CH-4255473,2025-09-09 00:28:08,
2025-09-09T01:21:11,Investing.com All News,Snowflake at Goldman Sachs Conference: Evolving into a Data and AI Leader,https://uk.investing.com/news/transcripts/snowflake-at-goldman-sachs-conference-evolving-into-a-data-and-ai-leader-93CH-4255472,2025-09-09 00:24:08,
2025-09-09T01:21:12,Investing.com Bond News,Rates Spark: A Beige Book That Smells a Tariff Stutter,https://uk.investing.com/analysis/rates-spark-a-beige-book-that-smells-a-tariff-stutter-200618517,"Sep 04, 2025 05:22 GMT",
2025-09-09T01:21:12,Investing.com Bond News,Treasury’s Firebreak or Fuel? The Bond Market’s Hidden Inferno,https://uk.investing.com/analysis/treasurys-firebreak-or-fuel-the-bond-markets-hidden-inferno-200618475,"Sep 03, 2025 05:37 GMT",
2025-09-09T01:21:12,Investing.com Bond News,Rates Spark: Dealing with Eurozone Disinflation,https://uk.investing.com/analysis/rates-spark-dealing-with-eurozone-disinflation-200618453,"Sep 02, 2025 07:18 GMT",
2025-09-09T01:21:12,Investing.com Bond News,Rates Spark: No Brain Steepeners Exposed to Reversals,https://uk.investing.com/analysis/rates-spark-no-brain-steepeners-exposed-to-reversals-200618401,"Aug 29, 2025 09:26 GMT",
2025-09-09T01:21:12,Investing.com Bond News,Bond Market Flashes Fiscal Dominance Warning as Yields Diverge,https://uk.investing.com/analysis/bond-market-flashes-fiscal-dominance-warning-as-yields-diverge-200618384,"Aug 28, 2025 16:37 GMT",
2025-09-09T01:21:12,Investing.com Bond News,Rates Spark: The Lisa Cook Affair and the Curve,https://uk.investing.com/analysis/rates-spark-the-lisa-cook-affair-and-the-curve-200618367,"Aug 28, 2025 07:03 GMT",
2025-09-09T01:21:12,Investing.com Bond News,Eurozone Bond Spreads Face a Jittery Autumn,https://uk.investing.com/analysis/eurozone-bond-spreads-face-a-jittery-autumn-200618345,"Aug 27, 2025 11:42 GMT",
2025-09-09T01:21:12,Investing.com Bond News,Credit Spreads at 25-Year Lows Highlight Investors’ Volatility Blind Spot,https://uk.investing.com/analysis/credit-spreads-at-25year-lows-highlight-investors-volatility-blind-spot-200618336,"Aug 26, 2025 13:28 GMT",
2025-09-09T01:21:12,Investing.com Bond News,Rates Spark: The Bottoming Out of the 2-Year Bund,https://uk.investing.com/analysis/rates-spark-the-bottoming-out-of-the-2year-bund-200618326,"Aug 26, 2025 08:18 GMT",
2025-09-09T01:21:12,Investing.com Bond News,Even the Worst Foreign Bonds Are Beating US Treasuries Thanks to a Weak Dollar,https://uk.investing.com/analysis/even-the-worst-foreign-bonds-are-beating-us-treasuries-thanks-to-a-weak-dollar-200618307,"Aug 25, 2025 12:28 GMT",
2025-09-09T01:21:12,Google News Reuters,Trump administration says it launches ICE crackdown in Illinois - Reuters,https://news.google.com/rss/articles/CBMiqAFBVV95cUxQSmliX1R5RXJvb0dJdmdaSEhaNUhKQmJDUXVNMXpFNGlvZ2xIOTExYkRBWDR0aWdFMFdPSVljaDF2d0tZMFpmaHBDMEFydDlDejJ6cDBYNGtnTkVlZEk3ZE94b0tPZjlob09JSUhRSGlOZC1yUTM4SFRoNENMc1ZmRkxMbkVLcUk0SUhKU2gyeU1PdGswYm5Hc0hVblRQczM4Rkx2TnlFTzY?oc=5,"Tue, 09 Sep 2025 00:29:00 GMT",
2025-09-09T01:21:12,Google News Reuters,Norway ruling Labour Party wins reelection while populists score gains - Reuters,https://news.google.com/rss/articles/CBMiuwFBVV95cUxQSG5RcVNzYTZpT3dtbU9DYWU1N1pXLXZkSGhRWUdNTEdGSF9MbHhRT01MWkVzVEZxNkE2bmEzY2wyUGNNc2ljMTVCUldrc2hnSVdBTzNLMU5yOTFKeUlXcHFRN09ZUUV3NnZCc2gtSl9hQ2Q1dDF2cXZlZC02Q3NSaDdKY0dVbHZoazVnblZEekptTjJnajE1SGF2cGt6LXpjR1NwT3RNWGJwV2JETGwyRTg3ckN3cTRNQ0xJ?oc=5,"Mon, 08 Sep 2025 22:45:22 GMT",
2025-09-09T01:21:12,Google News Reuters,Real-life 'Succession' ends: Lachlan Murdoch takes control and siblings take cash - Reuters,https://news.google.com/rss/articles/CBMi5AFBVV95cUxPaVFGWVB6aFB2ZHZzTWdxeDJRdWVCdUZuZS1palVLbXBiVnJSaVNIVDBsQW9tY2gydkFDdVhaUm42V1VpckFYMzBvTWp2UUlTVmFIcWEyVnBTYmRyX1VDNUpTaUxsZEh6amJQYmxoTTQzZ1JOa3FjZU9mWkx0NHlzdTY1bEFHSzdnVTR3WkwtN1dNUGFwUmNIMFZwZ0FMNmprN1JPVFNKZFZtQk5qZkJjQjVlRHA2RG5VZkExR0h1aEhMVnpQQk1LSGNCdzlVRHM5bFlDNTFIenRkTG9mNTFsc2M2Y1k?oc=5,"Tue, 09 Sep 2025 00:02:43 GMT",
2025-09-09T01:21:12,Google News Reuters,"Nebius signs $17.4 billion AI infrastructure deal with Microsoft, shares jump - Reuters",https://news.google.com/rss/articles/CBMiuwFBVV95cUxOUW9hZC0yOTdkems1SGRXZ2JUTTIyOG1tX3hJa3ZtSkhoVFpmMUZ6RHdzWW1tTGFwanBmSzJ5UHZfT0lHTjN2c3NQeUlFMHdYMmtMd04xVzRCbHBUcjdYMWh5YVhfQ0VKNDUxLW9YRGw3S3RfSC1RS09nNlY0WkVUekh3Q1Z1REJRM0F1Q1dnRXdvSHpNSmIyWk5ZcXIzaUR3SklmMG9XV0xGX0U2alM5YkJZUmJ6a3g3cXF3?oc=5,"Mon, 08 Sep 2025 22:10:18 GMT",
2025-09-09T01:21:12,Google News Reuters,US defense secretary tells sailors off Puerto Rico: this isn't training - Reuters,https://news.google.com/rss/articles/CBMivAFBVV95cUxNU25QZ2Y2TmFHeWc5Rnh1ZHRRZUU0dWxkTjlBcE8tMmtiUm9kWkkwVlZGUkZ6S29yX0lDQTZGVmhiSUpiY2JRaW9wTnMxUTZFVUl4c2R0T2traXlCTHQtVU5JNTJ2UzBadFA4bmNibWc5X2NsenFyMi04Rmx5WnAyV2w1NThuLWhGajRFVzUzYjE5NDlhRzJvVl9pR3RQU3lTSU55eXdQRE1jeTBlenpLdFY1eTFBeC05ckYtUQ?oc=5,"Mon, 08 Sep 2025 22:06:50 GMT",
2025-09-09T01:21:12,Google News Reuters,"Stocks rise on rate cut bets, political upheaval unsettles currencies globally - Reuters",https://news.google.com/rss/articles/CBMihgFBVV95cUxOb0ZwU0RLWFdJb2JtN2U1dWNDanI0QWlKUUZ5ZWd1TjhJYVcwQ3ZBWTUyUTRWTTRXMnJ5SjhNVGpkcHJ6RmxFbEIxSUt5M2FneFp6VWlaV3ltQ1F2QS1CS0lzU3Z1XzdmQ05LRk5xd3JEX09SLUpkZG8yNUMwdlFnYXdKTS1odw?oc=5,"Mon, 08 Sep 2025 20:57:11 GMT",
2025-09-09T01:21:12,Google News Reuters,Norway's ruling Labour holds narrow election lead - Reuters,https://news.google.com/rss/articles/CBMingFBVV95cUxQeXNUWXQzbGhuN3dYcnBTMXp5a0UxQkV4NkJuNVg4YkVuWDBhSEU1SGUxRkhtbEdpMFo3UzNEWXVRNGk1VWZYR2t2WXJoQVFjV3pSU3UtaW91VjBpR1l4M2w3S21sQUFDQTY2a2VaZFVTM0RuQW0zNkxEcXlCYlBMTzRUcEV4RGNwZnJOZ0pPT2VYbGNESmwtZzdUYWxYZw?oc=5,"Mon, 08 Sep 2025 21:02:27 GMT",
2025-09-09T01:21:12,Google News Reuters,"Access to social media restored in Turkey, internet monitor says - Reuters",https://news.google.com/rss/articles/CBMiwAFBVV95cUxQNkJrREp3ckVWam1ZYVNGOFBBTGJKNHJyX0FtaTF6WUZOaUJmRU5maFhjdVdYTXI2TEFWbnhSQ1hZNEpFUHUyUEJMTDE2RTFTb3pUNkRRLXFtZjFOSmU4TjVzUE9lRlZYWEczMGp6aHV3MElyZ3ZhUEhfS1lQMlVRVWlTVlUzUFQ1RzJYWEt0YmlVNFZwQ00yQTg4UkE1S2dxMV85MFVsc2h2Vk9aRGp2bXJUeV83aDItSzhQZlBsbUo?oc=5,"Mon, 08 Sep 2025 20:03:28 GMT",
2025-09-09T01:21:12,Google News Reuters,"Dell CFO Yvonne McGill to leave, PC maker reaffirms forecasts - Reuters",https://news.google.com/rss/articles/CBMipAFBVV95cUxNRTJCQnQ2WmJDcldBRU9rdTN2Vy1wTHhGVlJKV2lONEwwMHZCN0RfVXVkcFNmMTZPdk9uRTc3SXE2OGRFRTQzUkt1LWRYbXZ3UVRRekdBN2tkcUQyal9fZm9FVzhxaDFxUDIwdmpEQW1IWjNhVlp0aHR3QVRzZl9sdTU4UlVOcXh6eVh6SEZGUGQ1RWxJNnZDZjFEQXVCRHVmcEd3cw?oc=5,"Mon, 08 Sep 2025 20:37:46 GMT",
2025-09-09T01:21:12,Google News Reuters,"Ten people killed, 61 hurt after Mexican train hits double-decker bus - Reuters",https://news.google.com/rss/articles/CBMiuwFBVV95cUxOUy1IVkQwaDRXWWlqMU5rNXhBTzdiOENxYW10ZEc1UUw5WU45LUp4RzBGUUplTHRkbWJjQ3lfaFI5dUd3WmVyUzlxUkk1NHIwOHFlWHdDZ0MtUktMVzJJRE1TeTVuajZpbmxLajE1RGc1ZVR0UEdBcDJiRXhtbWZBZ2pCYlBhejdaaTBZVGtPWEtoMmtHaWRYWEtiQVRTLTNCSmdCVU9RNnN6SndDZHJJUl95OC1PUWtzWHhJ?oc=5,"Mon, 08 Sep 2025 23:14:34 GMT",
2025-09-09T01:21:12,Google News Reuters,Nasdaq notches record high close; traders focus on rate cuts - Reuters,https://news.google.com/rss/articles/CBMiowFBVV95cUxNc3loV2szcXNHdDBiNlNqR1NuSVo2LXFFeWlYbHBjOENVbDFpdXBEREdCTkkta0g0SWVHMDktN1JsUTZPSUsxc3BQZ3BCSENLalU1ZHhSdHlMQkZfNV9fWnd1RTROLTZ0Zi1kMFlwT3dReUlGZlBYSzQyalVGS05OemlwMDc0TUZIa3A2WWc4RE9DRk1oVnVFcTNHeVBhUVE2ZDVN?oc=5,"Mon, 08 Sep 2025 22:44:08 GMT",
2025-09-09T01:21:12,Google News Reuters,Oil settles up after OPEC+ opts for modest output hike - Reuters,https://news.google.com/rss/articles/CBMiowFBVV95cUxPU1BsTjlCTnM2cGt0ZEs2bXZITi1uTlpSYVBQVWVIUkJJZ0s4bXVKN3ozTmlvbThhV1RxQ3RqNlBUZGR3U1ozRzBrZUV5X256N1E0Z0ZiZ01CSDkzb1VqaWoxZDFQdzhSRmlsdkg5bG1MX2NQYk0yakFvNy1kNlJTbHlCa2hpS29Ra0J3V1pTWGVIRENFZ2JZZHlnRmNiY0xNOFZv?oc=5,"Mon, 08 Sep 2025 19:22:31 GMT",
2025-09-09T01:21:12,Google News Reuters,"US dollar falters on rate outlook, yen retreats amid Japan uncertainty - Reuters",https://news.google.com/rss/articles/CBMivAFBVV95cUxQd1hOaTdGaDBTNzg3OVNwbFZaTHg3ZF9MYjJrT2VhSFJzYWV1NjZXQVV2eDgwMllxclRSa1hicThISDN3UzZRV2FlbjNKbUxTcHNzSVBnZ2JKZGY5T2VFZDRwdHE1UHVTRWtfallqOGRmTVRKZjZHRjdCMDhPZWdMb2pFbHhjUGhqM3dKekZEN3BxOWlZZXNMcV9ISFJ5MG5WUTEyQVhIaERNZjFHckprZm5nYTg2NG9QbjRJbQ?oc=5,"Mon, 08 Sep 2025 19:33:20 GMT",
2025-09-09T01:21:12,Google News Reuters,"French parliament ousts prime minister, deepening political crisis - Reuters",https://news.google.com/rss/articles/CBMitAFBVV95cUxPT2ZZdmtabEg0YXcyUWJvQ1pBajlMOHF6eHVreXVreFkzbFkxX0dXLTRwcXZLLTlkWWRwTWlVc2tRblhJWktOR3lBZlVOSmNzMGhXT0RMVUkydno4MEo1dUctbF9USDhGNEN4MGpOdkl4X3hlanpGVjVnUUFETnlBeGhiRUpQc21OWEZWTVdBTGRUVWo4ekpWRFR6WU1JRGNZekhyRU1WaTlwUEJNTE1HbThNSnM?oc=5,"Mon, 08 Sep 2025 23:12:52 GMT",
2025-09-09T01:21:12,Google News Reuters,"Forty-five Colombian soldiers released in drug trafficking region, army says - Reuters",https://news.google.com/rss/articles/CBMiwAFBVV95cUxQQU1EMnNyRjktSXd3ejhLeUd1QU1jTUQ3eHRVZGxwYWNnU294S0wwaTgxWmc4VzJBa1BiaTc1QmQtRXZqMG96LUU3UGx1VUZqUG1idHhPbWJ2QUNMUDhaTXFacENISkd2WW9lX2NOODJCa0VZRno2VWwxUlNvMEtvM0ZpMnhCcVRMWGtzOUtmamhHM1BVeXhnZFdqcnFLSTVLRFRYaDdReHJveGJRR29XVUFTRkp6QV9ObmtIcHhMT0Y?oc=5,"Mon, 08 Sep 2025 19:12:17 GMT",
2025-09-09T01:21:12,Google News Reuters,"Stocks rise on rate cut bets, political upheaval unsettles currencies globally - Reuters",https://news.google.com/rss/articles/CBMigwFBVV95cUxPYU55QjdLbEU3TkkyeVdiUFNmZEVVY0I3bU00RzBTQmpIakpQNGI2QWtuWkhTMjJjSVA0ZEZsMmdqbE5YUEVieUEyVmM4UnZJWHgwYnEtRm1IZ2lONzhKWEk5SFVyaUEyWWNXRVZ1aWszUmJRRGpLTmJMcklJV1I1WW5pMA?oc=5,"Mon, 08 Sep 2025 19:46:39 GMT",
2025-09-09T01:21:12,Google News Reuters,Argentina's Milei must look to alliances after electoral defeat - Reuters,https://news.google.com/rss/articles/CBMirwFBVV95cUxPSTlpQmEyZ25Td2VwX3E5Q1ZpQWRKOEc1VGZWQlpaNkxzQ18tVFhROU9iWXVuZGQxdFNrRk9rYU9oU1RWMFRrV2g4RzJGUi1uTy16bVViY3RyNmV3dC12MVpybl9tVjdNQWJiT2NtM2NabHdad2Y3MWlTcGoxYjhGSG1UUGlVYzVCTFZzemtLQXRfYXJHU2R5MVRPQ2JLVnlEX2U5bld6dXMyTktFMXBj?oc=5,"Mon, 08 Sep 2025 18:57:31 GMT",
2025-09-09T01:21:12,Google News Reuters,Israel warns of 'mighty hurricane' in Gaza if Hamas does not surrender - Reuters,https://news.google.com/rss/articles/CBMitwFBVV95cUxORHdXNXZ6LWdqSEtwa2VRR1dqSkJaU1VVUHJkY28wUnMxRGpYU18wSWtmM0R1VnlNbDdLOW1mUHZOT01JY19ZbkpkVUJtTE13djdoRjlqc3ZCemNDMEdhanV3TDlFbVozS1E3cTBYWmlLdEhCeUEtenN5NkZIWm9LTFRka0hiUDJTQjA2Q1dwS3JPdmEwMUNtOUVkTjVfa3E3bjJsczB6MG92Zks5cDJDTE1kY05HTGM?oc=5,"Mon, 08 Sep 2025 21:52:03 GMT",
2025-09-09T01:21:12,Google News Reuters,"Nineteen killed in Nepal in 'Gen Z' protest over social media ban, corruption - Reuters",https://news.google.com/rss/articles/CBMixgFBVV95cUxON183R3lCUFNwbm9HRnhnMjJsbkdPU21pQjIzMnlIMVdzZXI1dkU1aFFOUlNFVEQ1YXBqYy12bzROZmJqTVdhazZlSVlaNWdJcGFBODd0YklMRmhPVmI4UTRzTzR4UFpOMS1GcjVZTlR3UkhKZzVlZzlsb1FDVUJtRmhMbERTRzFZYzFwSWNLLVF2TV9wc0Z5dF9DcExPdjN5NGNaWEN1T0JUTVdocXBRLVhxcUh0aGlxeTlpZjB3aDV3bGxneUE?oc=5,"Mon, 08 Sep 2025 23:18:10 GMT",
2025-09-09T01:21:12,Google News Reuters,Glencore's former head of recycling launches critical minerals processing firm - Reuters,https://news.google.com/rss/articles/CBMiuwFBVV95cUxOVUdURVh3ZHg1OHFubDhnVFlSYjh0NW1oNGNpQ3hpaVQtWHRfdkpVcjI5aU9sTUw3QjN3REo4YnRaSEQ0cU5IMHdVcTdHLWloaHdoZkNMV3FkemVsQWxSZ0RaVXQ3UzhmQXN0WUlzVXA4Nm1PTXBGV0lCTzFmYmlySTZVUnpTbVJEWjB0cndOekE3QTl0LXhFYmg4ZG9DOVBwRVFNYWlZQTE4ZVJzaGFhNDl2MjZDTEJTQXN3?oc=5,"Mon, 08 Sep 2025 16:56:41 GMT",
2025-09-09T01:21:12,Google News Reuters,Nineteen killed in Nepal in 'Gen Z' protest over social media ban - Reuters,https://news.google.com/rss/articles/CBMitwFBVV95cUxPeFBhTEd6UUJUOUg5cEJ0Yzl6UG1reFFGbjVUbWVxUURpVWxOdWZTcUpXS1Bfc3JZVnBvVVo2eTJHQy1BQ2ZwSXdybjlvN0VPMWxab3o3c0dyVUZ2ZUg1bDc1WGI1S1RrNjdpdEg2NFVDdTRSLUNSRkRzSUxvZ25ya2FkTFNsbGxiNlhucTdnazd0X183RDRGanVvczBBcllNbFJHbWlCMTc1QnBPTUFrN1lLWnBHN1E?oc=5,"Mon, 08 Sep 2025 13:25:31 GMT",
2025-09-09T01:21:12,Google News Reuters,Spain bans Israel-bound weapons ships and planes over Gaza - Reuters,https://news.google.com/rss/articles/CBMipgFBVV95cUxOWW9PZlh0cml6UDhJU1UwVFBFLWY1SlEtdkNRUFd1WkVjbkRaN3JFak9sTXF4WWdFZFpRUVhFVWxGOG5VbjQyWndzVlVDbTRGVnU3QWJOYjVlNVJic3hkSUtZbXp6Ty1LRC1QMUtFLXRfa2VweGVFV3BaRXBUdUdaSTN0OTR5WkJQVlZGUkRwRXhPc09wZklEd2lubmxtWmJINGNrVFJn?oc=5,"Mon, 08 Sep 2025 15:55:33 GMT",
2025-09-09T01:21:12,Google News Reuters,US Supreme Court backs Trump on aggressive immigration raids - Reuters,https://news.google.com/rss/articles/CBMipAFBVV95cUxNNzdOaGdqQVU1c2pYT0x1Z21ZWF9sQS1mWGNMT3BCVlBhSVZydTBtX0lUVzNfZTYzcEZjSm1KbE9yQ0d4Z2JjU3lrSVJrblpIcHB3Q2M4OGZzRUphOFJ6aUxpUWhDNnBQaWlZOWFSTTd1emhmdm50dy15YlBTSV82RkdqR1FaSzFwYVBFckYyVkFzMGN2QTdRamVhU2dWV1FKbXZqMA?oc=5,"Mon, 08 Sep 2025 23:09:41 GMT",
2025-09-09T01:21:12,Google News Reuters,Argentine markets plunge after Milei's party loses to Peronists in Buenos Aires vote - Reuters,https://news.google.com/rss/articles/CBMi2wFBVV95cUxPN0lyRWhTTHJ0Mkdlc3F6Z2htNU9WSEFRQXA2V1MzX1ZCX2EyX2tLYVV1bTlGWWRMZUtxNzZWQTI3N1FtaGFhcl9scTZhQUdla3VNLWxpcVZRLUFfNGd0RU4zYzVnU3RJX2FyX0hlckljcXZiMGdNVndhNm5aZk1WYlV5cTloQVFUamNZcFpnUVZJbnVVV2EwUW1PVmZueWdMTUJUcGRUMGt5MHdYUEZHRkFPWUYtV0dYWi1wTXVIYkRvb2tkaDhsWmNhRnc2U3hDTENrSzdUekFIZzg?oc=5,"Mon, 08 Sep 2025 20:04:23 GMT",
2025-09-09T01:21:12,Google News Reuters,"Discord down for over 90,000 users in US, Downdetector shows - Reuters",https://news.google.com/rss/articles/CBMinwFBVV95cUxPbUQwdUdYUWNkdWt0eFNrRDdBTWtYaTE5UUJKUlZBY2FtT1ZWbDZNWG1XYXpNVC1FeGRBRFkxZjBLSDJOaGw2MWZLbHVOUHAzbXZHOU5WSk9KR2s0MW9xRk44X3ZVSUZkLXVZMExIbjFmdTdINml4andDdXpyZE82Ykg2Wk5EMTl1d3lxeHJBWWRPcE5mMlBoaE5XTnYzTlE?oc=5,"Mon, 08 Sep 2025 22:39:19 GMT",
