timestamp,source,title,link,published,content
2025-08-03T02:01:05,MarketWatch Top,"‘I have never been asked for money before’: My friend wants to borrow $1,600 to pay her rent. Do I say yes?",https://www.marketwatch.com/story/i-have-never-been-asked-for-money-before-my-friend-wants-to-borrow-1-600-to-pay-her-rent-do-i-say-yes-5c67148f?mod=mw_rss_topstories,"Sat, 02 Aug 2025 23:47:00 GMT",
2025-08-03T02:01:05,MarketWatch Top,‘The sky has not fallen — yet’: Is it time to start worrying about a U.S. recession?,https://www.marketwatch.com/story/the-sky-has-not-fallen-yet-a-recession-has-been-predicted-for-years-is-it-time-to-stop-worrying-46eac7db?mod=mw_rss_topstories,"Sat, 02 Aug 2025 23:37:00 GMT",
2025-08-03T02:01:05,MarketWatch Top,"‘I worked at 14, had an 8.8% mortgage rate and drove used cars’: Did boomers really have it easier than millennials?",https://www.marketwatch.com/story/i-worked-at-14-had-an-8-8-mortgage-rate-and-drove-used-cars-did-boomers-really-have-it-easier-than-millennials-bdc012a2?mod=mw_rss_topstories,"Sat, 02 Aug 2025 23:11:00 GMT",
2025-08-03T02:01:05,MarketWatch Top,Will my spouse automatically inherit my 401(k)?,https://www.marketwatch.com/story/will-your-spouse-automatically-inherit-your-401-k-59ac8126?mod=mw_rss_topstories,"Sat, 02 Aug 2025 22:03:00 GMT",
2025-08-03T02:01:05,MarketWatch Top,The ‘great wealth transfer’ is coming. Many people will be rich — but they’re not ready.,https://www.marketwatch.com/story/the-great-wealth-transfer-is-coming-many-people-will-be-rich-but-theyre-not-ready-e206232f?mod=mw_rss_topstories,"Sat, 02 Aug 2025 19:26:00 GMT",
2025-08-03T02:01:05,MarketWatch Top,Trump and the dollar are doing something we saw just before the October 1987 stock market crash,https://www.marketwatch.com/story/weve-seen-how-stocks-react-to-white-house-pressure-for-low-interest-rates-and-a-weak-dollar-in-october-1987-833d64b0?mod=mw_rss_topstories,"Sat, 02 Aug 2025 19:26:00 GMT",
2025-08-03T02:01:05,MarketWatch Top,My therapist said he was in-network. The insurer says he’s not. Am I obliged to pay full rates for all prior sessions?,https://www.marketwatch.com/story/my-therapist-said-he-was-in-network-hes-not-am-i-obliged-to-pay-out-of-network-rates-for-all-prior-sessions-ab570bed?mod=mw_rss_topstories,"Sat, 02 Aug 2025 17:13:00 GMT",
2025-08-03T02:01:05,MarketWatch Top,Are Trump’s tariffs helping or hurting America’s economy? 6 key facts about U.S. trade.,https://www.marketwatch.com/story/does-international-trade-hurt-the-u-s-as-trump-claims-6-things-to-know-about-tariffs-666def4d?mod=mw_rss_topstories,"Sat, 02 Aug 2025 16:31:00 GMT",
2025-08-03T02:01:05,MarketWatch Top,"As the eldercare crisis escalates, families seek help from these coaches and consultants",https://www.marketwatch.com/story/who-you-gonna-call-for-eldercare-crises-or-insurance-questions-this-growing-group-of-consultants-e33a7af9?mod=mw_rss_topstories,"Sat, 02 Aug 2025 16:14:00 GMT",
2025-08-03T02:01:05,MarketWatch Top,Luxury cruise lines are relaxing their evening dress codes. But is denim at dinner too much?,https://www.marketwatch.com/story/luxury-cruise-lines-are-relaxing-their-evening-dress-codes-but-is-denim-at-dinner-too-much-1e28ab2b?mod=mw_rss_topstories,"Sat, 02 Aug 2025 16:08:00 GMT",
2025-08-03T02:01:05,CNBC Top News,Berkshire Hathaway operating earnings dip 4% as conglomerate braces for tariff impact,https://www.cnbc.com/2025/08/02/berkshire-hathaway-brk-earnings-q2-2025.html,"Sat, 02 Aug 2025 12:52:05 GMT",
2025-08-03T02:01:05,CNBC Top News,Ethereum turns 10: From scrappy experiment to Wall Street’s invisible backbone,https://www.cnbc.com/2025/08/02/ethereum-turns-10-from-scrappy-experiment-to-wall-streets-invisible-backbone.html,"Sun, 03 Aug 2025 00:03:44 GMT",
2025-08-03T02:01:05,CNBC Top News,Trump fires commissioner of labor statistics after weaker-than-expected jobs figures slam markets,https://www.cnbc.com/2025/08/01/trump-erika-mcentarfer-jobs-report-fired.html,"Sat, 02 Aug 2025 00:01:47 GMT",
2025-08-03T02:01:05,CNBC Top News,"Fed Governor Kugler is resigning, giving Trump a nominee on committee that sets interest rates",https://www.cnbc.com/2025/08/01/federal-reserve-governor-kugler-part-of-the-committee-that-sets-interest-rates-is-resigning.html,"Fri, 01 Aug 2025 21:49:02 GMT",
2025-08-03T02:01:05,CNBC Top News,Restaurants are adding dozens of new spicy menu items in a bid for younger diners,https://www.cnbc.com/2025/08/02/restaurants-spicy-menu-items-younger-diners.html,"Sat, 02 Aug 2025 12:45:54 GMT",
2025-08-03T02:01:05,CNBC Top News,'What am I falling in love with?' Human-AI relationships are no longer just science fiction,https://www.cnbc.com/2025/08/01/human-ai-relationships-love-nomi.html,"Fri, 01 Aug 2025 11:54:05 GMT",
2025-08-03T02:01:05,CNBC Top News,Google has dropped more than 50 DEI-related organizations from one of its funding lists,https://www.cnbc.com/2025/08/01/google-dropped-50-dei-groups-from-funding-list-.html,"Fri, 01 Aug 2025 18:23:01 GMT",
2025-08-03T02:01:05,CNBC Top News,Here's where the jobs are in this slowing economy,https://www.cnbc.com/2025/08/01/heres-where-the-jobs-are-in-this-slowing-economy.html,"Fri, 01 Aug 2025 15:04:23 GMT",
2025-08-03T02:01:05,CNBC Top News,How activist Elliott could use its data center know-how to amplify returns at Equinix,https://www.cnbc.com/2025/08/02/how-activist-elliott-may-use-its-data-center-know-how-to-lift-returns-at-equinix.html,"Sat, 02 Aug 2025 11:09:31 GMT",
2025-08-03T02:01:05,CNBC Top News,How Florida quietly surpassed California in solar growth,https://www.cnbc.com/2025/08/02/how-florida-quietly-surpassed-california-in-solar-growth.html,"Sat, 02 Aug 2025 16:00:01 GMT",
2025-08-03T02:01:05,CNBC Top News,JFK airport's $9.5 billion international terminal is taking shape. See what's inside,https://www.cnbc.com/2025/08/02/jfk-airport-new-international-terminal.html,"Sat, 02 Aug 2025 13:18:50 GMT",
2025-08-03T02:01:05,CNBC Top News,How this week's avalanche of news from Washington to Wall Street kept investors guessing,https://www.cnbc.com/2025/08/02/how-this-weeks-avalanche-of-news-kept-markets-and-investors-guessing.html,"Sat, 02 Aug 2025 16:19:02 GMT",
2025-08-03T02:01:05,CNBC Top News,"Trump 'soft, weak and afraid' in firing labor statistics chief McEntarfer: Wyden",https://www.cnbc.com/2025/08/01/trump-bls-labor-jobs-wyden-mcentarfer.html,"Fri, 01 Aug 2025 21:20:37 GMT",
2025-08-03T02:01:05,CNBC Top News,"Tesla must pay portion of $329 million in damages after fatal Autopilot crash, jury says",https://www.cnbc.com/2025/08/01/tesla-must-pay-329-million-in-damages-in-fatal-autopilot-case.html,"Fri, 01 Aug 2025 20:48:28 GMT",
2025-08-03T02:01:05,CNBC Top News,"Where $1,500 in rent gets you the most—and least—space in major U.S. cities",https://www.cnbc.com/2025/08/02/us-cities-where-1500-dollars-in-rent-gets-you-the-most-least-space.html,"Sat, 02 Aug 2025 14:00:02 GMT",
2025-08-03T02:01:05,CNBC Top News,Trump says he moved two nuclear submarines after Russia's Medvedev warns U.S.,https://www.cnbc.com/2025/08/01/trump-russia-nuclear-submarines.html,"Fri, 01 Aug 2025 18:03:54 GMT",
2025-08-03T02:01:05,CNBC Top News,"Yoga, Zumba or HIIT? The best way to exercise, based on your personality type",https://www.cnbc.com/2025/08/02/yoga-or-hiit-the-best-way-to-exercise-based-on-your-personality.html,"Sat, 02 Aug 2025 15:00:01 GMT",
2025-08-03T02:01:05,CNBC Top News,"29-year-old American left NYC and moved to Istanbul where he started a tourism company that brought in $100,000 last year",https://www.cnbc.com/2025/08/02/american-relocated-istanbul-turkey-started-tourism-company-youtube-channel.html,"Sat, 02 Aug 2025 14:00:02 GMT",
2025-08-03T02:01:05,CNBC Top News,Nearly 60% of millennials and Gen Zers say their social life is hurting their financial goals,https://www.cnbc.com/2025/08/02/millennials-gen-z-say-social-activities-hurt-their-money-goals.html,"Sat, 02 Aug 2025 13:00:01 GMT",
2025-08-03T02:01:05,CNBC Top News,"‘The eye of the hurricane’: Why the U.S. job market has soured, economists say",https://www.cnbc.com/2025/08/01/us-job-market-jobs-report-july-2025.html,"Fri, 01 Aug 2025 18:07:09 GMT",
2025-08-03T02:01:05,CNBC Top News,Jeffrey Epstein victims and family blast Trump for Ghislaine Maxwell prison transfer,https://www.cnbc.com/2025/08/01/jeffrey-epstein-ghislaine-maxwell-prison-florida-texas.html,"Fri, 01 Aug 2025 20:36:51 GMT",
2025-08-03T02:01:05,CNBC Top News,Why Black entrepreneurs flock to Martha's Vineyard every August,https://www.cnbc.com/2025/08/01/why-black-entrepreneurs-flock-to-marthas-vineyard-every-august.html,"Fri, 01 Aug 2025 21:53:29 GMT",
2025-08-03T02:01:05,CNBC Top News,"U.S. added just 73,000 jobs in July and numbers for prior months were revised much lower",https://www.cnbc.com/2025/08/01/jobs-report-july-2025.html,"Fri, 01 Aug 2025 17:37:39 GMT",
2025-08-03T02:01:05,CNBC Top News,"This is the 'No. 1 reason' to buy the early boarding upgrade, travel expert says",https://www.cnbc.com/2025/08/02/early-boarding-upgrade-value.html,"Sat, 02 Aug 2025 11:00:02 GMT",
2025-08-03T02:01:05,CNBC Top News,"Cramer's week ahead: Earnings from Palantir, Berkshire Hathaway, Disney and McDonald's",https://www.cnbc.com/2025/08/01/cramers-palantir-berkshire-hathaway-disney-mcdonalds-earnings.html,"Fri, 01 Aug 2025 23:01:08 GMT",
2025-08-03T02:01:05,CNBC Top News,"Senate bill aims to increase affordable housing supply. Here's what renters, home buyers need to know",https://www.cnbc.com/2025/08/01/what-to-know-about-the-senate-affordable-housing-bill.html,"Fri, 01 Aug 2025 17:35:34 GMT",
2025-08-03T02:01:05,CNBC Top News,Amazon stock sinks 8% after earnings: Here are the key takeaways,https://www.cnbc.com/2025/08/01/amazon-earnings-ai-aws-tariffs.html,"Fri, 01 Aug 2025 20:01:17 GMT",
2025-08-03T02:01:05,CNBC Top News,Palantir lands $10 billion Army software and data contract,https://www.cnbc.com/2025/08/01/palantir-lands-10-billion-army-software-and-data-contract.html,"Fri, 01 Aug 2025 17:25:51 GMT",
2025-08-03T02:01:05,CNBC Top News,Figma stock pops 5% in second day of trading after colossal debut,https://www.cnbc.com/2025/08/01/figma-fig-stock-ipo-price.html,"Fri, 01 Aug 2025 20:05:12 GMT",
2025-08-03T02:01:05,CNBC Top News,"Fed governors Bowman, Waller explain their dissents, say waiting to cut rates threatens economy",https://www.cnbc.com/2025/08/01/fed-governors-bowman-waller-explain-their-dissents-say-waiting-to-cut-rates-threatens-economy.html,"Fri, 01 Aug 2025 17:22:57 GMT",
2025-08-03T02:01:06,Investing.com All News,Russia shares lower at close of trade; MOEX Russia Index unchanged,https://uk.investing.com/news/stock-market-news/russia-shares-lower-at-close-of-trade-moex-russia-index-unchanged-4197823,2025-08-02 21:25:35,
2025-08-03T02:01:06,Investing.com All News,BOE rate cuts offer little relief as UK households face mounting financial strain,https://uk.investing.com/news/stock-market-news/boe-rate-cuts-offer-little-relief-as-uk-households-face-mounting-financial-strain-4197821,2025-08-02 18:40:11,
2025-08-03T02:01:06,Investing.com All News,Korea Electric Power surges 66% following InvestingPro's Fair Value signal,https://uk.investing.com/news/investment-ideas/korea-electric-power-surges-66-following-investingpros-fair-value-signal-93CH-4197819,2025-08-02 11:06:06,
2025-08-03T02:01:06,Investing.com All News,Aurora Innovation drops 45% after InvestingPro's February overvaluation warning,https://uk.investing.com/news/investment-ideas/aurora-innovation-drops-45-after-investingpros-february-overvaluation-warning-93CH-4197818,2025-08-02 11:02:06,
2025-08-03T02:01:06,Investing.com All News,Private equity giants accelerate push into UK pension risk-transfer market,https://uk.investing.com/news/stock-market-news/private-equity-giants-accelerate-push-into-uk-pension-risktransfer-market-4197816,2025-08-02 06:10:10,
2025-08-03T02:01:06,Investing.com All News,"Edward K. Christian trust sells Saga Communications (SGA) shares for $14,249",https://uk.investing.com/news/insider-trading-news/edward-k-christian-trust-sells-saga-communications-sga-shares-for-14249-93CH-4197814,2025-08-02 01:36:06,
2025-08-03T02:01:06,Investing.com All News,MP Materials general counsel Hoops sells $382k in shares,https://uk.investing.com/news/insider-trading-news/mp-materials-general-counsel-hoops-sells-382k-in-shares-93CH-4197813,2025-08-02 01:26:06,
2025-08-03T02:01:06,Investing.com All News,Kratos (KTOS) president Rock sells $222k in stock,https://uk.investing.com/news/insider-trading-news/kratos-ktos-president-rock-sells-222k-in-stock-93CH-4197811,2025-08-02 00:58:08,
2025-08-03T02:01:06,Investing.com All News,Wingstop CEO Skipworth sells $1.66m in shares,https://uk.investing.com/news/insider-trading-news/wingstop-ceo-skipworth-sells-166m-in-shares-93CH-4197810,2025-08-02 00:56:09,
2025-08-03T02:01:06,Investing.com All News,Wingstop SVP Kaleida Alex sells $2m in shares,https://uk.investing.com/news/insider-trading-news/wingstop-svp-kaleida-alex-sells-2m-in-shares-93CH-4197809,2025-08-02 00:52:08,
2025-08-03T02:01:06,Investing.com Bond News,Non-Farm Payrolls Ahead: Saving the Most Exciting for Last?,https://uk.investing.com/analysis/nonfarm-payrolls-ahead-saving-the-most-exciting-for-last-200617897,"Aug 01, 2025 06:50 GMT",
2025-08-03T02:01:06,Investing.com Bond News,Medium-Term Corporates Lead US Bond Market in 2025,https://uk.investing.com/analysis/mediumterm-corporates-lead-us-bond-market-in-2025-200617754,"Jul 23, 2025 11:53 GMT",
2025-08-03T02:01:06,Investing.com Bond News,Japan’s Election Results Could Send Shockwaves Through US Bond Market,https://uk.investing.com/analysis/japans-election-results-could-send-shockwaves-through-us-bond-market-this-week-200617701,"Jul 21, 2025 06:55 GMT",
2025-08-03T02:01:06,Investing.com Bond News,How Fed Could Inject Liquidity if Bond Yields Surge: What Investors Need to Know,https://uk.investing.com/analysis/how-fed-could-inject-liquidity-if-bond-yields-surge-what-investors-need-to-know-200617670,"Jul 17, 2025 13:37 GMT",
2025-08-03T02:01:06,Investing.com Bond News,US 10-Year Yield Holds Above Fair Value as Deficit and CPI Heat Up,https://uk.investing.com/analysis/us-10year-yield-holds-above-fair-value-as-deficit-and-cpi-heat-up-200617650,"Jul 16, 2025 11:56 GMT",
2025-08-03T02:01:06,Investing.com Bond News,Treasury Auction Shows Strength: Bid-to-Cover and Foreign Demand Surge,https://uk.investing.com/analysis/treasury-auction-shows-strength-bidtocover-and-foreign-demand-surge-200617554,"Jul 10, 2025 10:41 GMT",
2025-08-03T02:01:06,Investing.com Bond News,US 30-Year Yield Mispriced? Inflation and Deficits Point to Higher Rates,https://uk.investing.com/analysis/us-30year-yield-mispriced-inflation-and-deficits-point-to-higher-rates-200617522,"Jul 08, 2025 13:52 GMT",
2025-08-03T02:01:06,Investing.com Bond News,Bond Market May Struggle to Price in Conflicting Risk Factors,https://uk.investing.com/analysis/bond-market-may-struggle-to-price-in-conflicting-risk-factors-200617504,"Jul 07, 2025 12:20 GMT",
2025-08-03T02:01:06,Investing.com Bond News,How the Fed’s SLR Tweak Could End the Bond Bear Market,https://uk.investing.com/analysis/how-the-feds-slr-tweak-could-end-the-bond-bear-market-200617413,"Jun 30, 2025 10:24 GMT",
2025-08-03T02:01:06,Investing.com Bond News,US 10-Year Treasury Yield Stays Above Fair Value as Tariff Impact Looms,https://uk.investing.com/analysis/us-10year-treasury-yield-stays-above-fair-value-as-tariff-impact-looms-200617167,"Jun 12, 2025 11:18 GMT",
2025-08-03T02:01:06,Google News Reuters,Chile's Codelco reports death of one of five trapped El Teniente miners - Reuters,https://news.google.com/rss/articles/CBMitgFBVV95cUxQMXlQcURyd2lOX3otRlowNXc5bFo0TXMwTXl1bkJDLXFoaDFNM3RWZ2NPbEJab2ZjYjYxSU9ySzVVQldLdTBGcGNIc29xX3V2VHRBOHVHZkZXZUJiNURJOHZIbW10OTVzcERMSDNxZXFhS1ZDUnFldkNpU2FJS2Z2bUFEQU9seU9mb3dmUGZsYmhfc0w5VGNzTGVRdi16RG93MGkzV1FTbklMelpKQWc3Y3ltaTFfUQ?oc=5,"Sun, 03 Aug 2025 00:41:00 GMT",
2025-08-03T02:01:06,Google News Reuters,US envoy tells Israeli hostage families he is working on plan to end Gaza War - Reuters,https://news.google.com/rss/articles/CBMiwwFBVV95cUxOck9ydll5RUIzVkRLcWcxRlNqYTl1SEZKbjlGM29pbHMwZVhtVWExaS1FcHp3b216c21qRFpyWi1CM19jQzdLMWdwZkxadEk0QWxuRjZ4Tk8zSDl3ZDdLQ0RFcG1wZkJRVEkta3IwZloyVHpUMzd0TXJQaDRkZUliUElHMFNmQklMelMtMXVYMWIyRDRYS1NER0lTcE9NTlBWc08zOFlhOUctSE9wS2VBaDlrTjhpb08wOGMxVlEzMXVyV0E?oc=5,"Sat, 02 Aug 2025 19:08:56 GMT",
2025-08-03T02:01:06,Google News Reuters,Ukraine says it uncovers major drone procurement corruption scheme - Reuters,https://news.google.com/rss/articles/CBMiyAFBVV95cUxPdUZlUFpwa1lDamZHc01TWHc1Tno4b21MNER3LTMzcV81aXZZQ1RtTUJqYTNuZlI3R29qQ25VcDRCaVlnVWtYcGNEam1yLVRDdWRaZTladC1SYUpBbFFPSWpJYlN4V0pKeTNpcHExbTQzVGUyemVEUjJxM2tmN205bHExRU9qTEdVcXpULThnQ1BzVGhfbVBKeWFHNGpBSmJ1cDFOclY4ZGNEdnYwUFQ3d1ZDNWw5dnZ6VnJWQWRaYzdydGJKSnFZcA?oc=5,"Sat, 02 Aug 2025 16:03:24 GMT",
2025-08-03T02:01:06,Google News Reuters,"India to maintain Russian oil imports despite Trump threats, government sources say - Reuters",https://news.google.com/rss/articles/CBMiywFBVV95cUxOM2k5UXBwaXFqS1FrWXNsblV0T0lDSGxZeUNacXJLakVhWDI0bGdlbGlJcHVuS1ZBQnNyS185MVRtRXQ0UUtEM3o4S3JRV1dWYXEtYlA1eDh4dmtoaXFTVUpFSjFWdkNsX1J6NlZXTkU3bTFKbUFPYnlyQ0xsUFMtWE1oVDNabHRoQkdLcGxXdlVoVXR3aVRPSFJ6aDNyMllFdXdVakVqbVVPSGpzbVVvQTNJWTlkdlZOUmVkbVQ2RWEzbmN4MDdiR1pHOA?oc=5,"Sat, 02 Aug 2025 17:31:21 GMT",
2025-08-03T02:01:06,Google News Reuters,Trump reaffirms support for Morocco's sovereignty over Western Sahara - Reuters,https://news.google.com/rss/articles/CBMiswFBVV95cUxNcnMyTTJqWThtR2NrSmJkR0RsNnpxdENpdDRhUkkxc0NyallHNnc2RVl1amY1ZmdsRm9nSHExU3ZiZGJaY19nc09qNVp4d05ncFBvT3p5cF9NblhYVUl2d2Q0REZEN2lCaUdjWVlLOUhBMTRfaG01X0c4Nlg1QnlTcHVwQV8zeld6Q0NMZXI1TXAzSXI4VG9HeU85VkV5emFleHpiYVZ5WHBnb3YtU0l5Sjd1UQ?oc=5,"Sat, 02 Aug 2025 17:02:23 GMT",
2025-08-03T02:01:06,Google News Reuters,Federal agency opens probe into former Trump prosecutor Jack Smith - Reuters,https://news.google.com/rss/articles/CBMisAFBVV95cUxPa3Q5M3Eya0xtLWg2UHhVZTVrSkxPOVlTblAxUW9HbDlXTkpsYmFGN3JUeGFpMW9WcEltY05FVjJPN29vMG5pMTlZVkJFM0ZUTVoxMnd5dzkzSF9uazJadk02cHA0MFl3MF9lZ2pfRU1RMUQ2U0ZlNXlsZmNtVHZKOU1kalhtRDJfZ1VvbE5TRlVWV21kTThhakk3UkJSNEpjLVhlbEQ2cFdJVEcwbS1pUg?oc=5,"Sat, 02 Aug 2025 23:23:53 GMT",
2025-08-03T02:01:06,Google News Reuters,"Berkshire takes $3.8 billion Kraft Heinz write-down, operating profit falls - Reuters",https://news.google.com/rss/articles/CBMi4gFBVV95cUxOdnBQRGQ0bG1PRVRxLUJYa0ZvU196aThmRkJFV2ZETWN1Q3NQOWEza2xQdUYxSVVSSWFGNFpHa2VRdlB5anY2MGl3OFNCOVhURFZXX0FEOFNsOGQtd29OZlVsZC1md2VoQmxIbk5vdEdDTlBYd2J5WjRRc0J2RnhPajVhVlFHakh4ZkNqWUFsdEU5WF9odGNaWmxINFh3T1VvS2p4T1RfeldSaDhQbndsNHVmVkIzSE5xUXExYnhVVDBKanlmTWNTZXlITVJSckFfRUdMc1NPclRxOXlfZGwyZ1Rn?oc=5,"Sat, 02 Aug 2025 23:16:15 GMT",
2025-08-03T02:01:06,Google News Reuters,Trump tariffs hit Buffett's Berkshire consumer goods businesses - Reuters,https://news.google.com/rss/articles/CBMiqwFBVV95cUxNTTA5cHZpRU1SQTRSNWo5bHJXZVhVLUtaazBOQTdTOFdWV25OOXg0LUlDdlU4VWdFbGxVQ0VLSjJjSGxhbjdXVHpXMlRpWHBFN3gtRFZIcGcwazVJdnZETmlhN2w3QkhwdktFdE9UQ1VjT29rdVdMR1NRSENMeWhsYjVOM3JNYVZlTFNMTWxTZFg3bWxPaTFLSjNralV6UnBVZXlJSzJISXFTa1U?oc=5,"Sat, 02 Aug 2025 13:21:05 GMT",
2025-08-03T02:01:06,Google News Reuters,How Pakistan shot down India's cutting-edge fighter using Chinese gear - Reuters,https://news.google.com/rss/articles/CBMizAFBVV95cUxPSXNfVXhfc3o0d2l4d09qQ2stMWNvM3RpLWFmVElPN05tZzZrWW1hTWxtekNPV1h5a0RSRUtqZ2ZrdFlzRVZwUVFuN0otRXJSVUF0aU9nbzZxM2dWY3JmMWVlYnR6Yk5ZRHVWYldhcXN3Nl91TlZDUU1jN1k0eHk2MFVwWDF6bGN2QUJyNmgxcEFnODdKN1V5bkpvWEI4SkotLVVOb2g2cUVYalIzODFsTml5aXVLYlloUmJIbVlMSjladjhxdlhrOUtVdkI?oc=5,"Sat, 02 Aug 2025 13:39:50 GMT",
2025-08-03T02:01:06,Google News Reuters,Trump orders nuclear submarines moved after Russian 'provocative statements' - Reuters,https://news.google.com/rss/articles/CBMitwFBVV95cUxNbDM5YnhSU3ZXeEpvdFEyZGxHbDZhNk5wbzBSdkNUVlhVOXZaa3JuNTQ3TkM3d2NVU0FpbkRpdGw4YzdyMjRFcEFaVERXMjZkZEpuQ0h5NU9HRmdkTl8xRVdxalcxRjhNVmdTdXh3Q2RwckpkTGlWdlJoTFdvb0g1OVpaNW1sOEZKYkhqTkVNLWY3UFRYblR5UE1IVHlZU3htU1pTeHRBdGFFdlBvNkpSQ2V0MnplODQ?oc=5,"Sat, 02 Aug 2025 09:36:41 GMT",
2025-08-03T02:01:06,Google News Reuters,"Ukraine says it hit Russian oil facilities, military airfield - Reuters",https://news.google.com/rss/articles/CBMiwAFBVV95cUxQMG1uUnBjbkRyYnU2azlUeFRYc2VxYkhkT3paMzRuQnNHNHpuUFNKemlTU25NQWdQaVAxOXhjQWxfZElCQndZR3V2NWkyUmt5RVZmSjBZaWNvbnZ2UDMwYUM0NkJqRjZCejRYOTA3R2hLOFZwWVRqSlJUQnMyaExGN0NBS0RXTHU0ZjgwakVoZFh6Njg3R3pTTlhuMVFxN2VfLWxYUGdMOXozWGV0eGNtMGVjUGRMRUFoVFF2bVFvY1A?oc=5,"Sat, 02 Aug 2025 16:59:39 GMT",
2025-08-03T02:01:06,Google News Reuters,The US said it had no choice but to deport them to a third country. Then it sent them home - Reuters,https://news.google.com/rss/articles/CBMiwgFBVV95cUxOZHQwVkF1MlpXNnI2c3RwYm42VzJmTmFFRlJReXFiOHdDUDdXVF85VGtLbF9wZFJaLU5ZMkxVcTcyOXBtOUtPLVlQS25OZC1DUUNfdFRRV3F2MFVrUldmeDQxc2NzREpYQTI3eko4THE3QWxRcjZGdDJDM254NjlBaE9TbEpkMUgxSGhyUC1Ob24yZFJPamt5akZWYUI1M0hNbVlRa2JacDNiYnFacTM4ZnBLX1pmbjJ1ZVowUFROT2dQUQ?oc=5,"Sat, 02 Aug 2025 17:17:02 GMT",
2025-08-03T02:01:06,Google News Reuters,Trump fires US labor official over data and gets earlier than expected chance to reshape Fed - Reuters,https://news.google.com/rss/articles/CBMixAFBVV95cUxNb1RHTDlVWWExMk9OTlVVR2FXSVM1aldFZU1UVERILWhHbXVZS1hkb2V0V2VHNFNMbURHU1ZjZzI2TnI3UDJfWm4yVnM1TW9Cam5QQk9IMEF2SGlSdXgzMHluV3BTYV9oOHoycWdSSjRWY0NhNDdOT3NaSVY3cXJaR1lCQUlaYkpPQ0VUMjg3QkVsWHBfdFRYQUl0TmNnZVYtZVQ3YUNHeUFiOGw2cWJxSGNfNEFTTHBjcG5YNDNhQTVoRVE1?oc=5,"Sat, 02 Aug 2025 07:49:33 GMT",
2025-08-03T02:01:06,Google News Reuters,"Kia America recalls 201,149 US Telluride vehicles - Reuters",https://news.google.com/rss/articles/CBMitAFBVV95cUxPSVRmU1U5YUNIM1hKU2NhV25oejc1WkZkQ25OaWtzU0VzTGQzZ3FsckNUY3ZMTnlfUF9zWHY4dERfUFo1YW5uMHdacFRtYURNRHBzbkR1WmhTMGdQbVh4ZHdKd0lWVlhpWmtnOEVQTlBhNzYtbjVXSTQ1TzBaWTVhZF9QOHl4aXU1NXROSm1ITTRXbC01TVVFaWVUT3V5OGtPbFZIaTE0V2dZcmJaOW5aMjZxanM?oc=5,"Sat, 02 Aug 2025 07:31:03 GMT",
2025-08-03T02:01:06,Google News Reuters,"India will buy Russian oil despite Trump's threats, NYT reports - Reuters",https://news.google.com/rss/articles/CBMiswFBVV95cUxOSFRoYnF0NVlZZEJKam95QmpuSkpES0dpWVBybzlpM19BeHViRGlZUlBkTkN6REdsY1QwVS1lUTViT1lqRWpESjFTa3A4bk5YNjVaMHIyY3pjOV80VVVXRVVrUmtMdnFnUHQ3Zy1OeW9lMEl4QlBlVVExSG53R2JHYjlVNTBxbElzTVd6RU14SDJkMHFZelJ4a3ZWcFFVb2RsdGlsMDdreWtGY29ZcTR6Ul9TUQ?oc=5,"Sat, 02 Aug 2025 09:02:48 GMT",
2025-08-03T02:01:06,Google News Reuters,"Trump's labor firing, Fed resignation, Russia-US and Witkoff in Gaza - Reuters",https://news.google.com/rss/articles/CBMipgFBVV95cUxNbWlOOE45M0pOVXBZbHk2NTh4XzgtQVRuT3Rfd2IxUXpLUVdLRHM3QUNwVjZUanlyYURRR2RhMFRERkNESm5OTUR1UC1aLW9scmxJR2ZBS3FDNzhzM19Mb0hSbHNLbExZVmtObTdJM2Zra19NRWxvZFFlVW5VT2ZpcmROMnUxeE4tWU1URjduU3VhV1V2aU55aGI1M0VQS01UeUE4YU53?oc=5,"Sat, 02 Aug 2025 10:22:10 GMT",
2025-08-03T02:01:06,Google News Reuters,"Ghislaine Maxwell moved to prison camp, Trump says no plea for pardon - Reuters",https://news.google.com/rss/articles/CBMiqgFBVV95cUxQMV9ZSVVjdG16NFhRWTQtVTZjT0pFVml3OWR4NV94c0h2b3NGbVdLZ1ZCRE9nOUJOQXVBSUxIRlJNbUcydDNMZzdNXy1Jd1ZXdGZrNzA4R0lpakFRVTQxd2tJbGwyOURMZmJ3VWFtX25CQWloeGxpSVVLdzNuWmtFYzczVHRlWm1qcmhkbUNpczRlOXFwZ1owUGF5WDYwanIzQjNKV1VuUUFXUQ?oc=5,"Sat, 02 Aug 2025 23:08:20 GMT",
2025-08-03T02:01:06,Google News Reuters,"Richardson arrested for domestic violence in Seattle, report says - Reuters",https://news.google.com/rss/articles/CBMiogFBVV95cUxOOXo4QkFPeGRKdFZrYXR1TGtlVFgtYmh5OU84Y3NHeXUtVm1TXzF6T3libzFteFdzMllnbEQ2WkxHSWI5N2JxYlBka1A3ZV84ZEI0X2lkcHlITWVGbm96UUctLW5HS3J4UWR4S1lPdWJHVGNHZTM4ellBNFFmSDVMa0NfRGQ2eDdYSkNvbnRfU1EtUVlWYTdZZ3lzQzg1TWxfWEE?oc=5,"Sat, 02 Aug 2025 06:00:00 GMT",
2025-08-03T02:01:06,Google News Reuters,US appeals court keeps bar on Los Angeles federal immigration arrests - Reuters,https://news.google.com/rss/articles/CBMisAFBVV95cUxQUXQ3ZVI2ZHNhVHdyeE5TTFBLakVobjVFSVRTc2VHdjFhNE05MVZodkR1WGViRUxqLUpwVElBQmppWXFNOHpPSE5hellib3dWN0JOZlZ5OTFhZHNGR3pDUzFhT2dMbXd6T2NyMi0zR3BMM1hRX1VfSG5DOUtmQ0VUY0RpdVkxNUdGYy1EZmdKM3FLZXhjQXAyMGFhem43R1hpLUdvV180WkVtY0d4S0NGcw?oc=5,"Sat, 02 Aug 2025 07:43:12 GMT",
2025-08-03T02:01:06,Google News Reuters,Court allows Trump to end union bargaining for federal workers - Reuters,https://news.google.com/rss/articles/CBMirAFBVV95cUxPYnpoTEZRc0dIZE8wcTk0UXRxWklKYk1QUVBTc1VVc2NYRE00OE5hNjBIU05aS1haRHFtZlVtMzV5ZjlpdGx5amFNalJzQkZsdjdJSlNvY3hLVkNMV2t6WjRZTUpZVDBRZWxMMTdNVGxBejdaaTgwSG9scUtYcU5uY1ZuUUlRY0lhTjc5b2ppUlQ3UENlM212U1hGaHk0V0IzRGRmaU90bXFKNGFN?oc=5,"Fri, 01 Aug 2025 23:45:28 GMT",
2025-08-03T02:01:06,Google News Reuters,"Kugler resigning from Fed, opening door to Trump appointment - Reuters",https://news.google.com/rss/articles/CBMinAFBVV95cUxPYVRyN1RFNzhEODFEVkpjRGtud3ZmblpNajVrR25ySGM3b3k5c0MzMlk2V2M5RmJHWF84MmpVaWdaQ3VPRlZlS3cwZGlFRW1mMUJ4eEpHYkJ1bFp1eFpnZHU4SEdGSGtmWmVKUzNlSFl3RzZUUEhQTjhMV2hmZmgwS3J1c21pMnRRTmpUVWsxbC1fT2owX2hiU0pkbVk?oc=5,"Sat, 02 Aug 2025 19:05:29 GMT",
2025-08-03T02:01:06,Google News Reuters,"Stocks slump on latest tariffs, soft jobs data - Reuters",https://news.google.com/rss/articles/CBMikAFBVV95cUxObHc5aDFuYkpZRWN3SHJPT202OGNhOG9WazBDU1lCbFR6ekJlR0didk1rcW84cDFxbF9ETjFsN1NMaXZxYnh4VVBQSVdITE0tTFNEdzJ2aUNZTE9wNmNNVkx5cklPMzVodUcwWW9wcXQ5Mmd5UkZSWHlpZlNtM3dXWW9aWG5HV1ZuaC1tMmJ1TUI?oc=5,"Fri, 01 Aug 2025 23:09:50 GMT",
2025-08-03T02:01:06,Google News Reuters,"Global stock index sinks with dollar, bond yields after weak US jobs data - Reuters",https://news.google.com/rss/articles/CBMihwFBVV95cUxQVTlRNnJOQUxheld6SjlLTnRCQ1pvMDhJMHdGMHpPRFpveGtqNEpsMW03aU83Ry13czM2NGNZSjVzZng1VkgzWFRYSGZCYnhJRDIyazVTeVNVS3NVWEdoOXpqMjV3OXdoMWlUTUl1ZEpMXzJFTDE0OFpELTlZbFg3aWxfZTN6akU?oc=5,"Fri, 01 Aug 2025 22:12:17 GMT",
