timestamp,source,title,link,published,content
2025-08-13T01:51:49,MarketWatch Top,Ford is readying a ‘compelling EV.’ Will that be enough for the stock?,https://www.marketwatch.com/story/ford-is-readying-a-compelling-ev-will-that-be-enough-for-the-stock-732626e3?mod=mw_rss_topstories,"Wed, 13 Aug 2025 00:57:00 GMT",
2025-08-13T01:51:49,MarketWatch Top,Intel’s CEO seems to have made nice with Trump. What comes next?,https://www.marketwatch.com/story/intels-ceo-seems-to-have-made-nice-with-trump-what-comes-next-1c9a69d0?mod=mw_rss_topstories,"Wed, 13 Aug 2025 00:54:00 GMT",
2025-08-13T01:51:49,MarketWatch Top,"CoreWeave’s mixed earnings fail to wow AI bulls, and the stock falls",https://www.marketwatch.com/story/coreweaves-mixed-earnings-fail-to-wow-ai-bulls-and-the-stock-falls-6bc57d8d?mod=mw_rss_topstories,"Wed, 13 Aug 2025 00:13:00 GMT",
2025-08-13T01:51:49,MarketWatch Top,"Cava trims sales outlook, stock tumbles as CEO says consumers are navigating a ‘fog’",https://www.marketwatch.com/story/cava-trims-its-sales-outlook-and-shares-tumble-its-ceo-says-consumers-are-navigating-a-fog-8326ee19?mod=mw_rss_topstories,"Wed, 13 Aug 2025 00:11:00 GMT",
2025-08-13T01:51:49,MarketWatch Top,These Eli Lilly executives have been scooping up stock after its big drop,https://www.marketwatch.com/story/these-eli-lilly-executives-have-been-scooping-up-stock-after-its-big-drop-73d2b767?mod=mw_rss_topstories,"Tue, 12 Aug 2025 23:07:00 GMT",
2025-08-13T01:51:49,MarketWatch Top,​Trump is creating a perfect tax for corporate America — one it’ll pay. Here’s what to watch.,https://www.marketwatch.com/story/trumps-nvidia-deal-opens-a-pay-to-play-toll-road-to-do-business-in-america-investors-will-feel-every-bump-5601f2f7?mod=mw_rss_topstories,"Tue, 12 Aug 2025 22:09:00 GMT",
2025-08-13T01:51:49,MarketWatch Top,‘I feel shaken’: A man offered to powerwash my patio for $50. He would not take no for an answer.,https://www.marketwatch.com/story/i-feel-shaken-a-man-offered-50-to-powerwash-my-patio-he-would-not-take-no-for-an-answer-9223ce12?mod=mw_rss_topstories,"Tue, 12 Aug 2025 22:01:00 GMT",
2025-08-13T01:51:49,MarketWatch Top,Stocks too expensive for your taste? This bargain-hunting strategy can yield big returns with less risk.,https://www.marketwatch.com/story/stocks-too-expensive-for-your-taste-this-bargain-hunting-strategy-can-yield-big-returns-with-less-risk-02928810?mod=mw_rss_topstories,"Tue, 12 Aug 2025 21:42:00 GMT",
2025-08-13T01:51:49,MarketWatch Top,"‘I am a senior citizen’: My car needs $3,500 for repairs, but only has a trade-in value of $6,000. Do I bother fixing it?",https://www.marketwatch.com/story/i-am-retired-and-not-wealthy-my-car-needs-3-500-for-repairs-but-only-has-a-trade-in-value-of-6-000-do-i-bother-fixing-it-e81d225e?mod=mw_rss_topstories,"Tue, 12 Aug 2025 21:35:00 GMT",
2025-08-13T01:51:49,MarketWatch Top,‘Absolutely no one pays attention’: I could steal from my children’s trust fund without them having a clue,https://www.marketwatch.com/story/absolutely-no-one-pays-attention-i-could-steal-from-my-childrens-trust-fund-without-them-having-a-clue-06eb6526?mod=mw_rss_topstories,"Tue, 12 Aug 2025 21:30:00 GMT",
2025-08-13T01:51:49,CNBC Top News,Trump tells Goldman Sachs CEO David Solomon to replace bank's economist over tariff predictions,https://www.cnbc.com/2025/08/12/trump-solomon-goldman-sachs-economist-tariffs.html,"Tue, 12 Aug 2025 21:30:39 GMT",
2025-08-13T01:51:49,CNBC Top News,"Trump threatens Fed chair Powell with 'major lawsuit,' demands interest rate cut",https://www.cnbc.com/2025/08/12/trump-fed-powell-lawsuit-washington-building.html,"Tue, 12 Aug 2025 18:14:44 GMT",
2025-08-13T01:51:49,CNBC Top News,CoreWeave shares drop even as revenue and guidance top estimates,https://www.cnbc.com/2025/08/12/coreweave-crwv-q2-earnings-report-2025.html,"Tue, 12 Aug 2025 22:12:12 GMT",
2025-08-13T01:51:49,CNBC Top News,Circle shares fall after stablecoin issuer says it will offer 10 million shares,https://www.cnbc.com/2025/08/12/circle-shares-fall-after-stablecoin-issuer-says-it-will-offer-10-million-shares.html,"Tue, 12 Aug 2025 21:17:13 GMT",
2025-08-13T01:51:49,CNBC Top News,White House eyes Smithsonian museums for Trump's 'American exceptionalism' compliance,https://www.cnbc.com/2025/08/12/trump-white-house-smithsonian-museum-american.html,"Tue, 12 Aug 2025 22:16:16 GMT",
2025-08-13T01:51:49,CNBC Top News,Trump pick for BLS commissioner recently called for suspending monthly jobs report,https://www.cnbc.com/2025/08/12/trump-bls-antoni-jobs-report-data.html,"Tue, 12 Aug 2025 22:00:40 GMT",
2025-08-13T01:51:49,CNBC Top News,"Fed board contenders Miran, Bullard say Trump's tariffs are not causing inflation",https://www.cnbc.com/2025/08/12/fed-board-contenders-miran-bullard-say-trumps-tariffs-are-not-causing-inflation.html,"Tue, 12 Aug 2025 18:41:16 GMT",
2025-08-13T01:51:49,CNBC Top News,Cava stock plummets after company lowers forecast on disappointing same-store sales growth,https://www.cnbc.com/2025/08/12/cava-q2-2025-earningshtml.html,"Tue, 12 Aug 2025 20:26:28 GMT",
2025-08-13T01:51:49,CNBC Top News,Here’s the inflation breakdown for July 2025 — in one chart,https://www.cnbc.com/2025/08/12/heres-the-inflation-breakdown-for-july-2025-in-one-chart.html,"Tue, 12 Aug 2025 18:57:55 GMT",
2025-08-13T01:51:49,CNBC Top News,Perplexity offers to buy Google's Chrome browser for $34.5 billion,https://www.cnbc.com/2025/08/12/perplexity-google-chrome-ai.html,"Wed, 13 Aug 2025 00:55:09 GMT",
2025-08-13T01:51:49,CNBC Top News,Jim Cramer tells investors to 'stay the course' even when it feels tough. Here's why,https://www.cnbc.com/2025/08/12/cramer-stock-market-trump.html,"Tue, 12 Aug 2025 22:44:02 GMT",
2025-08-13T01:51:49,CNBC Top News,White House says it's working out legality of Nvidia and AMD China chip deals,https://www.cnbc.com/2025/08/12/white-house-working-out-legality-nvidia-amd-china-chip-deals.html,"Tue, 12 Aug 2025 18:33:09 GMT",
2025-08-13T01:51:49,CNBC Top News,Musk-Altman battle escalates as Tesla CEO drags Apple into the spat,https://www.cnbc.com/2025/08/12/musk-altman-battle-escalates-as-tesla-ceo-drags-apple-into-the-spat-.html,"Tue, 12 Aug 2025 22:13:45 GMT",
2025-08-13T01:51:49,CNBC Top News,"2 of our financial stocks jump to record highs — plus, Meta's Threads keeps growing",https://www.cnbc.com/2025/08/12/2-of-our-financial-stocks-jump-to-record-highs-plus-metas-threads-keeps-growing-.html,"Tue, 12 Aug 2025 18:33:23 GMT",
2025-08-13T01:51:49,CNBC Top News,"China warns companies against using Nvidia and AMD chips, report says",https://www.cnbc.com/2025/08/12/china-warns-companies-against-using-nvidia-and-amd-chips-report-says.html,"Tue, 12 Aug 2025 20:54:18 GMT",
2025-08-13T01:51:49,CNBC Top News,"FDA may pull authorization of Pfizer's Covid vaccine for children under 5, company says",https://www.cnbc.com/2025/08/12/fda-may-pull-authorization-of-pfizer-covid-shot-for-children-under-5.html,"Tue, 12 Aug 2025 20:08:40 GMT",
2025-08-13T01:51:49,CNBC Top News,"Social Security cost-of-living adjustment may be 2.7% in 2026, new estimates find",https://www.cnbc.com/2025/08/12/cola-2026-social-security-cost-of-living-adjustment-estimate.html,"Tue, 12 Aug 2025 19:31:25 GMT",
2025-08-13T01:51:49,CNBC Top News,"'Groundbreaking': Las Vegas Sphere says it's sold 120,000 tickets for 'Wizard of Oz' screenings",https://www.cnbc.com/2025/08/12/vegas-sphere-wizard-of-oz-ticket-sales.html,"Tue, 12 Aug 2025 18:46:18 GMT",
2025-08-13T01:51:49,CNBC Top News,Quantum computing could be commercial real estate’s next big tailwind,https://www.cnbc.com/2025/08/12/quantum-computing-commercial-real-estate-tailwind.html,"Tue, 12 Aug 2025 17:28:17 GMT",
2025-08-13T01:51:49,CNBC Top News,Musk threatens 'immediate' legal action against Apple over alleged antitrust violations,https://www.cnbc.com/2025/08/12/musk-threatens-immediate-legal-action-against-apple-over-alleged-antitrust-violations.html,"Tue, 12 Aug 2025 23:38:20 GMT",
2025-08-13T01:51:49,CNBC Top News,SpaceX rival AST SpaceMobile prepares to deploy nearly five dozen satellites,https://www.cnbc.com/2025/08/12/spacex-rival-ast-spacemobile-asts-stock.html,"Tue, 12 Aug 2025 17:54:35 GMT",
2025-08-13T01:51:49,CNBC Top News,Circle shares rise as second-quarter revenue jumps 53% on strong stablecoin growth,https://www.cnbc.com/2025/08/12/circle-crcl-earnings-q2-2025.html,"Tue, 12 Aug 2025 18:47:12 GMT",
2025-08-13T01:51:49,CNBC Top News,Spirit Airlines warns it might not be able to survive without more cash,https://www.cnbc.com/2025/08/12/spirit-airlines-warns-it-might-not-be-able-to-survive-without-more-cash.html,"Tue, 12 Aug 2025 14:43:04 GMT",
2025-08-13T01:51:49,CNBC Top News,"Tesla is hiring robotaxi test drivers in New York City, but company hasn't applied for permits",https://www.cnbc.com/2025/08/12/tesla-hiring-robotaxi-test-drivers-in-nyc-hasnt-applied-for-permits.html,"Tue, 12 Aug 2025 20:41:00 GMT",
2025-08-13T01:51:49,CNBC Top News,"Uber Freight CEO joins self-driving truck company Waabi, says era of autonomous big rigs on U.S. roads is here",https://www.cnbc.com/2025/08/12/uber-freight-ceo-self-driving-freight-truck-startup-waabi.html,"Tue, 12 Aug 2025 15:35:48 GMT",
2025-08-13T01:51:49,CNBC Top News,Anthropic is giving Claude to the U.S. government for $1 as AI companies try to win key agencies,https://www.cnbc.com/2025/08/12/anthropic-claude-government-ai.html,"Tue, 12 Aug 2025 20:06:06 GMT",
2025-08-13T01:51:49,CNBC Top News,IPO performance vs. S&P 500 since April market low? It's not even close,https://www.cnbc.com/2025/08/12/ipo-performance-sp-500-stocks-bull-market.html,"Tue, 12 Aug 2025 15:10:26 GMT",
2025-08-13T01:51:49,CNBC Top News,Why a new UK internet safety law is causing an outcry on both sides of the Atlantic,https://www.cnbc.com/2025/08/12/why-the-uk-age-verification-law-has-led-to-backlash.html,"Tue, 12 Aug 2025 14:38:41 GMT",
2025-08-13T01:51:49,CNBC Top News,These are smart moves for required withdrawals in retirement when you don’t need the money,https://www.cnbc.com/2025/08/12/required-minimum-distributions.html,"Tue, 12 Aug 2025 17:19:15 GMT",
2025-08-13T01:51:49,CNBC Top News,"Shares of Swiss sneaker company On jump as it posts 32% sales growth, hikes outlook",https://www.cnbc.com/2025/08/12/on-holding-onon-earnings-q2-2025.html,"Tue, 12 Aug 2025 17:24:07 GMT",
2025-08-13T01:51:49,Investing.com All News,CuriosityStream announces pricing of 7 million share secondary offering,https://uk.investing.com/news/company-news/curiositystream-announces-pricing-of-7-million-share-secondary-offering-93CH-4216718,2025-08-13 01:34:06,
2025-08-13T01:51:49,Investing.com All News,Form 13G URANIUM ENERGY CORP For: 12 August,https://uk.investing.com/news/filings/form-13g-uranium-energy-corp-for-12-august-93CH-4216717,2025-08-13 01:32:06,
2025-08-13T01:51:49,Investing.com All News,OpenAI mulls investing in brain implant startup to rival Musk’s Neuralink- reports,https://uk.investing.com/news/stock-market-news/openai-mulls-investing-in-brain-implant-startup-to-rival-musks-neuralink-reports-4216716,2025-08-13 01:32:06,
2025-08-13T01:51:49,Investing.com All News,Form 13G Cidara Therapeutics For: 12 August,https://uk.investing.com/news/filings/form-13g-cidara-therapeutics-for-12-august-93CH-4216714,2025-08-13 01:16:08,
2025-08-13T01:51:49,Investing.com All News,"Asian equities seen resilient despite global slowdown worries, says BofA",https://uk.investing.com/news/stock-market-news/asian-equities-seen-resilient-despite-global-slowdown-worries-says-bofa-4216713,2025-08-13 01:16:08,
2025-08-13T01:51:49,Investing.com All News,"Reeve, US physical therapy COO, sells $155k in shares",https://uk.investing.com/news/insider-trading-news/reeve-us-physical-therapy-coo-sells-155k-in-shares-93CH-4216712,2025-08-13 01:12:09,
2025-08-13T01:51:49,Investing.com All News,Form 13G Instil Bio For: 12 August,https://uk.investing.com/news/filings/form-13g-instil-bio-for-12-august-93CH-4216711,2025-08-13 01:10:08,
2025-08-13T01:51:49,Investing.com All News,Natera director Sheena Jonathan sells $958k in NTRA stock,https://uk.investing.com/news/insider-trading-news/natera-director-sheena-jonathan-sells-958k-in-ntra-stock-93CH-4216710,2025-08-13 01:08:09,
2025-08-13T01:51:49,Investing.com All News,Form 13G Soleno Therapeutics For: 12 August,https://uk.investing.com/news/filings/form-13g-soleno-therapeutics-for-12-august-93CH-4216709,2025-08-13 01:02:09,
2025-08-13T01:51:49,Investing.com All News,Resideo technologies (REZI) sees buys worth $35.2m by CD&R group,https://uk.investing.com/news/insider-trading-news/resideo-technologies-rezi-sees-buys-worth-352m-by-cdr-group-93CH-4216708,2025-08-13 01:02:08,
2025-08-13T01:51:49,Investing.com Bond News,Rates Spark: Tuesday’s Fiscal and CPI Data Can Prove Troubling,https://uk.investing.com/analysis/rates-spark-tuesdays-fiscal-and-cpi-data-can-prove-troubling-200618070,"Aug 12, 2025 05:13 GMT",
2025-08-13T01:51:49,Investing.com Bond News,US 3-Year Auction Disappoints Slightly as Markets Question Rate Cut Path,https://uk.investing.com/analysis/us-3year-auction-disappoints-slightly-as-markets-question-rate-cut-path-200617956,"Aug 05, 2025 20:31 GMT",
2025-08-13T01:51:49,Investing.com Bond News,US Treasury Yields Tick Higher Ahead of Heavy Auction Week,https://uk.investing.com/analysis/us-treasury-yields-tick-higher-ahead-of-heavy-auction-week-200617942,"Aug 05, 2025 07:14 GMT",
2025-08-13T01:51:49,Investing.com Bond News,The Bond Market Is Pricing in a Softer Economy,https://uk.investing.com/analysis/the-bond-market-is-pricing-in-a-softer-economy-200617930,"Aug 04, 2025 22:17 GMT",
2025-08-13T01:51:49,Investing.com Bond News,Non-Farm Payrolls Ahead: Saving the Most Exciting for Last?,https://uk.investing.com/analysis/nonfarm-payrolls-ahead-saving-the-most-exciting-for-last-200617897,"Aug 01, 2025 06:50 GMT",
2025-08-13T01:51:49,Investing.com Bond News,Medium-Term Corporates Lead US Bond Market in 2025,https://uk.investing.com/analysis/mediumterm-corporates-lead-us-bond-market-in-2025-200617754,"Jul 23, 2025 11:53 GMT",
2025-08-13T01:51:49,Investing.com Bond News,Japan’s Election Results Could Send Shockwaves Through US Bond Market,https://uk.investing.com/analysis/japans-election-results-could-send-shockwaves-through-us-bond-market-this-week-200617701,"Jul 21, 2025 06:55 GMT",
2025-08-13T01:51:49,Investing.com Bond News,How Fed Could Inject Liquidity if Bond Yields Surge: What Investors Need to Know,https://uk.investing.com/analysis/how-fed-could-inject-liquidity-if-bond-yields-surge-what-investors-need-to-know-200617670,"Jul 17, 2025 13:37 GMT",
2025-08-13T01:51:49,Investing.com Bond News,US 10-Year Yield Holds Above Fair Value as Deficit and CPI Heat Up,https://uk.investing.com/analysis/us-10year-yield-holds-above-fair-value-as-deficit-and-cpi-heat-up-200617650,"Jul 16, 2025 11:56 GMT",
2025-08-13T01:51:49,Investing.com Bond News,Treasury Auction Shows Strength: Bid-to-Cover and Foreign Demand Surge,https://uk.investing.com/analysis/treasury-auction-shows-strength-bidtocover-and-foreign-demand-surge-200617554,"Jul 10, 2025 10:41 GMT",
2025-08-13T01:51:50,Google News Reuters,Israel bombards Gaza City; Hamas leader visits Cairo in bid to salvage ceasefire talks - Reuters,https://news.google.com/rss/articles/CBMizgFBVV95cUxQNVpaeVlRS0JDOXJCNTFNRTI3dFllVFAxek9SWmZxQllsQS1Td3drLVdzd0docFdzT0lXSl8xNGY2NWJRLVlBNmY0UGRpMHFrbXM4UG1oUVBYREFkcERKMmpwNDZLZS1FcVhjdDdQWXZ4d1dvY20zTWRqUTNjVkM2Y3pscjhxWXFUVm9hZ3BqWjAtQnBHTEs1U2FvMlprS2cyXzJxWkFSdUM4MjI1djhqRFhUdkRhcmtRY0x5aHV3TVdHSk1JZmtTcUs1RlRUdw?oc=5,"Tue, 12 Aug 2025 22:06:38 GMT",
2025-08-13T01:51:50,Google News Reuters,South Korea's former first lady imprisoned after court issues warrant - Reuters,https://news.google.com/rss/articles/CBMiwAFBVV95cUxOa2VWTHc5bVJTdHR4SF9nZURrVERMVldBWW5oUXcxTGltM3dUWS1zOGlEU191RXVUbk52a0pBaVVOeUM0RTRaMElyTXBKYWQtOW9WdF9Ma1VrWDJzeE9vRW8tQ2E0a0l0OUZBNW1SZFBYZWI5emNfd3RkYzdVLUh0dlJQVWtkSVBfODZqM2NfeS1zVU9paW9lWFl2SnNTUHhMR241RXEzbjdWTU82Z2lkYllGZUJIWFJjV0ctdHdkOEI?oc=5,"Tue, 12 Aug 2025 21:36:11 GMT",
2025-08-13T01:51:50,Google News Reuters,Trump rebukes Goldman's Solomon over bank's tariff research - Reuters,https://news.google.com/rss/articles/CBMirwFBVV95cUxOVzhxcEl0djZ5WUFuZW9rUkZwdEEwajNjcW9mZW1WOTh2NURzYVdPQ2RJeFhHb3l1Nk94N2laa2tnN3NPTkREdGlndk1CeGZUVFNtdDdhNGFrT2V0X0cxSkd5Y3plZVdyNVZaSW52eVk3WlZzYXRPNFB3MmpkS19MdnNrNml5SVc0MFMxcFRpYUw3Ymw1dmpXT1lMaXVZN3h0aDFVZHJ1OVJqRllYMTBZ?oc=5,"Wed, 13 Aug 2025 00:27:00 GMT",
2025-08-13T01:51:50,Google News Reuters,"Exclusive: Pentagon Golden Dome to have 4-layer defense system, slides show - Reuters",https://news.google.com/rss/articles/CBMiwAFBVV95cUxPRENfRGJPMXJ2OTJzc05mY2FjOWUxSWdDdGhTeURxRHNpU2FfNmc0OERJX0NBRzgwanRaUWdocEFFNHNxSkVUN2lHWXQyUXBlZGE5ZHRITng0Y2pHaGtTRmNkQVVleUJIZTduc1FCWDJlRnVqUHcyOTRjNW40bFdHNktZNkR4alVUbnpRMzRfN1hVLWt1NjNBSkQ0ZjBUX2lvcnoxVHVUSDFWSzNCM3ZyUXo0cllRUjI1Qlp3QjljYWY?oc=5,"Tue, 12 Aug 2025 22:28:59 GMT",
2025-08-13T01:51:50,Google News Reuters,"Homeless who refuse to cooperate with Trump crackdown may go to jail, White House says - Reuters",https://news.google.com/rss/articles/CBMiwgFBVV95cUxOWWhEck5KSmRmeW5Sa21MTEdTYno3RWp0R2FvNzB6X2N6eXZMOS1EUXplMVA2WEwySkwwQXRGdUJiREhzZnpxc2RxZXMzSHUyUzhKWFBaUzBpREVSRGs3S0ZabE9XS3ZmRlRpOHBydldhbnF6SjJXbGs3UTFaTDk2QTN5Snk5cnU5S1VlRmRnNGIwMlFNMXpLZmdVenhGc08zSUxTeFpxcjlvOG9SQ3BIOFhwWnMxclkzdEZrUWw4Z3g0QQ?oc=5,"Tue, 12 Aug 2025 23:06:21 GMT",
2025-08-13T01:51:50,Google News Reuters,"S&P 500, Nasdaq end at record closing highs as moderate inflation lifts rate hopes - Reuters",https://news.google.com/rss/articles/CBMiuwFBVV95cUxNX0RBazdGWThGR2ZxalYzT1hSbk1uVzB3RXVXcWxqd1Q2VjlVSURKdFA2Ym1HMVFzb1hBWkVkTmNhZ1RoZHpvUm1sY2ktLXJjZnB3VFVReUdRQ2NiVFdlbFRkUHpnc2JKV3JVbl9JaTRlNHBYWFdUSHNXTFUyLVZyNGo3YUZ4Nm9pTzN6SzdjMUlvVFRQYVRFWWNWSmZPMk1sZm1lQlpRRHhTUkpINno3SGF5SjRHazlveUlJ?oc=5,"Tue, 12 Aug 2025 22:32:54 GMT",
2025-08-13T01:51:50,Google News Reuters,Air Canada seeks government intervention as contract talks with flight attendants stall - Reuters,https://news.google.com/rss/articles/CBMi0wFBVV95cUxPdXRZR2Z1eGlrWWE5d0RMNFNJdFp1eUVrUlNOM0Vqc3lBWFhkdXFqd2xyTXIzaTdPTXFjU1h0cVRTZUtGTDlGTEVPbWEwX2syYldOVGp5cmcwWjc0bUxlNjhNcHhvaVlFUzlKS1YySFJHY3poYnY5b2ZjeEVKQVN4VWVjb1I3RTJLTEVDSmtCZUljTmRmQ2FsX3cwRlJDbWI2M2J6UFJYXzU3UDlKQkxGS0NGTUNwOURDRFZ5VC1vMnl3U1hTYzVVNlBiWXRDMjE0d21B?oc=5,"Wed, 13 Aug 2025 00:25:00 GMT",
2025-08-13T01:51:50,Google News Reuters,"Russia is suspected to be behind hack of US federal court filing system, New York Times reports - Reuters",https://news.google.com/rss/articles/CBMixgFBVV95cUxOR3VKUm05RzNubUZCZmlQbkhOMWE5ZG9lWWVMbGRVbDNyaVhIRlh3SlIwaW9aYkNlT2hMWFN2YnhfcGdock9hZlk5YS1Mdnlpam14VjJjODdwWjZ0U2dxTlR4QV92Q0RQYnNYZFU3NVUwODd5UU1mMnNJcmQ4MVQ1RmQzSGdNV195U3dUeWtnaHdGYWJ3TVBsV2FYVF95VDhrQVBwX2JMa1BLMGwzM19KNkwxd0FjNGRMeWlOUGREMXcxdjN5eGc?oc=5,"Tue, 12 Aug 2025 19:48:56 GMT",
2025-08-13T01:51:50,Google News Reuters,"Ukraine, sidelined in Trump-Putin summit, fights Russian grab for more territory - Reuters",https://news.google.com/rss/articles/CBMivAFBVV95cUxOMXFXR0JtNHJQWUI5LTVPSnRULTR0SmhJU1Y4V2c2emZYUEdySmZXY1FNN3BNNzFVTDd1OWlwam1zdGl0bFdNbVptMDFUTzdaaFV5Wmk5VmJUbUM1NmtSekJCbURuakZ6aHdEZDZQVUZKNmhaUzVqNE1qN1VuaU5jd1lUcHVjTnVqMFJ2bFFaY1RUYXpwa25ObUo4VUtZbVJ2SGxhdTdfWXJHeTdpY2MzVlpWV3E1X1RsZDhDWg?oc=5,"Tue, 12 Aug 2025 23:55:12 GMT",
2025-08-13T01:51:50,Google News Reuters,"Trump's unusual Nvidia deal raises new corporate and national security risks, lawmakers and experts say - Reuters",https://news.google.com/rss/articles/CBMiwgFBVV95cUxQNW0tLWxBSXltQVFudWdidmdrWlhoaE0ta0lUUERINkVZam9Yc0VXTWxsMm8yS1R1Q21uYTZlRFI3T1dtNmgxUlZBZUctMlNEOEJ5QUVNdmtNY2M4M1c2X1JQeWxkZHFwLTB6ZGo1VHpMQnZGTnpnbWJ2NWJQVko3Mi1Bckd0MC1lcl9LRWNmMUQzSC1ITzczUFRLRnFrNUFwZExXeDVkdDh0M0QyQ2pabUQxM0E0OUgxNkpnbjhtcDM1UQ?oc=5,"Tue, 12 Aug 2025 19:34:04 GMT",
2025-08-13T01:51:50,Google News Reuters,Dollar slips as US inflation data backs September rate cut - Reuters,https://news.google.com/rss/articles/CBMirgFBVV95cUxPTllSQXpxdUxmR3BVNEhKSjUtWVh2LWxOY0ZUTkNPTi1hbUc3UldHcWgtYm45R213dWVseldQak5paEtyWFJ4YlRKT1V0UXhtc3ZGSGVTSDUyZDczQW1CdUwzZmYyTzBFZFF5VnhlZHVlRHVkRUpub2h2Z1dGQXFiN3ZaRUxJWER4RE1pMTZFeTZ6WldGSHVNRFI5YXRuQmhJbi1zcmNBTGNRSmVBZ2c?oc=5,"Tue, 12 Aug 2025 20:05:10 GMT",
2025-08-13T01:51:50,Google News Reuters,US deficit grows to $291 billion in July despite tariff revenue surge - Reuters,https://news.google.com/rss/articles/CBMiqwFBVV95cUxPVFFEZDVIZTR1aHhhWGhlOGEtZUh6SXFadW9Pc21uckh6R3VaRVdTV1NzUFRjZEpSb1N2eVhsUDRqU1RLeGtYZmE3NGNQekVJM2hVTEM4cjNNWjNaTTFmS0RGRnM2R2dmQzRpRGFtcU5aSTY4ek1RUmU1SE5hNzNIT2tudXBBOVVvei1nYmF0TENzbXE1cnZHYmw3R3djM2Q3cFQ1aHhBYXotcWc?oc=5,"Tue, 12 Aug 2025 23:10:16 GMT",
2025-08-13T01:51:50,Google News Reuters,"Mexico, under pressure from Trump, transfers 26 more cartel members to US - Reuters",https://news.google.com/rss/articles/CBMitAFBVV95cUxPSHdpQUZRaEN3Y0R4X19rblFxM1g5WHh3TUNuYnltbExEODBqZFlFV2lwNV9WbGxLVEJlbThMbzBjUUVoQndybmdQWS16U0JHY2MwUUU1OTJ0OUI4Zm9OaThSTjNFRlRoTnJaQVBGa25INDVZcTlZNjZVbFBiWG5saWtJdVRtQ1E2bi14RzduLW5fWjBoREJzbWduaUVpSkJDSE1oM3VRZmJzTHlGZ1Z4Rk5KU2o?oc=5,"Tue, 12 Aug 2025 23:15:45 GMT",
2025-08-13T01:51:50,Google News Reuters,US deficit grows to $291 billion in July despite surge in tariff revenue - Reuters,https://news.google.com/rss/articles/CBMiqwFBVV95cUxPMk94blhtUlFYWm5vbGVodnVMcVd2MXQtUWxIVktYazdMbTdkS2xsUDRkX0FVUEZqU1dDX3BqZWVETEhvWUJKOW1JNHhkRjRGNlczYUxOLW9VWUVPZXV0Nlg2cFBiZnd5SXF5UGdtZ196V21wZ3hEUTNYRl81aWhMOG02b01LMlBEejByUFM4akZuSmszQkJZdmNDS2FxcmdpNUFyMEtkN3VFbE0?oc=5,"Tue, 12 Aug 2025 18:06:31 GMT",
2025-08-13T01:51:50,Google News Reuters,Stocks hit fresh record high but US dollar weakens as Fed rate cut expectations gain momentum - Reuters,https://news.google.com/rss/articles/CBMihgFBVV95cUxOa3p1WmNNdXBsX2dXTG5icUQyU1lGMWJEbEFmUzJuX1ZCNEVQYWNQZDRIQ0NCSUxndW55bkg0NDB2bWJGZ3RzVzFxdk4wV0pBZDk5WHEzQURQUTNCT3c2a0hRbG12enI4UVFQTFNWSjJYd29ra0VET1VNN2I2TzlQVHVvRFhqZw?oc=5,"Tue, 12 Aug 2025 21:28:00 GMT",
2025-08-13T01:51:50,Google News Reuters,Russia tries to make sudden advance in Ukraine before Trump-Putin summit - Reuters,https://news.google.com/rss/articles/CBMitgFBVV95cUxOcHNDOTJMLWZwN181VzM5aVZyWl94ZGg5ejJrVEcyNnZpUWJ4Q3F0dktuNVRsNWx0cFF4Y3FKMHBxTm1XQjd4aU1vU1lkT2E0RURwb01ZRm9ESmRwSWpNQlFoQk9rclZ1dkxLNHhtLVk0ZFVNazByaF9Rb0tjRUxhVWtIVHo2b2ZZQjJsQ3hoZVJRdU9aWWtZZ3hHQ0VNV05qNFppQlNrRkphdlRLRnh1aVZUMnJrZw?oc=5,"Tue, 12 Aug 2025 17:22:12 GMT",
2025-08-13T01:51:50,Google News Reuters,"Russia has won war in Ukraine, Hungary's Orban says - Reuters",https://news.google.com/rss/articles/CBMikgFBVV95cUxOY3QwSndyQ3o0NHh6VTBEMzdZMXg0Tzd6YWZxeVAybkpMUGY5WTBRUWdxQVdvcEpMZTM5RXVVM2xpVzAtRkJvdjRKV0hXd0t6OFBLX1pvUFZpM2k5anVGUG9uNU01U19sQXU2SFNsUXJJZFRXeHBRMGVTOXFPZE9FZHhGeGktOEd3RzFDNU5pLVJLdw?oc=5,"Tue, 12 Aug 2025 16:39:07 GMT",
2025-08-13T01:51:50,Google News Reuters,"Trump weighing lawsuit against Fed's Powell over renovations, White House says - Reuters",https://news.google.com/rss/articles/CBMiyAFBVV95cUxNZERQcUZRQWpIUmdyZGlYT1dtNTVnV1ZWTDJUS2ZrWG1Nb2paaHB4OC1sWWU3NnpHd2RtZUhzMFlDR2V0SDdPLTV2X2oxNFZGMHY3TW9MWUdWNDdMOWNwS0hieWJIaDhxaEtVaDRhR1JtR0JRRDNNVllRbFNrVldQUFhpWmhTcGVNWExRUC1BRm5Ed3dzUGNJVl9jUU9HenZUX0J6ZmJidThtWkFwUDFKSjN6WHQ2bWdfTkF2N3lwTEZPY3ZVVl8taw?oc=5,"Tue, 12 Aug 2025 18:21:03 GMT",
2025-08-13T01:51:50,Google News Reuters,Cheaper gasoline restrains US consumer prices; worries about data quality rise - Reuters,https://news.google.com/rss/articles/CBMivwFBVV95cUxPeVZ0QnlPcWNiTjRBUHNtclJHZWJkNk9JcW93dmlXbWFLeVNyTERWRnZzbXIzczM4X1NRUGFVcFN1TzhmN3YwQThxZV9TUWRKSU9haXVxbjJNR3h2WFdsNHJpWGlCaWd3dk5LbTB5X1pMb3o4NVYyY0VaUjRFT0FvT0VvOEtWQVVMaDZVUlo4ckRkRHM4aXdSRWNqTXc3SG5UVXRIV2QybWU2b3pfNTRsM25tb2k0T3JyOGtla1A4aw?oc=5,"Tue, 12 Aug 2025 19:17:40 GMT",
2025-08-13T01:51:50,Google News Reuters,Oil prices dip as market awaits EIA report - Reuters,https://news.google.com/rss/articles/CBMilgFBVV95cUxQRzNVdnRaM3Y0ZG8xZlNKNjNCNjFjZFBJN3daLUFDZXBmU0RVeTVkUlkyanFoeW10dEVVU1NuWUpiaTAzYmUtOEpTdnNBOTduYWFPZTVFenpDNnF2QnV3b3I1SF91N0szZFppWnA0NTNvRjBwc1h5Y2VSTkVWck9Hb20wODB3dDctNFVaWkozcVNmVHFnSFE?oc=5,"Tue, 12 Aug 2025 20:04:56 GMT",
2025-08-13T01:51:50,Google News Reuters,Do Kwon pleads guilty to US fraud charges in $40 billion crypto collapse - Reuters,https://news.google.com/rss/articles/CBMiugFBVV95cUxONkM3YWZPNDR5YUtMMVlzZTNtRUw1clY1UlF6SFcyOV9FNEtoa3hWdXFDNlBEY2V3d2s3YUFWSXdsb2UtdV9FOG5QeDFmajhuOFZWRW5Wa25ZcWJyTjl4UjUwdXltYjQxSGdwVTUtWm9tU1F3RXFLZXNUa2k2cGlITHJjYTNSbC1SWTU3VFBkM3RuTG9NYkx3dXNUR1BWaDVFOTYtVUNmSEZrSTk5MkJUOWpFal8yMjMzMFE?oc=5,"Tue, 12 Aug 2025 22:17:12 GMT",
2025-08-13T01:51:50,Google News Reuters,Texas sues Eli Lilly for allegedly bribing providers to prescribe its medications - Reuters,https://news.google.com/rss/articles/CBMixgFBVV95cUxPajJJcTNaVWtheFBWSVFuZjlMNEhiZVRsVjRZS3ROVTE5d3p2anhuVXVVanVteXp5bXJwdi1WMl9OT29MbkI0dkhQLWkydnpCTkdreDV6dWpfX0hzWHlSZU5aR3NvR2thR2JZbVMzVV9fWDhxd2NQR0xjWXpZUkdYZDBIdDZIOVZHZUhiMkFiTUo4V1R2NGtLYUFKWWpGU0hIMmNCN0VrT2JtWlpMb1VBY1N1YllmUjUtR2ZVNzVIeXhVWTRXcHc?oc=5,"Tue, 12 Aug 2025 18:55:33 GMT",
2025-08-13T01:51:50,Google News Reuters,AI startup Perplexity makes bold $34.5 billion bid for Google's Chrome browser - Reuters,https://news.google.com/rss/articles/CBMiygFBVV95cUxNZVVDa1l6TXlOQ1F6Nkw0WkF3UFNFRWhGWTBwMFg1c3Z2VFVoeW5uVGkzVzZwZnF5dkRWeHRidEptQW9VMm91d3BGckpJU0JuT3dFVnRfZEdoYjFGZENaNGc3LXpRZEJ6R1ZNTjUyYXNxVDdsVzNKX2xqU3ByVTI0LUJ6M3JwTjdwQ2ZSZW5OMkVkSjJGYnVRaUJVbVMyelB6cVRNWlV1SnFkR2tlNVN0SDA4S3RkeXVCMzhjRnd1STI5dTljN1JVWmxB?oc=5,"Tue, 12 Aug 2025 18:35:50 GMT",
