timestamp,source,title,link,published,content
2025-08-28T01:20:46,MarketWatch Top,CoreWeave’s stock has slumped. Here’s how the company can prove the bears wrong.,https://www.marketwatch.com/story/coreweaves-stock-has-slumped-heres-how-the-company-can-prove-the-bears-wrong-62e237b4?mod=mw_rss_topstories,"Thu, 28 Aug 2025 01:17:00 GMT",
2025-08-28T01:20:46,MarketWatch Top,‘My brother found God in recovery’: How do you save for retirement when ‘God will provide’ is your core value?,https://www.marketwatch.com/story/my-brother-found-god-in-recovery-how-do-you-save-for-retirement-when-god-will-provide-is-your-core-value-fae8088a?mod=mw_rss_topstories,"Thu, 28 Aug 2025 01:07:00 GMT",
2025-08-28T01:20:46,MarketWatch Top,Urban Outfitters stock is selling off despite a strong quarter. Some analysts wonder what’s left in the tank.,https://www.marketwatch.com/story/urban-outfitters-stock-is-selling-off-despite-a-strong-quarter-some-analysts-wonder-whats-left-in-the-tank-ea9a2196?mod=mw_rss_topstories,"Thu, 28 Aug 2025 00:27:00 GMT",
2025-08-28T01:20:46,MarketWatch Top,"Five Below raises its full-year outlook, despite ‘ever-changing tariff environment’",https://www.marketwatch.com/story/five-below-raises-its-full-year-outlook-despite-ever-changing-tariff-environment-7f287614?mod=mw_rss_topstories,"Thu, 28 Aug 2025 00:26:00 GMT",
2025-08-28T01:20:46,MarketWatch Top,"Snowflake wows investors with AI momentum, and the stock rallies after earnings beat",https://www.marketwatch.com/story/snowflake-wows-investors-with-ai-momentum-and-the-stock-rallies-after-earnings-beat-6b616265?mod=mw_rss_topstories,"Thu, 28 Aug 2025 00:25:00 GMT",
2025-08-28T01:20:46,MarketWatch Top,I am a 65-year old single woman with 25 credit cards. How do I cancel them without hurting my credit score?,https://www.marketwatch.com/story/i-am-a-65-year-old-single-woman-with-25-credit-cards-how-do-i-cancel-them-without-hurting-my-credit-score-bd9fe4c7?mod=mw_rss_topstories,"Thu, 28 Aug 2025 00:00:00 GMT",
2025-08-28T01:20:46,MarketWatch Top,"We’re in our 70s and have $1.4 million. We pay $1,750 in rent. Will we run out of money in retirement?",https://www.marketwatch.com/story/we-pay-1-750-in-rent-my-partner-and-i-have-1-4-million-were-in-our-70s-will-we-run-out-of-money-in-retirement-443ac572?mod=mw_rss_topstories,"Wed, 27 Aug 2025 23:06:00 GMT",
2025-08-28T01:20:46,MarketWatch Top,"My friend, 61, signed a $20K contract for dental implants. She can’t afford it. Can she fight it?",https://www.marketwatch.com/story/she-absolutely-cannot-afford-this-procedure-my-friend-61-signed-a-20k-contract-for-dental-implants-can-she-fight-it-1c7a62b8?mod=mw_rss_topstories,"Wed, 27 Aug 2025 22:06:00 GMT",
2025-08-28T01:20:46,MarketWatch Top,Taylor Swift doesn’t need your prenup advice — so why do so many lawyers still give it?,https://www.marketwatch.com/story/taylor-swift-doesnt-need-our-financial-advice-so-why-does-she-get-so-much-of-it-ef0aefa8?mod=mw_rss_topstories,"Wed, 27 Aug 2025 22:06:00 GMT",
2025-08-28T01:20:46,MarketWatch Top,Retail coffee prices have spiked 30% year over year. Can the JDE Peet’s-Keurig Dr Pepper merger bring consumers some relief?,https://www.marketwatch.com/story/retail-coffee-prices-have-spiked-30-year-over-year-can-the-jde-peets-keurig-dr-pepper-merger-bring-consumers-some-relief-782796de?mod=mw_rss_topstories,"Wed, 27 Aug 2025 21:55:00 GMT",
2025-08-28T01:20:46,CNBC Top News,Nvidia beats on top and bottom lines. Here's why the stock is falling,https://www.cnbc.com/2025/08/27/nvidia-nvda-earnings-report-q2-2026.html,"Thu, 28 Aug 2025 00:27:23 GMT",
2025-08-28T01:20:46,CNBC Top News,"CDC Director Susan Monarez ousted, four other leaders quit health agency",https://www.cnbc.com/2025/08/27/cdc-director-susan-monarez-.html,"Wed, 27 Aug 2025 23:48:40 GMT",
2025-08-28T01:20:46,CNBC Top News,"Google has eliminated 35% of managers overseeing small teams in past year, exec says",https://www.cnbc.com/2025/08/27/google-executive-says-company-has-cut-a-third-of-its-managers.html,"Wed, 27 Aug 2025 18:29:49 GMT",
2025-08-28T01:20:46,CNBC Top News,"YouTube TV, Fox reach short-term extension to prevent blackout as football season starts",https://www.cnbc.com/2025/08/27/whats-at-stake-youtube-tv-fox.html,"Wed, 27 Aug 2025 21:36:30 GMT",
2025-08-28T01:20:46,CNBC Top News,Asia-Pacific markets largely fall; Bank of Korea policy decision in focus,https://www.cnbc.com/2025/08/28/asia-pacific-markets-bank-of-korea-decision-nifty-50-india-markets.html,"Thu, 28 Aug 2025 00:14:50 GMT",
2025-08-28T01:20:46,CNBC Top News,FDA approves new Covid shots with limits on who can get them under RFK Jr.,https://www.cnbc.com/2025/08/27/fda-covid-vaccine-authorization--rfk.html,"Wed, 27 Aug 2025 18:58:22 GMT",
2025-08-28T01:20:46,CNBC Top News,"Two children dead, 17 people injured in Annunciation school shooting: Minneapolis police",https://www.cnbc.com/2025/08/27/minneapolis-shooting-school-catholic.html,"Wed, 27 Aug 2025 18:50:13 GMT",
2025-08-28T01:20:46,CNBC Top News,Cracker Barrel rebrand: Why companies retreat when faced with consumer criticism,https://www.cnbc.com/2025/08/27/cracker-barrel-rebrand-why-companies-retreat-from-consumer-criticism.html,"Wed, 27 Aug 2025 20:20:32 GMT",
2025-08-28T01:20:46,CNBC Top News,"How Roth conversions could slash Trump's $40,000 'SALT' deduction for high earners",https://www.cnbc.com/2025/08/27/roth-conversions-trump-salt-deduction.html,"Wed, 27 Aug 2025 11:00:01 GMT",
2025-08-28T01:20:46,CNBC Top News,"Trump accused Fed Governor Lisa Cook of mortgage fraud. That can be hard to prove, experts say",https://www.cnbc.com/2025/08/27/trump-fed-governor-lisa-cook-mortgage-fraud-.html,"Wed, 27 Aug 2025 19:06:01 GMT",
2025-08-28T01:20:46,CNBC Top News,"After Nvidia's earnings beat, Jim Cramer pushes back against AI bubble fears",https://www.cnbc.com/2025/08/27/after-nvidias-earnings-beat-cramer-rejects-fears-of-an-ai-bubble.html,"Wed, 27 Aug 2025 22:55:47 GMT",
2025-08-28T01:20:46,CNBC Top News,How China’s electric vehicle juggernaut is reshaping the global car market,https://www.cnbc.com/2025/08/28/autos-chinas-electric-vehicle-juggernaut-is-reshaping-the-car-market.html,"Wed, 27 Aug 2025 23:00:07 GMT",
2025-08-28T01:20:46,CNBC Top News,Founder of IRL social media app charged with defrauding investors,https://www.cnbc.com/2025/08/27/founder-irl-social-media-fraud.html,"Wed, 27 Aug 2025 20:23:08 GMT",
2025-08-28T01:20:46,CNBC Top News,Lamborghini CEO says tariffs are causing even the wealthiest buyers to pause,https://www.cnbc.com/2025/08/26/lamborghini-ceo-tariffs-wealthiest-buyers-pause.html,"Tue, 26 Aug 2025 14:00:01 GMT",
2025-08-28T01:20:46,CNBC Top News,Trump White House pressures Fed Governor Lisa Cook to go on leave as lawsuit looms,https://www.cnbc.com/2025/08/27/trump-white-house-lisa-cook-fed.html,"Wed, 27 Aug 2025 15:12:53 GMT",
2025-08-28T01:20:46,CNBC Top News,Taylor Swift’s engagement is a big enough deal to move these stocks,https://www.cnbc.com/2025/08/27/taylor-swift-travis-kelce-enagagement-business-prediction-markets.html,"Wed, 27 Aug 2025 20:07:00 GMT",
2025-08-28T01:20:46,CNBC Top News,Gusto agrees to buy retirement plan provider Guideline,https://www.cnbc.com/2025/08/27/gusto-retirement-guideline-deal.html,"Wed, 27 Aug 2025 16:10:01 GMT",
2025-08-28T01:20:46,CNBC Top News,Fed's John Williams stresses independence as Trump moves to fire Lisa Cook,https://www.cnbc.com/2025/08/27/feds-john-williams-stresses-independence-as-trump-moves-to-fire-lisa-cook.html,"Wed, 27 Aug 2025 14:54:44 GMT",
2025-08-28T01:20:46,CNBC Top News,Feds fail to get indictment against DC 'Subway' sandwich thrower who DOJ fired,https://www.cnbc.com/2025/08/27/feds-indictment-grand-jury-sandwich-thrower-trump-dc.html,"Wed, 27 Aug 2025 19:10:29 GMT",
2025-08-28T01:20:46,CNBC Top News,Treasury yields are stable as traders try to gauge impact of Trump's fight for Fed control,https://www.cnbc.com/2025/08/27/us-treasury-yields-investors-look-ahead-to-key-inflation-data.html,"Wed, 27 Aug 2025 20:04:32 GMT",
2025-08-28T01:20:46,CNBC Top News,MongoDB stock surges 37% after earnings as company touts customer growth boom,https://www.cnbc.com/2025/08/27/mongodb-mdb-q2-earnings-report-2026.html,"Wed, 27 Aug 2025 20:00:46 GMT",
2025-08-28T01:20:46,CNBC Top News,"3 retailers, 3 distinct tariff strategies: What these plans say about their businesses",https://www.cnbc.com/2025/08/27/three-retailers-3-distinct-front-loading-strategies-what-these-plans-says-about-their-businesses.html,"Wed, 27 Aug 2025 16:29:08 GMT",
2025-08-28T01:20:46,CNBC Top News,Cramer says Apple still has 'a lot up its sleeve' even after its August stock run,https://www.cnbc.com/2025/08/27/cramer-says-apple-still-has-a-lot-up-its-sleeve-even-after-its-august-stock-run.html,"Wed, 27 Aug 2025 16:56:48 GMT",
2025-08-28T01:20:46,CNBC Top News,"American Eagle shares rise on partnership with Travis Kelce, fresh off his engagement to Taylor Swift",https://www.cnbc.com/2025/08/27/american-eagle-aeo-travis-kelce.html,"Wed, 27 Aug 2025 15:38:36 GMT",
2025-08-28T01:20:46,CNBC Top News,Kohl's shares jump 24% after big earnings beat,https://www.cnbc.com/2025/08/27/kohls-kss-q2-2025-earnings-.html,"Wed, 27 Aug 2025 20:21:49 GMT",
2025-08-28T01:20:46,CNBC Top News,SpaceX makes comeback with Starship test launch after fiery setbacks,https://www.cnbc.com/2025/08/27/spacex-makes-comeback-with-starship-test-launch-after-fiery-setbacks.html,"Wed, 27 Aug 2025 07:19:34 GMT",
2025-08-28T01:20:46,CNBC Top News,India's $434 billion merchandise exports engine: What's at stake as Trump's 50% tariffs kick in,https://www.cnbc.com/2025/08/07/indias-nearly-87-billion-exports-to-us-under-threat-due-to-trump-tariffs.html,"Wed, 27 Aug 2025 05:39:18 GMT",
2025-08-28T01:20:46,CNBC Top News,"Abercrombie sales growth slows again, but retailer hikes revenue outlook as Hollister surges",https://www.cnbc.com/2025/08/27/abercrombie-fitch-anf-q2-2025-earnings.html,"Wed, 27 Aug 2025 16:23:44 GMT",
2025-08-28T01:20:46,CNBC Top News,How to get someone on the phone about your student loans,https://www.cnbc.com/2025/08/27/student-loan-phone-help.html,"Wed, 27 Aug 2025 17:07:31 GMT",
2025-08-28T01:20:46,CNBC Top News,"Lego hits record revenue in first half of 2025, boosted by brick flowers and cars",https://www.cnbc.com/2025/08/27/lego-first-half-2025-earnings-post-record-revenue.html,"Wed, 27 Aug 2025 07:00:01 GMT",
2025-08-28T01:20:46,Investing.com All News,Form 144 Hut 8 Corp. For: 27 August,https://uk.investing.com/news/filings/form-144-hut-8-corp-for-27-august-93CH-4240256,2025-08-28 01:08:08,
2025-08-28T01:20:46,Investing.com All News,Form 144 Tencent Music Entertainment Group For: 27 August,https://uk.investing.com/news/filings/form-144-tencent-music-entertainment-group-for-27-august-93CH-4240255,2025-08-28 01:06:08,
2025-08-28T01:20:46,Investing.com All News,Form 144 NAVITAS SEMICONDUCTOR CORPORATION For: 27 August,https://uk.investing.com/news/filings/form-144-navitas-semiconductor-corporation-for-27-august-93CH-4240254,2025-08-28 01:04:08,
2025-08-28T01:20:46,Investing.com All News,Keysight Technologies at Deutsche Bank's 2025 Technology Conference: Growth Amid Challenges,https://uk.investing.com/news/transcripts/keysight-technologies-at-deutsche-banks-2025-technology-conference-growth-amid-challenges-93CH-4240253,2025-08-28 01:02:08,
2025-08-28T01:20:46,Investing.com All News,US stock futures dip as Nvidia earnings spark little cheer,https://uk.investing.com/news/stock-market-news/us-stock-futures-dip-as-nvidia-earnings-spark-little-cheer-4240251,2025-08-28 00:48:09,
2025-08-28T01:20:46,Investing.com All News,Qantas hits record high as FY profit climbs on strong travel demand,https://uk.investing.com/news/stock-market-news/qantas-fullyear-profit-climbs-on-strong-travel-demand-4240246,2025-08-28 00:46:08,
2025-08-28T01:20:46,Investing.com All News,"Phibro earnings beat by $0.05, revenue topped estimates",https://uk.investing.com/news/earnings/phibro-earnings-beat-by-005-revenue-topped-estimates-4240250,2025-08-28 00:35:47,
2025-08-28T01:20:46,Investing.com All News,"Domo earnings beat by $0.07, revenue topped estimates",https://uk.investing.com/news/earnings/domo-earnings-beat-by-007-revenue-topped-estimates-4240249,2025-08-28 00:34:42,
2025-08-28T01:20:46,Investing.com All News,"Greif Bros earnings beat by $0.09, revenue topped estimates",https://uk.investing.com/news/earnings/greif-bros-earnings-beat-by-009-revenue-topped-estimates-4240248,2025-08-28 00:26:29,
2025-08-28T01:20:46,Investing.com All News,"Greif Bros B earnings beat by $0.09, revenue topped estimates",https://uk.investing.com/news/earnings/greif-bros-b-earnings-beat-by-009-revenue-topped-estimates-4240247,2025-08-28 00:26:29,
2025-08-28T01:20:46,Investing.com Bond News,Eurozone Bond Spreads Face a Jittery Autumn,https://uk.investing.com/analysis/eurozone-bond-spreads-face-a-jittery-autumn-200618345,"Aug 27, 2025 11:42 GMT",
2025-08-28T01:20:46,Investing.com Bond News,Credit Spreads at 25-Year Lows Highlight Investors’ Volatility Blind Spot,https://uk.investing.com/analysis/credit-spreads-at-25year-lows-highlight-investors-volatility-blind-spot-200618336,"Aug 26, 2025 13:28 GMT",
2025-08-28T01:20:46,Investing.com Bond News,Rates Spark: The Bottoming Out of the 2-Year Bund,https://uk.investing.com/analysis/rates-spark-the-bottoming-out-of-the-2year-bund-200618326,"Aug 26, 2025 08:18 GMT",
2025-08-28T01:20:46,Investing.com Bond News,Even the Worst Foreign Bonds Are Beating US Treasuries Thanks to a Weak Dollar,https://uk.investing.com/analysis/even-the-worst-foreign-bonds-are-beating-us-treasuries-thanks-to-a-weak-dollar-200618307,"Aug 25, 2025 12:28 GMT",
2025-08-28T01:20:46,Investing.com Bond News,Treasury Yields Slip Ahead of Jackson Hole,https://uk.investing.com/analysis/treasury-yields-slip-ahead-of-jackson-hole-200618276,"Aug 22, 2025 06:50 GMT",
2025-08-28T01:20:46,Investing.com Bond News,Rates Spark: Chair Powell to Be His Own Man,https://uk.investing.com/analysis/rates-spark-chair-powell-to-be-his-own-man-200618274,"Aug 22, 2025 05:41 GMT",
2025-08-28T01:20:46,Investing.com Bond News,Inflation Signals Set Stage for Treasury Curve Steepening,https://uk.investing.com/analysis/inflation-signals-set-stage-for-treasury-curve-steepening-200618270,"Aug 22, 2025 05:07 GMT",
2025-08-28T01:20:46,Investing.com Bond News,Bond Market Awaits Powell’s Speech for Hints on Rate Cuts,https://uk.investing.com/analysis/bond-market-awaits-powells-speech-for-hints-on-rate-cuts-200618257,"Aug 21, 2025 11:54 GMT",
2025-08-28T01:20:46,Investing.com Bond News,Rates Spark: Inflation Blinkers On,https://uk.investing.com/analysis/rates-spark-inflation-blinkers-on-200618243,"Aug 21, 2025 06:37 GMT",
2025-08-28T01:20:46,Investing.com Bond News,Rates Spark: Index Disappointment Vs. AAA Squeeze,https://uk.investing.com/analysis/rates-spark-index-disappointment-vs-aaa-squeeze-200618222,"Aug 20, 2025 07:15 GMT",
2025-08-28T01:20:46,Google News Reuters,"Nvidia still growing, but China uncertainty clouds outlook - Reuters",https://news.google.com/rss/articles/CBMiowFBVV95cUxPUmxHNWVvbXh6MmVzbW93MkgxYnB6T1cwWUlQbG1CVlVCZFNMNXJ0djhnX2RjeF9rSUhxVkdORUsxZGoxdTdocGI5RkdXOFNKeGgxNTdMM0FNNFJSSkI0dXphaWEwWnEwMXdmdDd3SVJYdEFLaGZUd00zLTROMzJCRDUwUE5rR0xld1h2d1p5clNrUU5NbXhJeGdfaEE5bzRXYTB3?oc=5,"Thu, 28 Aug 2025 00:09:00 GMT",
2025-08-28T01:20:46,Google News Reuters,"Trump's doubling of tariffs hits India, damaging ties - Reuters",https://news.google.com/rss/articles/CBMinAFBVV95cUxORzFEM3BfT05pbmhOTmd6cTNXWWwyMjNYa3dIWnlBVEcwcjBDc0JRMVFrOXZfVnFNb1RuRFJ4djV0WkljaERZejNxR1YwVjBLN2VWREFJUFlPMzFlV2Jpa0xvQ0lDcmU1VEVhU0p1b05TWFhkRDBOS0paUmlrRlA3bFU2b2dKMzdMMll6RmM3cTBwWVBoQVFZdXZPSVc?oc=5,"Wed, 27 Aug 2025 23:50:08 GMT",
2025-08-28T01:20:46,Google News Reuters,"US CDC chief out after weeks in role, challenges ouster as four top officials resign - Reuters",https://news.google.com/rss/articles/CBMi4wFBVV95cUxQTVFqUG8zMlFaeG1BcE1wU3hLbElBTnI4a2JuUmsyZFRsbEluc09VWkxMemZDb0tDb25wMHVlNnJFb2NOMDFBQUVkazd5SFBxQzBEa1NCZkVHZkJ5Z0dHaFI5TWtEcEsyeXBKSXZ1RFJtczBKRjJZeURHcjFKRWpEeG9qdFNNaDE4VE9ReHJqaVRfVVJOdmhKbHFnVVY2Wm9tRlg1ejd6X3dNTy1CTExHWHg4eW8wMGt2bVRFNGdxWlVHVGVKQm1BZy04NWN0WWptdHNTLXZnRnI3bXp0ZmNsenRiOA?oc=5,"Thu, 28 Aug 2025 00:42:00 GMT",
2025-08-28T01:20:46,Google News Reuters,"US CDC chief exits after weeks in role, three top officials resign - Reuters",https://news.google.com/rss/articles/CBMizwFBVV95cUxOejNlQ01vNnF1ZmtMMm45QVRfLU1VdERCS09Ic0NaZkNyRGpIQ2EwNjhfbEZyS0x5M09adVNSdWRyQkZkTDkwWGtSak9oSk54ZkJCTTZ5anhPRzJLWTFOdnNDMWpvWktDbDNDNXFnUVlYRUNqb2t1T1h0cDFFYzhURGlka3Q3SVd1WGg4eGxESTRZR0FxZFA3VTNoTXU4UEN0SzA5R3RLS0tEZUppUHREV01tT0NFQlhuamJuU1poQlVlSjRmNEVFSXpUUEIyUTA?oc=5,"Wed, 27 Aug 2025 22:53:34 GMT",
2025-08-28T01:20:46,Google News Reuters,Israel conducts landing on former air defence base in southwest Damascus - sources - Reuters,https://news.google.com/rss/articles/CBMixwFBVV95cUxPbC1ScENvMGtjeFkyWXlMRFBKa1RadTl3cjRpVWNxeU9QYnVpQm5CUzNyTXU0Z29QZ0docjR6N2dSMlhjWUh3RU5KZzFKRUc5UDBCUGViMXdrVXNoeGprWDZYdGExZm9LV2pXRGtjUWxkZDlBTFBIMU9BYWFXSzl6NWFaV1BzS3RQQWo2dWtXQlB6QTZnVVdyUnV0NVU0MWJFU29RUzNlcm41TjE4TjlJUUZ6MUlURVpPdG5Ic1BwYkF2b2l1Q2VV?oc=5,"Wed, 27 Aug 2025 22:21:15 GMT",
2025-08-28T01:20:46,Google News Reuters,Nvidia forecasts higher revenue as China clouds future - Reuters,https://news.google.com/rss/articles/CBMioAFBVV95cUxNQVhFak00WU1jWmMyTEtPdVY3aGtoMFVKUnNPLVhLbWxrdGZld1lvNS1KYjB5Nlp3TUwydl92a3VpU0p0Wi05WHpoc3JtLTRtV21wdlF5bmxDb0JpdWcwRTExZmRLOGtzYnhxWkQ2TFZNcHE5NG5ES3ZqRXlzcHdlZjI0c05tMy15aHgzazZyVmJlVEczWkFKakxHdHhPLUVm?oc=5,"Wed, 27 Aug 2025 21:44:45 GMT",
2025-08-28T01:20:46,Google News Reuters,Trump administration to take control of Washington's Union Station - Reuters,https://news.google.com/rss/articles/CBMipwFBVV95cUxQS2Fja2VlMzBXd3lXTW41ZDVlY1JFa3g5Sk5VZlJONHVhTGF1NEZmSDk1UmM3S05lN0paUFFTTEpJVGlya2RLd08tbzNuV0lRSlVnU0hYMFJ1V2liMTRNTWF6TFdqU2pJUFZOQ0pFSzVOcEUweG1HazE5ZEFteTdrdTRrNGt1NG5VOV9WZGJZOTB0TTg2XzdqWGFiU0ZTbFNEREFwcFlVTQ?oc=5,"Wed, 27 Aug 2025 20:25:47 GMT",
2025-08-28T01:20:46,Google News Reuters,VIEW Nvidia Q3 revenue forecasts suggest AI trade has more to run - Reuters,https://news.google.com/rss/articles/CBMiqwFBVV95cUxQRjVVclVWd29iemNRTGItbzF3X0hLZHZjc0ZIR3lnV2xoVVR0XzJZSTFSYTA2X3owd28xaUFnd1g0dXAzR2tUQmNNdlhES0FfR1VmbDJ1ZWRuME4yRWtoMjhfaURzUDF4V29jWkY2UkNIRVhVSmFVYXFvRW1iLXA4eHNpWjBLLU9Sb2JYYWhuN01lRFNGa3Q1LUJ3QjRXdFd5ZnlPSks5UXk3ckE?oc=5,"Wed, 27 Aug 2025 21:50:44 GMT",
2025-08-28T01:20:46,Google News Reuters,S&P 500 notches record close; traders turn to Nvidia results - Reuters,https://news.google.com/rss/articles/CBMiogFBVV95cUxQWFNyOGc1dUxRZzktWlZyOE9Gc013OEM4T2E4bnV0THhzZlFjQ1NOZHA0N2tCckF0M1JSUVZQU1RNbHR2VFFLZHVhNTQySXJHNEVKRk9vTkFic2ZMMkFMczdUZldaNmQzUWU1dUlsM0ZwVUQ5N1lDdmZrT1BQbDFJbW1HZ2xUWGhwMzM1THhON0E2dTdNNkhhb2gyZnFaLXplcWc?oc=5,"Wed, 27 Aug 2025 23:00:40 GMT",
2025-08-28T01:20:46,Google News Reuters,"Shooter kills two Minneapolis school children in Catholic church, wounds 17 others - Reuters",https://news.google.com/rss/articles/CBMiqwFBVV95cUxPRERqZWFvZWU4c1V0TDBvZVl6YWJYeDZVNDlfTmQtelFRY3dxdHVObUh0SUJ0LUE1WHBTYW5mdzVqN1dTTUJrQm9tSjhEd2ppcWtnNVBXZl8teGxYVkFzZ2lZSVltOEQ5c0lsOHBmRTItUkZ5dWVDaVd6NnZDRFF1c3Q5ZHFJeHllaTFFbTBvdk1WOGRIUHRuMl9zVWZ3RmdBUVFtZElRdV9vUWs?oc=5,"Thu, 28 Aug 2025 00:59:00 GMT",
2025-08-28T01:20:46,Google News Reuters,Nvidia earnings updates: CEO Jensen Huang on China sales - Reuters,https://news.google.com/rss/articles/CBMiqwFBVV95cUxQNk5rMHpCV3ExanlTcURmRVZjN3dLV0R5N2JqV1ZTcGphSldpSXZZTXBSakFjU0lxQV9venpnOC1hN19yRThNT0xLTGcwY2c0MFFNTE5ndWJDa0JQb0RGSXlVWWxzVVZiSXJUckd5QjUzalEyNXlKbkFoQktqcGRzWUJJODloeG9LM0g5bHdRdEpldVlhWnRwUG80ZmxnQmQzb01ldHB5QnNTU2M?oc=5,"Wed, 27 Aug 2025 20:10:22 GMT",
2025-08-28T01:20:46,Google News Reuters,US FDA narrows under-65 COVID vaccine eligibility; maintains full access for older Americans - Reuters,https://news.google.com/rss/articles/CBMi4wFBVV95cUxNVlg1RXpJSmFsYk1aNHVBeC1zQi1BUkxYbzE3enA4VXRTaG5uSWEwQlM4QngtWXljd1NNUDh1emlHLVh5aXU4WjRkTnFpUElBMjJYVl9XR04yQk44RlhKR1pPTWkwX2diR1dMbm82Z3ZxSEZmUnFTNG9SWVduem5pTTRLcUxYUS1ZM24zQkZlcTBISExmMktoMnhHSHJmWW8yQ1E3R2MxWHpPMVloczhhWXg0X0JHR3JFWi1HalBKWHRuMmFmaWRIMm5ZTUdIUzFXZlhvREJocHRHZTk4eDN2ZTFvaw?oc=5,"Wed, 27 Aug 2025 20:49:25 GMT",
2025-08-28T01:20:46,Google News Reuters,Argentina's Milei rushed from campaign event as protesters throw rocks at car - Reuters,https://news.google.com/rss/articles/CBMitwFBVV95cUxPWVBNMXRSZzA2c3h0czk3WUNaR2l0X09BVlQ4OGowV2ZsY1lHTlVjTWxRZEd6Q0V4WDlzN2Y3aFQzdXFLZUc5MFRtUmplUWZfNjRlczhXdVg1blBzaGlGMDl5Nnc2MkVidl9LVmhDY2MzdVlqVXo0V2pySEdPXy1qb291NkJVTlRHc0NUaXNlV3JSSWt3Mm5LWlVDMFFSWFF3dTR0dG8tdnNMVW9CQ1RGcDRLQWdaQTA?oc=5,"Wed, 27 Aug 2025 23:23:43 GMT",
2025-08-28T01:20:46,Google News Reuters,"All UN Security Council members, except US, say famine in Gaza is 'man-made crisis' - Reuters",https://news.google.com/rss/articles/CBMiygFBVV95cUxQcUFwSlFkZHI3ZW55dk55RUdCcElnQzlGOWdTbDVDYW96R3hsNVlrbUtqOHhPR3U1NUlYNm96TlpEOXNSOHZfc0YycF84YmJBUXFVN2trMVZmTlRya01faVJ0WE9HM3dlSi1vMUlXTS1jMFA2RzZnRGdGUjNwbk5VY0ZOODBmTEtYaDZCWlUyZmNsVnZzUDhBUDNWRUhsVVc5SlByd2J2TVNTSDdhbU4xU2xaZXFQRlJFd0NyNFZmajVLUVRFVUZxTjF3?oc=5,"Wed, 27 Aug 2025 19:08:39 GMT",
2025-08-28T01:20:46,Google News Reuters,S&P 500 hits record high as investors await Nvidia results - Reuters,https://news.google.com/rss/articles/CBMioAFBVV95cUxNTUNRV2lleEFTMjFjSHRTREtDNHpab3g0OGRaTFlRNm5pemI4Q1g2SGNRSEgyUF9zeGo4dC1FTDVTdHV4OExiazZQMEhCUVBmRmtxSjR4QlhldXludW43bzcwcllPMHpCNnpob1ZobkRubGIzeDB1NDZqa1UtQW9HZ0dhVXk2b1ZQc2pqb0xuMnphcDY5VTNEaGNpRnJNSlk3?oc=5,"Wed, 27 Aug 2025 20:00:32 GMT",
2025-08-28T01:20:46,Google News Reuters,"Gunman attacks Minneapolis school children in chapel, killing two and injuring 17 - Reuters",https://news.google.com/rss/articles/CBMiugFBVV95cUxNeXU5WnBXQVFQOUZEQ1E2RTVicko0eTNLdlJnOEw2OTJmYjRFRzZKOU9QSk9vSlc1cUt3bkw2bFBGNHBaUnFVcWxBYjdZSl9QMVp0eHkzb19yQkk1TTVZWl9yUGNqOVZFUFdTMW9fZkNDUkRoU1g5My1tZWI5WEFFQ2Z2a2lTcmRlZ1NTSUl6Ylc3bm1WY2o4RWJVVnJiQjBEeXRBbDlSb1ZmSXZ4cDQ5WGdQZlFYRlNPcGc?oc=5,"Wed, 27 Aug 2025 19:17:58 GMT",
2025-08-28T01:20:46,Google News Reuters,"Trump holds Gaza policy meeting with Blair and Kushner, White House official says - Reuters",https://news.google.com/rss/articles/CBMivgFBVV95cUxNdWU2enFSaWFzWE1JT0t4NjVmVjdKdDRiTDJTcXA5UzJqeVFJV0VZYUxCeDRfOWV6QTlyQXRzclFjTWlpVEtSWkxSVmxuNVlCTHhLZVJMSU55RnotbDlOWXRFYTllelV3TmY4MHU5OGd5TGVhR1g5YzZxTjNpZHN1VW5JZFM1cmNfN2J4ZVc5N1BrY0ZDQ01nQnNoa1l5WTVjRTdLUWxKOUstdk5lZkl0Q1ItVlRsREVqcGZTV0VR?oc=5,"Wed, 27 Aug 2025 21:17:28 GMT",
2025-08-28T01:20:46,Google News Reuters,"Ryanair impressed by Boeing turnaround, optimistic it can boost output - Reuters",https://news.google.com/rss/articles/CBMitAFBVV95cUxOLVZLa2w2cmpraUNLU0FnRjdfTUdoalZ6UHZNR1NCRENWckJ3c0dPLUgzeXlIRjFRREt1bzBoeVhRYlVYVlQxSUZMSG5WdHlNbTFjZUprUDRLZFlWQVBFeElZenJZdlM0R05TWUZ1VDlwVkdMRHBrWG9NWmV1UVB3SWNsOXdFVkdRcG5fOGhpVEM0enkyd2lwVjFYSmwtUWVPTHZCcmNhMC1JSkdMZWpaSzh1YjU?oc=5,"Wed, 27 Aug 2025 17:36:53 GMT",
2025-08-28T01:20:46,Google News Reuters,Gold little changed with inflation data in focus - Reuters,https://news.google.com/rss/articles/CBMimAFBVV95cUxPYnQybWNzOEJ5MU1LQVI5UHN6c1E2MkdpNTNWQU4yZ2xKRmpGdjNPNzZIZzU0NnZ4VlozUGpGeVhLU044LWdjMWtMYm41d3NhdGtUY3ExamtlWkVtbUF6ZHNIV01KdlFGLVVib1k5RmpTUDY2T05aTjN1T1R2ZVFrY1FkRl9hNDY5SkZpSk55Zmp2NnZjVVJONA?oc=5,"Wed, 27 Aug 2025 19:07:40 GMT",
2025-08-28T01:20:46,Google News Reuters,"Oil edges up on US crude stocks drop, impact of US tariffs on India - Reuters",https://news.google.com/rss/articles/CBMirgFBVV95cUxQaGgxRnBQdDM4RmxYcG1PWmFkUjNPSVBMazMtSVdEamtzMktfQk42Q29FTDVOMkdPOVFtODFBR3pKTFJ2clF1OG1sQUpoZkJXZmItZFlZTVhxT04tUWFiNm00WmM2MkJmejZKWG1XOHJPZ09zcFRnZGFEWUNNWmxSZDgxZFFrYm9CQWdfaFNPXzRSMGJZRnY1LUhfWG9oMm5zWlo2aXZUeGJFTkEtd1E?oc=5,"Wed, 27 Aug 2025 19:20:50 GMT",
2025-08-28T01:20:46,Google News Reuters,VIEW AI bellwether Nvidia forecasts Q3 revenue above forecasts - Reuters,https://news.google.com/rss/articles/CBMiqwFBVV95cUxOLV9xMWl5V1B2bEcxQkstb0pkOXJiOHVTc1ZkMEpRZjg4RDFSVUJTMk9reEF6U3Q0VkptRWJSYVBHaV9za2JMcEFWY00wTG5GeVhOUWg4c2tLTEh2UTk1UEVtT29zU3VuSGx4N1cwSlhpZE9oX2o1OUF2YjZJZXNVZnh4NTc5Ri1YTGJKbVRUNEU5eExSX3cta1FBSmJEbGMyMXFDUnk5aVRwTlk?oc=5,"Wed, 27 Aug 2025 21:13:56 GMT",
2025-08-28T01:20:46,Google News Reuters,"French political crisis carries steep economic risk, business leaders say - Reuters",https://news.google.com/rss/articles/CBMitAFBVV95cUxQckNUOVJhcE5nMThPakZ2dUlEM3lTandjVXNtazNjTTgwRGtQdVVWR0JHcHdMdW05YzRKOExyVTA4dTRid0FWYU5SX0t2M2JFYkdzTnRXZmJlV2dtSENGelFwZHk0ZVZrV3pGNWprYXNwVFdFazlaWHBkMjlXWnMtdXBFaENSM3gyaWtuaDZFSUQwY0ZfSFN1V2ExSV9SbmRsc09LaFRfWXVfeExDMWczMUhpSkQ?oc=5,"Wed, 27 Aug 2025 21:12:12 GMT",
2025-08-28T01:20:46,Google News Reuters,"Oil ticks up on US crude stocks drop, impact of US tariffs on India - Reuters",https://news.google.com/rss/articles/CBMirgFBVV95cUxQZ1dtRnNpUzhnVG84dVh6NDFGWEh1TGFDTFpjWmRmRzZGNEJJVVJjT1o4M2JyM2F5MXBIOGJZYkVGT0RndXBpbVlqRzhBMEpKZGt1Vk1iSTB6RG4tcFBWSTkwOFU1TnFYMEotcFhYWDR4Y2lSSEtwQnA3SWpKYVhndDFWTTU1UmZRT3hUejFTck9qaUh2N0h5cUxrM3AxN0hoQjQzTlpoSmo5VnkxUGc?oc=5,"Wed, 27 Aug 2025 15:29:19 GMT",
2025-08-28T01:20:46,Google News Reuters,Cracker Barrel sticks to old logo after social media backlash - Reuters,https://news.google.com/rss/articles/CBMiuwFBVV95cUxNVk9hdnJyVFpkWTk3UFpJM3JmakZGVTM3OXR4aWpyVjRDWWxKRXVQNkVVUEZoeFh0SnlRWTJYYVdxbUNYbTFxS2xlN1BBbXNyMW1kR3dORnNzYUFPN2ZaUlY0VTI5VnFhUkluME9FSmlucXVoN0ktVDRxbFVBUk5TOEVUaThrWHd3VUwwVHVpWVVVS3p4UnJzenVmLWRUUDc4dkFpMS1FV294bWNBN19oZTBLdGx0RHFadDFj?oc=5,"Wed, 27 Aug 2025 18:23:37 GMT",
