timestamp,source,title,link,published,content
2025-09-20T01:18:23,MarketWatch Top,Why Ariana Grande opting out of dynamic pricing might actually help ticket scalpers — and not her fans,https://www.marketwatch.com/story/why-ariana-grande-opting-out-of-dynamic-pricing-might-actually-help-ticket-scalpers-and-not-her-fans-9646ec39?mod=mw_rss_topstories,"Fri, 19 Sep 2025 22:27:00 GMT",
2025-09-20T01:18:23,MarketWatch Top,Taylor Swift tries to save the movie industry again with ‘Showgirl’ film release,https://www.marketwatch.com/story/taylor-swift-tries-to-save-the-movie-industry-again-with-showgirl-film-release-8a1653e0?mod=mw_rss_topstories,"Fri, 19 Sep 2025 21:47:00 GMT",
2025-09-20T01:18:23,MarketWatch Top,Trump touts TikTok deal but doesn’t address fear that China ‘retains a veto’,https://www.marketwatch.com/story/trump-touts-tiktok-deal-but-doesnt-address-fear-that-china-retains-a-veto-29910753?mod=mw_rss_topstories,"Fri, 19 Sep 2025 21:08:00 GMT",
2025-09-20T01:18:23,MarketWatch Top,Stocks tend to suffer in the second half of September — but the Fed’s rate cut might keep bears at bay,https://www.marketwatch.com/story/stocks-tend-to-suffer-in-the-second-half-of-september-but-the-feds-rate-cut-might-keep-bears-at-bay-6aa7d63b?mod=mw_rss_topstories,"Fri, 19 Sep 2025 21:00:00 GMT",
2025-09-20T01:18:23,MarketWatch Top,Is the revamped American Express Platinum card worth the $895 fee? This new perk may seal the deal.,https://www.marketwatch.com/story/is-the-revamped-american-express-platinum-card-worth-the-895-fee-this-new-perk-may-seal-the-deal-49497124?mod=mw_rss_topstories,"Fri, 19 Sep 2025 20:54:00 GMT",
2025-09-20T01:18:23,MarketWatch Top,People are complaining that Apple’s new iPhone 17 scratches easily — but these Wall Street analysts say it won’t hurt sales,https://www.marketwatch.com/story/people-are-complaining-that-apples-new-iphone-17-scratches-easily-but-these-wall-street-analysts-say-it-wont-hurt-sales-9890ade2?mod=mw_rss_topstories,"Fri, 19 Sep 2025 20:45:00 GMT",
2025-09-20T01:18:23,MarketWatch Top,"COVID-19 vaccine recommendations dropped by panel, shots won’t require a prescription",https://www.marketwatch.com/story/covid-19-vaccine-wont-require-a-prescription-according-to-hhs-panel-vote-c68d7d94?mod=mw_rss_topstories,"Fri, 19 Sep 2025 20:38:00 GMT",
2025-09-20T01:18:23,MarketWatch Top,Social Security is on track to be insolvent in less than 10 years — but its commissioner says there’s ‘plenty of time’ to find a solution,https://www.marketwatch.com/story/social-security-is-on-track-to-be-insolvent-in-less-than-10-years-but-its-commissioner-says-theres-plenty-of-time-956344f1?mod=mw_rss_topstories,"Fri, 19 Sep 2025 20:21:00 GMT",
2025-09-20T01:18:23,MarketWatch Top,My mother’s lawyer stole $400K after she moved to a nursing home. How can we get justice?,https://www.marketwatch.com/story/my-mothers-lawyer-stole-her-400k-estate-he-was-disbarred-how-can-we-get-our-money-back-1349ac6c?mod=mw_rss_topstories,"Fri, 19 Sep 2025 20:14:00 GMT",
2025-09-20T01:18:23,MarketWatch Top,"‘Am I the biggest loser with the Fed rate cut?’ I’m 68, retired and live off IRAs and Social Security",https://www.marketwatch.com/story/am-i-the-biggest-loser-with-the-fed-rate-cut-im-68-retired-and-live-off-iras-and-social-security-e21b7f2d?mod=mw_rss_topstories,"Fri, 19 Sep 2025 19:12:00 GMT",
2025-09-20T01:18:24,CNBC Top News,Inside the fakes and scams on Walmart.com,https://www.cnbc.com/2025/09/19/walmart-marketplace-fakes-scams-investigation.html,"Fri, 19 Sep 2025 21:00:39 GMT",
2025-09-20T01:18:24,CNBC Top News,"RFK Jr.'s vaccine panel weakens Covid shot recommendations, calling it an individual decision",https://www.cnbc.com/2025/09/19/rfk-jr-vaccine-panel-covid-shot-recommendations.html,"Fri, 19 Sep 2025 21:31:17 GMT",
2025-09-20T01:18:24,CNBC Top News,"Trump is threatening broadcast station licenses — what that means, and how it all works",https://www.cnbc.com/2025/09/19/trump-threatening-broadcast-station-licenses-explained.html,"Fri, 19 Sep 2025 23:21:49 GMT",
2025-09-20T01:18:24,CNBC Top News,Ted Cruz compares FCC Chair Carr to Mafia boss in Jimmy Kimmel warnings,https://www.cnbc.com/2025/09/19/ted-cruz-jimmy-kimmel-fcc-carr-mafia.html,"Fri, 19 Sep 2025 22:30:44 GMT",
2025-09-20T01:18:24,CNBC Top News,Top Amazon reseller Pattern opens at $13.50 in Nasdaq debut after IPO raised $300 million,https://www.cnbc.com/2025/09/19/amazon-reseller-pattern-debuts-on-nasdaq-after-ipo-raised-300-million.html,"Fri, 19 Sep 2025 20:02:12 GMT",
2025-09-20T01:18:24,CNBC Top News,Trump says 'I'm winning' after judge tosses his $15 billion NY Times lawsuit,https://www.cnbc.com/2025/09/19/trump-new-york-times-lawsuit-merryday.html,"Fri, 19 Sep 2025 21:55:05 GMT",
2025-09-20T01:18:24,CNBC Top News,StubHub's stock plunges 10% in third day on NYSE as post-IPO slump deepens,https://www.cnbc.com/2025/09/19/stubhub-shares-stumble-for-third-day-as-post-ipo-slump-deepens.html,"Fri, 19 Sep 2025 20:02:58 GMT",
2025-09-20T01:18:24,CNBC Top News,"'Tonight, we are all Jimmy Kimmel,' Stephen Colbert says, calling Trump an 'autocrat'",https://www.cnbc.com/2025/09/18/jimmy-kimmel-kirk-colbert-letterman-trump.html,"Fri, 19 Sep 2025 04:02:43 GMT",
2025-09-20T01:18:24,CNBC Top News,"Kevin Durant has access restored to his Coinbase bitcoin account, after years of being locked out",https://www.cnbc.com/2025/09/19/bitcoin-coinbase-kevin-durant-nba-password.html,"Fri, 19 Sep 2025 21:27:49 GMT",
2025-09-20T01:18:24,CNBC Top News,Cramer's week ahead: New inflation data and earnings from Micron and Costco,https://www.cnbc.com/2025/09/19/cramers-week-ahead-new-inflation-data-earnings-micron-and-costco.html,"Fri, 19 Sep 2025 22:35:59 GMT",
2025-09-20T01:18:24,CNBC Top News,Steve Bannon floats idea of Bessent running both Treasury and the Fed,https://www.cnbc.com/2025/09/19/steve-bannon-floats-idea-of-bessent-running-both-treasury-and-the-fed.html,"Fri, 19 Sep 2025 18:39:12 GMT",
2025-09-20T01:18:24,CNBC Top News,Microsoft raises Xbox prices in U.S. due to economic environment,https://www.cnbc.com/2025/09/19/microsoft-xbox-prices-tariffs-macroeconomic-conditions.html,"Fri, 19 Sep 2025 19:37:08 GMT",
2025-09-20T01:18:24,CNBC Top News,Business travel and expense startup Navan files for initial public offering in booming deal market,https://www.cnbc.com/2025/09/19/navan-files-for-ipo-public-offering.html,"Fri, 19 Sep 2025 21:06:26 GMT",
2025-09-20T01:18:24,CNBC Top News,"Former Disney CEO Eisner backs Jimmy Kimmel, blasts FCC 'intimidation' of ABC",https://www.cnbc.com/2025/09/19/jimmy-kimmel-disney-eisner-fcc-abc.html,"Fri, 19 Sep 2025 21:43:12 GMT",
2025-09-20T01:18:24,CNBC Top News,Elon Musk's xAI raising $10 billion at $200 billion valuation: sources,https://www.cnbc.com/2025/09/19/musks-xai-10-billion-at-200-billion-valuation.html,"Fri, 19 Sep 2025 20:41:02 GMT",
2025-09-20T01:18:24,CNBC Top News,"Trump, Xi make progress on TikTok deal, but more work remains, White House says",https://www.cnbc.com/2025/09/19/trump-xi-tiktok-call.html,"Fri, 19 Sep 2025 21:45:00 GMT",
2025-09-20T01:18:24,CNBC Top News,"Gas is expected to get cheaper this fall: It's looking good 'for motorists in most areas,' one expert says",https://www.cnbc.com/2025/09/19/gas-expected-to-get-cheaper-this-fall.html,"Fri, 19 Sep 2025 17:25:13 GMT",
2025-09-20T01:18:24,CNBC Top News,A new forecast on U.S. electricity demand growth shows why we own these 2 industrial stocks,https://www.cnbc.com/2025/09/19/a-new-forecast-on-us-electricity-demand-growth-shows-why-we-own-these-2-industrial-stocks.html,"Fri, 19 Sep 2025 19:49:14 GMT",
2025-09-20T01:18:24,CNBC Top News,"Miran says he doesn't see tariffs causing inflation, putting him in minority on Fed committee",https://www.cnbc.com/2025/09/19/miran-says-he-doesnt-see-tariffs-causing-inflation-putting-him-in-minority-on-fed-committee.html,"Fri, 19 Sep 2025 17:39:55 GMT",
2025-09-20T01:18:24,CNBC Top News,"SEC to propose rule change on Trump's call to end quarterly earnings reporting, says Chair Atkins",https://www.cnbc.com/2025/09/19/sec-to-propose-rule-change-on-trumps-call-to-end-quarterly-earnings-reporting-says-chair-atkins.html,"Fri, 19 Sep 2025 16:47:00 GMT",
2025-09-20T01:18:24,CNBC Top News,"Treasury, IRS release key details about Trump’s ‘no tax on tips’ deduction",https://www.cnbc.com/2025/09/19/treasury-details-trumps-no-tax-on-tips.html,"Fri, 19 Sep 2025 19:41:03 GMT",
2025-09-20T01:18:24,CNBC Top News,Fed Governor Miran says he did not tell Trump how he would vote on rates this week,https://www.cnbc.com/2025/09/19/fed-gov-miran-says-he-did-not-tell-trump-how-he-would-vote-on-rates-this-week.html,"Fri, 19 Sep 2025 17:29:41 GMT",
2025-09-20T01:18:24,CNBC Top News,"Paramount Skydance bid for Warner Bros. Discovery could be in the range of $22 to $24 per share, sources say",https://www.cnbc.com/2025/09/19/paramount-skydance-warner-bros-discovery-bid-update.html,"Fri, 19 Sep 2025 14:48:09 GMT",
2025-09-20T01:18:24,CNBC Top News,Apple CEO Tim Cook says iPhone price hikes are not tied to tariffs,https://www.cnbc.com/2025/09/19/apple-ceo-tim-cook-iphone-price-increase-tariffs.html,"Fri, 19 Sep 2025 15:15:47 GMT",
2025-09-20T01:18:24,CNBC Top News,RFK Jr.'s vaccine panel postpones vote on whether to delay babies' first hepatitis B shot,https://www.cnbc.com/2025/09/19/rfk-jrs-vaccine-panel-postpones-vote-on-hepatitis-b-shot-for-babies.html,"Fri, 19 Sep 2025 13:47:29 GMT",
2025-09-20T01:18:24,CNBC Top News,"Wall Street bets on chip boom are getting more concentrated, and it could be good thing for investors",https://www.cnbc.com/2025/09/19/chip-stocks-ai-tech-investing-etfs.html,"Fri, 19 Sep 2025 17:14:47 GMT",
2025-09-20T01:18:24,CNBC Top News,Panama Canal is making major play to win back lost energy trade,https://www.cnbc.com/2025/09/19/panama-canal-energy-lng-pipeline-trade-shipping.html,"Fri, 19 Sep 2025 19:21:18 GMT",
2025-09-20T01:18:24,CNBC Top News,Fed's Kashkari advocates two more rate cuts this year as he sees limited tariff impact on inflation,https://www.cnbc.com/2025/09/19/kashkari-advocates-two-more-rate-cuts-this-year-as-he-sees-limited-tariff-impact-on-inflation.html,"Fri, 19 Sep 2025 17:45:08 GMT",
2025-09-20T01:18:24,CNBC Top News,10-year Treasury yield hits 2-week high despite Fed rate cut this week,https://www.cnbc.com/2025/09/19/us-treasury-yields-investors-weigh-the-state-of-the-us-economy.html,"Fri, 19 Sep 2025 20:09:43 GMT",
2025-09-20T01:18:24,CNBC Top News,iPhone 17 goes on sale globally as Apple faces China rivals and AI doubts,https://www.cnbc.com/2025/09/19/apple-iphone-17-launch-sale-globally-china-market-and-ai-strategy.html,"Fri, 19 Sep 2025 12:03:39 GMT",
2025-09-20T01:18:24,Investing.com All News,iQSTEL increases authorized common stock to 26 million shares,https://uk.investing.com/news/sec-filings/iqstel-increases-authorized-common-stock-to-26-million-shares-93CH-4271052,2025-09-20 01:08:09,
2025-09-20T01:18:24,Investing.com All News,Form 8K American Battery Metals Corp USD For: 19 September,https://uk.investing.com/news/filings/form-8k-american-battery-metals-corp-usd-for-19-september-93CH-4271051,2025-09-20 01:06:11,
2025-09-20T01:18:24,Investing.com All News,Form 8K Block H&R  For: 19 September,https://uk.investing.com/news/filings/form-8k-block-hr--for-19-september-93CH-4271049,2025-09-20 01:06:10,
2025-09-20T01:18:24,Investing.com All News,Form 8K IDACORP Inc For: 19 September,https://uk.investing.com/news/filings/form-8k-idacorp-inc-for-19-september-93CH-4271047,2025-09-20 01:06:10,
2025-09-20T01:18:24,Investing.com All News,Form 8K Mach Natural Resources LP For: 19 September,https://uk.investing.com/news/filings/form-8k-mach-natural-resources-lp-for-19-september-93CH-4271050,2025-09-20 01:06:09,
2025-09-20T01:18:24,Investing.com All News,Form 8K US Energy Corp For: 19 September,https://uk.investing.com/news/filings/form-8k-us-energy-corp-for-19-september-93CH-4271048,2025-09-20 01:06:09,
2025-09-20T01:18:24,Investing.com All News,Integrated Rail & Resources Acquisition extends merger deadline to December 31,https://uk.investing.com/news/sec-filings/integrated-rail--resources-acquisition-extends-merger-deadline-to-december-31-93CH-4271045,2025-09-20 01:00:12,
2025-09-20T01:18:24,Investing.com All News,Form 8K Pearl Diver Credit Co Inc. For: 19 September,https://uk.investing.com/news/filings/form-8k-pearl-diver-credit-co-inc-for-19-september-93CH-4271044,2025-09-20 01:00:11,
2025-09-20T01:18:24,Investing.com All News,Form 8K Bit Digital Inc For: 19 September,https://uk.investing.com/news/filings/form-8k-bit-digital-inc-for-19-september-93CH-4271046,2025-09-20 01:00:10,
2025-09-20T01:18:24,Investing.com All News,Form 8K Aeluma Inc For: 19 September,https://uk.investing.com/news/filings/form-8k-aeluma-inc-for-19-september-93CH-4271042,2025-09-20 01:00:10,
2025-09-20T01:18:24,Investing.com Bond News,Markets Still Expect Lower Yields After Fed Rate Cut,https://uk.investing.com/analysis/markets-still-expect-lower-yields-after-fed-rate-cut-200618837,"Sep 18, 2025 13:35 GMT",
2025-09-20T01:18:24,Investing.com Bond News,"Rates Spark: Feels a Bit Like a Hike, for Bonds",https://uk.investing.com/analysis/rates-spark-feels-a-bit-like-a-hike-for-bonds-200618828,"Sep 18, 2025 05:34 GMT",
2025-09-20T01:18:24,Investing.com Bond News,Rates Spark: Resilient Risk Sentiment,https://uk.investing.com/analysis/rates-spark-resilient-risk-sentiment-200618769,"Sep 16, 2025 08:29 GMT",
2025-09-20T01:18:24,Investing.com Bond News,Corporate Bonds Are Set for a Powerful Rally as the Fed Prepares to Cut Rates,https://uk.investing.com/analysis/corporate-bonds-are-set-for-a-powerful-rally-as-the-fed-prepares-to-cut-rates-200618735,"Sep 15, 2025 09:49 GMT",
2025-09-20T01:18:24,Investing.com Bond News,Bond Yields Drop as Weaker Labor Market Overshadows Inflation Data,https://uk.investing.com/analysis/bond-yields-drop-as-weaker-labor-market-overshadows-inflation-data-200618709,"Sep 12, 2025 11:55 GMT",
2025-09-20T01:18:24,Investing.com Bond News,Rates Outlook: Bulls Pushing Down the Back End,https://uk.investing.com/analysis/rates-outlook-bulls-pushing-down-the-back-end-200618693,"Sep 12, 2025 07:15 GMT",
2025-09-20T01:18:24,Investing.com Bond News,US Rate Cut Vs. a Very French Affair,https://uk.investing.com/analysis/us-rate-cut-vs-a-very-french-affair-200618677,"Sep 11, 2025 12:32 GMT",
2025-09-20T01:18:24,Investing.com Bond News,Rates Spark: Not the End to France’s Problems,https://uk.investing.com/analysis/rates-spark-not-the-end-to-frances-problems-200618602,"Sep 09, 2025 07:15 GMT",
2025-09-20T01:18:24,Investing.com Bond News,Rates Spark: A Beige Book That Smells a Tariff Stutter,https://uk.investing.com/analysis/rates-spark-a-beige-book-that-smells-a-tariff-stutter-200618517,"Sep 04, 2025 05:22 GMT",
2025-09-20T01:18:24,Investing.com Bond News,Treasury’s Firebreak or Fuel? The Bond Market’s Hidden Inferno,https://uk.investing.com/analysis/treasurys-firebreak-or-fuel-the-bond-markets-hidden-inferno-200618475,"Sep 03, 2025 05:37 GMT",
2025-09-20T01:18:25,Google News Reuters,Microsoft hikes Xbox prices in US once again as tariff challenges persist - Reuters,https://news.google.com/rss/articles/CBMisgFBVV95cUxNbVJtWUNQUkdIN1FkYW9vVUZlTEFhRjV3blJOQTROMHMtdUR3R1JqRWl0VTgzcWI5V2E3QjFXdlF1cF9OdTV5cDRkQlZsaXlhdzRkS2t5Z29sd1k4Mlhla3NxQ3kyZWJoWG9DcmN1VThDdy1yVGNPN0FhVDMtNGt2eG56R0pQWnU3dGhhRWx2WDFoaG9lMWV6OUlMTjVMZUE3LXRyRl9sTGNHZEZxaElJbFFn?oc=5,"Fri, 19 Sep 2025 21:22:46 GMT",
2025-09-20T01:18:25,Google News Reuters,"Oracle eyes $20 billion AI cloud computing deal with Meta, source says - Reuters",https://news.google.com/rss/articles/CBMivAFBVV95cUxPVHVtRkRwSkdnR2t5aGk5NVhUZUJZLUd1d0hmenRUb0F1dllQYURzSzM4dDc5OVNLM1MwamNWUFR4TEoySU1UbGx4ZGZHNjl2OGFhUHlKUEx4N3p0dy14Umd3OUlNVEtiSkJiWFc5S3FhYmhYNnNNZFdWams0a0paZnlMLVdKbmN0TzR0YUxHYXA5LWpRbE9JR1cxcHpkQ1ByWWg4bkVoS3JRdVVIYlU4dkdycXhKVFJLT3RTeg?oc=5,"Fri, 19 Sep 2025 21:46:52 GMT",
2025-09-20T01:18:25,Google News Reuters,"Trump to impose $100,000 fee per year for H-1B visas, in likely blow to tech - Reuters",https://news.google.com/rss/articles/CBMixAFBVV95cUxQTDlleWVxcFI2NGxON1JIRU1wNUUtc002NENzeVZrOU13ZHRyeXc5dHRMV1VXTmtjMXFveFc0NXZQZTNoU1BNNU1fTmd3bGlSVDVFXzAwU2V2N1J3cU81bGdteEFEbUcyVmxONFpRbndWdDhianEtR3hqT21NejRtVmc0bjVWbzR4ZjNuTzJFeENSejBmQTJJWmZTS3NuWEo3cl91QmhSY1FDTWFVTXB2bXhmNG4yMHFDM1hzMnRpb21hYkVI?oc=5,"Fri, 19 Sep 2025 23:51:06 GMT",
2025-09-20T01:18:25,Google News Reuters,"Apple has asked suppliers to boost production of iPhone 17 model, the Information reports - Reuters",https://news.google.com/rss/articles/CBMiwAFBVV95cUxOQm96cFg2aVZBY0lzQUd2WUpvaTZlSF9YaWxNNHlXSEllU0xQRGQtNnhYVGdFZ0FiLWo0aDh0OWNtWXdRbk1yQ05yOFdkZlZheHBFSHdaYTBQcnpjWGN0MmNyQ2RQNGxMcGdremo3NzVSSUkwdXpYYk9HcHlKZGRvM3RLcE5STF8wM29CTVBIclNoMk9pQzhCZDQ3U3VZVTZrcVAwMEQyQWd1Q1Bucmx6X01PVFpRVTEwMGFpYm9KZjg?oc=5,"Fri, 19 Sep 2025 18:38:43 GMT",
2025-09-20T01:18:25,Google News Reuters,"Exclusive: Comcast plans to cut jobs at its biggest unit, housing broadband and pay TV, to centralize operations, source says - Reuters",https://news.google.com/rss/articles/CBMizwFBVV95cUxPcWRPX1ZCMFRpanpLUVFQVXlhR1U3d0dLVkw2Q2Q2RWw0WXFzSDRHZnU5dVRyR2s3UjRwWHZLMXUxZU5qb2gwQnpPdUpLdVhUemJlNFoydUNET0hMei16bldCemZndjJ0LWF0aWRvdTF0alBxWngxdl9sVTdBQnlnVzZ5VE9lOVFNUmVCYTh6VTVILXR3amJDWjlDS2xTSUIwVUNHZm1oY1ZsVFBhZDFNd3Vzc2Q2LU9yd1FpeUwwYl9ERnBPbTVENmo2amlzV1U?oc=5,"Fri, 19 Sep 2025 23:50:26 GMT",
2025-09-20T01:18:25,Google News Reuters,"Portugal to recognize a Palestinian state, government says - Reuters",https://news.google.com/rss/articles/CBMiowFBVV95cUxPTmRMV0xlcERQZDU3aU1BR205LVpla3B5YWwwNUMzQ203bEt0bjFDMkRZN0xVU21QQ3k1ZHBqVTI4MHI1emNOU2p6NmpJQVZiMHRsaVNIa0hVUHc1S193UUNlS2ZnN1lxcThpZ0pTaGVNZ2pNQ1FSYzIzdVlvemUyQ0V6NFhSUXNMY084YzdxdHV3Z19NYnc2c0htRkVOS2RRcmxN?oc=5,"Fri, 19 Sep 2025 21:38:46 GMT",
2025-09-20T01:18:25,Google News Reuters,Trump says to host Turkey's Erdogan at White House on Sept. 25 - Reuters,https://news.google.com/rss/articles/CBMiqAFBVV95cUxOUEZSZ0MtU3JuN0RPYlNlb0RyYktaMUhHRkRFT19VdEN6ZktfTVhXa3JYb2ctaVdhZlJsLUNIWTgtaDFpLThDdWd6a1RKTU1iSnFxMGFPcks0bjA0VGkwNjNHcHd2U3lBV0tOM1RTazBQUnBBZ3ByY05oaUM1TGxkeTNlN2Z6dHZEM1FIdDRCZG5OQ050MkZRRFlhVVVlanYzS05OTVhkX0w?oc=5,"Fri, 19 Sep 2025 18:17:48 GMT",
2025-09-20T01:18:25,Google News Reuters,Musk says xAI is not raising capital after CNBC report on $10 billion funding - Reuters,https://news.google.com/rss/articles/CBMiowFBVV95cUxNTHNOVkQwUHpyeUFwX0txczF5d3VGVW1lc0h2YVRxWjRoOG1vV3FHUlRLcm5EbW1NQWZtYjlmYVBZSUVqb2NUMjBpTFBqTjVmRmk5eXMtNFY5VVd0OTV6RmVTU3FKVkxveUdjNE9INkdMV3k3OVNDZld3ZXN6MzVidG16RmRRM0R0aEw0UjE1cUhzckY2YnNkOVFDdUM3NTk0X3JR?oc=5,"Fri, 19 Sep 2025 20:10:22 GMT",
2025-09-20T01:18:25,Google News Reuters,"Russian jets violated safety zone of drilling platform in Baltic sea, Poland says - Reuters",https://news.google.com/rss/articles/CBMi0wFBVV95cUxPQ0pLV0lvQlZBSzc4M2tPY3VPcTdTazZzb2pNMlNsMUVtRjMxNUVVU054WW1TWGt3VDZiN2VRQ2lHLWpDZWI3SFliZ0U3STUxc2YyRW9qd2NDSFhuNkJ0aGg5X3RXOG4tRjJlZG9fNmRUN1RIZWY3ODVQbHRVMnlBSmpMa1JZZmc0S1pCcTR6Wk9kVkxrMEQ5WExiaElNd2NMYlFCcTd6eHI4aEhpZDNoN0l4V1pyWkNjdlNlaVVaelY1RWxXaW54VEtmdURmY1ZlaFhz?oc=5,"Fri, 19 Sep 2025 17:31:23 GMT",
2025-09-20T01:18:25,Google News Reuters,"Trump administration plans $6.4 billion in weapons sales to Israel, sources say - Reuters",https://news.google.com/rss/articles/CBMiyAFBVV95cUxOWS1JeXBabU5BTkZaMWgyVFAzRlA0WDlpT0NTYjFEQnNkeWhpd3dtcGt6aU9pVFYzZGRQbVVBTENZcVhqb19RLWw0QkJtUFhoQnkzb3d2WjIyOXZHY0VRMWNZUUVTQ3JQRktpUUQ4NXAyYUkxdEFIcmFNUEZjWVZfWDVxVEN0ak9YRzEyYlZnTW5Zd05UMERMZmNVWDd4cWs0b1M3c0pUcWFaWC04b21CTjBPNkZNVHZ5UEZrNzNnNHh2dC1CNzRUbw?oc=5,"Fri, 19 Sep 2025 20:07:22 GMT",
2025-09-20T01:18:25,Google News Reuters,Ted Cruz breaks with fellow Republicans and condemns government threats against US broadcasters - Reuters,https://news.google.com/rss/articles/CBMixwFBVV95cUxOZ1dwWTBOMG1xa1BBSURCdHhSYmxnR0dNRjFIakJjcW1EYUJodDBkcmZhb3gyR2tyRlEtOHJvbWYtWjlaNEl3eXVILUxiajZ2Q05fd0dsX0VTSVUtdEkzMEYzZnNyMkVPUkpDbEVTTmFOcExmU0VLZFI3ZElmN1ZfOHFnR1g3anJZbzFEQ1JEX0Rpd2pSRWNhaWo2MUZKYUU3elNaZGFiRjAycnJQRWdQcXduYzZnalBMdy1mWC1rdWJMQzRObmEw?oc=5,"Fri, 19 Sep 2025 22:38:55 GMT",
2025-09-20T01:18:25,Google News Reuters,"Judge throws out Trump's $15 billion lawsuit against New York Times, citing improper content - Reuters",https://news.google.com/rss/articles/CBMixgFBVV95cUxNcUdHX0puLXp2VENXaWIyMGRTdk9QREhiSlNsdDF2UE5aRzlyUjItT2ZodkV6em9wX1F1WUsyVi1seWtzcXJVeFlXRFBSQWhmdzNJMGo1aUhTLTRZaU5BZFFSQ3NlVnVlVWRqa05ndEpER3dMY29hWGU1SzI2VThFSWpvNDkySFFMWkFjcllDTFc2cUtZVGRvY0d6QWptLWtYTk94YXlaNjNCU0lwaTVWbzh6VnpxZzFTLW15OVVYLTlXTUJCMUE?oc=5,"Fri, 19 Sep 2025 18:52:59 GMT",
2025-09-20T01:18:25,Google News Reuters,US FDA approves Merck's injectable version of blockbuster cancer therapy Keytruda - Reuters,https://news.google.com/rss/articles/CBMixAFBVV95cUxPQVMySmE0eFpxcFVHVnpvQ1JaWGVkSzlQSkJfZmlRWl9Ub3M3TXVSSm9wUFl0Q01jUGxWcmlfSGRQQWJrMEZHcWF3NHloYVVMSVI4bTBVbmE4TkFEb3lYanRzT0hTb3R2Ty02WGQ4VXlUWXoxVUJWNGMtNFFWTDZqQU4xckVJM25aT2QzaXBQN29haUlwZlZ0NnhrUFJGSS1VQmtlaDVlWW5MUEdBdlJyZ2JlRlo5TkFyWEptSV9FRWR1ZDZR?oc=5,"Fri, 19 Sep 2025 22:21:03 GMT",
2025-09-20T01:18:25,Google News Reuters,Porsche EV roll-out delay deals $6 billion hit to parent Volkswagen - Reuters,https://news.google.com/rss/articles/CBMiuAFBVV95cUxNWGhCb2xkVDVTVnhTZkVwNnBubVpQMEFqdDRwZE9pQzM1RWp6NzRxTDdzOHhQQnp5bzd0dlZ5a3ZtODNqekxhRzVUN1dHMm5wOHJhdGc1amZtQWZrbXktSXJxRTV6eDFLNm4zUjk1UnhzMVhteFRqZUVDdFpXbVdOdGMxeEwwdFhGUllpdko0NW10WjFXRUJ0djlVRTFwUkN2MWJJMmY1VlRKVkhNQUJOZkdVLVIwbFUt?oc=5,"Fri, 19 Sep 2025 19:24:53 GMT",
2025-09-20T01:18:25,Google News Reuters,Trump says China's Xi approved TikTok deal - Reuters,https://news.google.com/rss/articles/CBMikwFBVV95cUxNSW5tbE45SGRCX1hKU01XUmVnd1NMTThBbk5pcC14X3FSblFTUkY0cmR2eXlTMUIyTEltay1YSnVTT1JSZUptOXF5T3A2YnpvNU5iQi11ejJ1YW1mWVoxY1N4Y29uMFB2NXZDR1F1eEtmM1k0OXJZYnV3S2p3V1VNWEZGM2xKSWo1akJTM2wteFRJZ1k?oc=5,"Fri, 19 Sep 2025 21:18:51 GMT",
2025-09-20T01:18:25,Google News Reuters,Zelenskiy says Ukrainian forces inflict heavy losses on Russia in counteroffensive - Reuters,https://news.google.com/rss/articles/CBMiugFBVV95cUxQMEQ0RzBZSktRNXFWcm1aVGN5UXNoSDVycHp2YVBmcVhuTXdvWHVrUC1pZjVrWW5SNjdabkg0M3ZZZ0xSVHBsU0hQZVF3Y2NCc0NNbnNVWXhFa0dyZGIxVXp4RXBQZlhPeENvYXdiUTFKb3l5c1JwMWI4N3JOQ2V5Y0JBX3FqdTI5TWVfT0pBQXJNQTFIWFBQR0FQWGJaay1ZMDZCX2psUUlWbjJCcFJJQXc2S1FPaWhBNVE?oc=5,"Fri, 19 Sep 2025 22:24:02 GMT",
2025-09-20T01:18:25,Google News Reuters,"UN Security Council decides not to lift Iran sanctions, but still time to agree delay - Reuters",https://news.google.com/rss/articles/CBMixwFBVV95cUxQWnhwMUlqd0J2aGtBZEtIU1FrdHJoN1BtUGhkdFZyb2xzd2FVaGpic1pteWhMbFItTnItNUdKZ0p2bmpMNEczRFpMZHdxWlJidEZJR0dQM1ZGNHo3SEZkYUZhQkphUjloUzBqN0x3bmkwWERDNlltVzVUcWRULUVSaVRhUnFHOHlSbVdJdmJaMlZ6aHZrcFc3Q05Jczg0YWRuVmJzZjBSTU9sMWxlRXk3Rnl1djdTd1JIQXU5OURiM1R0RXA2WDZN?oc=5,"Fri, 19 Sep 2025 16:36:54 GMT",
2025-09-20T01:18:25,Google News Reuters,"US has talked with Gulf states about post-war Gaza administration, envoy says - Reuters",https://news.google.com/rss/articles/CBMiygFBVV95cUxOdnNUa0hlVnhTMjItM0JLeWZWbW5IcWtvbWRSYVJISWpfeWZ1d0ROYUhsVjNvRFE2bldkb19oUHJRZXhYTm1MRkw5YVg5b29NWm5kMUxXR0N2dTdrbklKVWJPaEtrTUw5MUxVZ3RCdHdCS0xUUWFIaU9xVmhDYWFGSXNHXzhiSmk2dHJOVWhwSkpZTjY1MG5vdmtEYW13X1FPYUtPcEZPVEluUGx4TjFET1dOMndTOE04bVdiem1LVUVZWHl6aHdLdV9R?oc=5,"Fri, 19 Sep 2025 16:12:17 GMT",
2025-09-20T01:18:25,Google News Reuters,Russian jets enter Estonia's airspace in latest test for NATO - Reuters,https://news.google.com/rss/articles/CBMixwFBVV95cUxNSUNvT3lIYXJTakZYRzRhRFIwN2lyaHo2ejhWcE16aGxZaU9tdHN4bE80dGJNSlZST0V5eXRiQW52ZGJxUldkb0lIbjVYZGZLanI2a2Y4eFpPaDZMa2ZxOGpqQUk0MmJ3VzRWTWF4UENtY180RGhNd3BuNW9YTk5JaktkSFNUS2R4WXBDTUY5bElMdDVaeDhteFFvd0VPWkV0N3R4T2pSZlhiOTU3ZGZ3YUVlV0xmQnNyc21kaTQwclpyamotU2lF?oc=5,"Fri, 19 Sep 2025 21:57:45 GMT",
2025-09-20T01:18:25,Google News Reuters,Senate Republican blasts FCC chair threats to Disney - Reuters,https://news.google.com/rss/articles/CBMirAFBVV95cUxPYXcxT2JFVVJJSWUycjdyNWxNUkw5X0xkM0dyRFlyalItWW85a2VrNlFSOE1zVXlrck5NTmlNSXRGR2JKV0lzOXdnNjU3S2Fjam1IVEJmX0t0YlJkc0IyMUxyNFA4bjJWVkZiSFVPeXV3SjRVUW9XV0o1VmdEZ19sa01LVk1SZzd1bTR6WHJEaDdLcmE2ai1zaFBrc1RfNGVUTmNxVTRGWTdIbWpH?oc=5,"Fri, 19 Sep 2025 17:17:02 GMT",
2025-09-20T01:18:25,Google News Reuters,"Estonian airspace violated by Russian jets on Friday, sources say - Reuters",https://news.google.com/rss/articles/CBMirwFBVV95cUxOQUx3eFNhZzVXc1R6aUlWX043Nmp5emRDbVgzZHBjbGJpNVBrVzZVYm9VbzlieGQwa25CYmJHeDFpRjdsVFFBRTZDcVFHNHhEWmdpX2FlbWdwSk9RSUdTaEUxQWNlX0pSUDhvSXlOaUlpLXZoWV9fdklnSXc3dkJLYmdVQTFHQ3U0Wi12TXZtektwbW1UVkxrUUs1OGk2VFhKejNLMWFEUnFwS1FRUmlv?oc=5,"Fri, 19 Sep 2025 14:11:09 GMT",
2025-09-20T01:18:25,Google News Reuters,"Israel presses ahead with Gaza City assault, displaced Palestinians panic - Reuters",https://news.google.com/rss/articles/CBMixAFBVV95cUxNT256Y1ZITXo3cHlGd0NBYnFUNEttcVFoTVU4UTliWkxSLXJGZ3N2TFE4NGp0VHc0bnhScUFtMDZNemJBTVY4OFBUVE9OODZxR2JVREhpaHNjZkZCUk1kWU5LZzdVcHhZUndKOTdFRFN5VV9xYzJjT1ZhUF9uNHBxZ1N6TXNjaGplR3hCOHNia0pDVkY4c09lYm0zX3U1Vmhienp2Z1diSTByU2dURHA2UUphMm13dW1Ic3hQZFVyQzdCOHhn?oc=5,"Fri, 19 Sep 2025 20:04:52 GMT",
2025-09-20T01:18:25,Google News Reuters,"Barred from Eurovision, Russia hosts rival 'Intervision' song contest - Reuters",https://news.google.com/rss/articles/CBMivAFBVV95cUxPbllNc3F1VGI2WE1BOFRVdHp0NmY0U3lMMnItOFBCN3FESE9kQnRPYmZZMlhLdUZJSWV3WXYzMUpPTXFIUFYxaUFuUG44SDZvRVpPVGJmSld5cmRqZzhJcU5iTW5HY0dXaFh0M0R6U2lUTjFCRlZ4Zk5QcVBPbzJTaU5QR3VpcnllNm1qT09pOUxHbkc0Z3JKcGNQTU9temkxa3hXNmR1OGRfdlhiRmYtZE9qMlB5YVlJOVYwVg?oc=5,"Fri, 19 Sep 2025 14:00:18 GMT",
