timestamp,source,title,link,published,content
2025-09-12T00:00:22,MarketWatch Top,"My parents promised to split their estate 50/50, but my mother gave my brother real estate. Is that fair?",https://www.marketwatch.com/story/my-parents-promised-to-split-their-estate-50-50-but-my-mother-gave-my-brother-real-estate-is-that-fair-ec30343f?mod=mw_rss_topstories,"Thu, 11 Sep 2025 23:17:00 GMT",
2025-09-12T00:00:22,MarketWatch Top,"Adobe’s earnings beat shows investors that AI is finally paying off, and the stock rises",https://www.marketwatch.com/story/adobes-stock-has-fallen-after-the-last-four-earnings-calls-can-ai-finally-deliver-cb3242ec?mod=mw_rss_topstories,"Thu, 11 Sep 2025 23:07:00 GMT",
2025-09-12T00:00:22,MarketWatch Top,"‘My income is not enough’: I’m a single parent in my early 50s. Should I add my kids, 23 and 29, to my mortgage application?",https://www.marketwatch.com/story/my-income-is-not-enough-im-a-single-parent-in-my-early-50s-should-i-add-my-kids-23-and-29-to-my-mortgage-application-a82f73ba?mod=mw_rss_topstories,"Thu, 11 Sep 2025 22:37:00 GMT",
2025-09-12T00:00:22,MarketWatch Top,Super Micro’s stock is getting an Nvidia bump. Here’s the latest update.,https://www.marketwatch.com/story/super-micros-stock-is-getting-an-nvidia-bump-heres-the-latest-update-96f74aa7?mod=mw_rss_topstories,"Thu, 11 Sep 2025 22:37:00 GMT",
2025-09-12T00:00:22,MarketWatch Top,"I’m 67. My wife, 48, is financially illiterate. How do I teach her to manage our money? After all, I won’t be around forever.",https://www.marketwatch.com/story/im-scared-for-her-my-wife-48-is-financially-illiterate-im-67-what-happens-when-i-die-0e9dbd09?mod=mw_rss_topstories,"Thu, 11 Sep 2025 22:29:00 GMT",
2025-09-12T00:00:22,MarketWatch Top,Gold keeps setting records — but its September performance history could be a roadblock,https://www.marketwatch.com/story/gold-has-a-september-trading-pattern-that-could-surprise-investors-this-time-e8baafcc?mod=mw_rss_topstories,"Thu, 11 Sep 2025 21:56:00 GMT",
2025-09-12T00:00:22,MarketWatch Top,Cheap pharmaceuticals from China and India put Americans at risk. Here’s the cure.,https://www.marketwatch.com/story/cheap-pharmaceuticals-from-china-and-india-put-americans-at-risk-heres-the-antidote-3f9061f2?mod=mw_rss_topstories,"Thu, 11 Sep 2025 21:54:00 GMT",
2025-09-12T00:00:22,MarketWatch Top,"RH CEO: ‘Significant inflation’ to hit this year, and gather speed in 2026 and beyond",https://www.marketwatch.com/story/rh-ceo-significant-inflation-to-hit-this-year-and-gather-speed-in-2026-and-beyond-86f68282?mod=mw_rss_topstories,"Thu, 11 Sep 2025 21:52:00 GMT",
2025-09-12T00:00:22,MarketWatch Top,Klarna goes public as more people say buy-now-pay-later is the only way they can afford to buy things,https://www.marketwatch.com/story/klarna-goes-public-as-more-people-say-buy-now-pay-later-is-the-only-way-they-can-afford-to-buy-things-fcca828d?mod=mw_rss_topstories,"Thu, 11 Sep 2025 21:25:00 GMT",
2025-09-12T00:00:22,MarketWatch Top,Gemini’s IPO rides the crypto craze to further the fortunes of the Winklevoss twins,https://www.marketwatch.com/story/geminis-ipo-rides-the-crypto-craze-to-further-the-fortunes-of-the-winklevoss-twins-3f716738?mod=mw_rss_topstories,"Thu, 11 Sep 2025 21:10:00 GMT",
2025-09-12T00:00:23,CNBC Top News,'We will do better.' Microsoft CEO Nadella admits company has to rebuild trust with employees,https://www.cnbc.com/2025/09/11/microsoft-ceo-nadella-says-company-must-rebuild-trust-with-employees.html,"Thu, 11 Sep 2025 21:14:14 GMT",
2025-09-12T00:00:23,CNBC Top News,Oracle shares retreat 6% after sharpest rally in more than 30 years,https://www.cnbc.com/2025/09/11/oracle-shares-slide-7percent-openai.html,"Thu, 11 Sep 2025 20:00:43 GMT",
2025-09-12T00:00:23,CNBC Top News,"Paramount Skydance is preparing a bid for Warner Bros. Discovery, sources say",https://www.cnbc.com/2025/09/11/warner-bros-discovery-paramount-skydance-bid.html,"Thu, 11 Sep 2025 20:19:00 GMT",
2025-09-12T00:00:23,CNBC Top News,United CEO says he expects struggling Spirit Airlines to go out of business,https://www.cnbc.com/2025/09/11/united-ceo-predicts-struggling-spirit-airlines-will-go-out-of-business.html,"Thu, 11 Sep 2025 22:48:42 GMT",
2025-09-12T00:00:23,CNBC Top News,"Charlie Kirk shooting: FBI shares person of interest photos, offers $100,000 reward",https://www.cnbc.com/2025/09/11/charlie-kirk-shooter-manhunt-trump.html,"Thu, 11 Sep 2025 20:58:17 GMT",
2025-09-12T00:00:23,CNBC Top News,Trump asks appeals court to let him fire Lisa Cook before next week's Fed meeting,https://www.cnbc.com/2025/09/11/trump-lisa-cook-fed-lawsuit-fomc.html,"Thu, 11 Sep 2025 20:54:21 GMT",
2025-09-12T00:00:23,CNBC Top News,"Treasury Secretary Bessent met this week with Warsh, Lindsey and Bullard as Fed chief search continues",https://www.cnbc.com/2025/09/11/bessent-warsh-lindsey-bullard-fed-chief-search.html,"Thu, 11 Sep 2025 20:18:17 GMT",
2025-09-12T00:00:23,CNBC Top News,Here's what Paramount Skydance would be buying in a deal for Warner Bros. Discovery,https://www.cnbc.com/2025/09/11/paramount-skydance-warner-bros-discovery-bid-content.html,"Thu, 11 Sep 2025 20:44:49 GMT",
2025-09-12T00:00:23,CNBC Top News,Most of Elon Musk’s fortune now comes from his private companies,https://www.cnbc.com/2025/09/11/elon-musk-fortune-private-companies.html,"Thu, 11 Sep 2025 18:02:53 GMT",
2025-09-12T00:00:23,CNBC Top News,"Adobe's stock gains on earnings, revenue beat",https://www.cnbc.com/2025/09/11/adobe-adbe-q3-2025-earnings-report.html,"Thu, 11 Sep 2025 23:18:26 GMT",
2025-09-12T00:00:23,CNBC Top News,Amazon suspends engineer who protested company's work with Israeli government,https://www.cnbc.com/2025/09/11/amazon-suspends-engineer-who-protested-companys-work-with-israel.html,"Thu, 11 Sep 2025 20:45:48 GMT",
2025-09-12T00:00:23,CNBC Top News,"After a record day for the indexes, Jim Cramer argues against market 'cynics'",https://www.cnbc.com/2025/09/11/jim-cramer-argues-against-market-cynics-after-records.html,"Thu, 11 Sep 2025 22:24:37 GMT",
2025-09-12T00:00:23,CNBC Top News,Trump's tariffs are slowly finding their way into consumer prices,https://www.cnbc.com/2025/09/11/trumps-tariffs-are-slowly-finding-their-way-into-consumer-prices.html,"Thu, 11 Sep 2025 18:52:39 GMT",
2025-09-12T00:00:23,CNBC Top News,"Plane carrying Hyundai, LG workers detained in immigration raid departs for South Korea",https://www.cnbc.com/2025/09/11/trump-hyundai-lg-south-korea-workers.html,"Thu, 11 Sep 2025 18:18:12 GMT",
2025-09-12T00:00:23,CNBC Top News,Opendoor stock closes 78% higher after company names new CEO,https://www.cnbc.com/2025/09/11/opendoor-stock-ceo-nejatian-keith-rabois.html,"Thu, 11 Sep 2025 20:04:04 GMT",
2025-09-12T00:00:23,CNBC Top News,Uber sued by DOJ for alleged discrimination against disabled riders,https://www.cnbc.com/2025/09/11/uber-doj-lawsuit-disabilities-discrimination.html,"Thu, 11 Sep 2025 20:40:34 GMT",
2025-09-12T00:00:23,CNBC Top News,"Alphabet, Meta, OpenAI, xAI and Snap face FTC probe over AI chatbot safety for kids",https://www.cnbc.com/2025/09/11/alphabet-meta-openai-x-ai-chatbot-ftc.html,"Thu, 11 Sep 2025 19:58:31 GMT",
2025-09-12T00:00:23,CNBC Top News,U.S. will split profits with Tokyo from Japan-funded projects until $550 billion is recouped: Lutnick,https://www.cnbc.com/2025/09/11/japan-us-tariff-550-billion-investment-trump-lutnick.html,"Thu, 11 Sep 2025 20:04:30 GMT",
2025-09-12T00:00:23,CNBC Top News,Kodak launches vintage-style toy camera with strong sales,https://www.cnbc.com/2025/09/11/kodak-vintage-style-toy-camera-chamera.html,"Thu, 11 Sep 2025 19:29:55 GMT",
2025-09-12T00:00:23,CNBC Top News,"Health care inflation rises as patients, employers brace for biggest jump in health spending in 15 years",https://www.cnbc.com/2025/09/11/cpi-report-health-care-inflation-rises.html,"Thu, 11 Sep 2025 18:40:44 GMT",
2025-09-12T00:00:23,CNBC Top News,"Alphabet's Verily covered up HIPAA violations, whistleblower says in lawsuit",https://www.cnbc.com/2025/09/11/alphabet-verily-hipaa-diabetes-whistleblower.html,"Thu, 11 Sep 2025 16:38:18 GMT",
2025-09-12T00:00:23,CNBC Top News,"Who was Charlie Kirk, Trump ally and conservative activist?",https://www.cnbc.com/2025/09/11/who-was-trump-ally-and-conservative-influencer-charlie-kirk.html,"Thu, 11 Sep 2025 12:41:01 GMT",
2025-09-12T00:00:23,CNBC Top News,"Offshore wind has no future in the U.S. under Trump administration, Interior Secretary says",https://www.cnbc.com/2025/09/11/offshore-wind-renewables-energy-trump-burgum.html,"Thu, 11 Sep 2025 19:04:31 GMT",
2025-09-12T00:00:23,CNBC Top News,Trump’s pressure on Europe to slap 100% tariffs on India and China raises eyebrows,https://www.cnbc.com/2025/09/11/trump-asking-eu-to-slap-100percent-tariffs-on-india-and-china-raises-eyebrows.html,"Thu, 11 Sep 2025 06:45:14 GMT",
2025-09-12T00:00:23,CNBC Top News,"GE Vernova's wind business faces a rocky future, and Southwest gives Boeing shares a lift",https://www.cnbc.com/2025/09/11/ge-vernovas-wind-business-faces-a-rocky-future-and-southwest-gives-boeing-shares-a-lift.html,"Thu, 11 Sep 2025 18:21:50 GMT",
2025-09-12T00:00:23,CNBC Top News,"Social Security cost-of-living adjustment may be slightly higher in 2026, estimates find. What that means for retirees",https://www.cnbc.com/2025/09/11/social-security-cola-cost-of-living-adjustment-may-be-higher-in-2026-estimates.html,"Thu, 11 Sep 2025 18:46:29 GMT",
2025-09-12T00:00:23,CNBC Top News,UK sacks U.S. Ambassador Peter Mandelson over Epstein links,https://www.cnbc.com/2025/09/11/uk-sacks-mandelson-as-us-ambassador-over-epstein-links.html,"Thu, 11 Sep 2025 15:40:34 GMT",
2025-09-12T00:00:23,CNBC Top News,‘Here we go’: Trump responds to Russia’s drone incursion on a NATO ally. But what comes next?,https://www.cnbc.com/2025/09/11/nato-what-comes-next-as-trump-responds-to-russias-drone-incursion.html,"Thu, 11 Sep 2025 12:12:38 GMT",
2025-09-12T00:00:23,CNBC Top News,Inside Wealth: Family offices double down on stocks and dial back on private equity,https://www.cnbc.com/2025/09/11/family-office-investing-portfolio-allocation-goldman-sachs-survey.html,"Thu, 11 Sep 2025 13:20:06 GMT",
2025-09-12T00:00:23,CNBC Top News,"Treasury released early list for ‘no tax on tips’ deduction — but some jobs won’t qualify, experts say",https://www.cnbc.com/2025/09/10/no-tax-on-tips-deduction-who-qualifies.html,"Wed, 10 Sep 2025 18:33:38 GMT",
2025-09-12T00:00:23,Investing.com All News,"Microsoft, OpenAI say non-binding deal reached over for-profit transition",https://uk.investing.com/news/stock-market-news/microsoft-openai-say-nonbinding-deal-reached-over-forprofit-transition-4260778,2025-09-11 23:50:08,
2025-09-12T00:00:23,Investing.com All News,Decheng capital funds sell $40k in BeyondSpring (BYSI) shares,https://uk.investing.com/news/insider-trading-news/decheng-capital-funds-sell-40k-in-beyondspring-bysi-shares-93CH-4260777,2025-09-11 23:48:08,
2025-09-12T00:00:23,Investing.com All News,Rothblatt (United Therapeutics) sells $3.1m in UTHR stock,https://uk.investing.com/news/insider-trading-news/rothblatt-united-therapeutics-sells-31m-in-uthr-stock-93CH-4260776,2025-09-11 23:48:07,
2025-09-12T00:00:23,Investing.com All News,Duggan buys Summit Therapeutics (SMMT) shares worth $5.9m,https://uk.investing.com/news/insider-trading-news/duggan-buys-summit-therapeutics-smmt-shares-worth-59m-93CH-4260775,2025-09-11 23:42:07,
2025-09-12T00:00:23,Investing.com All News,Summit Therapeutics director Zanganeh buys shares worth $5.9m,https://uk.investing.com/news/insider-trading-news/summit-therapeutics-director-zanganeh-buys-shares-worth-59m-93CH-4260774,2025-09-11 23:42:06,
2025-09-12T00:00:23,Investing.com All News,Form 144 Ouster For: 11 September,https://uk.investing.com/news/filings/form-144-ouster-for-11-september-93CH-4260772,2025-09-11 23:40:07,
2025-09-12T00:00:23,Investing.com All News,"Gemini prices IPO above range, raises $425M - Reuters",https://uk.investing.com/news/stock-market-news/gemini-prices-ipo-above-range-raises-425m--reuters-432SI-4260771,2025-09-11 23:34:06,
2025-09-12T00:00:23,Investing.com All News,Neha Narkhede sells Confluent shares worth $3.04 million,https://uk.investing.com/news/insider-trading-news/neha-narkhede-sells-confluent-shares-worth-304-million-93CH-4260769,2025-09-11 23:10:07,
2025-09-12T00:00:23,Investing.com All News,"Legence prices IPO at $28 per share, expects to raise $688 million",https://uk.investing.com/news/stock-market-news/legence-prices-ipo-at-28-per-share-expects-to-raise-688-million-432SI-4260767,2025-09-11 23:10:07,
2025-09-12T00:00:23,Investing.com All News,"Mellinger, director at Mara, sells $16,100 in shares",https://uk.investing.com/news/insider-trading-news/mellinger-director-at-mara-sells-16100-in-shares-93CH-4260768,2025-09-11 23:10:06,
2025-09-12T00:00:23,Investing.com Bond News,US Rate Cut Vs. a Very French Affair,https://uk.investing.com/analysis/us-rate-cut-vs-a-very-french-affair-200618677,"Sep 11, 2025 12:32 GMT",
2025-09-12T00:00:23,Investing.com Bond News,Rates Spark: Not the End to France’s Problems,https://uk.investing.com/analysis/rates-spark-not-the-end-to-frances-problems-200618602,"Sep 09, 2025 07:15 GMT",
2025-09-12T00:00:23,Investing.com Bond News,Rates Spark: A Beige Book That Smells a Tariff Stutter,https://uk.investing.com/analysis/rates-spark-a-beige-book-that-smells-a-tariff-stutter-200618517,"Sep 04, 2025 05:22 GMT",
2025-09-12T00:00:23,Investing.com Bond News,Treasury’s Firebreak or Fuel? The Bond Market’s Hidden Inferno,https://uk.investing.com/analysis/treasurys-firebreak-or-fuel-the-bond-markets-hidden-inferno-200618475,"Sep 03, 2025 05:37 GMT",
2025-09-12T00:00:23,Investing.com Bond News,Rates Spark: Dealing with Eurozone Disinflation,https://uk.investing.com/analysis/rates-spark-dealing-with-eurozone-disinflation-200618453,"Sep 02, 2025 07:18 GMT",
2025-09-12T00:00:23,Investing.com Bond News,Rates Spark: No Brain Steepeners Exposed to Reversals,https://uk.investing.com/analysis/rates-spark-no-brain-steepeners-exposed-to-reversals-200618401,"Aug 29, 2025 09:26 GMT",
2025-09-12T00:00:23,Investing.com Bond News,Bond Market Flashes Fiscal Dominance Warning as Yields Diverge,https://uk.investing.com/analysis/bond-market-flashes-fiscal-dominance-warning-as-yields-diverge-200618384,"Aug 28, 2025 16:37 GMT",
2025-09-12T00:00:23,Investing.com Bond News,Rates Spark: The Lisa Cook Affair and the Curve,https://uk.investing.com/analysis/rates-spark-the-lisa-cook-affair-and-the-curve-200618367,"Aug 28, 2025 07:03 GMT",
2025-09-12T00:00:23,Investing.com Bond News,Eurozone Bond Spreads Face a Jittery Autumn,https://uk.investing.com/analysis/eurozone-bond-spreads-face-a-jittery-autumn-200618345,"Aug 27, 2025 11:42 GMT",
2025-09-12T00:00:23,Investing.com Bond News,Credit Spreads at 25-Year Lows Highlight Investors’ Volatility Blind Spot,https://uk.investing.com/analysis/credit-spreads-at-25year-lows-highlight-investors-volatility-blind-spot-200618336,"Aug 26, 2025 13:28 GMT",
2025-09-12T00:00:24,Google News Reuters,Brazil's Bolsonaro sentenced to 27 years after landmark coup plot conviction - Reuters,https://news.google.com/rss/articles/CBMiwAFBVV95cUxOcnFpSUdYNi1DMWNWR2NCUUFUVWxyd1lGbk1OVDAxU2FsdXpVa3Exb0wxejlTdm5PVDhkbXF4OW9KeTNGT3pyY1FERnJ6WjdSNEpTa2d2MUFxRnUyOEY1YTdHTTFobHNvM2N5eFRtS3RWQWR6VVlGeERMc1R2czZnNGQzYzQtTDVVSkNpZHF6aHpKbVhLdl9BNmM4RlhrdnJtRzhMMmxzaDE1WWRhMTIxQjlzendlWjY4NVh3M0ZDYXA?oc=5,"Thu, 11 Sep 2025 23:26:43 GMT",
2025-09-12T00:00:24,Google News Reuters,"Microsoft, OpenAI reach non-binding deal to allow OpenAI to restructure - Reuters",https://news.google.com/rss/articles/CBMirgFBVV95cUxNSUhOLWhSbzhwYmFjYkhaWGZtdXNiRC1YNzYwVWFEc3ZpYWlYMkMxQm9uZlhWbzhFOHBKN0JybUpiaWgzMWt2Y2xlTmRnODlSZkh2ZmJHQ2czS0ZmWHA0ZGNrcWpfV3Zfb0pYSmJKbkZMOGJmczBYaHRyeExreF9DNGFHcmV3aGlObVRGZWlCSVRUaXV2TW8yR0hCNkpTNFVOUGQxdnUxeV9Xc3MtUHc?oc=5,"Thu, 11 Sep 2025 23:02:12 GMT",
2025-09-12T00:00:24,Google News Reuters,"Stocks rise, dollar falls as soft US jobs data fuels rate cut bets - Reuters",https://news.google.com/rss/articles/CBMie0FVX3lxTFB3dmlrRmZab09aVkwzQ1ctaGN6ckxJQ3hMekpUOFlmTkIxcG93cjlCQzRyUmQ3V0Q1STk3T0J6S2p4bFhNSGxUSm0zNXhJcEdDSnkwLVBjblJ3TjZWdmJDSG9vWXJJdjdJMk5BMXRSTk05UmdKTVdxalpDcw?oc=5,"Thu, 11 Sep 2025 22:20:17 GMT",
2025-09-12T00:00:24,Google News Reuters,"FTC launches inquiry into AI chatbots of Alphabet, Meta and others - Reuters",https://news.google.com/rss/articles/CBMipgFBVV95cUxPeVJSSWFOc3FXSnQ1N052TGNDTkJsSVRjLWFIWWFQdUlHcnBuNGJYaklsa3J0S1NiYk1Ob1ZoYzNzMV9wQXA2NUNpT1BkZmpqQ05OV1RaWV9ybDBXelFlLW1aR3d6Z2EyNE96SVNiM3lwdXR1bHZIWkpTZjItdXpCeEw1aHA1dkRRTHkzMVpjbmZiVE1TTlRkY1QwUk5Vc3FZR0VsVER3?oc=5,"Thu, 11 Sep 2025 22:07:00 GMT",
2025-09-12T00:00:24,Google News Reuters,Court allows Trump administration to end Planned Parenthood's Medicaid funding - Reuters,https://news.google.com/rss/articles/CBMitwFBVV95cUxPM25IR1JnZHQtY2N0LVpvcWgzZTkybERsYWFZcnJ4NWllRUlpWDhPeDg3aEx3bmZtYlczel9DdEd0Y29EOWU3b3VRRnlMLVFDZGFzVHF5NmVEOVhIZl9PWFpscHJydEYzZnQySWZER1BUMW96Q215NGsxUXJwcVN5Mm5XQUlnVk4wTGpsVEI1MzRjRGF5SXU4YTFFVklKLTNReVYxYjR1Q0ZFT0tWVjZ4UllnUllfOEU?oc=5,"Thu, 11 Sep 2025 23:17:48 GMT",
2025-09-12T00:00:24,Google News Reuters,Black US colleges restrict campus activity after threats - Reuters,https://news.google.com/rss/articles/CBMiowFBVV95cUxPSnUzZG0yQXNPaXQxYThXU3d2eDZCZHh1NkFrNHBZSlhoQzhQRnU4em1rdXNvUHVDLXNkMDZsYkJDa1huRjFScGh2bUhuUWEwb1dpZ1huR2JJVUxfbUNzaUdKWkNTenZYQjFabnc3T1R5VjdBQU1QdHlXekd6eWpyQTRTZll3T3podnIzckhLVUE5S1BFLTRBTTBaTGxWa3hXZERR?oc=5,"Thu, 11 Sep 2025 20:31:34 GMT",
2025-09-12T00:00:24,Google News Reuters,Wall Street indexes post record-high closes; Tesla and Micron rally - Reuters,https://news.google.com/rss/articles/CBMiqwFBVV95cUxQeEtZMmhaMmpLQXlvaE53RmtvbDFvNFFMYjdNU2x2NG1kdThGeTYySEdBNjUwZk1PNmlOVlVuSFBmT2lMWS1qckRjb2RVR0ZMaHZhWVMzZnJmUS1yc0hDeWFlSjhIc3dQSmg0Njg1aXhKQzVrUkp4a1pBRE1fbmx1LVJSLVN4UnREbmx5cHNZbGNfTTlaTmNUSTlMWlpPZ2k3V3FmY2E0VXBSNVk?oc=5,"Thu, 11 Sep 2025 22:19:07 GMT",
2025-09-12T00:00:24,Google News Reuters,US threatens action against foreigners praising Kirk killing - Reuters,https://news.google.com/rss/articles/CBMiqAFBVV95cUxOUHQ3R3BiZkhVS2pPWE1oWllnckRNZk1SUUJ0SGJLOGxQLXhGRVhoZ1hMM1dfNEtYTV9JUHIzRDZWWGZYQ1ptSXRTX1hnYVMwLTM1anlQWjdDRG4zeUdudkpxaklHSFZYcEwxb09jX3lRb2pMcW1HX1VVRm9FYlQ4VXRyRUgxNDdDY2tFSmNZX1NaLUNaaExHWmZiTnQ3aVlxbVdua19PcFg?oc=5,"Thu, 11 Sep 2025 19:05:20 GMT",
2025-09-12T00:00:24,Google News Reuters,FBI Director Kash Patel faces scrutiny for inaccurately saying Kirk killer had been caught - Reuters,https://news.google.com/rss/articles/CBMiwgFBVV95cUxNdjFwR3BqWWROdXMtUTNZTndUYlFISktNQ01xUjBLWjJVdG8wZEJIdHdmVmI0dWFULUcxYV9oZE11aGx2MXlvM29NNHM3TXVCTXRmZlA5ZjVid1pBQmlxd291dWJjemo1NUNBXzhFQ2hpZG80dG12bXB0OWthN0NKa0thSEZySkR0a2Zwak93Mnl1OEVOZlNVVml5MVpNbGQ3Qk9VbHg1ZmdIQWs3a1FNcWZIODhGT3hwekxHa204TWJvZw?oc=5,"Thu, 11 Sep 2025 19:26:05 GMT",
2025-09-12T00:00:24,Google News Reuters,"Oil prices slide 2% on worries about global oversupply, US demand - Reuters",https://news.google.com/rss/articles/CBMisgFBVV95cUxNcER1b29IV2NEaElxaDdKZkZlcDJfYzRNQTdXQ0dnRk9fWUo4VVN2b2VsdlNrSk01SE1fNldtd1daSXdUVFdzdjFGT2dDSVYzdS0zU2l4cXhyWjRYUDdJZWRQb25CcHBicXNJSWJYZmFJc1ZTSXNIZWQ3Qi1CaURvZTR6cUJiVU5Td0dKVnRVcXZlcjdTbXNCQ0RpdmVWc2RiQy1kR2hlR2J3NU82VjE3a0tn?oc=5,"Thu, 11 Sep 2025 19:18:26 GMT",
2025-09-12T00:00:24,Google News Reuters,"US sues Uber, alleges discrimination against disabled riders - Reuters",https://news.google.com/rss/articles/CBMiwwFBVV95cUxPT0J1UGc1d3NmczRzSFVoSGYzbkxGWnk3U0hXOWhIWE9FUUxxWXFCLU10VnhpV1JHNnZQSUNEaGZCTG1GSTlOcUVSWTNWVGtNMUdORWk3TmtaZE85dTU0V3dTSURSSi1BRFQ5WlUybHVkM0ZKRGVTc01ZUjZYWEVmZEZxMVNqZTI0clVOZWlwbERhcS1EM0l3a1JST09MeUhOMXRYVVFUMnNJWXFOcVB5cEh2T1FQc2J0N0VteHhUNHlWdU0?oc=5,"Thu, 11 Sep 2025 19:35:21 GMT",
2025-09-12T00:00:24,Google News Reuters,"UN Security Council, with US support, condemns strikes on Qatar - Reuters",https://news.google.com/rss/articles/CBMisgFBVV95cUxOUUJOeFJzSVZOM1NZU1RIbTJsNE4weHR1N1lzUHJSUE9abU43cW9fU0xaRDNHbEpQaG5id0wwcFBWZENBbkVISkxodEg4aFlTVTA5aDJDNEVlX2lPTUwzeEVYRk5sY2FNWURNX3I1X2dPWEpwNndOeHBuaUxvSXlsX3QzUlVxRnEzTTJSUVNJMmZ1bzFpc29tLWZsMEZYWGdWTWZJX1RDRFA3ZlYtejFTd1RR?oc=5,"Thu, 11 Sep 2025 21:37:04 GMT",
2025-09-12T00:00:24,Google News Reuters,"Paramount Skydance preparing bid for Warner Bros Discovery, source says - Reuters",https://news.google.com/rss/articles/CBMi1gFBVV95cUxQaUtZYXlEcEMzUlBwVkh6OUY3UzZ6WGwyREpNajUyN2d4cFhnNnRCS0xubkpQdks5bGNIbmQ4b0dqUkhxS2JmUWRfOWtqWkU5MjE1amt0TmJMaE5nVlVPdW84RlJUeW8zTXFDM3NZWDRzUFFNLVFIOGsxSE1sQlJ5SzFhcFVtUDF0UHlyRk00NUJQdG1lbWwzU1hxZWNmNkV2SEJGalR6X1YtdWZBX2NWbld1UnA2MHdQMTdpdXdsam1ja1NfcnhmZzM1TkVza2s0Mm9tQWdn?oc=5,"Thu, 11 Sep 2025 23:35:36 GMT",
2025-09-12T00:00:24,Google News Reuters,Representative for LeBron James denies NBA star wrote for Chinese state newspaper - Reuters,https://news.google.com/rss/articles/CBMizAFBVV95cUxQQjJDZmRZUW94OWZPMlZrbWd6WlVrTHlCN29pczcyZHdyX1c1M2JhY0hrTVZJN2ktaVNuSTlVcGZJamQxRXl6b3JyTmZtdk1UcUx3ZGtSM0NQMXpIMTVKajQ1UGpWeE5ONUlUYzUxSFFNQm4tSG9UNnFaSXJ4QVM1TmtkZmxrVUpqaHZQZzlmcUpudktsdzhGWmhUR1pRNWdVUU9BTjRHd1JPMFF1dFVjMXFKMEdfM0F3V1NxbWtCNjFNMUNLcXZlWUQzYjk?oc=5,"Thu, 11 Sep 2025 19:19:59 GMT",
2025-09-12T00:00:24,Google News Reuters,UN Security Council to meet Friday on drone incursions in Poland - Reuters,https://news.google.com/rss/articles/CBMipwFBVV95cUxORFlNOWVaVDR2VGpPMExsaXkyVXpLMUZkZUVKUUJzc1dPN1NZYnZWNmdPZXhNU0l0anN2enZBVlptV05HeVc5MWd4WmNkRW03dzdXeE51NkZMSVU4b2dNZjNvYnl2NXk5SDZFVWM0X1NMX0FjdnZZaUJzQ08yV1BHLUY2YTAwVTVlc3c1YlRFaDlVOGtNcFFnR3E0a05sVHlsbzhpME5pRQ?oc=5,"Thu, 11 Sep 2025 19:13:33 GMT",
2025-09-12T00:00:24,Google News Reuters,"Netanyahu signs West Bank settlement expansion plan, rules out Palestinian state - Reuters",https://news.google.com/rss/articles/CBMizgFBVV95cUxNRFFVenkzS0cwUUMtaVAtTVFNZnBscXcyN0VCLVRnTGlZZU1ESVh2Z0cxZ08wcG9NcV95c1hRbnZrdE1mOE53dDlGX05ENjFQQXJkRXM5OThTSWhvdkpTT2VmT3l5MU04dWhPV3AtajNrbzctNk5TamRleVJXWXNZSWpUbXhqcGF2ai10WmRXdUFGbzNYQ3h2Q2dqS01WN0NIVUhmT1NoWnZpTnNKTHpqRlg3akNQQ0NDdmpmR3BUSlY5NkEyTWhkX0dvaW1idw?oc=5,"Thu, 11 Sep 2025 17:44:19 GMT",
2025-09-12T00:00:24,Google News Reuters,"US dollar retreats as inflation runs warm, jobless claims tick higher - Reuters",https://news.google.com/rss/articles/CBMitAFBVV95cUxPcVhEM1N5Qnk0a09wOXdNdXBMRDQ5ZFZURUJXd0NjQVk3VGFScGFwaDFWTHJTM2k1cU1xeTdMMjBvRjR1Ri14T2R1MHpRTXppMzZ1VzE2RE1naUhKOWluQXBOTGVINlNiaFhMN3F2V0JXSnkyYkN4NEpUODFfa28wWXdjZHE5Zzg4TEdDVHBZMnYzbjBDbUNGdjZneDRpLV9ocmtxWmZ4aGtvUTVTVjk5ZGV2dDA?oc=5,"Thu, 11 Sep 2025 19:48:09 GMT",
2025-09-12T00:00:24,Google News Reuters,US consumer inflation accelerates; weekly jobless claims approach four-year high - Reuters,https://news.google.com/rss/articles/CBMiwgFBVV95cUxOckp0OTBmcFVvaDBjNzFGSUF4TG54MHhackxseXFYSkNhNlFqN1NWQkVGTTFhUUxQdllnVzJoQ3BJRloxZlA0dnFBZTFfZWRiaWZhY3EzMVptXzNMdHh6VklQdGtsQS1jUFM0blY3dENmWEU4RU91eXRaT0g1d0ltemNGWmhmQlg4ekZGelZvUWdfaWl6VlpRLW81R2dZZkttRGpnY2sxMFRhRU1BcTBxekFWcHUxdVJiSXlQWEN2cHhaZw?oc=5,"Thu, 11 Sep 2025 20:56:47 GMT",
2025-09-12T00:00:24,Google News Reuters,Rubio vows US response following conviction of Brazil's Bolsonaro - Reuters,https://news.google.com/rss/articles/CBMisgFBVV95cUxOX01Oakx5am85anhmR0lLNU5CN3kzby1VUjhpZEp2YWdaSnJuRjZiUkpRVUs0YmZVTVo1SlRZXzZYQlh5RHhPU1BKYzZRYVNsUDQ1emMyOHZrMEwwMWszTmc3Z3lTR2djNVM0ZUg3c2x4eTdYbm9jRmZmLUJhLWIzTHZDQVlDbmpldlZObUFSWHhfWVZqRWtMbUt5emdOSWE1czFHTEl6THZjd3pMRXV6aVJR?oc=5,"Thu, 11 Sep 2025 22:06:23 GMT",
2025-09-12T00:00:24,Google News Reuters,"People killed in US boat strike were not Tren de Aragua, Venezuela minister says - Reuters",https://news.google.com/rss/articles/CBMixgFBVV95cUxOUHJEY1AtQmR6cUZzMkxVYngxdV9Oam5lU2lXRGNOcUFVV1FNTDVSQnBTS0N4YnhEOFdtMU5VWXRYR2lvM2MtWVhlOEl2cUR3M1lxcjNoeklpUjZyZWRTRmtRUWJ6c0JORm5ZS19WQnc0MGQzUElqZm9RbW82NlRJRUU1OHZUYjZ0YjluMnNpU01GOXdrOEdCZVMtbjdud2kxNVdwaWdMMnBadlloTS1WbGZKeDB6ZVNtMndvejItQS1fUmtMSHc?oc=5,"Thu, 11 Sep 2025 20:25:39 GMT",
2025-09-12T00:00:24,Google News Reuters,"Charlie Kirk killing: Rumors, misinformation rampant on social media - Reuters",https://news.google.com/rss/articles/CBMitAFBVV95cUxOcl9DQk83Mm5ybW1iVU9acUxxVGV6Q2huV0VYa3puQ0UtdkE0YXVubmxmaFJCanhRek1QVVdteTk2TTlOYzJQMHZZci01Y05VNC1kSUIwUVI5aUlQckY0NUwweHFtdm1vUXFpQWtfekYwU1hJbG9JWGZFRExkUnJwcWRmQVNybDR5b3NISjRSX0lneGNjS1YtbGlKcHlMVnpkQWxFc0dzN1BLLWxIWkFLWk5Td2Q?oc=5,"Thu, 11 Sep 2025 20:03:06 GMT",
2025-09-12T00:00:24,Google News Reuters,Man Utd left scrambling after boots vanish before Women's Champions League game - Reuters,https://news.google.com/rss/articles/CBMixwFBVV95cUxNMk03YXFjRFoxUkk1bTEwSkdEMDZwN1JMZ0NxY0MycnkwOURUV0VQSkUwTUJEbW1RZVlNbUtWNWhILVViMkFUSDczT1RjTGV4NFhtdlRXeG0wVmJ6OS13bV9DZmYtLXhNN0NCR1lwQmE0U1UwOGF0Vkg4STBqMTZ5ODAxREdQbTZielp1aHRRaDNHWkg4RXdHekJDN0xyZ0hTSS1HN2lOZ2Z0MkdoOUdJeW5mMXFRdTMybnY3VmViTnUtNmhGVWJZ?oc=5,"Thu, 11 Sep 2025 17:58:48 GMT",
2025-09-12T00:00:24,Google News Reuters,"Oil prices slide 2% on oversupply, weaker US demand - Reuters",https://news.google.com/rss/articles/CBMinwFBVV95cUxOZF9PZ1VuNTJDWTlWenZ1ZmtJZTgtNFhoQzk1d0xUWEJYZEpwNXdVZVEzRTZSdnJ0aUZyUEZpcFBacVh4U3ZvaVBfZlg3T21IdXgwY2poSXlPWmpTMUlMa1oxWXVqcmxpTUxXdlZqTmZ4UU9heml2MTRJZVNPYlJfZEFpclVQamNGZC0tZzBTS0ZLbTNtUUUtTkt0QnNWeVk?oc=5,"Thu, 11 Sep 2025 16:27:59 GMT",
2025-09-12T00:00:24,Google News Reuters,"U.S. authorities find rifle, release photos in hunt for killer of Charlie Kirk - Reuters",https://news.google.com/rss/articles/CBMirwFBVV95cUxQdXJfcGFxMmtRUE5CVFpQUXB0SWlhZFRoQXdnRUFHSkVTbEN0X2V4LThNajFHdVduTFU1NFRJVFZOX29rMDZpX29Lck9xMGVjbE1nOE41S3ZJYTM2VWNmNGV5Nm5HS0xhaGh6QWFkUmhpdktYSWZBd0szanMzTEpYMnMzVF9TNzlrZGpjY09WMjItYzRrQnhvYUVnMTVCeHl5ODNPXzQwVmFlUEhqcnpz?oc=5,"Thu, 11 Sep 2025 20:59:04 GMT",
