timestamp,source,title,link,published,content
2025-09-04T00:00:07,MarketWatch Top,I’m 70 and have $2.6 million for retirement. Is 80% in equities too risky?,https://www.marketwatch.com/story/we-own-our-home-im-70-and-have-2-6-million-for-retirement-is-80-in-equities-too-risky-85b895d4?mod=mw_rss_topstories,"Wed, 03 Sep 2025 23:00:00 GMT",
2025-09-04T00:00:07,MarketWatch Top,American Eagle says Sydney Sweeney ad campaign ‘is not going anywhere’ after uptick in demand,https://www.marketwatch.com/story/american-eagle-says-sydney-sweeney-and-travis-kelce-campaigns-helping-fall-demand-as-shares-skyrocket-26e2c9d7?mod=mw_rss_topstories,"Wed, 03 Sep 2025 22:58:00 GMT",
2025-09-04T00:00:07,MarketWatch Top,"Figma’s revenue jumps 41%, but that’s not enough to lift the stock",https://www.marketwatch.com/story/figmas-revenue-jumps-41-but-thats-not-enough-to-lift-the-stock-cace7a67?mod=mw_rss_topstories,"Wed, 03 Sep 2025 22:54:00 GMT",
2025-09-04T00:00:07,MarketWatch Top,Bitcoin firm backed by Trump brothers jumps 110% in debut before pulling back. Is it a buy?,https://www.marketwatch.com/story/bitcoin-firm-backed-by-trump-brothers-jumps-110-on-debut-before-pulling-back-is-it-a-buy-43280a21?mod=mw_rss_topstories,"Wed, 03 Sep 2025 22:35:00 GMT",
2025-09-04T00:00:07,MarketWatch Top,‘Her kids will have no inheritance’: Will my friend lose her house to Medicaid if she goes into a nursing home?,https://www.marketwatch.com/story/her-kids-will-have-no-inheritance-will-my-friend-lose-her-house-to-medicaid-if-she-goes-into-a-nursing-home-e65e2ce4?mod=mw_rss_topstories,"Wed, 03 Sep 2025 22:30:00 GMT",
2025-09-04T00:00:07,MarketWatch Top,Salesforce posts an earnings beat — but stock drop shows investors are still wary of AI adoption,https://www.marketwatch.com/story/salesforce-posts-an-earnings-beat-but-stock-drop-shows-investors-are-still-wary-of-ai-adoption-aebe8f28?mod=mw_rss_topstories,"Wed, 03 Sep 2025 22:22:00 GMT",
2025-09-04T00:00:07,MarketWatch Top,"Here’s what’s worth streaming in September 2025 on Netflix, Hulu, HBO Max and more",https://www.marketwatch.com/story/heres-whats-worth-streaming-in-september-2025-on-netflix-hulu-hbo-max-and-more-b2d86a1f?mod=mw_rss_topstories,"Wed, 03 Sep 2025 21:52:00 GMT",
2025-09-04T00:00:07,MarketWatch Top,Rising prices upset shoppers. Do retailers dare tell the truth about who’s to blame?,https://www.marketwatch.com/story/tariff-triggered-price-hikes-upset-consumers-but-who-gets-the-blame-2dc8d454?mod=mw_rss_topstories,"Wed, 03 Sep 2025 21:16:00 GMT",
2025-09-04T00:00:07,MarketWatch Top,"After my father died, my stepsister transferred assets into her name. Do I have any legal recourse?",https://www.marketwatch.com/story/after-my-father-died-my-stepsister-transferred-assets-into-her-name-do-i-have-any-legal-recourse-9d7bb6ff?mod=mw_rss_topstories,"Wed, 03 Sep 2025 21:15:00 GMT",
2025-09-04T00:00:07,MarketWatch Top,"Fed officials struggle to explain slowing economy, adding to the sense a rate cut is coming",https://www.marketwatch.com/story/fed-officials-struggle-to-explain-slowing-economy-adding-to-the-sense-a-rate-cut-is-coming-fa9896ef?mod=mw_rss_topstories,"Wed, 03 Sep 2025 21:04:00 GMT",
2025-09-04T00:00:08,CNBC Top News,Figma's stock plunges after company's first earnings report since IPO,https://www.cnbc.com/2025/09/03/figma-fig-q2-earnings-report-2025.html,"Wed, 03 Sep 2025 22:35:13 GMT",
2025-09-04T00:00:08,CNBC Top News,Salesforce issues weak revenue guidance even as earnings beat estimates,https://www.cnbc.com/2025/09/03/salesforce-crm-q2-earnings-report-2026.html,"Wed, 03 Sep 2025 23:50:43 GMT",
2025-09-04T00:00:08,CNBC Top News,Judge voids $2.2 billion Harvard funding freeze by Trump administration,https://www.cnbc.com/2025/09/03/trump-harvard-funding-freeze-court.html,"Wed, 03 Sep 2025 22:00:43 GMT",
2025-09-04T00:00:08,CNBC Top News,Apple has survived Trump's tariffs so far. It might raise iPhone prices anyway,https://www.cnbc.com/2025/09/03/apple-might-raise-iphone-prices-despite-its-handling-of-tariffs-so-far.html,"Wed, 03 Sep 2025 17:19:33 GMT",
2025-09-04T00:00:08,CNBC Top News,Congress races to avoid government shutdown as partisan standoff deepens,https://www.cnbc.com/2025/09/03/congress-trump-partisan-standoff-government-funding-.html,"Wed, 03 Sep 2025 21:40:32 GMT",
2025-09-04T00:00:08,CNBC Top News,"C3 AI reports declining revenue, announces new CEO to replace Siebel",https://www.cnbc.com/2025/09/03/c3-ai-earnings-ceo-siebel.html,"Wed, 03 Sep 2025 20:55:05 GMT",
2025-09-04T00:00:08,CNBC Top News,Ban on congressional stock ownership gains momentum with new bill,https://www.cnbc.com/2025/09/03/ban-on-congressional-stock-ownership-gains-momentum-with-new-bill.html,"Wed, 03 Sep 2025 21:02:22 GMT",
2025-09-04T00:00:08,CNBC Top News,Job openings data falls to levels rarely seen since pandemic,https://www.cnbc.com/2025/09/03/job-opening-data-falls-to-levels-rarely-seen-since-pandemic.html,"Wed, 03 Sep 2025 20:12:09 GMT",
2025-09-04T00:00:08,CNBC Top News,"American Eagle stock soars 20% as retailer says Sydney Sweeney campaign is 'best' to date, beats earnings",https://www.cnbc.com/2025/09/03/american-eagle-outfitters-aeo-earnings-q2-2025.html,"Wed, 03 Sep 2025 20:19:18 GMT",
2025-09-04T00:00:08,CNBC Top News,Gold is at an all-time high—here's what a Costco bar bought a year ago is worth now,https://www.cnbc.com/2025/09/03/gold-hits-record-high-what-costco-bar-bought-last-year-is-worth.html,"Wed, 03 Sep 2025 20:09:20 GMT",
2025-09-04T00:00:08,CNBC Top News,"68 jobs may qualify for Trump’s $25,000 ‘no tax on tips’ deduction",https://www.cnbc.com/2025/09/03/treasury-trump-no-tax-on-tips-jobs.html,"Wed, 03 Sep 2025 19:39:39 GMT",
2025-09-04T00:00:08,CNBC Top News,Salesforce CEO calls guidance 'appropriately conservative' as stock declines after earnings,https://www.cnbc.com/2025/09/03/salesforce-ceo-calls-guidance-appropriately-conservative-as-stock-declines-after-earnings.html,"Wed, 03 Sep 2025 22:53:21 GMT",
2025-09-04T00:00:08,CNBC Top News,Salesforce's soft guidance gives the skeptics more fuel. Here's why we are hanging on,https://www.cnbc.com/2025/09/03/salesforces-soft-guidance-gives-the-skeptics-more-fuel-heres-why-we-are-hanging-on.html,"Wed, 03 Sep 2025 23:29:04 GMT",
2025-09-04T00:00:08,CNBC Top News,GOP senators not in rush to consider Lisa Cook replacement on Fed until case resolved,https://www.cnbc.com/2025/09/03/lisa-cook-fed-senate-republicans.html,"Wed, 03 Sep 2025 20:36:15 GMT",
2025-09-04T00:00:08,CNBC Top News,OpenAI boosts size of secondary share sale to $10.3 billion,https://www.cnbc.com/2025/09/03/openai-boosts-size-of-secondary-share-sale-to-10point3-billion.html,"Wed, 03 Sep 2025 21:00:33 GMT",
2025-09-04T00:00:08,CNBC Top News,Sen. Rand Paul blasts Trump's stake in Intel as 'a step towards socialism',https://www.cnbc.com/2025/09/03/sen-rand-paul-calls-trump-stake-in-intel-a-step-towards-socialism.html,"Wed, 03 Sep 2025 18:58:16 GMT",
2025-09-04T00:00:08,CNBC Top News,"Stephen Miran, Trump's Fed governor nominee, pledges central bank independence",https://www.cnbc.com/2025/09/03/stephen-miran-trumps-fed-governor-nominee-pledges-central-bank-independence.html,"Wed, 03 Sep 2025 18:12:32 GMT",
2025-09-04T00:00:08,CNBC Top News,"Polymarket set for U.S. launch after getting green light from CFTC, CEO says",https://www.cnbc.com/2025/09/03/polymarket-set-for-us-launch-after-getting-green-light-from-cftc-ceo-says.html,"Wed, 03 Sep 2025 18:55:34 GMT",
2025-09-04T00:00:08,CNBC Top News,"How are Gen Zs affording luxury trips? For some, it’s all a facade",https://www.cnbc.com/2025/09/03/how-are-gen-zs-affording-luxury-trips-for-some-its-all-a-facade.html,"Wed, 03 Sep 2025 23:53:31 GMT",
2025-09-04T00:00:08,CNBC Top News,"Florida to become first state to end all vaccine mandates, including in schools",https://www.cnbc.com/2025/09/03/florida-to-end-all-vaccine-mandates-first-state-in-the-us-to-do-so.html,"Wed, 03 Sep 2025 19:21:57 GMT",
2025-09-04T00:00:08,CNBC Top News,Newsmax sues Fox News for allegedly abusing monopoly power,https://www.cnbc.com/2025/09/03/fox-news-newsmax-antitrust-lawsuit.html,"Wed, 03 Sep 2025 19:44:26 GMT",
2025-09-04T00:00:08,CNBC Top News,Trump calls Epstein files a distraction from his success as victims call for their release,https://www.cnbc.com/2025/09/03/trump-epstein-files-victims-maxwell.html,"Wed, 03 Sep 2025 16:25:02 GMT",
2025-09-04T00:00:08,CNBC Top News,"NBC touts record NFL season ad revenue, sells out of Super Bowl LX spots",https://www.cnbc.com/2025/09/03/nbc-record-nfl-season-ad-revenue-super-bowl-lx-spots.html,"Wed, 03 Sep 2025 17:00:12 GMT",
2025-09-04T00:00:08,CNBC Top News,Healthy Returns: Novo Nordisk’s head of research and development previews the first-ever obesity pill,https://www.cnbc.com/2025/09/03/healthy-returns-novo-nordisks-martin-holst-lange-previews-obesity-pill.html,"Wed, 03 Sep 2025 19:35:28 GMT",
2025-09-04T00:00:08,CNBC Top News,Disney to pay $10 million to settle FTC complaint over collection of children's personal data on YouTube,https://www.cnbc.com/2025/09/03/disney-ftc-youtube-childrens-data.html,"Wed, 03 Sep 2025 15:53:43 GMT",
2025-09-04T00:00:08,CNBC Top News,"Student loan borrowers pausing payments have doubled since 2024, expert calculates",https://www.cnbc.com/2025/09/03/student-loan-borrowers-forbearances-deferments.html,"Wed, 03 Sep 2025 17:13:04 GMT",
2025-09-04T00:00:08,CNBC Top News,"Waller, in the running for chair, says Fed should start cutting this month and can adjust pace",https://www.cnbc.com/2025/09/03/waller-in-the-running-for-chair-says-fed-should-cut-in-september.html,"Wed, 03 Sep 2025 16:34:47 GMT",
2025-09-04T00:00:08,CNBC Top News,Trump appeals ruling that National Guard deployment to LA broke the law,https://www.cnbc.com/2025/09/03/trump-appeals-california-national-guard-deployment.html,"Wed, 03 Sep 2025 16:17:58 GMT",
2025-09-04T00:00:08,CNBC Top News,"Starbucks takes another step in turnaround, and our wish list for Salesforce earnings",https://www.cnbc.com/2025/09/03/starbucks-next-turnaround-step-plus-wish-list-for-salesforce-earnings.html,"Wed, 03 Sep 2025 19:06:55 GMT",
2025-09-04T00:00:08,CNBC Top News,"Macy's shares jump 20% as retailer tops earnings estimates, raises outlook",https://www.cnbc.com/2025/09/03/macys-q2-earnings-2025.html,"Wed, 03 Sep 2025 20:14:04 GMT",
2025-09-04T00:00:08,Investing.com All News,"Indie semiconductor COO Wittmann sells $254,718 in stock",https://uk.investing.com/news/insider-trading-news/indie-semiconductor-coo-wittmann-sells-254718-in-stock-93CH-4248957,2025-09-03 23:52:06,
2025-09-04T00:00:08,Investing.com All News,Reddit CEO huffman sells $4m in shares,https://uk.investing.com/news/insider-trading-news/reddit-ceo-huffman-sells-4m-in-shares-93CH-4248956,2025-09-03 23:50:06,
2025-09-04T00:00:08,Investing.com All News,Selective at KBW Insurance Conference: Navigating Growth and Challenges,https://uk.investing.com/news/transcripts/selective-at-kbw-insurance-conference-navigating-growth-and-challenges-93CH-4248955,2025-09-03 23:48:07,
2025-09-04T00:00:08,Investing.com All News,"Alpern, Arteris VP, sells $2.3k in AIP stock",https://uk.investing.com/news/insider-trading-news/alpern-arteris-vp-sells-23k-in-aip-stock-93CH-4248954,2025-09-03 23:48:06,
2025-09-04T00:00:08,Investing.com All News,MannKind at Wells Fargo Conference: Strategic Diversification Unveiled,https://uk.investing.com/news/transcripts/mannkind-at-wells-fargo-conference-strategic-diversification-unveiled-93CH-4248953,2025-09-03 23:46:07,
2025-09-04T00:00:08,Investing.com All News,"Hawkins, Arteris CFO, sells $3.9k in AIP stock",https://uk.investing.com/news/insider-trading-news/hawkins-arteris-cfo-sells-39k-in-aip-stock-93CH-4248952,2025-09-03 23:46:06,
2025-09-04T00:00:08,Investing.com All News,Magnite at Bank of America Conference: Strategic Growth and Challenges,https://uk.investing.com/news/transcripts/magnite-at-bank-of-america-conference-strategic-growth-and-challenges-93CH-4248951,2025-09-03 23:44:06,
2025-09-04T00:00:08,Investing.com All News,Arteris CEO Janac sells $11k in shares,https://uk.investing.com/news/insider-trading-news/arteris-ceo-janac-sells-11k-in-shares-93CH-4248950,2025-09-03 23:44:06,
2025-09-04T00:00:08,Investing.com All News,Nomad Foods at Barclays Conference: Strategic Adjustments Amid Challenges,https://uk.investing.com/news/transcripts/nomad-foods-at-barclays-conference-strategic-adjustments-amid-challenges-93CH-4248949,2025-09-03 23:42:07,
2025-09-04T00:00:08,Investing.com All News,"EverCommerce CEO Remer sells shares worth $274,828",https://uk.investing.com/news/insider-trading-news/evercommerce-ceo-remer-sells-shares-worth-274828-93CH-4248948,2025-09-03 23:42:06,
2025-09-04T00:00:08,Investing.com Bond News,Treasury’s Firebreak or Fuel? The Bond Market’s Hidden Inferno,https://uk.investing.com/analysis/treasurys-firebreak-or-fuel-the-bond-markets-hidden-inferno-200618475,"Sep 03, 2025 05:37 GMT",
2025-09-04T00:00:08,Investing.com Bond News,Rates Spark: Dealing with Eurozone Disinflation,https://uk.investing.com/analysis/rates-spark-dealing-with-eurozone-disinflation-200618453,"Sep 02, 2025 07:18 GMT",
2025-09-04T00:00:08,Investing.com Bond News,Rates Spark: No Brain Steepeners Exposed to Reversals,https://uk.investing.com/analysis/rates-spark-no-brain-steepeners-exposed-to-reversals-200618401,"Aug 29, 2025 09:26 GMT",
2025-09-04T00:00:08,Investing.com Bond News,Bond Market Flashes Fiscal Dominance Warning as Yields Diverge,https://uk.investing.com/analysis/bond-market-flashes-fiscal-dominance-warning-as-yields-diverge-200618384,"Aug 28, 2025 16:37 GMT",
2025-09-04T00:00:08,Investing.com Bond News,Rates Spark: The Lisa Cook Affair and the Curve,https://uk.investing.com/analysis/rates-spark-the-lisa-cook-affair-and-the-curve-200618367,"Aug 28, 2025 07:03 GMT",
2025-09-04T00:00:08,Investing.com Bond News,Eurozone Bond Spreads Face a Jittery Autumn,https://uk.investing.com/analysis/eurozone-bond-spreads-face-a-jittery-autumn-200618345,"Aug 27, 2025 11:42 GMT",
2025-09-04T00:00:08,Investing.com Bond News,Credit Spreads at 25-Year Lows Highlight Investors’ Volatility Blind Spot,https://uk.investing.com/analysis/credit-spreads-at-25year-lows-highlight-investors-volatility-blind-spot-200618336,"Aug 26, 2025 13:28 GMT",
2025-09-04T00:00:08,Investing.com Bond News,Rates Spark: The Bottoming Out of the 2-Year Bund,https://uk.investing.com/analysis/rates-spark-the-bottoming-out-of-the-2year-bund-200618326,"Aug 26, 2025 08:18 GMT",
2025-09-04T00:00:08,Investing.com Bond News,Even the Worst Foreign Bonds Are Beating US Treasuries Thanks to a Weak Dollar,https://uk.investing.com/analysis/even-the-worst-foreign-bonds-are-beating-us-treasuries-thanks-to-a-weak-dollar-200618307,"Aug 25, 2025 12:28 GMT",
2025-09-04T00:00:08,Investing.com Bond News,Treasury Yields Slip Ahead of Jackson Hole,https://uk.investing.com/analysis/treasury-yields-slip-ahead-of-jackson-hole-200618276,"Aug 22, 2025 06:50 GMT",
2025-09-04T00:00:08,Google News Reuters,"Trump administration unlawfully cut Harvard's funding, US judge rules - Reuters",https://news.google.com/rss/articles/CBMisgFBVV95cUxPUE1tcDBtcUwxRlZFU21fLTl4VnBQSWlqYXdmTk54VTJEMEJiUzB0VWV1UE43T0ltZlg3N0RYRGN3R19nTzV5RF9jWk9jNTRCY1BhOFBwX0JOZWFQRWRFTmdLbVJuay1YM0I2MVpEd2tydk82bkV0eVE3Mk0zTHRIemZTYVJXc0x0aEJkWmFpdU5tckNZY0lheDVGRmlHUXFVWFlXUmV4UmhMRG5WVHduUTVB?oc=5,"Wed, 03 Sep 2025 22:41:29 GMT",
2025-09-04T00:00:08,Google News Reuters,At least 15 killed in crash on Lisbon's historic cable car railway - Reuters,https://news.google.com/rss/articles/CBMiqAFBVV95cUxPVkJINWhodjJ5VUluUk8wY1IzWlc0SWZmLW5LZVdLNFlqVE8zY0FzWTJyUENVZnlEaHJEMzh1NjdaT1JKTzFwMnhzSEpzTmRwcEp4U1NYS09Sak92aXMwTzlxdmg1QnU1M0YtZ0FxbUttSExhZy13TVBXdEJmWWFkem5mNHJpOUN4bXZya1gyTXo0b1h0OHAyUm9RQV9HdXpjY202WnV1Rks?oc=5,"Wed, 03 Sep 2025 23:00:11 GMT",
2025-09-04T00:00:08,Google News Reuters,"Mexico emphasizes sovereignty, good ties during Rubio visit - Reuters",https://news.google.com/rss/articles/CBMirgFBVV95cUxQcTRYNmcwaVVWLXluaTF0OThOQk9jUE9Eald3ZS1PRGozNWNyTEdIMmU3dGdKUlQ3dkg3d2VsbEYtRUhQSzBGQTFjRUJlQkdtMFlmalBhS1g4dklmdUt0V1ZHZ0M3cXBXVHVhNDB3Mk52YUJ2ekVfc005M3hNR3JKV0lBdS1weEhQcV9jdmRibGsxMWliWm56RXZQU3F3SVpoWnkyUlFwNHVkSjhSR0E?oc=5,"Wed, 03 Sep 2025 20:44:57 GMT",
2025-09-04T00:00:08,Google News Reuters,Trump administration says more operations against cartels coming - Reuters,https://news.google.com/rss/articles/CBMirgFBVV95cUxQWGl4X0NSQ2ZVcTlhR3ZSMy1saVk1SHZaUkZ6VV8zc3NDa3JHMkFYNGt5Y1J3bm93WThUSVh3R1JtREJ0eXJnLUVKS2FuS085RnRpOGRfUndEV3E0Mml1ZUFYSjhPdWw0SjhlNVd6VmV3bGdoQlc2ZUlVdWl3bGM1Vk1Bc3NPME90VFlmUmZsaHh5Z1Y5Nmk4RzhvSkhDeHZtMTRNenNBZHhvNUEyX2c?oc=5,"Wed, 03 Sep 2025 22:39:25 GMT",
2025-09-04T00:00:08,Google News Reuters,Trump says China should have mentioned US during 'beautiful ceremony' - Reuters,https://news.google.com/rss/articles/CBMitgFBVV95cUxPTC1yRE00ZWJOY0xHaWpEaHRieVpQYjNkYkUxbnZDaU81YlFpc05Fd3dZdHY0b2xvQVdrM1RlTHJyYWhrVFlHVzRPYmhZdTZpZEJHaW4yMmlKN3ZyRHVDQmFsN2tYNFpIakdEQm9fcTFjUHhEdFhjMG5ZREEzZGNHOWVDYTlEWWZLUmdicHJjclpWa0tlMkVvcEl3eFZwZmoydk1iTFQzckxtRnVDWFJ3Vy1UTVpLQQ?oc=5,"Wed, 03 Sep 2025 20:42:42 GMT",
2025-09-04T00:00:08,Google News Reuters,"Stocks rebound but soft US jobs data, global bond selloff keep investors on edge - Reuters",https://news.google.com/rss/articles/CBMie0FVX3lxTE5ER1EzeUVTanROVkwxaXRKVVY2U3haMTFqaFJuaWVBWlZpWGJrT3EyT0ZPTzZaVXJyUlNJd1VFTGliRUVqcGlIdEs4SEdmU29iLWxSWjYzdElZMmdSVzRQV2RtMjlaYXNiaXNqemdsb2pndU5WaGNIVWNuRQ?oc=5,"Wed, 03 Sep 2025 20:59:53 GMT",
2025-09-04T00:00:08,Google News Reuters,Trump signals Poland could get more US troops during Nawrocki White House visit - Reuters,https://news.google.com/rss/articles/CBMixwFBVV95cUxQVWktRi1Pc1JsR1BzVUNqZ3B0UmdiSXM1QTY0Y0ZYZVh1cGR2YVdwYWdTbFFxamVmUHFJamNvcEZpSnJtU0xJRlRscXdKSEJXQ2Q2Wkloa0Q3SkdSa2FiS2RtWXZJNktQNXhld0EwRTAwdGt2djVOTm8zUDRidk0wYkVMZjBzUTBGOXduOWhDTnEyN3M3OTAtMldfMlRTaFhvb05BQ25EU2FSRUdpam5FZ0g1V0JTYVY5TGxYUW1udUdWN3FGYjVr?oc=5,"Wed, 03 Sep 2025 19:46:49 GMT",
2025-09-04T00:00:08,Google News Reuters,"Argentina officials recover missing painting stolen by Nazis, ending 80-year mystery - Reuters",https://news.google.com/rss/articles/CBMivgFBVV95cUxNRG9sQ29rYWl6dkY2RUgwWFJaRjFDOE14cXlyc2tickFEdnhmRlp3ZFBzVDRHSXBKZzAtZXJFYms2cEdIOWJfZkQtRjRtam0xU2pfT2wwQ09mTUlzVldBeDV2TnRfNnhEZzY0MUdNUTZKM29RWjVYcnJqbnFHUXYxZ291cHozV3NzMmxFdDUyU3poOVZCUzE1bkRzUTZFVS1tNGhqdGlyYjJ4NE5BWUctN2tCQ2JENEtMb0Nnb2ZR?oc=5,"Wed, 03 Sep 2025 20:15:53 GMT",
2025-09-04T00:00:08,Google News Reuters,Israeli military intercepts missiles launched by Yemen's Houthis - Reuters,https://news.google.com/rss/articles/CBMiuAFBVV95cUxOUzNrdG90aTFha0NxQ0t6eVdKS1BvQU9fWVJWZ21uVVA1dWJmLTRybDFGSGVjOVpYd0F2c3lkTnVrTFhWcmZ3OFFuVDFzS0M4VG0yVlM4MU54SWJMeWVoQmw1bmZraEpRaDdqcGI5bDV4RzRFWnpiWE9oMGhERmZnXzRkVnBuempxclp2dzNXeGgxcWdDSnlaYjlvSVZtZFoxS3BtV3pQekV6c2toaGplREVVX204bE1j?oc=5,"Wed, 03 Sep 2025 21:43:29 GMT",
2025-09-04T00:00:08,Google News Reuters,"Nasdaq, S&P 500 end higher with Alphabet, Apple, rate-cut hopes; Dow dips - Reuters",https://news.google.com/rss/articles/CBMiswFBVV95cUxNd0I5c05aV1lLX1NxR1h4TVR4YThPRDBuaFVOQ0VWRnd3YkdJZ3hLVWF2OFNHVjZhVi0zNTdGVzlHSE5leGEzeEw3dDhLX3NiOWFQX2dTQVZZX3pMc2hrdnpYTzBQU0pucldnOExhNVZrTVdqdVdjYlpWZ2lXTUxyRFVFZmVsNVhVdUpxUG1RaW5WSkVFQWM5LVhNWVByR2Q1N0c3OVA3V1dkMWdFSGpVWERpZw?oc=5,"Wed, 03 Sep 2025 22:40:35 GMT",
2025-09-04T00:00:08,Google News Reuters,Venezuela's oil exports rise to 9-month high as cargoes return to US - Reuters,https://news.google.com/rss/articles/CBMirwFBVV95cUxNSkV3Q3VVSVFLdi0zdzJELXlhc2lvTmJqVzhSRms3LV9yTVNyOHR3N1kzLUFXejhnVkxIVHRSclRQUTMxMUc4S0lhU3BtdGR4ZFl6V3J1dWtCSUFzZUtpdnlMbm5YZ0F4ZTl3Zm9PNVY1NDdfZjl4MGEtbEFCTDYteGNHbmFiai1LUmVmWS1TOVNRdUpQcXJqTkRfb2RqZnZLQWZxd1Q1RWNmbU00OE00?oc=5,"Wed, 03 Sep 2025 19:59:37 GMT",
2025-09-04T00:00:08,Google News Reuters,Oil settles down as OPEC+ weighs another output hike - Reuters,https://news.google.com/rss/articles/CBMiogFBVV95cUxOblRsTlNfem1pQXFWaDBLYm5oc2JfMWhVM2RTemk0UFZLYmt6TkdmUWtnTHgyU3hZZnpLbkF1cklyWUtVTUZYR3EzYjI2OUhZbVgtVktlMjFvYmV0emx3TE90WG9DdHhjXzc3VkNPUGF3QzUxQTV5ODN3dlFoVE5jNHlfMDBRamN0Sy02V0psaXJ0LWlHZnV3RERNZkxsRlZJUEE?oc=5,"Wed, 03 Sep 2025 18:55:20 GMT",
2025-09-04T00:00:08,Google News Reuters,Dollar falls versus yen and Swiss franc following US jobs data - Reuters,https://news.google.com/rss/articles/CBMiqwFBVV95cUxQdTR1MVpJQ1NYekx3NUxOdVUtR3pKTUVoWVM5a1NHQndZRElyQXNzMWV2dXh2Ql80b09nQXdHaGRKTExKendfbDduSV9FRzJXQ2RMcVNmbFhqRHFIZE1LQzZyd1lLTVhZMnBQZk5PU2twRmpQRHJ3WDVmTzRfZWZxaHh4Qk9zTzRfRF9iWFVtWHBGOTZOdWU0WURNZjI2cVpwOUZBZlRlN2JhMU0?oc=5,"Wed, 03 Sep 2025 20:04:04 GMT",
2025-09-04T00:00:08,Google News Reuters,"Global bond markets stabilize, for now, as fiscal storm looms - Reuters",https://news.google.com/rss/articles/CBMingFBVV95cUxNZ1JRQjdDUUIzMzFwVFppU1BNT09PRzI1Z00xbUN4Ym5SbDZTRlo4Ui13OVR2Zm5jeVJ0YURkWjZPLTNuMHdGY1J2Wm5WYU1DdDRFaUhkNE9LdFdQSUV2cmxOUENvSjFTODBSX3hwSk9lWVMwOVdUTURST1pMRnhtY2ppZFQ0VkF4eXNKcm1ELTBnOXN3UXQ3a0VHTEFyUQ?oc=5,"Wed, 03 Sep 2025 19:31:42 GMT",
2025-09-04T00:00:08,Google News Reuters,"As Trump chills US-India ties, Modi warms to China and Russia - Reuters",https://news.google.com/rss/articles/CBMinwFBVV95cUxNckFWX0hBbG4wUFg4QUJucnZnQ3Fra0NsVEVPbURJXzFCUUNuVmFPNVdOQjhkVUxpdUlrWUtiOVBoMmFVRW42emcwZ3lpcnU1cW1YRFVUM1k3OXVlU2JTU3VBM1NhajZzUjZPb25xRFEwU1BjdExFV2syUXRaMFRmMWRPSnpKejYzVmNNWGd6QnducGpFUDh1dkM3ZGZkOHc?oc=5,"Wed, 03 Sep 2025 19:58:43 GMT",
2025-09-04T00:00:08,Google News Reuters,"Florida plans to end all state vaccine mandates, including for schools - Reuters",https://news.google.com/rss/articles/CBMizwFBVV95cUxOT28yVlp4d2w4YXZ4YjFEMGl6bzhRVjBTUUNLWEtkWnhGa0JURkotQ0pJcV9RdlQtM2laM09UdEhRWnJKd0ZtUlJSNmNsWDlHeUpWVHpuMWF3Sk9sVVRqQWJmd3pNd0RKQW8tQ2NZdUdhZzRmSS0tVWtxMXc5VWZKYkFJeF9fdWRzM2ZCaVRwZzIwY1pGNVlqZVROemYzS3FVMzZESDRNRTl1aU5BYncxWmZsc1BmdWJYOURXRU45ZTlOWEwwMDNmN0JyeC0xOEU?oc=5,"Wed, 03 Sep 2025 19:59:14 GMT",
2025-09-04T00:00:08,Google News Reuters,"Pfizer, Moderna defend COVID vaccine effectiveness after Trump remarks - Reuters",https://news.google.com/rss/articles/CBMi2AFBVV95cUxPUUV3LVNfdnZzWFAyRnd1VkgwN2xZTVBhTHpwRElkR01UZzI5ZFNZeWxQQWVwQmZtTlNfd3g4djc0ekUxYWg1Rl9MRTVQaEVfOWpEVmJXN3Y1eUdWdlJOUzl2YWVINk9ZQ2phQjJBblJPNjN6amxaR1cyUGdoRkVZRUUwb0MtMWRjT1dodTBfRXQxNFk0Q3EzRTNOS1ZYdnh1Wnlic1NOc3lqUFJpNWpYQk5GdTRYaDg4ekoyRmloSnZvVjctcGJFcG5uYVdYZjd4d0tvR0M0cHo?oc=5,"Wed, 03 Sep 2025 19:30:37 GMT",
2025-09-04T00:00:08,Google News Reuters,Indonesia fires officer involved in police killing as protests continue - Reuters,https://news.google.com/rss/articles/CBMiswFBVV95cUxNbV9ONFU3UDlyYTRBY1dIZm1KYUpEWjdITFhQWnlkamtPcWJPcGw3d0hRRHVHSjlZellKTzZFVDkxcGhkVTlXZmVFQlhzZ1huSHNHTmFCLWhwNURnTXVTR2ZacmRjX2FoRzhoaXBtZDBBNldBVTVxOXg4YWtpUHZGOHdEZWJwUV9SMWg0Ql9CUWplUWFRRWdtYlhZdjVpRFB2RjBYYWtkd0FZWTZNZjNmQm1KRQ?oc=5,"Wed, 03 Sep 2025 22:32:30 GMT",
2025-09-04T00:00:08,Google News Reuters,"Trump says US might have to unwind trade deals with EU, others if it loses tariff case - Reuters",https://news.google.com/rss/articles/CBMizAFBVV95cUxPQW9OUm9jTmpMZUV3SUhWVFA2dm5vWUNJVmx1R2NUWTJ2bUNYclAxcGdCOTFjNzR3Vnp4NEFWVExSaXBBdDN6djltOGxqc1lvb25GQWJMOGVhdFlfU2pfc1VDMzJ0dkNUcmhJMlVUYXRzaDhFU1psV0MxRHFNZXV6Njg5MFB2MkdOV1VHZ25RMmlPTFFfUzB6MlJkU1owUHloMWhUOUJoelhzZDRGYU04elZCMnFGZUdfa2E0d0hUbzlxQUl6Z1FGdElnZFA?oc=5,"Wed, 03 Sep 2025 16:58:17 GMT",
2025-09-04T00:00:08,Google News Reuters,"Classified intelligence meeting blocked after far-right activist criticism, US Democrat says - Reuters",https://news.google.com/rss/articles/CBMiygFBVV95cUxQNDZvUXN5eVRwRldRSXFvNWd2NjhVQVlscWRWa3VJblRGMHdxTXViU3FOWTFSQkx1bTBHYjBQRnVoSnE4VmFHUUw4TnVCZDhDQkRDRTJIdkNTRkRtM2hzVDlESHFhSVZ1N1JMNS1YNGRwTk0tSWVfaFBIeWxlOE5UUjhDT2x3Mm9KWk9PbHpGel90TTN6OW80ai1ET0l0a1Zzcm01RVNmNEtIdEhxaHlSX2p5bGcwU05tWHJxMnRLVEt3Ty0zN19pTVF3?oc=5,"Wed, 03 Sep 2025 23:22:18 GMT",
2025-09-04T00:00:08,Google News Reuters,"Nestle CEO axed after probe into complaints of favouritism, CFO says - Reuters",https://news.google.com/rss/articles/CBMi1wFBVV95cUxNSDRQUTBsQ0VyandRVWl0WGdEZ0hYaVJhblVuUWsyNVpkcDMtTVJNUGxpY3BLLWk2YXh1MW1yQjJDUWwwbVVfUUZVZDZIZGRqNEpVRW1pNzY1RXhyaHFFalhOdEU0RUdSaWxFdHFpNE5PNlFBVUFHbTBrbC1LQ3hKbVkwNWY2bEw2QXlwcE4yU2U3TjR3MVBidFdmX0FHMDY3UVFmTENFTFQ4WU1reER4T3U5b3R0cGloTGgwbkI1YnhJTXh6SjVhZEN3RnJzQnpuVGk4TzU0WQ?oc=5,"Wed, 03 Sep 2025 17:19:28 GMT",
2025-09-04T00:00:08,Google News Reuters,Epstein victims urge US Congress to pass bill requiring release of documents - Reuters,https://news.google.com/rss/articles/CBMiwAFBVV95cUxOemF2ZmNseW5oVmZrVXdEZnNGeWpzejdsbkJVTG1KV2ZRU1BWSEJZc2psdXlVTVpQNXhid1ZGbWVTX3JoZUZ0LXJraEJEYkY5YV9ya09GNlNZTk9DRGgxRWhwWFRzREZnN2xYVi1NTk5KeUxrMGdWRXZRYmhRR0tSRHlGbW1qSDA4c2NEY3pUZDZjRkRDNlI2OXNVM0c1LWEzekFkbzFObVpRZExoUHBEOHFFdXNFSHhEYUk4dXVfSUw?oc=5,"Wed, 03 Sep 2025 19:03:46 GMT",
2025-09-04T00:00:08,Google News Reuters,'Ketamine Queen' pleads guilty in 'Friends' star Matthew Perry's drug death - Reuters,https://news.google.com/rss/articles/CBMivAFBVV95cUxPRDhYb3lMNGlLbjRhellVTWhtb0JTNjRMSWJScndOZnZsc042c0VmcThfY1lkN0JOMV9IN2VhMFNiV29NanhQU3VWd0hESVM2WWJwc2xQeFJMaVlwX2hFN281bHdMdzdtZHQxaVdMSHo4azlZVHRMOEFBbWNPTnF3TmstX2puRnhZN3VRZk1mOVc2V1hjTWlRWVdtSFRralp3ZDBrLVQtczhqZGYwMHhMZy1WSnZEU3VfYUp3OQ?oc=5,"Wed, 03 Sep 2025 18:32:16 GMT",
2025-09-04T00:00:08,Google News Reuters,Global drugmakers rush to boost US presence as tariff threat looms - Reuters,https://news.google.com/rss/articles/CBMizAFBVV95cUxOZVZ6Y0p1OWd0N09yUG05TnRwblJDdDZ6dUlmOHQ3VUlsXzVXOFJtelZEbE1aVVQzNVlEM0tyV3R0Z1hMTmthdjgyNHpJMUVNM2EzNW9tZHlWR01LR2hwWGctaXNGTkdRdlVwZ0QxcEJ2UENwUVlJRmlLWEh4UEtuVGdITkMybDVCV0laSDNYbC16cjQ0NEZLczBxTDY0Ty05cWpNaVdHaG5NZmNScDkzcGJsbm1HX2pXRlN4RmtteWpQMXdVZFZiR3ZkTXI?oc=5,"Wed, 03 Sep 2025 21:21:30 GMT",
