timestamp,source,title,link,published,content
2025-08-14T01:28:14,MarketWatch Top,"Bitcoin extends rally, hits record high above $124,000",https://www.marketwatch.com/story/bitcoin-extends-rally-hits-record-high-above-124-000-677302d9?mod=mw_rss_topstories,"Thu, 14 Aug 2025 01:08:00 GMT",
2025-08-14T01:28:14,MarketWatch Top,‘Absolutely no one pays attention’: I could steal from my children’s trust fund without them having a clue,https://www.marketwatch.com/story/absolutely-no-one-pays-attention-i-could-steal-from-my-childrens-trust-fund-without-them-having-a-clue-06eb6526?mod=mw_rss_topstories,"Wed, 13 Aug 2025 23:47:00 GMT",
2025-08-14T01:28:14,MarketWatch Top,My father was worth millions. I suspect my mother is stealing my inheritance. What can I do?,https://www.marketwatch.com/story/she-kicked-us-to-the-curb-my-father-was-worth-millions-i-suspect-my-mother-is-stealing-my-inheritance-what-can-i-do-69625204?mod=mw_rss_topstories,"Wed, 13 Aug 2025 23:21:00 GMT",
2025-08-14T01:28:14,MarketWatch Top,‘I’m confused!’ Why does President Trump want a rate cut so badly?,https://www.marketwatch.com/story/im-confused-why-does-president-trump-want-a-rate-cut-so-badly-whats-wall-streets-view-ce9a72f9?mod=mw_rss_topstories,"Wed, 13 Aug 2025 22:57:00 GMT",
2025-08-14T01:28:14,MarketWatch Top,"‘I am a senior citizen’: My car needs $3,500 for repairs, but only has a trade-in value of $6,000. Do I bother fixing it?",https://www.marketwatch.com/story/i-am-retired-and-not-wealthy-my-car-needs-3-500-for-repairs-but-only-has-a-trade-in-value-of-6-000-do-i-bother-fixing-it-e81d225e?mod=mw_rss_topstories,"Wed, 13 Aug 2025 22:26:00 GMT",
2025-08-14T01:28:14,MarketWatch Top,"Cisco’s growing AI demand sparks earnings beat, but the stock is falling",https://www.marketwatch.com/story/ciscos-growing-ai-demand-sparks-earnings-beat-but-the-stock-is-falling-3f2f9558?mod=mw_rss_topstories,"Wed, 13 Aug 2025 22:13:00 GMT",
2025-08-14T01:28:14,MarketWatch Top,Why Amazon’s ‘major’ grocery expansion is bad news for delivery apps and retailers,https://www.marketwatch.com/story/why-amazons-major-grocery-expansion-is-bad-news-for-delivery-apps-and-retailers-e3d9076a?mod=mw_rss_topstories,"Wed, 13 Aug 2025 22:08:00 GMT",
2025-08-14T01:28:14,MarketWatch Top,"What’s driving ether’s ‘catch-up trade,’ as it nears record high after bitcoin’s streak of peaks",https://www.marketwatch.com/story/whats-driving-ethers-catch-up-trade-as-it-nears-record-high-after-bitcoins-streak-of-peaks-4aa6c21d?mod=mw_rss_topstories,"Wed, 13 Aug 2025 21:55:00 GMT",
2025-08-14T01:28:14,MarketWatch Top,"I’m a senior who barely survives on $1,300 a month. No way could I live on $1,000.",https://www.marketwatch.com/story/im-a-senior-who-barely-survives-on-1-300-a-month-no-way-could-i-live-on-1-000-dfe42c83?mod=mw_rss_topstories,"Wed, 13 Aug 2025 21:51:00 GMT",
2025-08-14T01:28:14,MarketWatch Top,Paramount Skydance shares prompt meme-stock comparisons with record rally,https://www.marketwatch.com/story/paramount-skydance-shares-prompt-meme-stock-comparisons-with-sharp-rally-82dce4b8?mod=mw_rss_topstories,"Wed, 13 Aug 2025 21:11:00 GMT",
2025-08-14T01:28:15,CNBC Top News,"Cisco reports narrow earnings beat, issues inline forecast for the year",https://www.cnbc.com/2025/08/13/cisco-csco-q4-earnings-report-2025.html,"Thu, 14 Aug 2025 01:09:10 GMT",
2025-08-14T01:28:15,CNBC Top News,Google faces loss of Chrome as Perplexity bid adds drama to looming breakup decision,https://www.cnbc.com/2025/08/13/google-antitrust-chrome-perplexity-ai-youtube.html,"Wed, 13 Aug 2025 22:37:15 GMT",
2025-08-14T01:28:15,CNBC Top News,CoreWeave tanks 20% after posting wider-than-expected loss ahead of lock-up expiration,https://www.cnbc.com/2025/08/13/coreweave-stock-loss-lockup.html,"Wed, 13 Aug 2025 20:12:24 GMT",
2025-08-14T01:28:15,CNBC Top News,"Trump considering 11 candidates for Fed chair, including David Zervos and Rick Rieder, sources say",https://www.cnbc.com/2025/08/13/trump-considering-11-candidates-for-fed-chair-including-david-zervos-and-rick-rieder-sources-say.html,"Wed, 13 Aug 2025 16:27:34 GMT",
2025-08-14T01:28:15,CNBC Top News,"As Trump berates Goldman, other economists agree that higher tariff inflation is coming",https://www.cnbc.com/2025/08/13/as-trump-berates-goldman-other-economists-agree-that-higher-tariff-inflation-is-coming.html,"Wed, 13 Aug 2025 20:05:20 GMT",
2025-08-14T01:28:15,CNBC Top News,Many business travelers are quietly taking their families along on trips,https://www.cnbc.com/2025/08/14/most-business-travelers-are-taking-families-along-on-trips.html,"Wed, 13 Aug 2025 23:40:08 GMT",
2025-08-14T01:28:15,CNBC Top News,"Elon Musk's xAI loses co-founder Igor Babuschkin, who's leaving to start venture firm",https://www.cnbc.com/2025/08/13/elon-musks-xai-loses-co-founder-igor-babuschkin-for-venture-firm.html,"Wed, 13 Aug 2025 23:12:16 GMT",
2025-08-14T01:28:15,CNBC Top News,Trump's budget bill made 529 college savings plans even more powerful—here's what it means for your money,https://www.cnbc.com/2025/08/13/trumps-budget-bill-made-529-college-savings-plans-more-powerful-heres-what-it-means-for-your-money.html,"Wed, 13 Aug 2025 18:48:47 GMT",
2025-08-14T01:28:15,CNBC Top News,Nearly 1 in 5 older student loan borrowers are seriously delinquent as Trump steps up collections,https://www.cnbc.com/2025/08/13/older-student-loan-delinquencies-under-trump.html,"Wed, 13 Aug 2025 17:23:37 GMT",
2025-08-14T01:28:15,CNBC Top News,"Cava, Chipotle and other fast-casual restaurant chains are finally hit by consumer slowdown",https://www.cnbc.com/2025/08/13/cava-chipotle-sweetgreen-report-slower-sales.html,"Wed, 13 Aug 2025 18:51:02 GMT",
2025-08-14T01:28:15,CNBC Top News,"Coffee and tea prices continue to ramp up due to tariffs, worrying retailers and importers",https://www.cnbc.com/2025/08/13/coffee-and-tea-prices-ramp-up-due-to-tariffs.html,"Wed, 13 Aug 2025 23:16:38 GMT",
2025-08-14T01:28:15,CNBC Top News,Brinker International CEO credits Chili's growth to marketing strategies,https://www.cnbc.com/2025/08/13/brinker-chilis-sales-marketing.html,"Wed, 13 Aug 2025 22:40:45 GMT",
2025-08-14T01:28:15,CNBC Top News,New York man charged with cyberstalking widow of slain UnitedHealthcare CEO Brian Thompson,https://www.cnbc.com/2025/08/13/unitedhealthcare-cyberstalking-brian-thompson-mangione.html,"Wed, 13 Aug 2025 21:29:37 GMT",
2025-08-14T01:28:15,CNBC Top News,"Weekly mortgage refinancing demand shoots 23% higher, with riskier loans making a comeback",https://www.cnbc.com/2025/08/13/weekly-mortgage-refinancing-shoots-23percent-higher.html,"Wed, 13 Aug 2025 12:03:50 GMT",
2025-08-14T01:28:15,CNBC Top News,"Amazon launches same-day delivery of meat, eggs, produce in more than 1,000 cities",https://www.cnbc.com/2025/08/13/amazon-same-day-delivery-meat-eggs-produce.html,"Wed, 13 Aug 2025 20:04:22 GMT",
2025-08-14T01:28:15,CNBC Top News,"Former Goldman Sachs, JPMorgan exec gambled away investor funds for his online casino company: feds",https://www.cnbc.com/2025/08/13/goldman-jpmorgan-galaxy-kim-indicted-gambling-casino-fraud.html,"Wed, 13 Aug 2025 19:15:11 GMT",
2025-08-14T01:28:15,CNBC Top News,Small caps rally as Magnificent 7 stocks roll over in market rotation,https://www.cnbc.com/2025/08/13/small-cap-rally-magnificent-seven-megacap-tech-slide.html,"Wed, 13 Aug 2025 20:08:52 GMT",
2025-08-14T01:28:15,CNBC Top News,How some of the biggest U.S. companies are using AI to cut workers,https://www.cnbc.com/2025/08/13/how-some-of-the-biggest-us-companies-are-using-ai-to-cut-workers.html,"Wed, 13 Aug 2025 17:33:11 GMT",
2025-08-14T01:28:15,CNBC Top News,Tom Dundon to buy the Portland Trail Blazers from Paul Allen's estate,https://www.cnbc.com/2025/08/13/tom-dundon-to-buy-portland-trail-blazers-from-paul-allen-estate.html,"Wed, 13 Aug 2025 17:49:34 GMT",
2025-08-14T01:28:15,CNBC Top News,"New York Attorney General James sues Zelle parent company, alleging it enabled fraud",https://www.cnbc.com/2025/08/13/new-york-letitia-james-zelle-lawsuit.html,"Wed, 13 Aug 2025 17:57:16 GMT",
2025-08-14T01:28:15,CNBC Top News,Trump shrugs off suspected Russian hack of U.S. federal courts: 'Are you surprised?',https://www.cnbc.com/2025/08/13/trump-russia-hack-putin-pacer-courts.html,"Wed, 13 Aug 2025 18:35:37 GMT",
2025-08-14T01:28:15,CNBC Top News,Port of Los Angeles broke a century-old record as tariff threats triggered import surge,https://www.cnbc.com/2025/08/13/us-companies-rushed-in-imports-at-port-of-los-angeles-to-avoid-tariff-deadline-now-pushed-back.html,"Wed, 13 Aug 2025 18:56:10 GMT",
2025-08-14T01:28:15,CNBC Top News,Odds of Trump tapping David Zervos for Fed chief jump on Kalshi after CNBC report,https://www.cnbc.com/2025/08/13/trump-zervos-fed-kalshi-odds.html,"Wed, 13 Aug 2025 16:48:41 GMT",
2025-08-14T01:28:15,CNBC Top News,Amazon Web Services CEO: I told my own teenager to develop this No. 1 'most important skill' to succeed in the AI age,https://www.cnbc.com/2025/08/13/amazon-aws-ceo-the-most-important-skill-you-need-to-succeed-in-ai-age.html,"Wed, 13 Aug 2025 19:28:26 GMT",
2025-08-14T01:28:15,CNBC Top News,Walmart expands grocery discount for 1.6 million employees as tariffs renew inflation concerns,https://www.cnbc.com/2025/08/13/walmart-expands-employee-discount-on-groceries.html,"Wed, 13 Aug 2025 19:47:54 GMT",
2025-08-14T01:28:15,CNBC Top News,An unusual suspect is leading Wednesday's market while the AI trade takes a breather,https://www.cnbc.com/2025/08/13/an-unusual-suspect-is-leading-wednesdays-market-while-the-ai-trade-takes-a-breather.html,"Wed, 13 Aug 2025 18:32:54 GMT",
2025-08-14T01:28:15,CNBC Top News,"Crypto exchange Bullish prices IPO at $37 per share, above expected range, ahead of NYSE debut",https://www.cnbc.com/2025/08/13/crypto-exchange-bullish-prices-ipo-at-37-per-share-ahead-of-nyse-debut.html,"Wed, 13 Aug 2025 17:29:05 GMT",
2025-08-14T01:28:15,CNBC Top News,Healthy Returns: FDA launches program to streamline creation of new U.S. drug manufacturing sites,https://www.cnbc.com/2025/08/13/healthy-returns-fda-launches-program-to-boost-us-drug-manufacturing-.html,"Wed, 13 Aug 2025 14:21:15 GMT",
2025-08-14T01:28:15,CNBC Top News,Cava stock plummets after company lowers forecast on disappointing same-store sales growth,https://www.cnbc.com/2025/08/12/cava-q2-2025-earningshtml.html,"Wed, 13 Aug 2025 13:38:38 GMT",
2025-08-14T01:28:15,CNBC Top News,"'Groundbreaking': Las Vegas Sphere says it's sold 120,000 tickets for 'Wizard of Oz' screenings",https://www.cnbc.com/2025/08/12/vegas-sphere-wizard-of-oz-ticket-sales.html,"Wed, 13 Aug 2025 11:59:44 GMT",
2025-08-14T01:28:15,Investing.com All News,Lyell Immunopharma CEO Seely sells shares worth $8k,https://uk.investing.com/news/insider-trading-news/lyell-immunopharma-ceo-seely-sells-shares-worth-8k-93CH-4220024,2025-08-14 01:14:08,
2025-08-14T01:28:15,Investing.com All News,EastGroup Properties’ SWOT analysis: sunbelt-focused REIT stock weathers market volatility,https://uk.investing.com/news/swot-analysis/eastgroup-properties-swot-analysis-sunbeltfocused-reit-stock-weathers-market-volatility-93CH-4220023,2025-08-14 01:12:09,
2025-08-14T01:28:15,Investing.com All News,Recursion Pharma CEO Gibson sells shares worth $3.26 million,https://uk.investing.com/news/insider-trading-news/recursion-pharma-ceo-gibson-sells-shares-worth-326-million-93CH-4220022,2025-08-14 01:10:09,
2025-08-14T01:28:15,Investing.com All News,Oppfi director Schwartz sells $2.25 million in shares,https://uk.investing.com/news/insider-trading-news/oppfi-director-schwartz-sells-225-million-in-shares-93CH-4220021,2025-08-14 01:08:08,
2025-08-14T01:28:15,Investing.com All News,Form 13G Kosmos Energy Ltd. For: 13 August,https://uk.investing.com/news/filings/form-13g-kosmos-energy-ltd-for-13-august-93CH-4220020,2025-08-14 01:06:09,
2025-08-14T01:28:15,Investing.com All News,TELA Bio’s SWOT analysis: biologic innovator’s stock faces growth hurdles,https://uk.investing.com/news/swot-analysis/tela-bios-swot-analysis-biologic-innovators-stock-faces-growth-hurdles-93CH-4220019,2025-08-14 01:06:09,
2025-08-14T01:28:15,Investing.com All News,Snap CEO Evan Spiegel sells $20 million in shares,https://uk.investing.com/news/insider-trading-news/snap-ceo-evan-spiegel-sells-20-million-in-shares-93CH-4220018,2025-08-14 01:04:08,
2025-08-14T01:28:15,Investing.com All News,Form 13G National CineMedia For: 13 August,https://uk.investing.com/news/filings/form-13g-national-cinemedia-for-13-august-93CH-4220017,2025-08-14 01:02:09,
2025-08-14T01:28:15,Investing.com All News,Open Lending’s SWOT analysis: stock faces headwinds amid restructuring,https://uk.investing.com/news/swot-analysis/open-lendings-swot-analysis-stock-faces-headwinds-amid-restructuring-93CH-4220016,2025-08-14 01:00:09,
2025-08-14T01:28:15,Investing.com All News,"Australia’s Telstra shares fall despite FY profit rise, buyback announcement",https://uk.investing.com/news/stock-market-news/australias-telstra-shares-fall-despite-fy-profit-rise-buyback-announcement-4220015,2025-08-14 00:58:09,
2025-08-14T01:28:15,Investing.com Bond News,"Treasury Yields Remain Stable Despite Tariffs, Rising Debt Risks",https://uk.investing.com/analysis/treasury-yields-remain-stable-despite-tariffs-rising-debt-risks-200618105,"Aug 13, 2025 12:03 GMT",
2025-08-14T01:28:15,Investing.com Bond News,Rates Spark: Tuesday’s Fiscal and CPI Data Can Prove Troubling,https://uk.investing.com/analysis/rates-spark-tuesdays-fiscal-and-cpi-data-can-prove-troubling-200618070,"Aug 12, 2025 05:13 GMT",
2025-08-14T01:28:15,Investing.com Bond News,US 3-Year Auction Disappoints Slightly as Markets Question Rate Cut Path,https://uk.investing.com/analysis/us-3year-auction-disappoints-slightly-as-markets-question-rate-cut-path-200617956,"Aug 05, 2025 20:31 GMT",
2025-08-14T01:28:15,Investing.com Bond News,US Treasury Yields Tick Higher Ahead of Heavy Auction Week,https://uk.investing.com/analysis/us-treasury-yields-tick-higher-ahead-of-heavy-auction-week-200617942,"Aug 05, 2025 07:14 GMT",
2025-08-14T01:28:15,Investing.com Bond News,The Bond Market Is Pricing in a Softer Economy,https://uk.investing.com/analysis/the-bond-market-is-pricing-in-a-softer-economy-200617930,"Aug 04, 2025 22:17 GMT",
2025-08-14T01:28:15,Investing.com Bond News,Non-Farm Payrolls Ahead: Saving the Most Exciting for Last?,https://uk.investing.com/analysis/nonfarm-payrolls-ahead-saving-the-most-exciting-for-last-200617897,"Aug 01, 2025 06:50 GMT",
2025-08-14T01:28:15,Investing.com Bond News,Medium-Term Corporates Lead US Bond Market in 2025,https://uk.investing.com/analysis/mediumterm-corporates-lead-us-bond-market-in-2025-200617754,"Jul 23, 2025 11:53 GMT",
2025-08-14T01:28:15,Investing.com Bond News,Japan’s Election Results Could Send Shockwaves Through US Bond Market,https://uk.investing.com/analysis/japans-election-results-could-send-shockwaves-through-us-bond-market-this-week-200617701,"Jul 21, 2025 06:55 GMT",
2025-08-14T01:28:15,Investing.com Bond News,How Fed Could Inject Liquidity if Bond Yields Surge: What Investors Need to Know,https://uk.investing.com/analysis/how-fed-could-inject-liquidity-if-bond-yields-surge-what-investors-need-to-know-200617670,"Jul 17, 2025 13:37 GMT",
2025-08-14T01:28:15,Investing.com Bond News,US 10-Year Yield Holds Above Fair Value as Deficit and CPI Heat Up,https://uk.investing.com/analysis/us-10year-yield-holds-above-fair-value-as-deficit-and-cpi-heat-up-200617650,"Jul 16, 2025 11:56 GMT",
2025-08-14T01:28:16,Google News Reuters,"Oil hits two-month low as US, IEA supply guidance weighs - Reuters",https://news.google.com/rss/articles/CBMipwFBVV95cUxPUy1lNlo5YS1kTExzdEJTN2xKSTNibkU1VU1WZnplMWZUb0RMcG1CNG5PWjYwUjJJVER0M0oxa3h0WHJPSEQwZnRmVk5LNHBSSXVxUWZReUI1ZmRjVFJ3MTJCX1FDSmxvVVVmeFNwOWpZNUU3NEJCU2FsNFo2QVlSVXhFU0pYRDNQRDBhTjl4Y3c0Q3RpWGxzbzlDajdUTTRSZTA0dl93VQ?oc=5,"Wed, 13 Aug 2025 20:39:19 GMT",
2025-08-14T01:28:16,Google News Reuters,"US proposes nearly $1 billion in funds for critical minerals, materials - Reuters",https://news.google.com/rss/articles/CBMitAFBVV95cUxNUWU1NThiTXNYN1J4d3Uta05lbWlhNHV1LWdQdkhNRl8yMEdtMWRHZFMzQWo3cnJWblloYXdnOHlpYzFCRnZMRU9RbnNvbG5YZUxUZkdWeU9uOGxDRHJVdkV1OTF6ejF4eS1DVEFhOXJ2ZTVPTzl3Z3ZmRzNrak8zUGVOTzZ1TmNYOTA2UHZyWkhXZmRiTG9lNnVGalVyZWs2MUJrOXNUSEFDbXV6ZGxZRzJQZFA?oc=5,"Wed, 13 Aug 2025 21:36:11 GMT",
2025-08-14T01:28:16,Google News Reuters,"S&P 500, Nasdaq hit new closing highs on rate cut hopes - Reuters",https://news.google.com/rss/articles/CBMimwFBVV95cUxQalVya21PcEM5cmI1TGtKczJhTTB1dE0yTVpXVjlKSmdxc3duQVgzNU9kemtiUUhraUk0YVdjVkprc29OdUtvWDlkYkl4bkFTVEV5R2d1SGpCcVJ6blVMWmpBTW5pZ3paY3hHdkNWME9EOWNnRjNkcXBOaXZVNnpqcDNHMDJXbDRINmRhLWY5N1AxQkFnM3RTWDVZWQ?oc=5,"Wed, 13 Aug 2025 22:37:20 GMT",
2025-08-14T01:28:16,Google News Reuters,Dollar slips further as anticipation mounts of Fed interest rate cut - Reuters,https://news.google.com/rss/articles/CBMitwFBVV95cUxON1BhY0FFbWctYVFLMjQ4b2hMRWVacmpmdURNVXhTVWxQcXdSNXVMSVJwWlVuRVBnbjczb3czUlRXWmxBMjY1Wl93T2JjUGZrSldfLW1WdmRuZFRJY2pJTFdjYmRNNklla1NBdjI1dk5QRzlzdjg5RmZLdmFSRGRFSkpLeFRrV0lDVVEtZTk5bFpIMmROSmFRcmg0UXQzR0JDV1R5SklrRElySXFMNGNyRDExN0xPbzA?oc=5,"Wed, 13 Aug 2025 19:19:14 GMT",
2025-08-14T01:28:16,Google News Reuters,"Google pledges $9 billion to expand AI, cloud infrastructure in Oklahoma - Reuters",https://news.google.com/rss/articles/CBMirgFBVV95cUxQdDkzUmtwREhEclp5Smd6N2xQNkhhN0dLTF9KOGZGLVhQQllWU25pTkJ2VlZ5b3JZanFQZzYwRWpJUmFYNmtBUXNpSl9WTkNJazBycG5rVW5oSTY1ZktYLXJhWEs5OHA3d3pYSExPc2dMTzJlVE1oSFNqVDJyMEltam94UFA0Q1ptVXVWTW5nZ3c0Z3c1eFl6YkxyQ01mOF9TS1VxTXVOQ1pRV3k0dHc?oc=5,"Wed, 13 Aug 2025 22:50:33 GMT",
2025-08-14T01:28:16,Google News Reuters,Trump to host Kennedy Center Honors event as he expands his reach in Washington - Reuters,https://news.google.com/rss/articles/CBMitgFBVV95cUxQUVR3NExDMTFDVzRQMFBsMWVWb1hLYmtfMXIxNzg4ZURCcmd1YnZ6RUowd3BNeXZtekVmNTdMa2RSUHJLV1BRSS1fclZvUktQcm1sMS00VEtLMXRfTFF2MEZSMi0zQmhJYXY1d28wVmM5cC1PS0tvRHh2ZzVOaS1nempWOG8zQk9KaVo1bThjRFdzS2ZpaEoycUsyZ2NvUFFJZEJiRWlJaDF3SmJWV1cyX1Q0OFkxdw?oc=5,"Wed, 13 Aug 2025 20:17:33 GMT",
2025-08-14T01:28:16,Google News Reuters,"Exclusive: US pharma tariffs likely weeks away as Trump plans for Alaska, sources say - Reuters",https://news.google.com/rss/articles/CBMi1AFBVV95cUxQSXBCdGJBX09LNDNjdUVlbGV4SF9nM3ZtRFpwUkZabWw0ZmRCN3lJajAyR0NJNGRzUm1XX24xQUhoZnRyLUJaZTlfbV9zVE51LWp5NGpPd1RMT3NhUU5uT2xjdDV4a3dDLWZiY2Z6UmJSNVlvbkZpLWY3T0c0WXBmWHYtekxNMVJaeU5Mb0luUUpXSTdMOU1ScUxhUFFFa3ljaDB4R0c5cXFhemlTREo2WWdVOXJBWkMwclBaVTRtVHVzSnB1bXpaRmVMeUMybUxlNVhoSg?oc=5,"Wed, 13 Aug 2025 21:40:24 GMT",
2025-08-14T01:28:16,Google News Reuters,Trump wants to extend federal control over Washington police - Reuters,https://news.google.com/rss/articles/CBMipAFBVV95cUxNTUJzOVhoUWUyRzJIZzcyYWRqd0xBNUp1SU1lY0txS2hkWGhQdV9nTjNveUtzOGxESFIzWUpCWWxEZ3FHNUpqbUVhOUxsMm13aFp3OWFSMGRNcmVFWXhGUXhhS1hsVHE3TGFqUml6UWNJYXpoX0U0MXJtNkNfa1AtRTgzdWRkMklYRFZyRlVTN0dfdHRFWXdvVmMxdzJSMmQ0b1o2Zg?oc=5,"Wed, 13 Aug 2025 21:50:47 GMT",
2025-08-14T01:28:16,Google News Reuters,Trump asked Polish President Nawrocki to replace Tusk in Ukraine meeting - Reuters,https://news.google.com/rss/articles/CBMitgFBVV95cUxORlJFR3RhSlBpZWZId1VLRXpwUW41bWlDTW5lRVhfV3Rub3JvdFRRMHJqYmpPM3FzSXkxeFhkal9WWmpDLUhkakluV0NjbWdJR2dhZTMwTkxHRGpVd0VKMHpzVWx2VERES2tLVnpCSXBKYTlKZEZ4SDUwM0tWU2J1d0o1S01td2syMnd3UTUxbWJ5Zk5lbGFoUnZ6aHVUSTcxVFlWb3F6NDdKeXUzUF8xYVZKY1QzZw?oc=5,"Wed, 13 Aug 2025 18:20:48 GMT",
2025-08-14T01:28:16,Google News Reuters,Trump threatens 'severe consequences' if Putin blocks Ukraine peace - Reuters,https://news.google.com/rss/articles/CBMitAFBVV95cUxQNUZyOXpVbFh4dFR2STQ2T1NQbzNNUVQ2SzJadXhpZVZOOVd5eWpXZDdIdmtfdXlkTWJyZlBlSDdPTHQ3LUUwd3E4bjZueXl3X1NrdjYwbmtQQ1R3UU96ZlQwOURmOGxHQ0FpSGEyemtySDdya0d0RzUzek9lVXByR2FrQ0tSRjBaTzNHdGpkTTVReWYxUTJtc2hjbXM1UHFDNi1XNTh5YUgwWjNDd0tpRnY3S1I?oc=5,"Wed, 13 Aug 2025 21:45:16 GMT",
2025-08-14T01:28:16,Google News Reuters,Trump to host Kennedy Center Honors ceremony - Reuters,https://news.google.com/rss/articles/CBMijwFBVV95cUxPOE5lb3laa01Dc3lNQzEzNGtrZGtHb1o1VVE5N0dVRjBZREVQWHJha1M3eFBQWnJfUk9ncUJsbm0wc3Z5YS13MEZjd2pZTkVPSzI3SG1xZVprTnRJakZ3MUF3blVsRmFuRFB6ekkwLUpCSWkzQ0lhSWFIQnNObXdNS1Z2cXFxRS1DSlZKeThJcw?oc=5,"Wed, 13 Aug 2025 17:44:37 GMT",
2025-08-14T01:28:16,Google News Reuters,Crypto exchange Bullish valued at nearly $13.2 billion in blowout NYSE debut - Reuters,https://news.google.com/rss/articles/CBMivgFBVV95cUxPd0RNUk9EalE2bkplYk1SUEd3SXYzWThjVkloM1FBNEJOUFFiQmdpSlFoaTluNWdnMXJuWER5X2RMeHdSX05iY21ndS1EWUJwLWNXaXdlTmhnT0U0Z2J2eTR4VVpQUlZBV0hldDV3LXdWaktRN0VHZ25VWlVvT0kxRFEta0FxdFBDekdQbm5ocjFIbWJ0VU93TVlxSXJkWmJmMTFHTTVib2ROakJ0YWk4UDdlVjBtd1V5X3NNMVN3?oc=5,"Wed, 13 Aug 2025 18:10:37 GMT",
2025-08-14T01:28:16,Google News Reuters,"New York sues Zelle, says security lapses led to $1 billion consumer fraud losses - Reuters",https://news.google.com/rss/articles/CBMi5wFBVV95cUxQeHdIcldqVVU5bGowV1BLUi1wWHFnVnNPZW8tT29rQW9zYkhEUGdYYzJtdkpWZ3h4NEdfUHJ5Sy1icHZrLWk4ME1ETmd3bUREV1RUZElkZDd0OHd0SWhHckI1OER3VXlXTVBVN2Y4WExiaVNlUl9nTW55TUE4SVRhZ0dpeW14NjFINzFXWk9ZU0NnWHg1MmhiT3NOUVN5aXBrMTJOU3VpX0Rhb09MbzNnNnBSLWxSdldaUy01akVOZW43VGhyNFd4TmQwUy02bXd5OF9hSktsZlcxMFhhT3hfdlBUYjNyclE?oc=5,"Wed, 13 Aug 2025 18:19:52 GMT",
2025-08-14T01:28:16,Google News Reuters,"Putin appears ready to test new missile as he prepares for Trump talks, researchers say - Reuters",https://news.google.com/rss/articles/CBMiwwFBVV95cUxOUHhhUHMwaXBBbnRpWWdwQkN5SExYb2VWdWJRRDBpRDVvTXpvLVZYb3pJcjBjcFZDS2tCXzZicHZMOHNTanlWaWdxTi1QUkxYZW1iLUpqRnpLLXVTOHFLREdqWlhSdF93VExRWUFKcm9YX3ZHQmVjNEMzNTFFN05wTlRmU3BGTV9LckwwRWlja1lUblVQWklyb1R2cDAzQmt2LThKUmg1QmhZMHJ5cGxfcjVXRkJXejloVFdlaDlUa1hXYTg?oc=5,"Wed, 13 Aug 2025 19:03:19 GMT",
2025-08-14T01:28:16,Google News Reuters,US appeals court lets Trump cut billions in foreign aid - Reuters,https://news.google.com/rss/articles/CBMiqAFBVV95cUxNLWZtWVZSNzRxYnJGU0dTYUZLRXVxNkNYNERxS2ZFQVZLLVIybjB3NGhFRUJ0clRraUVPVnZKYUgtQjhsWWFjMkdPbGF0cC16TXh5NkV6ZTdLbjV2X2pvRnZvbzFsZ2ZoMGktb015cWxhQUgzM0tmRHZBRzlPRXhKck5yaG1hbXozVlJCMkxNNlB5dk5Id1ZYVTNnV2tsZF9BdUlvdXJlMW4?oc=5,"Wed, 13 Aug 2025 20:37:44 GMT",
2025-08-14T01:28:16,Google News Reuters,"Ukraine's allies, after fears of sellout, signal hope for Trump-Putin talks - Reuters",https://news.google.com/rss/articles/CBMitAFBVV95cUxOc21VX21tSEJDUnM1X1BRaGRYcXA3ZVFYdjQtZk9QRUdoRWRxSHZQMzREamRuTUFMYkVwQ2lYbjBfVTM5UXFoMHhoYXRxMXZJZ2tINWJXUW9lb1ptWDZrSGM0TDk3dndUVkh5eFZiQ3ZzR2lUT0FLa2w4ZVB4LW0wZkFGMmFqaGo0QzN4MFF0RUFhVWpjN3B1eXFaVkFWMWlqbjdvanR6ZDZqZ1YtVnZiUktabXg?oc=5,"Wed, 13 Aug 2025 16:27:12 GMT",
2025-08-14T01:28:16,Google News Reuters,"Russia wants to link cut in NATO troops to talks about Ukraine, says Poland - Reuters",https://news.google.com/rss/articles/CBMitAFBVV95cUxPdk40VHBrYm4ybDVjajNGRkE2WFRaNFpWQjhPdGhZUTVETmdPN3lxYm9WS2xMZGhNRVZWcU5mM2JaTFdXdFZDaEZWZE8zajdac3hFUDRuWnl2c3Q4ZnloMDF4UHNCZnY1cElPRGVSMTFqYldvRHNWMXEzTTIzbldYOFhVd1NDMWJLU01UeDJyMVlHajhWY0k3OFJqdGg1YWRMZ1NEdzlKSG9WZndJejBjSjdjVTY?oc=5,"Wed, 13 Aug 2025 16:36:09 GMT",
2025-08-14T01:28:16,Google News Reuters,US judge blocks Trump religious exemption to birth control coverage - Reuters,https://news.google.com/rss/articles/CBMiuAFBVV95cUxPUWlUdzhuUlRkSXlpRjdOZkpFZGtUMVVLYWFGV0lHTVZsM2FvSmZnUHc2cl9lam9YQVNwQm5tR3ZSaVlEOGRMdkxpZE1QRXVHU0N1aVIySkJfVGZoR0NiU0toN1dqVUFlNmNuQjlzMW41b2xJTU1GRmlFSXlWaEp5TG03bEUxRXF2ZllSVkVUb0twb1EtSGRUN2dEUDVRbGFaVHBSazlYYU9IUWNvSlpMUWt3c002NTNy?oc=5,"Wed, 13 Aug 2025 21:14:33 GMT",
2025-08-14T01:28:16,Google News Reuters,"USDA moves to end employee union contracts, documents show - Reuters",https://news.google.com/rss/articles/CBMiqwFBVV95cUxQcnplRGNTWDNydzM2NjdLa0FNOVUxTFdZcDdsQkVnWHNyeDIyWnkxdTJMS29JU1pCcjdDVUk1cl9JQUdXZW1zbTFvdndCRGRwLW5KSmVjMFlsOXR1eW1hcXlZS3Vjc1FhRUxrRDczWHhFOEt3TnlyNWJSU0h5eGNYNTdORkhmY1RDVlFpWTZxRjRzTFFtbng0dVgyeWRoM0JycWRLbHFqV0Nuc2c?oc=5,"Wed, 13 Aug 2025 21:22:11 GMT",
2025-08-14T01:28:16,Google News Reuters,Air Canada cancels flights from Thursday as cabin crew strike looms - Reuters,https://news.google.com/rss/articles/CBMi1wFBVV95cUxQY2JDUTJqV0kxUW1NQ2xNWjNkRS1tV2tlQm14Y01EeU9Va0F5cVdoczVrb3FnWHJqakNMVjhlM2p3ZjFZSkU3ekRqd2xyTGxpUTBKZWhtOTkxcGNHV1V5SHRNSUdFRVlHbjdiWll3ay1YTHItaFJuRzE5Ulh5R0FuMXVXcjA5aUNYWUMtaHNuQjhIclludWpBby0xUi1RdHg5WUJhN3V3elZDVmFYamNuZVk0ZFJqeDV6YWJxWXROTzZsMEpFazZUUFp6LUhXQXJQX2o5WUlCMA?oc=5,"Wed, 13 Aug 2025 19:53:15 GMT",
2025-08-14T01:28:16,Google News Reuters,At least 26 die in migrant shipwreck off Italy's Lampedusa island - Reuters,https://news.google.com/rss/articles/CBMiogFBVV95cUxPdzAyc3dYelVMalh0YmNFM2Z4RXo4eUQwVXNhY3RuSmFFcHQ5bDNiekJWRHJlLVV4UWNReGlXUXA4dGI0aUFkV1BCUVhicHl5QzBLZGx6aGoxQmtzUEEzY0pVQ1Z3V0hTNnFaQ3ZGQmIxTHdsMHlPYkI3UXVhR3A2MGpGUFNkY3EtNm5uOGVBUTBOSVAzazlGNll6V0FlUmMyUHc?oc=5,"Wed, 13 Aug 2025 16:02:28 GMT",
2025-08-14T01:28:16,Google News Reuters,US selects 11 projects for program to fast-track small nuclear test reactors - Reuters,https://news.google.com/rss/articles/CBMivgFBVV95cUxNZUV2VWJiMGs1aE91NC1rY0cyZTM5UjctWnd0LXhlclhCRGNUUklWU2Y3UTJFRnhFYVdVdV83aS1uY0h1SFRwTkdyc0x4Sm45cUtKRFY4NThLbE9DQVVhb3JUbGdkaWJWd2hZQ1dkQm51ZkNuaEdFWjJ1cnM2WG91QS1Va1VaSVcybmtZcWNHTE5fS0Y0MnJEam1adXlNU0hLb3pfN3U4WHVVd3p3a1NBZkN2Tjh4SFBSbFk4TlNB?oc=5,"Wed, 13 Aug 2025 16:57:21 GMT",
2025-08-14T01:28:16,Google News Reuters,Wildfires fanned by heatwave and strong winds rage across Europe - Reuters,https://news.google.com/rss/articles/CBMixAFBVV95cUxPNkVVbnp1eWhlQnFtUnlpVkZBTEoxeHB1MTVudDZaV3JFeFgyaHVoQjlUR05Nb0VCUXhseHN4MGlOUUdZNDY4LUV5YXlWRFh4TG44bmptVURld0ZLNkMzc2xmcDVFUlFMVzBqOE1IWHNLR3BBOEpfNnNVT0NOQV9PNUgySTZUdE5QS3NVcGRSVFlfUzRDQ0xGTGJaSG5oN2c4elJjVDN2a2JjMFhYOWdyakYzeVdUYU5Rc3p2aUJEeWp0UUJG?oc=5,"Wed, 13 Aug 2025 22:10:39 GMT",
