timestamp,source,title,link,published,content
2025-08-09T01:55:52,MarketWatch Top,‘This scam stuff is going to get worse’: A man approached me in my car — he had a crazy story,https://www.marketwatch.com/story/this-scam-stuff-is-going-to-get-worse-a-man-approached-me-in-my-car-he-had-a-crazy-story-ccd885d3?mod=mw_rss_topstories,"Fri, 08 Aug 2025 21:58:00 GMT",
2025-08-09T01:55:52,MarketWatch Top,Why investors are making a big mistake by not worrying more about tariffs,https://www.marketwatch.com/story/investors-are-now-less-concerned-about-tariffs-than-the-economy-says-bofa-survey-why-that-could-be-a-mistake-8798a2ac?mod=mw_rss_topstories,"Fri, 08 Aug 2025 21:08:00 GMT",
2025-08-09T01:55:52,MarketWatch Top,Gold and bitcoin are both vying to be safe havens for investors. Why gold is winning so far this year.,https://www.marketwatch.com/story/gold-and-bitcoin-are-both-vying-to-be-safe-havens-for-investors-why-gold-is-winning-so-far-this-year-42e5fc9e?mod=mw_rss_topstories,"Fri, 08 Aug 2025 20:51:00 GMT",
2025-08-09T01:55:52,MarketWatch Top,Sweetgreen’s customers are cutting back on pricey salads. Will extra chicken help?,https://www.marketwatch.com/story/sweetgreens-customers-are-cutting-back-on-pricey-salads-will-extra-chicken-help-ccd79c31?mod=mw_rss_topstories,"Fri, 08 Aug 2025 20:45:00 GMT",
2025-08-09T01:55:52,MarketWatch Top,"Trade Desk’s stock sees its worst drop ever, and analysts wonder if Amazon is to blame",https://www.marketwatch.com/story/trade-desks-stock-may-see-its-worst-drop-ever-and-analysts-wonder-if-amazon-is-to-blame-e0f52f38?mod=mw_rss_topstories,"Fri, 08 Aug 2025 20:41:00 GMT",
2025-08-09T01:55:52,MarketWatch Top,Trump nominee Miran could have a surprising effect on the Fed: giving officials more freedom to dissent,https://www.marketwatch.com/story/trump-nominee-miran-could-have-a-surprising-effect-on-the-fed-giving-officials-more-freedom-to-dissent-eccbb5fe?mod=mw_rss_topstories,"Fri, 08 Aug 2025 20:34:00 GMT",
2025-08-09T01:55:52,MarketWatch Top,I plan to work until 80. Can I contribute to my IRA while taking RMDs?,https://www.marketwatch.com/story/i-plan-to-work-until-80-can-i-contribute-to-my-ira-while-taking-rmds-02362eda?mod=mw_rss_topstories,"Fri, 08 Aug 2025 20:24:00 GMT",
2025-08-09T01:55:52,MarketWatch Top,‘I have a great mortgage rate’: I need $80K to buy my husband out of our home. Do I raid my $180K Roth IRA?,https://www.marketwatch.com/story/i-need-80k-to-buy-my-husband-out-of-our-home-do-i-raid-my-180k-roth-ira-73460355?mod=mw_rss_topstories,"Fri, 08 Aug 2025 19:40:00 GMT",
2025-08-09T01:55:52,MarketWatch Top,‘I feel shaken’: A man offered to powerwash my patio for $50. He would not take no for an answer.,https://www.marketwatch.com/story/i-feel-shaken-a-man-offered-50-to-powerwash-my-patio-he-would-not-take-no-for-an-answer-9223ce12?mod=mw_rss_topstories,"Fri, 08 Aug 2025 19:37:00 GMT",
2025-08-09T01:55:52,MarketWatch Top,The truth about ‘no tax on tips’ is not every service worker gets a break. Here’s what we know about who might make the list.,https://www.marketwatch.com/story/the-truth-about-no-tax-on-tips-is-not-every-service-worker-will-get-it-heres-what-we-know-about-who-could-make-the-list-a8f905a3?mod=mw_rss_topstories,"Fri, 08 Aug 2025 18:58:00 GMT",
2025-08-09T01:55:52,CNBC Top News,Apple has its best week since July 2020 after White House visit,https://www.cnbc.com/2025/08/08/apple-has-best-week-since-july-2020-after-tim-cooks-white-house-visit.html,"Fri, 08 Aug 2025 21:02:29 GMT",
2025-08-09T01:55:52,CNBC Top News,Gold futures trade off highs as White House to issue clarification on bullion tariffs,https://www.cnbc.com/2025/08/08/gold-futures-trade-off-highs-as-white-house-to-issue-clarification-on-bullion-tariffs.html,"Fri, 08 Aug 2025 18:56:32 GMT",
2025-08-09T01:55:52,CNBC Top News,Trump says he will meet with Putin in Alaska on Aug. 15,https://www.cnbc.com/2025/08/08/trumps-russia-deadline-comes-around-with-tariffs-at-stake.html,"Fri, 08 Aug 2025 22:34:19 GMT",
2025-08-09T01:55:52,CNBC Top News,Intel CEO responds to 'misinformation' and Trump threat in letter to employees,https://www.cnbc.com/2025/08/08/intel-ceo-responds-to-misinformation-and-trump-threat-in-letter.html,"Fri, 08 Aug 2025 18:06:51 GMT",
2025-08-09T01:55:52,CNBC Top News,Trade Desk tanks 39% for worst day ever on CFO departure and competition from Amazon,https://www.cnbc.com/2025/08/08/trade-desk-tanks-cfo-departure-q2-results-amazon-competition.html,"Fri, 08 Aug 2025 20:15:12 GMT",
2025-08-09T01:55:52,CNBC Top News,"Trump warns courts against knocking down tariffs, says duties are 'huge positive' for stock market",https://www.cnbc.com/2025/08/08/trump-warns-courts-against-knocking-down-tariffs-says-duties-are-huge-positive-for-stock-market.html,"Fri, 08 Aug 2025 15:56:06 GMT",
2025-08-09T01:55:52,CNBC Top News,Tesla Robotaxi scores permit to run ride-hailing service in Texas,https://www.cnbc.com/2025/08/08/tesla-robotaxi-scores-permit-to-run-ride-hailing-service-in-texas.html,"Fri, 08 Aug 2025 18:53:53 GMT",
2025-08-09T01:55:52,CNBC Top News,"Bed Bath & Beyond relaunches with first store in Nashville, plans dozens more",https://www.cnbc.com/2025/08/08/bed-bath-beyond-store-nashville.html,"Fri, 08 Aug 2025 17:36:12 GMT",
2025-08-09T01:55:52,CNBC Top News,The winners and losers in tech's AI-powered ad race,https://www.cnbc.com/2025/08/08/tech-earnings-ai-ad-revenue.html,"Fri, 08 Aug 2025 18:59:14 GMT",
2025-08-09T01:55:52,CNBC Top News,Sweetgreen shares drop 23% after salad chain cuts outlook for the second time in two quarters,https://www.cnbc.com/2025/08/08/sweetgreen-cuts-outlook-stock-drops.html,"Fri, 08 Aug 2025 20:04:22 GMT",
2025-08-09T01:55:52,CNBC Top News,"EV sales soar as Trump axes $7,500 tax credit: 'People are rushing out' to buy, analyst says",https://www.cnbc.com/2025/08/08/ev-sales-trump-tax-credit.html,"Fri, 08 Aug 2025 18:37:38 GMT",
2025-08-09T01:55:52,CNBC Top News,OpenAI's Altman is still looking to spend after GPT-5 launch and is 'willing to run the loss',https://www.cnbc.com/2025/08/08/chatgpt-gpt-5-openai-altman-loss.html,"Fri, 08 Aug 2025 15:15:10 GMT",
2025-08-09T01:55:52,CNBC Top News,Tesla exec leading development of chip tech and Dojo supercomputer is leaving company,https://www.cnbc.com/2025/08/07/tesla-vp-pete-bannon-developing-chip-tech-dojo-supercomputer-leaving.html,"Thu, 07 Aug 2025 23:42:06 GMT",
2025-08-09T01:55:52,CNBC Top News,Government-backed MP Materials rises as loss narrows on record rare earth oxide production,https://www.cnbc.com/2025/08/08/government-backed-mp-materials-surges-as-loss-narrows-on-record-rare-earth-oxide-production.html,"Fri, 08 Aug 2025 20:25:18 GMT",
2025-08-09T01:55:52,CNBC Top News,Dodge unveils additions to 2026 muscle car lineup: 'It's about choice',https://www.cnbc.com/2025/08/08/dodge-durango-jailbrea-charger-sixpack.html,"Fri, 08 Aug 2025 15:00:01 GMT",
2025-08-09T01:55:52,CNBC Top News,"Crocs CEO says consumer environment is 'concerning,' will reduce orders in the second half",https://www.cnbc.com/2025/08/08/crocs-reducing-order-volume-second-half-cautious-consumer.html,"Fri, 08 Aug 2025 16:18:09 GMT",
2025-08-09T01:55:52,CNBC Top News,OpenStore’s demise marks endgame for once-booming e-commerce aggregator market,https://www.cnbc.com/2025/08/08/openstore-demise-endgame-for-once-booming-ecommerce-aggregator-market.html,"Fri, 08 Aug 2025 12:40:47 GMT",
2025-08-09T01:55:52,CNBC Top News,A major historical bitcoin cycle that dictates its price might be breaking,https://www.cnbc.com/2025/08/08/bitcoin-btc-price-cycle-might-be-breaking.html,"Fri, 08 Aug 2025 15:54:44 GMT",
2025-08-09T01:55:52,CNBC Top News,Record-setting market: Using ETFs to help avoid hefty tax bills,https://www.cnbc.com/2025/08/08/record-setting-market-using-etfs-to-help-avoid-hefty-tax-bills-.html,"Fri, 08 Aug 2025 11:30:01 GMT",
2025-08-09T01:55:52,CNBC Top News,Pinterest stock falls 10% after earnings miss,https://www.cnbc.com/2025/08/07/pinterest-pins-q2-earnings-report-2025.html,"Thu, 07 Aug 2025 21:59:50 GMT",
2025-08-09T01:55:52,CNBC Top News,"Trump to nominate economic advisor Stephen Miran to be new Fed governor, replacing Kugler",https://www.cnbc.com/2025/08/07/trump-to-nominate-stephen-miran-to-be-new-fed-governor-replacing-kugler-.html,"Thu, 07 Aug 2025 21:20:38 GMT",
2025-08-09T01:55:52,CNBC Top News,Op-ed: Silicon Valley is dictating U.S. AI policy. It's a mistake that will benefit China,https://www.cnbc.com/2025/08/08/silicon-valley-dominant-us-ai-policy-will-benefit-china.html,"Fri, 08 Aug 2025 11:30:01 GMT",
2025-08-09T01:55:52,CNBC Top News,"Student loan borrowers face an expensive ‘cliff effect’ under the new 'standard' repayment plan, expert says",https://www.cnbc.com/2025/08/08/student-loan-borrowers-standard-plan-changes.html,"Fri, 08 Aug 2025 10:15:01 GMT",
2025-08-09T01:55:52,CNBC Top News,Block shares pop on full-year guidance boost,https://www.cnbc.com/2025/08/07/block-xyz-q2-2025-earnings-report.html,"Thu, 07 Aug 2025 22:44:20 GMT",
2025-08-09T01:55:52,CNBC Top News,Firefly Aerospace soars over 30% in market debut to land at $8.5 billion valuation,https://www.cnbc.com/2025/08/07/rocket-maker-firefly-aerospace-fly-stock-ipo.html,"Thu, 07 Aug 2025 20:13:36 GMT",
2025-08-09T01:55:52,CNBC Top News,"Trump's approval rating still negative while the public sours further on Democrats, CNBC survey shows",https://www.cnbc.com/2025/08/07/trumps-approval-rating-still-negative-while-the-public-sours-further-on-democrats-cnbc-survey-shows.html,"Fri, 08 Aug 2025 12:45:09 GMT",
2025-08-09T01:55:52,CNBC Top News,"Flutter tops second-quarter earnings expectations, raises full-year guidance",https://www.cnbc.com/2025/08/07/flutter-flut-q2-2025-earnings-report.html,"Thu, 07 Aug 2025 20:41:55 GMT",
2025-08-09T01:55:52,CNBC Top News,"Instacart tops estimates, issues upbeat outlook",https://www.cnbc.com/2025/08/07/instacart-cart-earnings-q2-2025.html,"Thu, 07 Aug 2025 21:25:15 GMT",
2025-08-09T01:55:52,CNBC Top News,"The UK government won't admit it, but tax rises are coming — and there are no good options",https://www.cnbc.com/2025/08/08/the-uk-government-wont-admit-it-but-tax-rises-are-coming.html,"Fri, 08 Aug 2025 05:21:46 GMT",
2025-08-09T01:55:52,CNBC Top News,Duolingo stock skyrockets 14% on boosted guidance as AI powers user growth,https://www.cnbc.com/2025/08/07/duolingo-duol-q2-earnings-2025.html,"Thu, 07 Aug 2025 20:01:39 GMT",
2025-08-09T01:55:52,Investing.com All News,VIQ Solutions amends credit agreement with Beedie Investments,https://uk.investing.com/news/company-news/viq-solutions-amends-credit-agreement-with-beedie-investments-93CH-4211684,2025-08-09 01:38:06,
2025-08-09T01:55:52,Investing.com All News,Thumzup Media launches public offering of convertible preferred stock,https://uk.investing.com/news/company-news/thumzup-media-launches-public-offering-of-convertible-preferred-stock-93CH-4211680,2025-08-09 00:06:08,
2025-08-09T01:55:52,Investing.com All News,"Exclusive: Opendoor CEO Wheeler breaks silence, EMJ's Eric Jackson calls for more",https://uk.investing.com/news/stock-market-news/exclusive-opendoor-ceo-wheeler-breaks-silence-emjs-eric-jackson-calls-for-more-4211679,2025-08-08 22:58:06,
2025-08-09T01:55:52,Investing.com All News,"Focus Graphite raises C$891,000 in private placement",https://uk.investing.com/news/company-news/focus-graphite-raises-c891000-in-private-placement-93CH-4211677,2025-08-08 22:26:06,
2025-08-09T01:55:52,Investing.com All News,Fiera Capital Q2 2025 slides: Private Markets shine amid overall AUM decline,https://uk.investing.com/news/company-news/fiera-capital-q2-2025-slides-private-markets-shine-amid-overall-aum-decline-93CH-4211674,2025-08-08 21:54:06,
2025-08-09T01:55:52,Investing.com All News,RLJ Lodging Trust Q2 2025 slides: RevPAR dips amid mixed market performance,https://uk.investing.com/news/company-news/rlj-lodging-trust-q2-2025-slides-revpar-dips-amid-mixed-market-performance-93CH-4211673,2025-08-08 21:46:06,
2025-08-09T01:55:52,Investing.com All News,Westlake declares $0.53 per share quarterly dividend,https://uk.investing.com/news/company-news/westlake-declares-053-per-share-quarterly-dividend-93CH-4211671,2025-08-08 21:38:06,
2025-08-09T01:55:52,Investing.com All News,Mexico shares lower at close of trade; S&P/BMV IPC down 0.33%,https://uk.investing.com/news/stock-market-news/mexico-shares-lower-at-close-of-trade-spbmv-ipc-down-033-4211670,2025-08-08 21:35:31,
2025-08-09T01:55:52,Investing.com All News,TSX finishes flat as Canadian employment data disappoints,https://uk.investing.com/news/stock-market-news/tsx-futures-edge-higher-as-investors-await-canadian-employment-data-4209889,2025-08-08 21:34:06,
2025-08-09T01:55:52,Investing.com All News,Oppenheimer raises Talen Energy stock price target to $405 on higher capacity revenues,https://uk.investing.com/news/analyst-ratings/oppenheimer-raises-talen-energy-stock-price-target-to-405-on-higher-capacity-revenues-93CH-4211669,2025-08-08 21:32:06,
2025-08-09T01:55:52,Investing.com Bond News,US 3-Year Auction Disappoints Slightly as Markets Question Rate Cut Path,https://uk.investing.com/analysis/us-3year-auction-disappoints-slightly-as-markets-question-rate-cut-path-200617956,"Aug 05, 2025 20:31 GMT",
2025-08-09T01:55:52,Investing.com Bond News,US Treasury Yields Tick Higher Ahead of Heavy Auction Week,https://uk.investing.com/analysis/us-treasury-yields-tick-higher-ahead-of-heavy-auction-week-200617942,"Aug 05, 2025 07:14 GMT",
2025-08-09T01:55:52,Investing.com Bond News,The Bond Market Is Pricing in a Softer Economy,https://uk.investing.com/analysis/the-bond-market-is-pricing-in-a-softer-economy-200617930,"Aug 04, 2025 22:17 GMT",
2025-08-09T01:55:52,Investing.com Bond News,Non-Farm Payrolls Ahead: Saving the Most Exciting for Last?,https://uk.investing.com/analysis/nonfarm-payrolls-ahead-saving-the-most-exciting-for-last-200617897,"Aug 01, 2025 06:50 GMT",
2025-08-09T01:55:52,Investing.com Bond News,Medium-Term Corporates Lead US Bond Market in 2025,https://uk.investing.com/analysis/mediumterm-corporates-lead-us-bond-market-in-2025-200617754,"Jul 23, 2025 11:53 GMT",
2025-08-09T01:55:52,Investing.com Bond News,Japan’s Election Results Could Send Shockwaves Through US Bond Market,https://uk.investing.com/analysis/japans-election-results-could-send-shockwaves-through-us-bond-market-this-week-200617701,"Jul 21, 2025 06:55 GMT",
2025-08-09T01:55:52,Investing.com Bond News,How Fed Could Inject Liquidity if Bond Yields Surge: What Investors Need to Know,https://uk.investing.com/analysis/how-fed-could-inject-liquidity-if-bond-yields-surge-what-investors-need-to-know-200617670,"Jul 17, 2025 13:37 GMT",
2025-08-09T01:55:52,Investing.com Bond News,US 10-Year Yield Holds Above Fair Value as Deficit and CPI Heat Up,https://uk.investing.com/analysis/us-10year-yield-holds-above-fair-value-as-deficit-and-cpi-heat-up-200617650,"Jul 16, 2025 11:56 GMT",
2025-08-09T01:55:52,Investing.com Bond News,Treasury Auction Shows Strength: Bid-to-Cover and Foreign Demand Surge,https://uk.investing.com/analysis/treasury-auction-shows-strength-bidtocover-and-foreign-demand-surge-200617554,"Jul 10, 2025 10:41 GMT",
2025-08-09T01:55:52,Investing.com Bond News,US 30-Year Yield Mispriced? Inflation and Deficits Point to Higher Rates,https://uk.investing.com/analysis/us-30year-yield-mispriced-inflation-and-deficits-point-to-higher-rates-200617522,"Jul 08, 2025 13:52 GMT",
2025-08-09T01:55:53,Google News Reuters,"US licenses Nvidia to export chips to China, official says - Reuters",https://news.google.com/rss/articles/CBMioAFBVV95cUxPbzBCT1lTTW9hd1NfLVlZeXpwZ3FEUFZsQ2tfVlYyWHJYM3ZVblFDTjlJUzJhaEJMYjJ0Vm5wcl9HeFhhQ0xMSk1XdGp5U1hPTHZrakRYVlgtaW1jdGlVRkY0ZFEzTU9OMXlHbUh3RHpHWnJiLWZEUEVEYUpUZ2huRXZlSnA4MHhiQWFpRlhJSWU2T3FFdzVKSG1scE5RQmFV?oc=5,"Sat, 09 Aug 2025 00:14:00 GMT",
2025-08-09T01:55:53,Google News Reuters,Trump announces peace agreement between Azerbaijan and Armenia - Reuters,https://news.google.com/rss/articles/CBMiogFBVV95cUxPNDVfdUxlck9pbGF1UTNfU0k3RF9NbXJpWGd2VTVoVzBiekc3em92ZmgwUWtDWEw2VTloczlBVnlvR19scXkwYTRObTdoYUZ4NFYxdEZYVXc0VUZ3VUE2TUxqbFlEVE1MQXVHR1lMNW0tUmNLeU9qOGt1YXA3ak9WRmluSnhCRDJZOUlJWGdPVU9TQmEwVHF3WElJbTJ6blhWcGc?oc=5,"Fri, 08 Aug 2025 23:49:07 GMT",
2025-08-09T01:55:53,Google News Reuters,Trump and Putin to meet to discuss Ukraine peace deal in Alaska - Reuters,https://news.google.com/rss/articles/CBMioAFBVV95cUxOM1VDZzBHVG9RMDkwNXZLM0hINkVTUG9SR3Z4a0t3UENLc205RzJybW5oalpCbGktek9mN3ZDRG44YTNXSzlKYTFBTW85WmlfNkxpMWJBMTdaQXJ4UjFVMThDempoejV4RGNpU25UdDRWdjZ6QlFmbEZ6ckhKbDZEa01mRnNMaEswOXB5NXRtVXFvMFdJVE8tRWRvTEtVTHJ2?oc=5,"Sat, 09 Aug 2025 00:21:56 GMT",
2025-08-09T01:55:53,Google News Reuters,Exclusive: Harvard patents targeted by Trump administration - Reuters,https://news.google.com/rss/articles/CBMiowFBVV95cUxPcTJIVkdBR0luVGozUmJsV2pmMlhibWZNb01rZjdIV3M0QmlZWmU1OGtDMDlISENqc2ZXTEktWXNrTEUxd1I4dEFfcVRFUFFDQ0FaVU56bElKX1dQQ2FBaUNtSFpQOWNNZnZzVy1yQ044Skx2SVJvM2pBTXRWbVlIbUVpRG55YkZMLUlPUEg1SldTWW9rQ2hYSjgxOFVBWXBjYXk4?oc=5,"Fri, 08 Aug 2025 21:45:37 GMT",
2025-08-09T01:55:53,Google News Reuters,"Oil steadies on reports of US-Russia deal, ends week about 5% lower - Reuters",https://news.google.com/rss/articles/CBMisAFBVV95cUxPWWw4VFJpRFFVUkEyMkZIaWpMckxXYi1TUmdFUGtpa0ZWdGdaaVR2MEZSaWxobDhWdTAxZU9jNHhjUkpWcWM1M3RhQlJUdDNkVFdkZk9tUzY3anhhLTFRNF9tclZFRFU3YzZ3RXYweDFrTFA0SUJFQlpyTkVZT2xvSEkwNndEellZejhseVNSRnEta0FFcnBYWkVZUVJ2T0hRUW53M2sydk1Tc0ltMUtHZQ?oc=5,"Fri, 08 Aug 2025 21:45:24 GMT",
2025-08-09T01:55:53,Google News Reuters,Trump announces peace deal between Azerbaijan and Armenia at White House - Reuters,https://news.google.com/rss/articles/CBMiqwFBVV95cUxNRE5ZM1E2RW55WXdWXzJkUUV6cG5rOVFWdnJXQ2RsUlE2NzYwbEx6M2l0Rm9BTnV6OGF2SFc4YVhXMWZLdHVnU3M4aFdMWkRfUUxNVHlWTTVDQzFpMnJSYU5CVTZHNXlERmY1c2p4MGIyanBBcXdxZTQzcW5rU1U1alBTX3d4WklKU2ZJWUk1UXF5eUVleDhJM1dwRktNMUU0V0lqUS1JVHFuX00?oc=5,"Fri, 08 Aug 2025 23:49:07 GMT",
2025-08-09T01:55:53,Google News Reuters,"Global stocks gain, gold futures hit record - Reuters",https://news.google.com/rss/articles/CBMiigFBVV95cUxNRDdibkFFb0tFY2hodTdaZTFSSUU0UURvV1ZKZmRrck1NOVV1SzBnMG9DdGNxZzU3VDJxT1RwUURTeTEyRjNHc085V29zdm1FYmVFNGFNTUtiNi1lQXpUZ2JBYlRVclk4ZkNxdmpOMVpwdWxQTWZ1UmFFOHM2ZUlab2ZFdG0xcEpJU0E?oc=5,"Fri, 08 Aug 2025 20:55:52 GMT",
2025-08-09T01:55:53,Google News Reuters,"Nasdaq posts record closing high with tech gains, rate cut optimism - Reuters",https://news.google.com/rss/articles/CBMisAFBVV95cUxQU19EeXFfdlcyZ0pIRmNXRjFTamtVSHAwMGZGb3hQODByWDdueWJqS2ZrN2I5a2pGVjdIdWRKSGd3RnE1UTlpQ042ODlWSHRHY3lGMXh3T3Y2dmNiaGR3UDl4Vm1CcDhkd1RuYzJndy1ic2E2OHNMNFpyNG9kWlNON1N1bkFfQWNIUWFqSWR5MG5LNG5QREFTTVdYQ0YzRDFueW5saGhyNzkyWmJueEVERw?oc=5,"Fri, 08 Aug 2025 21:12:24 GMT",
2025-08-09T01:55:53,Google News Reuters,"Trump fires IRS commissioner, Bessent named acting head - Reuters",https://news.google.com/rss/articles/CBMioAFBVV95cUxPNXRJbV9WTzJNaVAtQjkyT1dleFlwVVRvOTNtLTJ0LTJZWVExYWx2U1JpRjctV2ZsQjl6Nk5vTTRnRFZlR2tJU1AxRU5LNlRCSW5QMVFWOEhlYU5XQXZ0Sy1hS0s1dkc2eU54MldrOFhYdHhMUWR2Njg5MDBUdDJIRndoWWFzTDVRQXRIQVlBRGEwaExZMGZ6UF9xVF9RejBL?oc=5,"Fri, 08 Aug 2025 20:14:39 GMT",
2025-08-09T01:55:53,Google News Reuters,US gold futures pare gains after official says White House to clarify tariff policy on bullion bars - Reuters,https://news.google.com/rss/articles/CBMixwFBVV95cUxNNlgxMGY0MmZva2V0cjNONHgtcnc2bndZWWl2TFk0UVpMMWVyUWZ6aURVMXZETTdVWWd5Q0ZXQzg0TUk3aWFjenhrX2tDX1JWWjZOc09mR1JIX0JjSGxCUngwelNMQ3JRQU9HaWFaWnVYbEl1RHZ5YXlvbHluX0ttSWZncWNoSVZ4UUZyU3V4Rk5ieC1uQ2l6SWNHeTkwb1VlLXkzcjNzMWt5ai1McWw1Y1JUMnZtV25iQ2o3cmZZTWhiYWU4ZVBJ?oc=5,"Fri, 08 Aug 2025 19:13:51 GMT",
2025-08-09T01:55:53,Google News Reuters,"Trump administration eyes military action against drug cartels, US officials say - Reuters",https://news.google.com/rss/articles/CBMizAFBVV95cUxQVkVaRWcxTTZQcHUxY0ZFYkFuTGpBQ3NIa09IQVBzdGFYOWw4eW92VHBObUR3ZGhpN3F0R2x4R2drLWUtZTVyTzRSQzFBOV9qdkNFWko0UnlyQldmbk9iYW44X0VWZW5JVDBoYXVIYnJ4VlFQQy1RVF9EVVdCNF9JcUFRUWR3NkVNUEd5aWQ0cGQzSGNrblNVSHhMVzR5bkFBOUROU1ZvMlVRci02V2pMZ2pjMF9HNmtRSVh2aXluQVZpZjl6c1VQbk91VWI?oc=5,"Fri, 08 Aug 2025 18:38:35 GMT",
2025-08-09T01:55:53,Google News Reuters,As it happened: Trump hosts Azerbaijan and Armenia leaders at White House to sign peace deal - Reuters,https://news.google.com/rss/articles/CBMi0gFBVV95cUxPT0dMdGd4enozUHBKVDNPRS0tUklHajZFM2RIUmRRMjlScnlHam1jMmJLMk4xMlk0RTh2TUVBbHZOakNOQVk5ZWZvdlFNVFNjMlNsTFYwU0J3d01fZThZeEF2ajhmYzFaTWRpWEhlclpwVDJTeURiUFd6YVlCYnZ6OEwxbEd1bjhYZ0Y2TVliQkkzejFzajAtd2t2dExoQWtMS1JYUVhFV3BTYVNIY0JQWExPV056TzJKRGNRUW5HVl9scmhFV3d2YWN3dWFDSUh3ZGc?oc=5,"Fri, 08 Aug 2025 19:23:56 GMT",
2025-08-09T01:55:53,Google News Reuters,"Jim Lovell, commander of NASA's Apollo 13 moon mission, dies at 97 - Reuters",https://news.google.com/rss/articles/CBMirwFBVV95cUxOWENhLVAxSVdjOHRCNENTZ0xZTWpDU3ZGaVdNOGRVaWNnWDdWMjhWZXllS0RTR1JzdW1CY1pvZ180bkJ2eWgzNm9kSy1tUGhqcWZ1Zzkzak5sRU9oUTN1UWh4MndMU09FYVpwSG5JQlRCMFphb3YwaElYaWd6YllaUzk2aXhETDhrSDJYTTRTdld0eVg5TFNsNFVBbjRRc0RyakhUVHZHVWZtOWU3ZlVn?oc=5,"Fri, 08 Aug 2025 22:52:16 GMT",
2025-08-09T01:55:53,Google News Reuters,Canada joins allies in lowering price cap on Russian oil - Reuters,https://news.google.com/rss/articles/CBMipAFBVV95cUxORGxoZ2swbkxKR3RIdGc3UmVrVEZBdmlWNU4zOGFyZl9EUkI2OFdoLS1zckdIX0RNNmdqZjQxZ3FmdnNOa0RaVnQzSDBIek9QaWNXblRLYjl3dlhEVktLRnE5dld6MkdNQjdnQ3V5bVhKdl9XZTFYUmJycUFhYlFqU1NkMWxSVTZJcmRlX0I0WnlhQnZLelR6QUlsMHBWc0Fld1ZBRQ?oc=5,"Fri, 08 Aug 2025 21:03:55 GMT",
2025-08-09T01:55:53,Google News Reuters,"Trump administration eyeing IPOs for Fannie Mae and Freddie Mac this year, US official says - Reuters",https://news.google.com/rss/articles/CBMivwFBVV95cUxQb1VXYkRDb3pwNnRzU3hOYlpYWWtlYkdqOEdtQVlwSXpldXRFNlhkdENpQjU0M29pSENKZ25kQnlYTUJ2aHRzb1dCTVEtelhaV2NFNHh4cGxwTlc3LUdMRVdTSUNwRURPYzdWVHRRR3p5bnB6U3hFOXVQdVAxOEEzX2REQkdFaUxnQzZBclJRQS1WNlo4VkpmWi1abGloc1hQUkVxc085dTlZVkhlUXpTa0lwbVlUc3E0Z0xyX3c3SQ?oc=5,"Fri, 08 Aug 2025 18:34:43 GMT",
2025-08-09T01:55:53,Google News Reuters,"Wall Street gains with tech, rate cut expectations - Reuters",https://news.google.com/rss/articles/CBMimgFBVV95cUxQMUJqTlB3X0NzbDNFVUtCaGdfZ3g5R0IxTm11QWlSdE91NzBNY2JQQ2ZEUDNSOVVCZnc3WnR5cGsyWktMNHhxbFhpQjMtMXRmZWVFTXV2dmQwU01SYkhrbC1OZDRoMEFZbE9xaGN1TzBfbWZ4T2ZIU3pwRDJIdENBOGJ3cUxOZGE5cXQ1eGNLQm8yVy1CVHoyUzNn?oc=5,"Fri, 08 Aug 2025 18:50:59 GMT",
2025-08-09T01:55:53,Google News Reuters,University of California reviews US government's $1 billion UCLA settlement offer - Reuters,https://news.google.com/rss/articles/CBMiyAFBVV95cUxQdENERnBZdHNtdVZHRE85X196dVBZRG05eHpacVowbm5PbVJDRzE1YWZQVk5CcU16Z3kyYWplNk5JajdaX25oV05QbklDUU1xVUV1UzJDTlhaMmRsVDk3YlJyc1dpRWZzbWQ1R1VuZ2oxR1pqNmo2TFJPckVUcW5WWHd1bXBuRGhaRGJCclNCVXVFRUdTb0J3S0Y1THdQdDJGal9wUGZwbWNDa0Z5LUNySGZqYUZjZ2RueXFMcklDMnlmbFJKLV9zNw?oc=5,"Fri, 08 Aug 2025 21:22:27 GMT",
2025-08-09T01:55:53,Google News Reuters,Justice Dept probes New York AG James as it escalates scrutiny of Trump targets - Reuters,https://news.google.com/rss/articles/CBMiyAFBVV95cUxQQUM0ZzB2NmJvc3F1aFZUUEp5cl9RVTVkWE1pOEhWa1FQY1RsWmVLZWM2VW1tc29DZ2NsWUFtSDFvX1BUVGFwNnNPcFRhcHB3Unc3R2ZXMlJpakhzdEdvTTZLY2QxelNncGIzd216OURqekZBbUF3Vm1yWjI0NzNqckw1MHExblhUOTkzbE5TamRCblNHTXZ1QzJneVBobllYVEdnNlg3SkpQb3VKM2lVcGhIUTBNbU5KTmdteGpXbnNVWUZwMm80Sg?oc=5,"Sat, 09 Aug 2025 00:24:55 GMT",
2025-08-09T01:55:53,Google News Reuters,Trump's Fed pick wanted to upend its protection from politics - Reuters,https://news.google.com/rss/articles/CBMingFBVV95cUxQM3hfbmFNR1FRaDRFRi0tcVhzODZENlhJbGNacWdQa2hCZ05MZWtFSlhTUElGWHdQUWJMVkRJR1l2bjN4Q3BPR1A4WFZ2cTRDUWZpVUlfUW1KaDlNWFlhVmxNZWJJNFBRU0ZfNHdsdU5vR0JNVkdvYTdURXpySFBkQlhOVkpGbjVzVmZCTVJMaXBWem5SUzJaSWFXb3BNQQ?oc=5,"Fri, 08 Aug 2025 16:04:47 GMT",
2025-08-09T01:55:53,Google News Reuters,"US licenses Nvidia to export chips to China after CEO meets Trump, FT reports - Reuters",https://news.google.com/rss/articles/CBMiugFBVV95cUxONnc0MXBBMnF2NDZ5cV9ON3ZrMGVkV3VCbG5ORXB4b05BR1dWa2tOWk42ejNMbHAxMWE0R1k1U2ZSYnBaWk91dk0xb2RMWDY2X0RLQmV3c0RJaUFjQkEyaF9rUTl6S1VFVjVSOXhRZGFIdHdTb0FKNW9zcUl3OFVDS0M4dlE0alFkOU9uRUFwWk5ldTJ1c0hCeVdTS2Z5MFp4b3lLWlU0TnNfbkRfY3B6RzhBdl9RQUtDNEE?oc=5,"Fri, 08 Aug 2025 22:22:34 GMT",
2025-08-09T01:55:53,Google News Reuters,Veteran Belarus leader Lukashenko signals this may be his final term - Reuters,https://news.google.com/rss/articles/CBMirwFBVV95cUxQZXhDV19JUUJ2MEV3WWJqSDJvUXVmcDVNZWJhTS1YNlJHdlA2cWt5SFR5MUJpNEZWQUhRZHVmYkhScUdva1pOanh2TU12Z2V2TnJYZTVUcWFGU25hUlQ1bFhsRDI0cHFaSVJnWDE1NUJYb0wwbDJadi1BT2VlUjFMZjV5eWRYbk9NVXBXaGZvckF5NFJ2TzRGNkZ3YjlhZk80eEo2YU55Zm0xNTA3bWcw?oc=5,"Fri, 08 Aug 2025 15:01:35 GMT",
2025-08-09T01:55:53,Google News Reuters,"US and UK differ on Gaza but share goal to end crisis, Vance says - Reuters",https://news.google.com/rss/articles/CBMioAFBVV95cUxOOUIzdHNEX1E3M1hQbjdHNFkzTjVRbktPR0RXd3hoT3o2aXp6eVRaZXczS211N3pyV05NV21mU1NzbURocWxENTE4SDNqMGhURnB2Ylpkc095TjdTcmFqdEhqWEtrUkdIMHJrYlh5Vm03X05idVFKM0s0SHVBaE8wN2hhaWhxWTJhekhNSFJ1cnZuSE1pNTdBS3R4bGJRV21Z?oc=5,"Fri, 08 Aug 2025 17:07:31 GMT",
2025-08-09T01:55:53,Google News Reuters,White House to clarify tariffs for gold bars as industry stops flying bullion to US - Reuters,https://news.google.com/rss/articles/CBMitgFBVV95cUxPT1JUSWdSNmlPN2NZazU3cG90QWFEd3VtTFRobTNWN3BtZTRQUHNzZnhQS0laYzQwQXNEMEFHSHk1OWFMM0Y2bTFCN0VVWUYwRXd3Y1R3UjMxUGQwRkswaGtETU1xUEROQmNlNGpfRnBXQkxqQ2djbUtIcWVVS1g1cWlwenpVbGI5Sjc0c1d1TUNQOGR6a2QtM0x1Q0VRWmhNdnB4QWtKd3VxQ2k2a1B2eURmaVM5UQ?oc=5,"Fri, 08 Aug 2025 19:56:02 GMT",
2025-08-09T01:55:53,Google News Reuters,"Trump officials will not face contempt over Venezuela deportations, appeals court rules - Reuters",https://news.google.com/rss/articles/CBMizgFBVV95cUxNaFZzRWRESExwZHBMa3VrTkRjQ2tEa21MVm93RGRtYzVvQ19mS1hqQS1IMC0tVXQ3ZDhpN0dIWGtHcUlELVAyaVRUUFhoSGJfMEZuRUZRWjFNTVVGcGd2blVWRGpNcUdGcXVMYTV0bFozLVpqakpUZElpTkswUHpxMk5pQV9GTFF5c1p2OHRDRmlDVWc5UEsxZWlYZ1FKbW5zV25hSVBjck1rcmQtMnc3bkNSQmNlSUF2YXc0VllKRVREMkxDZWxKUnRQS0pEdw?oc=5,"Fri, 08 Aug 2025 18:43:55 GMT",
