timestamp,source,title,link,published,content
2025-08-23T01:45:40,MarketWatch Top,‘I can only rely on me’: How do I protect myself from my parents’ nursing-home bills?,https://www.marketwatch.com/story/i-can-only-rely-on-myself-how-do-i-protect-myself-from-my-parents-nursing-home-bills-db37b021?mod=mw_rss_topstories,"Fri, 22 Aug 2025 23:42:00 GMT",
2025-08-23T01:45:40,MarketWatch Top,Bond market rallies after Powell ‘walked a fine line’ with Jackson Hole speech,https://www.marketwatch.com/story/bond-market-rallies-after-powell-walked-a-fine-line-with-jackson-hole-speech-5ca81fab?mod=mw_rss_topstories,"Fri, 22 Aug 2025 23:25:00 GMT",
2025-08-23T01:45:40,MarketWatch Top,"‘I learned a hard lesson’: My ex-husband gambled away our $900,000 life savings. Do I use my 401(k) to buy a home?",https://www.marketwatch.com/story/i-learned-a-hard-lesson-my-ex-husband-gambled-away-our-900-000-life-savings-do-i-use-my-401-k-to-buy-a-home-182e026a?mod=mw_rss_topstories,"Fri, 22 Aug 2025 22:39:00 GMT",
2025-08-23T01:45:40,MarketWatch Top,"Are you middle class? No, you’re not. Here’s why.",https://www.marketwatch.com/story/are-you-middle-class-no-youre-not-heres-why-afcdf304?mod=mw_rss_topstories,"Fri, 22 Aug 2025 22:39:00 GMT",
2025-08-23T01:45:40,MarketWatch Top,Furniture companies’ stocks fall as Trump promises tariffs for the sector,https://www.marketwatch.com/story/furniture-companies-stocks-fall-as-trump-promises-tariffs-for-the-sector-01aeff10?mod=mw_rss_topstories,"Fri, 22 Aug 2025 21:41:00 GMT",
2025-08-23T01:45:40,MarketWatch Top,Intel agrees to 10% U.S. government stake. It may not be the last chip company to do so.,https://www.marketwatch.com/story/intel-agrees-to-u-s-government-stake-trump-says-why-it-may-not-be-the-last-chip-company-to-do-so-ed824ca0?mod=mw_rss_topstories,"Fri, 22 Aug 2025 21:32:00 GMT",
2025-08-23T01:45:40,MarketWatch Top,Retirees: The news from Jackson Hole is ominous for you,https://www.marketwatch.com/story/retirees-the-news-from-jackson-hole-is-ominous-for-you-9ca906f0?mod=mw_rss_topstories,"Fri, 22 Aug 2025 21:28:00 GMT",
2025-08-23T01:45:40,MarketWatch Top,I’m a widow living off Social Security. I have $200K invested. Why does my broker ignore me?,https://www.marketwatch.com/story/im-a-widow-living-off-social-security-i-have-200k-in-a-brokerage-account-so-why-am-i-ignored-c01398e4?mod=mw_rss_topstories,"Fri, 22 Aug 2025 21:00:00 GMT",
2025-08-23T01:45:40,MarketWatch Top,‘The money went into his account’: Is my father trying to swindle me out of my grandparents’ $800K home?,https://www.marketwatch.com/story/the-money-went-into-his-account-is-my-father-trying-to-swindle-me-out-of-my-grandparents-800k-home-7176ba11?mod=mw_rss_topstories,"Fri, 22 Aug 2025 20:37:00 GMT",
2025-08-23T01:45:40,MarketWatch Top,"As a nurse, I’ve seen people use their power of attorney to take advantage of their parents. Watch out for these warnings.",https://www.marketwatch.com/story/as-a-nurse-ive-witnessed-people-abuse-their-power-of-attorney-here-are-the-signs-5f9137ad?mod=mw_rss_topstories,"Fri, 22 Aug 2025 20:29:00 GMT",
2025-08-23T01:45:41,CNBC Top News,"U.S. government takes 10% stake in Intel, as Trump expands control over private sector",https://www.cnbc.com/2025/08/22/intel-goverment-equity-stake.html,"Fri, 22 Aug 2025 21:12:48 GMT",
2025-08-23T01:45:41,CNBC Top News,Trump says furniture tariffs are coming later this year,https://www.cnbc.com/2025/08/22/trump-tariffs-furniture-trade.html,"Fri, 22 Aug 2025 21:17:41 GMT",
2025-08-23T01:45:41,CNBC Top News,Ether notches first new record since 2021 after Powell speech teasing rate cuts,https://www.cnbc.com/2025/08/22/crypto-market-today.html,"Fri, 22 Aug 2025 23:06:07 GMT",
2025-08-23T01:45:41,CNBC Top News,Ghislaine Maxwell interview released by DOJ; Epstein procurer questioned about Trump,https://www.cnbc.com/2025/08/22/ghislaine-maxwell-transcripts-trump-epstein-doj.html,"Fri, 22 Aug 2025 22:14:18 GMT",
2025-08-23T01:45:41,CNBC Top News,"Meta to unveil Hypernova smart glasses with a display, wristband at Connect next month",https://www.cnbc.com/2025/08/22/meta-hypernova-ar-glasses-wristband.html,"Fri, 22 Aug 2025 22:14:39 GMT",
2025-08-23T01:45:41,CNBC Top News,Google shares rise on report of Apple using Gemini for Siri,https://www.cnbc.com/2025/08/22/google-shares-rise-on-report-of-apple-using-gemini-for-siri.html,"Fri, 22 Aug 2025 21:56:52 GMT",
2025-08-23T01:45:41,CNBC Top News,Powell indicates conditions 'may warrant' interest rate cuts as Fed proceeds 'carefully',https://www.cnbc.com/2025/08/22/powell-indicates-conditions-may-warrant-interest-rate-cuts-as-fed-proceeds-carefully.html,"Fri, 22 Aug 2025 19:58:42 GMT",
2025-08-23T01:45:41,CNBC Top News,Canada drops many of its retaliatory tariffs on the U.S.,https://www.cnbc.com/2025/08/22/canada-retaliatory-tariffs-trump-autos-steel.html,"Fri, 22 Aug 2025 18:42:30 GMT",
2025-08-23T01:45:41,CNBC Top News,"Inside Texas Instruments' $60 billion U.S. megaproject, where Apple will make iPhone chips",https://www.cnbc.com/2025/08/22/apple-will-make-chips-at-texas-instruments-60-billion-us-project.html,"Fri, 22 Aug 2025 13:50:10 GMT",
2025-08-23T01:45:41,CNBC Top News,Wage growth is doing something odd in 2025 — the last time it happened was around the Great Recession,https://www.cnbc.com/2025/08/22/wage-growth-2025-job-switcher-job-stayer.html,"Fri, 22 Aug 2025 13:55:12 GMT",
2025-08-23T01:45:41,CNBC Top News,"John Bolton was not targeted for criticizing Trump, Vance claims after FBI raid",https://www.cnbc.com/2025/08/22/john-bolton-investigation-vance-trump-fbi-raid.html,"Fri, 22 Aug 2025 18:52:06 GMT",
2025-08-23T01:45:41,CNBC Top News,Cybersecurity firm Netskope files to go public on the Nasdaq,https://www.cnbc.com/2025/08/22/cybersecurity-firm-netskope-ipo-nasdaq.html,"Fri, 22 Aug 2025 21:59:30 GMT",
2025-08-23T01:45:41,CNBC Top News,Cleveland Fed's Hammack casts doubt on interest rate cuts amid inflation worries,https://www.cnbc.com/2025/08/22/cleveland-feds-hammack-casts-doubt-on-interest-rate-cuts-amid-inflation-worries.html,"Fri, 22 Aug 2025 17:42:25 GMT",
2025-08-23T01:45:41,CNBC Top News,Here's what current and former Fed officials are saying about Lisa Cook investigation,https://www.cnbc.com/2025/08/22/heres-what-current-and-former-fed-officials-are-saying-about-lisa-cook-investigation.html,"Fri, 22 Aug 2025 18:50:10 GMT",
2025-08-23T01:45:41,CNBC Top News,Higher tariffs are kicking in. Here's what Walmart and other retailers said about their impact,https://www.cnbc.com/2025/08/22/retail-earnings-walmart-target-home-depot-discuss-tariffs.html,"Fri, 22 Aug 2025 17:18:49 GMT",
2025-08-23T01:45:41,CNBC Top News,"Major League Baseball closes in on new media rights deals with ESPN, NBC, Netflix",https://www.cnbc.com/2025/08/22/mlbrrights-espn-nbc-netflix.html,"Fri, 22 Aug 2025 22:11:09 GMT",
2025-08-23T01:45:41,CNBC Top News,"OpenAI CEO Sam Altman: The AI era is 'probably the most exciting time to be starting out one's career, maybe ever'",https://www.cnbc.com/2025/08/22/openai-ceo-says-ai-era-is-exciting-time-to-start-a-career.html,"Fri, 22 Aug 2025 17:17:00 GMT",
2025-08-23T01:45:41,CNBC Top News,"Leaders, laggards after Powell's speech — plus, key Starbucks, Honeywell updates",https://www.cnbc.com/2025/08/22/leaders-laggards-after-powells-speech-plus-key-starbucks-honeywell-updates.html,"Fri, 22 Aug 2025 18:50:14 GMT",
2025-08-23T01:45:41,CNBC Top News,Trump says he'll fire Fed Governor Lisa Cook 'if she doesn't resign',https://www.cnbc.com/2025/08/22/trump-fire-fed-lisa-cook-powell.html,"Fri, 22 Aug 2025 16:15:56 GMT",
2025-08-23T01:45:41,CNBC Top News,"The new gold play as investors look to hedge against risk, volatility",https://www.cnbc.com/2025/08/22/the-new-gold-play-as-investors-look-to-hedge-against-risk-volatility.html,"Fri, 22 Aug 2025 17:06:17 GMT",
2025-08-23T01:45:41,CNBC Top News,"The summer box office sizzled, but brace for a cooldown until November",https://www.cnbc.com/2025/08/22/summer-box-office.html,"Fri, 22 Aug 2025 16:33:57 GMT",
2025-08-23T01:45:41,CNBC Top News,Watch Fed Chair Powell's full policy speech at Jackson Hole,https://www.cnbc.com/2025/08/22/watch-live-fed-chair-powell-delivers-key-policy-speech-at-jackson-hole.html,"Fri, 22 Aug 2025 15:37:32 GMT",
2025-08-23T01:45:41,CNBC Top News,Student loan borrowers in default could soon see reduced paychecks. What to know,https://www.cnbc.com/2025/08/22/student-loan-borrowers-in-default-face-wage-garnishment.html,"Fri, 22 Aug 2025 18:42:05 GMT",
2025-08-23T01:45:41,CNBC Top News,"Cracker Barrel faces social media pushback on new logo, brand refresh",https://www.cnbc.com/2025/08/21/cracker-barrel-cbrl-new-logo-branding.html,"Fri, 22 Aug 2025 13:09:43 GMT",
2025-08-23T01:45:41,CNBC Top News,"FBI raids home, office of John Bolton, former Trump national security advisor",https://www.cnbc.com/2025/08/22/fbi-raid-john-bolton-trump-patel.html,"Fri, 22 Aug 2025 18:49:40 GMT",
2025-08-23T01:45:41,CNBC Top News,Kimbal Musk on Elon's Tesla pay package: 'My brother deserves to be paid',https://www.cnbc.com/2025/08/22/kimbal-musk-elon-tesla-pay.html,"Fri, 22 Aug 2025 17:38:26 GMT",
2025-08-23T01:45:41,CNBC Top News,Stellantis unveils new Jeep Cherokee as brand tries to shake off sales declines,https://www.cnbc.com/2025/08/21/stellantis-2026-jeep-cherokee-suv-hybrid.html,"Fri, 22 Aug 2025 12:09:41 GMT",
2025-08-23T01:45:41,CNBC Top News,Powell hints at potential interest rate cuts. What that means for homeowners hoping to refinance,https://www.cnbc.com/2025/08/22/fed-rate-cuts-mortgage-refinance.html,"Fri, 22 Aug 2025 16:03:00 GMT",
2025-08-23T01:45:41,CNBC Top News,"Fed's Powell signals rate cuts are coming, and the stocks that need them the most are flying",https://www.cnbc.com/2025/08/22/feds-powell-signals-rate-cuts-are-coming-and-the-stocks-that-need-them-the-most-are-flying.html,"Fri, 22 Aug 2025 16:50:37 GMT",
2025-08-23T01:45:41,CNBC Top News,"John Deere faces a crossroads amid decreasing demand, increasing investments",https://www.cnbc.com/2025/08/22/john-deere-demand-layoffs.html,"Fri, 22 Aug 2025 13:37:21 GMT",
2025-08-23T01:45:41,Investing.com All News,Form 13G Dave Inc. For: 22 August,https://uk.investing.com/news/filings/form-13g-dave-inc-for-22-august-93CH-4235234,2025-08-23 01:02:08,
2025-08-23T01:45:41,Investing.com All News,"Cathie Wood's ARK sells Shopify, Coinbase stock; buys PagerDuty",https://uk.investing.com/news/company-news/cathie-woods-ark-sells-shopify-coinbase-stock-buys-pagerduty-93CH-4235233,2025-08-23 00:04:07,
2025-08-23T01:45:41,Investing.com All News,US halts offshore work on Revolution Wind project,https://uk.investing.com/news/company-news/us-halts-offshore-work-on-revolution-wind-project-93CH-4235232,2025-08-22 23:56:06,
2025-08-23T01:45:41,Investing.com All News,Form 144 GeneDx Holdings Corp. For: 22 August,https://uk.investing.com/news/filings/form-144-genedx-holdings-corp-for-22-august-93CH-4235231,2025-08-22 23:16:06,
2025-08-23T01:45:41,Investing.com All News,TikTok to cut hundreds of UK moderation jobs amid Online Safety Act rollout: report,https://uk.investing.com/news/stock-market-news/tiktok-to-cut-hundreds-of-uk-moderation-jobs-amid-online-safety-act-rollout-report-4235230,2025-08-22 23:10:11,
2025-08-23T01:45:41,Investing.com All News,Form 144 SOUTHSTATE CORPORATION For: 22 August,https://uk.investing.com/news/filings/form-144-southstate-corporation-for-22-august-93CH-4235228,2025-08-22 23:00:07,
2025-08-23T01:45:41,Investing.com All News,Form 144 Red Rock Resorts For: 22 August,https://uk.investing.com/news/filings/form-144-red-rock-resorts-for-22-august-93CH-4235227,2025-08-22 23:00:07,
2025-08-23T01:45:41,Investing.com All News,Form 144 RUSH ENTERPRISES INC TX For: 22 August,https://uk.investing.com/news/filings/form-144-rush-enterprises-inc-tx-for-22-august-93CH-4235226,2025-08-22 22:32:06,
2025-08-23T01:45:41,Investing.com All News,Elite Express Holding completes $15.2 million IPO on NASDAQ,https://uk.investing.com/news/stock-market-news/elite-express-holding-completes-152-million-ipo-on-nasdaq-432SI-4235225,2025-08-22 22:20:06,
2025-08-23T01:45:41,Investing.com All News,Form 144 Moelis & Company For: 22 August,https://uk.investing.com/news/filings/form-144-moelis--company-for-22-august-93CH-4235224,2025-08-22 22:18:07,
2025-08-23T01:45:41,Investing.com Bond News,Treasury Yields Slip Ahead of Jackson Hole,https://uk.investing.com/analysis/treasury-yields-slip-ahead-of-jackson-hole-200618276,"Aug 22, 2025 06:50 GMT",
2025-08-23T01:45:41,Investing.com Bond News,Rates Spark: Chair Powell to Be His Own Man,https://uk.investing.com/analysis/rates-spark-chair-powell-to-be-his-own-man-200618274,"Aug 22, 2025 05:41 GMT",
2025-08-23T01:45:41,Investing.com Bond News,Inflation Signals Set Stage for Treasury Curve Steepening,https://uk.investing.com/analysis/inflation-signals-set-stage-for-treasury-curve-steepening-200618270,"Aug 22, 2025 05:07 GMT",
2025-08-23T01:45:41,Investing.com Bond News,Bond Market Awaits Powell’s Speech for Hints on Rate Cuts,https://uk.investing.com/analysis/bond-market-awaits-powells-speech-for-hints-on-rate-cuts-200618257,"Aug 21, 2025 11:54 GMT",
2025-08-23T01:45:41,Investing.com Bond News,Rates Spark: Inflation Blinkers On,https://uk.investing.com/analysis/rates-spark-inflation-blinkers-on-200618243,"Aug 21, 2025 06:37 GMT",
2025-08-23T01:45:41,Investing.com Bond News,Rates Spark: Index Disappointment Vs. AAA Squeeze,https://uk.investing.com/analysis/rates-spark-index-disappointment-vs-aaa-squeeze-200618222,"Aug 20, 2025 07:15 GMT",
2025-08-23T01:45:41,Investing.com Bond News,How Treasury's Cash Balance Rebuild Could Drain Liquidity and Impact Markets,https://uk.investing.com/analysis/how-treasurys-cash-balance-rebuild-could-drain-liquidity-and-impact-markets-200618194,"Aug 19, 2025 06:53 GMT",
2025-08-23T01:45:41,Investing.com Bond News,Rates Spark: Heavier Treasuries Despite the Buying,https://uk.investing.com/analysis/rates-spark-heavier-treasuries-despite-the-buying-200618199,"Aug 19, 2025 05:48 GMT",
2025-08-23T01:45:41,Investing.com Bond News,Eurozone Long-Term Yields Under Pressure as Debt Supply Builds,https://uk.investing.com/analysis/eurozone-longterm-yields-under-pressure-as-debt-supply-builds-200618172,"Aug 18, 2025 08:04 GMT",
2025-08-23T01:45:41,Investing.com Bond News,The Index Isn’t Always Accurate: Factors Influencing Yields,https://uk.investing.com/analysis/the-index-isnt-always-accurate-factors-influencing-yields-200618100,"Aug 16, 2025 10:00 GMT",
2025-08-23T01:45:42,Google News Reuters,"US to take 10% equity stake in Intel, in Trump's latest corporate move - Reuters",https://news.google.com/rss/articles/CBMipgFBVV95cUxPYlI5bGJMdHByaDJzM0xPUFdmbWZQZV9lQlZrZEo4ZUowQ2hkTnJXLVBxb25EX2NvSzUtanRUYWFna1JmenVldEd1Z1pUdTlhOFF2TFN4ZTJ5OWxKaER2dDNiT3F4ZWxaanVaVFNfSjVTMktDMEpKVXJtWDM0WHdWaEtoMWNUZTc4VWhCUDRYSjFVUTMyZVROTnJ6d0xQUUZOR1pfWU1n?oc=5,"Sat, 23 Aug 2025 00:19:00 GMT",
2025-08-23T01:45:42,Google News Reuters,"Tour bus rolls over on New York highway, killing 5 and injuring dozens - Reuters",https://news.google.com/rss/articles/CBMiqwFBVV95cUxOaHV4UURrUTlSQk0wQ2xrWmk1NXBGSHNFMERrSE9SSlBLVzFHWlVRUWp4ZmNMdHRUZkxkU1kxV1pwMzBOZHQ5Zk1ISTNBcXE2N3dNSjYzMDdhekhRazFmLWdoVU4wZEgtM1h5VU5qS0hpd0oxRU1BQ04yang0OWdydzN6ZU9vTGF4X3pvNUFvRVBGU2RMaTczcVJFcVBhdmJuZXBiQV9oMUF6RGM?oc=5,"Fri, 22 Aug 2025 23:29:42 GMT",
2025-08-23T01:45:42,Google News Reuters,Ghislaine Maxwell told DOJ she is unaware of any Epstein 'client list' - Reuters,https://news.google.com/rss/articles/CBMirwFBVV95cUxPdDI0OUx4VVp4Y0Nwc2p2TEVMU0RSWHlGNWh0Y01XS3FZQkJpV01QZ1B4WnZhMlVsczdzMS1hSUxYZXRRRnlzQk5oV2JFWGthZ1NWbjVNVVRRU3hIN0ZLZFJndk5WWXkzNzRKX1Q4WDlQNlVMQW95cFhSaC1qSDQ0Mmk0dmJiTjBJQmYzWXZwNUNtcFV3Mk9xWGd5MUkzZG9YTWJVQnYzOVJ2eXl4Y3NB?oc=5,"Fri, 22 Aug 2025 22:49:13 GMT",
2025-08-23T01:45:42,Google News Reuters,Exclusive: Databricks to buy Sequoia-backed Tecton in AI agent push - Reuters,https://news.google.com/rss/articles/CBMipgFBVV95cUxNdDBpUlM0U1hSNnZzbXJpcjg1Rkk3ZzdsVm83SWlhMHFHWWVjWkhuQkJvcmFlbl9jMUxnNzhxUkZJV2VvN1pRU29OejBQOFlHQ0xzS0NNTjdicFQ1TmVTYkFJcWQyaWxVNEZleFhaTm1UcEpjeXZMLU9yNVVFUGVGY3EwX05sbWFNTzYwZlgwb29qOG0xRFBHaVVmOFgyZ0k3bUZUczRB?oc=5,"Fri, 22 Aug 2025 23:10:59 GMT",
2025-08-23T01:45:42,Google News Reuters,"In latest purge, Hegseth removes head of Pentagon intelligence agency, other senior officials - Reuters",https://news.google.com/rss/articles/CBMivAFBVV95cUxQNEJuTzNIX0VZUmxTVDJJTVNieWRESkdfcUJQTW9YWTk3aHZjTFpMLW11STlXR1E5Vm1BQ3hEb0UyYTZxQzBqNkk2cTRrQ2gyZmN2UkRPVVRmb1R6a2p5ZFFDUWxQV0RIVUx6UnlnMUV0X21OOU9pbHRZOVViWG9yTTdSaEYzQkowS0lvMDVmd1l3S3ZVQVJoM3J4NF9hM2IySDZkTnIyWVo0WmJ4cUpZV2dqUmFZUHFwT3hfaw?oc=5,"Fri, 22 Aug 2025 22:03:51 GMT",
2025-08-23T01:45:42,Google News Reuters,"Wrongly deported migrant Abrego released, but he may be detained again - Reuters",https://news.google.com/rss/articles/CBMirwFBVV95cUxQMVJHa3FBRm1SWGVZd09BYmd6Sm05eWZEaDFWb2VPN3p6NHBNWHlWOUNsMkFCQTVFbl9pX1AwaGVTQ19lLVhYTm9GUVEtWXRvbmluTGtzMnJFRVdUaFRfUWpLaHdDbDRxRU0zOTBKcnpXejZvc0pMeGJ1RWhMMzA3eHhGaG5PSVhibXYxdDFJalNOdDZYMG9lQXBzV3JOV05jUUlQWm1OTXRVTl9MMUY4?oc=5,"Fri, 22 Aug 2025 22:14:07 GMT",
2025-08-23T01:45:42,Google News Reuters,Trump nominates Sergio Gor to be next US ambassador to India - Reuters,https://news.google.com/rss/articles/CBMipAFBVV95cUxQdC1jVnY2U2J0Z0dXeWE5dXo1cDFKQkpqLTZhRlJBWDF1YWxsUmFkWG94NEpSdnp4ZHctUWZfSFptT0plS01GSFoySE1XTTdqOGpYbm5POUc4cDFoUkE4al9PSGN1RnNCdk9McDVTa1doSDIyVzdhNXZlZm9ZWGo5d2FvemEwc01FdWR6N0FEZUhjUDRwaVRXR1ZlbEQ5Ynh0VldKTg?oc=5,"Fri, 22 Aug 2025 23:07:10 GMT",
2025-08-23T01:45:42,Google News Reuters,North Korea says South Korea fired warning shots in border region - Reuters,https://news.google.com/rss/articles/CBMiuAFBVV95cUxNdVdVUUhYanlxRFlfZUhOMGNodUlsd3F0a2c2UDdEWjk4aG9rWS13aVRrZFlKQ09kTHRxcWhIYkpsTGtqYjhRelVpMjJUY3kxalFDQndhN0VpV3dObVBEMDVxRS1Gdld1RWVuNFozbjV4VFJETEdTX2lpajBkM1lQWFQtWUMzaVNfdlkzX3lxUVpseWpQZS1kSmVzZS1Rc0JFN3k2bUZBUmRkZ0RYZ0tRMEtVaE53S0Vq?oc=5,"Fri, 22 Aug 2025 21:53:07 GMT",
2025-08-23T01:45:42,Google News Reuters,"With no Ukraine peace deal, Trump again threatens Russia sanctions - Reuters",https://news.google.com/rss/articles/CBMitAFBVV95cUxPeENIQ3pmcDdwbzJ0b1pDendSa1ZsZk9zRmRQbjZOR3QzX1VuQ2FjWkg1a09xV1Nic09lSjRaR2RkaHFKTmlEdUItY3JaUDQ4VW0yaE5YVS1RTzhNZ0hwWEV2WUw2QUlJZ0RONzVtYXdTR3dmQ21yZXRyM0xKOTI5RFlqdkZHUEkyUjRSVnh1Zjk5ZXQ3Z2dod0I4QnhXMVdfVEM1TFFrazdYY09kTUMyclVodUU?oc=5,"Fri, 22 Aug 2025 21:54:44 GMT",
2025-08-23T01:45:42,Google News Reuters,Wall Street closes higher as Powell hints at Fed rate cut - Reuters,https://news.google.com/rss/articles/CBMinAFBVV95cUxNdkt6ZzhlRTFLV0QxMGFoTVJuangtTEFFTVItWlBtbUNsbjlxMUNvWjJQSGNoSk5BRC1RU2pRQzAxOGFNY19lLUxHb3diNFp3NFpnRmNBVERYNG84anAzTGpXRl9sYktfdXh5c1JkenhmamtLZXVoN1JPaEdqZ2xzb3BkRDJ0T1RqQ3NBWk1uYXJQbV9sYmdvZ3B1a3U?oc=5,"Fri, 22 Aug 2025 20:00:38 GMT",
2025-08-23T01:45:42,Google News Reuters,Exclusive: Trump plans to make Cold War-era plutonium available for nuclear power - Reuters,https://news.google.com/rss/articles/CBMitgFBVV95cUxPTmpSS2Ytd3FvV3lQaXNjYUI3cENteGZFQXlyV1A0cTR0a2tSUThuTjNaWTZmYzRJb19UMjNHM3VJTzQxQ0VrajJuM1J6Q21WWEVwcTcwSHpydVVzYzdnanNBd0lQLWJiUHVOS3cxbmVWRk14WmNSTnNZMS1oWHVWNG54elZxWVhXSllCekVZVzNvWEh3bHROdkYxSmUtNkJ6MXVRM0ROcGp3TFM1cVJOZXRNdnZPUQ?oc=5,"Fri, 22 Aug 2025 20:51:10 GMT",
2025-08-23T01:45:42,Google News Reuters,Dow notches record high as Wall Street cheers Powell's speech - Reuters,https://news.google.com/rss/articles/CBMipAFBVV95cUxPd1owT0p2dFF5LVowMXJSel9ENDF0SHNySmRlTm5PLUY1cWtrNzBjRWZBLUlDOEVrVDJjSEdDMmFOTklnRTlCb1NFM3pYbE9jVWY0VDNZNHkzNHk0UF9CVndGaTBzeHdZNFZMMl9FVERydm5xX3dtb3dNVEJ3aVhJNkgxcGoyVkxuVUVRakwtOTFZRGQ2Qm9rVFhsWnhyZFN4eHA1MQ?oc=5,"Fri, 22 Aug 2025 22:16:56 GMT",
2025-08-23T01:45:42,Google News Reuters,Meta partners with Midjourney to license AI tech for future products - Reuters,https://news.google.com/rss/articles/CBMiqgFBVV95cUxPLXp5eEw1Rmt1cmRzc3VhQW1Xd01tVEljWWE2RmRMRlhadWZkWlFvcF9Jdi1KYnZFZllRLUNKakJvM3A0azQyN19PUmhhUTBWVlJRM2FXVjFYTDlRSEpfXzZ0aTJ0aTM5VE9aZXhKaHY2NWVvaXRrbTh5ekVESERseHFQVzdBenhBLXMxVkdaY2Y0aXllZm00c04zUzh3NkoyWmpSenc0UGpGdw?oc=5,"Fri, 22 Aug 2025 22:56:58 GMT",
2025-08-23T01:45:42,Google News Reuters,"Canada to remove many retaliatory tariffs on US, Carney says - Reuters",https://news.google.com/rss/articles/CBMipwFBVV95cUxOTUFBZmpMdWFnUDFZdU96SFFrcWhYSkJtOXlsZkxGQ0JST21JZXRGbG9uTTNXQ0d6YlVrcTFsYXFyeWVvUVVra1BzaG5VcmRxZFZNTDE5UXFOd0g2NDNlWWprZEZUek5HbGNpUFhEZWtSVFNXUWdkN0tnVy1waHBsS0hmWFhkRWdaOVJldmc3UjVvcFVZbUVPd3ZWVkx6TzRaV19CRVBfSQ?oc=5,"Fri, 22 Aug 2025 19:05:25 GMT",
2025-08-23T01:45:42,Google News Reuters,"Oil prices rise, make weekly gains as Ukraine peace process stalls - Reuters",https://news.google.com/rss/articles/CBMitAFBVV95cUxPTjZkVkc4RGlCb2o4WWN0cTFvc29vOWVSZ2lmTnZzQWl2QUxGdmRjUlp6X3hvNnM2VTRtbHh5MENqaXJfT0NEaU82TnYxcl9xQ1FZY2JQbXppYTJEemEtckEwZk5YLVk1SG9PVFBuU29NVVdjTndKcnJBOW5fTE5xeXhfWjVLZEJWRmNKRUtlY21oZGxENkRvMWFPNmIxMUZXTnZuZ1c0VkFCRmxoVV9WRmdfdEk?oc=5,"Fri, 22 Aug 2025 19:06:26 GMT",
2025-08-23T01:45:42,Google News Reuters,Boeing Defense workers hold out for better deal - Reuters,https://news.google.com/rss/articles/CBMipAFBVV95cUxQYkNUdEs3TVBONmprMEtRMVdLTk44RjVCZS1ZV3FwZUpxR0o0ai16akNlaU9Oc2JXQjRGdktOX0xUTjYtaXlvNnU0ZWRoVUVPZGwyM0hFTzVCS1c2aW9kVV91TDVPSjRmUDlwRW50a2M2Rmd6ZkVJY1NzRTl3Tm5CMDBPRm5ibWFXaVdQT29oaG1DTmt4bkpPT2ZrR3J6b3ZwcUhKdA?oc=5,"Fri, 22 Aug 2025 19:09:00 GMT",
2025-08-23T01:45:42,Google News Reuters,"Trump threatens federal intervention in Chicago, government takeover in D.C. - Reuters",https://news.google.com/rss/articles/CBMisgFBVV95cUxOcmlhc1laWDhOeFlCR0o0ZlNybUp4WVhRcDZfN0FmRE82akJveG1GNUdMbnp3WkxXOVFwcjlRV3BkZk1idVN1ZFQ4N1RKMHRoTmpTRFl6Z3V3RHlSQjdoSFltQS1mcHBkYTRwOU9YT05MdmFTMXlpTkZGblhFa29lWjRfODNiRnVNQ3ZmOEtlU0hRYWZRUmloOW5yV0N6cHhfSFAtYlRxa1Y0c1B5ejFFXzhB?oc=5,"Fri, 22 Aug 2025 22:07:55 GMT",
2025-08-23T01:45:42,Google News Reuters,Wall St jumps after Powell hints at possible Fed rate cut - Reuters,https://news.google.com/rss/articles/CBMioAFBVV95cUxQUG5mMFRYcDJVRkRjcWZEb1pGd2F4NGp3R1NOUXROdWEyM3RFMm53bklFOHhrYW10Qll1VXFtalV4dVpGTVJ5R1V5Y0ZvVE5QbWJBZnFPN3lNeXV6VUt6RU01Y0VPaWVzMkEtQ0ZrekVjRDNGbzBoSU9aWVpTc3RNRjJTWTQ5d0I4bTdfWTIzWXhULVd6dXFNT2h6X0dPZ1hL?oc=5,"Fri, 22 Aug 2025 19:37:17 GMT",
2025-08-23T01:45:42,Google News Reuters,"Powell says Fed may need to cut rates, will proceed carefully - Reuters",https://news.google.com/rss/articles/CBMirAFBVV95cUxQNkl4OUp0aVhveWVKSVAzV2JDR2pSUUgxV0hNdVZINy0tTTNibE13U3ZUSHZ3U0xmRXA3OTNpUGpqUEsyUzgtSnVadzllVnZqOWF6a08xUTVGcE5zTWJjbGVQOHVhR0pCUS1aNlhYTGd2RGp5czFOMXA5ei0xbS1UeUI3cDR2Zi1iblROblQ3SHBTR2xIc1pmQno2cUNwZ185OTJkVVZqNDlZUVFC?oc=5,"Fri, 22 Aug 2025 19:39:58 GMT",
2025-08-23T01:45:42,Google News Reuters,Trump: Could impose sanctions on Russia in two weeks - Reuters,https://news.google.com/rss/articles/CBMimgFBVV95cUxOQ2t4aEFUQkdhOFVtd2dWeDNaQTl3TEtFeGM0a29iT3NjQktwUG9mUEttdWhrOVI3TlpLc2dZY1BPdzlJMGhuN1l4anMtdG1DN3VNaEZ2UzZYNVFvSjVHMEdYMGEtWmFNbnhMTk55ZWNNUUROVGE5SFVrWWdxY2dUelZmQ1h2czFMTXgwRHV0WWZxZ0FZa0E0dDVn?oc=5,"Fri, 22 Aug 2025 17:49:29 GMT",
2025-08-23T01:45:42,Google News Reuters,Trump says he will next take his crime crackdown to Chicago - Reuters,https://news.google.com/rss/articles/CBMiowFBVV95cUxPbl9fSWt1czRIN0x3bXlpNF9IVGItbS1tTzI4bWJhN3g1RWZMNzFrUDlndzZOWlF4UzhGM0p6cVROck8weXlqYW0ta0p1amw1UUtXeDlGT01tdkdNaXZDMmlYcTdERF9VbEhCSTFpVXRUWUNmbmtCXzVNam85cHlSWXIzclV5MlFfYzhiWEw0TEhBMEN4SmN4cTVRaWptN20zT3Rn?oc=5,"Fri, 22 Aug 2025 18:08:23 GMT",
2025-08-23T01:45:42,Google News Reuters,"CSX-BNSF railroad pact lessens expectations of quick merger, analysts say - Reuters",https://news.google.com/rss/articles/CBMitAFBVV95cUxPQm5jZVdZbFNOd00yVWUyc0hsZC1QbEJlOU9qZHhFVDJsV3lzVGttdWVwZERYZXpLeEdONkVCbEFkUlNsb01EcWxGTDE5cnBjeXczZGJySVlsTnBmejNjbFNpZm5nckotaVFfam5Rb2hpRUx2dmsza1liRXBSRm5UejVuMzJHRzZuRGpIbUEzV3MyQnhCSTQteHZkV00xVzVNb2lHYnNtVnhjYk8wVVBnT25XWVo?oc=5,"Fri, 22 Aug 2025 20:41:24 GMT",
2025-08-23T01:45:42,Google News Reuters,"Trump's tariffs could reduce US deficit by $4 trillion, CBO estimates - Reuters",https://news.google.com/rss/articles/CBMisAFBVV95cUxNMHFOUzloaEZ4R2g4bEl0NFZwdEhfWmVjZHFKVkhGek9USFZVMi12OE1kdWVsVlFnZzhTZGd0WVlTVGtxRWMzYWI5Tk1yTjVWM2Rfa3dkWUVBZFZvaEJWaWRqNXNvaENzbkFHYzJ0VTFBajNJMEZkaHU1aERlYjFnZ0hkSEdIZ01vX0ZTWHNtN01MMEdybUlXZ1hCYUU2U0pJT1hGTGV2T0JDYUt1MmdkLQ?oc=5,"Fri, 22 Aug 2025 17:09:10 GMT",
2025-08-23T01:45:42,Google News Reuters,"Powell fires up markets, but some investors see reason for caution - Reuters",https://news.google.com/rss/articles/CBMirwFBVV95cUxOcGRiMDRIN3NLd1M3cXdQS1daUmZPWGlnNXlnOVZJbVVFVXUxLVJkRDNhdkNSdUw0TXp1eGMycXVaclJIMkJTUjk1OGpRcWhvZkwyNG95VFpzd2cyT2tmbDlCUDlIZmpKM1JMZS1NY3F1cVNtendnck4wUHFYY3FubVhZdktXak1GS0FfLWxQZ3ZWSGRPcVVuOUtZbF9GVmF2RFBhYnpQZVlWYy10c2Jn?oc=5,"Fri, 22 Aug 2025 21:09:29 GMT",
2025-08-23T01:45:42,Google News Reuters,"Stocks rally, yields dip as Powell opens door to September rate cut - Reuters",https://news.google.com/rss/articles/CBMie0FVX3lxTFB3RExJSFVScDZQQ0t2clFmM0I4eTFmc0IyX0hvZXFUcng4WjZfSHdTc0FnQUJYTGw3Mkc2WllybDh3Wm1ZQzVDZUY3T19YSk4tRXpMd05saG1UME1Rd1JEbUk4Y0dxSDM3QVdzRF9LUzRXWWlUdHFWZDFNUQ?oc=5,"Fri, 22 Aug 2025 16:53:42 GMT",
2025-08-23T01:45:42,Google News Reuters,Trump says US is conducting tariff investigation into furniture imports - Reuters,https://news.google.com/rss/articles/CBMitwFBVV95cUxNcjNub2NOQWNocHNBXzVlT0JwckJ1dVRDQmxWNzY5MXBhNjdITVlma1VmWmFhdEhyYWdBQ3ZZdzk5b2R1b1RiSDJkMTFoTkVwLU9qMnBEVHRnWFZLQXFsU3pPZzRURnRZc1RvRGFfS1lGRHRqZHRhaF9XYWJuQXFLT3RCd3p4N2FXNXAzWmR1UmhSRGRxN25LS2U4LXdqdkpxTVJIS2RXdDhwNXp0MXR0QWJEaFJKUGM?oc=5,"Fri, 22 Aug 2025 22:59:50 GMT",
