timestamp,source,title,link,published,content
2025-08-10T02:06:41,MarketWatch Top,My late husband’s employer is forcing me to take 10% 401(k) distributions. Help!,https://www.marketwatch.com/story/my-late-husbands-employer-is-forcing-me-to-take-10-401-k-distributions-help-fe94579c?mod=mw_rss_topstories,"Sat, 09 Aug 2025 19:39:00 GMT",
2025-08-10T02:06:41,MarketWatch Top,"‘Things are getting tougher’: I’m struggling with $145,000 in debt. Should I refinance my 3.5% mortgage?",https://www.marketwatch.com/story/things-are-getting-tougher-im-struggling-with-145-000-in-debt-should-i-refinance-my-3-5-mortgage-6a7962c9?mod=mw_rss_topstories,"Sat, 09 Aug 2025 19:28:00 GMT",
2025-08-10T02:06:41,MarketWatch Top,A voice breaking from the Fed ranks just heightened her push for cutting interest rates fast,https://www.marketwatch.com/story/a-voice-breaking-from-the-fed-ranks-just-heightened-her-push-for-cutting-interest-rates-fast-4bd935a9?mod=mw_rss_topstories,"Sat, 09 Aug 2025 18:31:00 GMT",
2025-08-10T02:06:41,MarketWatch Top,‘I have a great mortgage rate’: I need $80K to buy my husband out of our home. Do I raid my $180K Roth IRA?,https://www.marketwatch.com/story/i-need-80k-to-buy-my-husband-out-of-our-home-do-i-raid-my-180k-roth-ira-73460355?mod=mw_rss_topstories,"Sat, 09 Aug 2025 18:30:00 GMT",
2025-08-10T02:06:41,MarketWatch Top,Stock buybacks are surging. Here’s why it matters to your portfolio.,https://www.marketwatch.com/story/dividends-rise-when-companies-have-confidence-about-earnings-but-this-is-happening-instead-c5ef7d9e?mod=mw_rss_topstories,"Sat, 09 Aug 2025 18:13:00 GMT",
2025-08-10T02:06:41,MarketWatch Top,Is booze making a comeback? The sober craze may have run its course.,https://www.marketwatch.com/story/is-gen-z-really-drinking-less-alcohol-or-just-being-choosier-about-when-they-indulge-i-love-a-good-mojito-388ae920?mod=mw_rss_topstories,"Sat, 09 Aug 2025 17:54:00 GMT",
2025-08-10T02:06:41,MarketWatch Top,I plan to work until 80. Can I contribute to my IRA while taking RMDs?,https://www.marketwatch.com/story/i-plan-to-work-until-80-can-i-contribute-to-my-ira-while-taking-rmds-02362eda?mod=mw_rss_topstories,"Sat, 09 Aug 2025 17:41:00 GMT",
2025-08-10T02:06:41,MarketWatch Top,‘I’m tired of corporate America’: My wife and I have $1.65 million. I’m 61. Can I retire already?,https://www.marketwatch.com/story/im-tired-of-corporate-america-my-wife-and-i-have-1-65-million-im-61-can-i-retire-already-b125f48a?mod=mw_rss_topstories,"Sat, 09 Aug 2025 17:31:00 GMT",
2025-08-10T02:06:41,MarketWatch Top,‘This scam stuff is going to get worse’: A man approached me in my car — he had a crazy story,https://www.marketwatch.com/story/this-scam-stuff-is-going-to-get-worse-a-man-approached-me-in-my-car-he-had-a-crazy-story-ccd885d3?mod=mw_rss_topstories,"Sat, 09 Aug 2025 17:24:00 GMT",
2025-08-10T02:06:41,MarketWatch Top,"Chelsea Handler talks about her boozy lemonade, the meaning of turning 50 and why real estate is the best investment",https://www.marketwatch.com/story/chelsea-handler-talks-about-her-boozy-lemonade-the-meaning-of-turning-50-and-why-real-estate-is-the-best-investment-0fd521b9?mod=mw_rss_topstories,"Sat, 09 Aug 2025 17:12:00 GMT",
2025-08-10T02:06:41,CNBC Top News,Apple has its best week since July 2020 after White House visit,https://www.cnbc.com/2025/08/08/apple-has-best-week-since-july-2020-after-tim-cooks-white-house-visit.html,"Sat, 09 Aug 2025 22:54:58 GMT",
2025-08-10T02:06:41,CNBC Top News,Trump to speak at White House on violent crime in D.C. amid federal crackdown,https://www.cnbc.com/2025/08/09/trump-to-speak-at-white-house-on-violent-crime-in-dc.html,"Sat, 09 Aug 2025 15:54:19 GMT",
2025-08-10T02:06:41,CNBC Top News,How one real estate startup is taking on record heat this summer,https://www.cnbc.com/2025/08/09/real-estate-startup-runwise-cre-heating-cooling.html,"Sat, 09 Aug 2025 12:00:01 GMT",
2025-08-10T02:06:41,CNBC Top News,"The new American shopping mall is less Macy's, more church, bowling, Barnes & Noble",https://www.cnbc.com/2025/08/09/americas-dying-shopping-malls-have-surprising-rebound-in-store.html,"Sat, 09 Aug 2025 12:30:02 GMT",
2025-08-10T02:06:41,CNBC Top News,We spent $104 million turning an abandoned 19th-century college in NYC into luxury apartments—take a look inside,https://www.cnbc.com/2025/08/09/abandoned-st-johns-university-the-hartby-apartment-building.html,"Sat, 09 Aug 2025 15:00:02 GMT",
2025-08-10T02:06:41,CNBC Top News,How much money you need to be considered wealthy across the U.S.—it's over $2 million in most places,https://www.cnbc.com/2025/08/09/how-much-money-you-need-to-be-considered-wealthy-across-the-us.html,"Sat, 09 Aug 2025 13:00:01 GMT",
2025-08-10T02:06:41,CNBC Top News,Activist Carronade spots a hidden gem in Viasat’s business. How the firm may unlock value,https://www.cnbc.com/2025/08/09/activist-carronade-spots-a-hidden-gem-in-viasats-business-how-the-firm-may-unlock-value.html,"Sat, 09 Aug 2025 11:57:05 GMT",
2025-08-10T02:06:41,CNBC Top News,Intel CEO responds to 'misinformation' and Trump threat in letter to employees,https://www.cnbc.com/2025/08/08/intel-ceo-responds-to-misinformation-and-trump-threat-in-letter.html,"Fri, 08 Aug 2025 18:06:51 GMT",
2025-08-10T02:06:41,CNBC Top News,Gold futures trade off highs as White House to issue clarification on bullion tariffs,https://www.cnbc.com/2025/08/08/gold-futures-trade-off-highs-as-white-house-to-issue-clarification-on-bullion-tariffs.html,"Fri, 08 Aug 2025 18:56:32 GMT",
2025-08-10T02:06:41,CNBC Top News,"From Starbucks to Smoothie King, restaurants seek to cash in on consumers' protein frenzy",https://www.cnbc.com/2025/08/09/restaurants-starbucks-smoothie-king-first-watch-protein.html,"Sat, 09 Aug 2025 12:00:01 GMT",
2025-08-10T02:06:41,CNBC Top News,Bestselling author: This parenting habit keeps you from raising successful kids—but you can start fixing it 'immediately',https://www.cnbc.com/2025/08/09/mel-robbins-your-phone-habit-can-keep-you-from-raising-successful-kids.html,"Sat, 09 Aug 2025 13:15:01 GMT",
2025-08-10T02:06:41,CNBC Top News,New Yorker quit her corporate role in the middle of a meeting—now she earns twice as much and is happier in her dream job,https://www.cnbc.com/2025/08/09/new-yorker-quit-during-a-meeting-now-earns-twice-as-much-in-dream-job.html,"Sat, 09 Aug 2025 14:00:01 GMT",
2025-08-10T02:06:41,CNBC Top News,"Some concertgoers use buy now, pay later loans for tickets. Start a 'Beyoncé fund' instead, analyst says",https://www.cnbc.com/2025/08/09/using-buy-now-pay-later-bnpl-loans-for-concert-tickets.html,"Sat, 09 Aug 2025 12:00:01 GMT",
2025-08-10T02:06:41,CNBC Top News,"Trump warns courts against knocking down tariffs, says duties are 'huge positive' for stock market",https://www.cnbc.com/2025/08/08/trump-warns-courts-against-knocking-down-tariffs-says-duties-are-huge-positive-for-stock-market.html,"Fri, 08 Aug 2025 15:56:06 GMT",
2025-08-10T02:06:41,CNBC Top News,The winners and losers in tech's AI-powered ad race,https://www.cnbc.com/2025/08/08/tech-earnings-ai-ad-revenue.html,"Fri, 08 Aug 2025 18:59:14 GMT",
2025-08-10T02:06:41,CNBC Top News,Trade Desk tanks 39% for worst day ever on CFO departure and competition from Amazon,https://www.cnbc.com/2025/08/08/trade-desk-tanks-cfo-departure-q2-results-amazon-competition.html,"Fri, 08 Aug 2025 20:15:12 GMT",
2025-08-10T02:06:41,CNBC Top News,"From lipsticks and Labubu dolls to concerts, the 'treatonomics' trend is booming in uncertain times",https://www.cnbc.com/2025/08/09/from-lipsticks-to-concerts-the-treatonomics-trend-is-booming.html,"Sat, 09 Aug 2025 02:11:47 GMT",
2025-08-10T02:06:41,CNBC Top News,Tesla Robotaxi scores permit to run ride-hailing service in Texas,https://www.cnbc.com/2025/08/08/tesla-robotaxi-scores-permit-to-run-ride-hailing-service-in-texas.html,"Fri, 08 Aug 2025 18:53:53 GMT",
2025-08-10T02:06:41,CNBC Top News,"This 30-year-old founder was so fatigued by dating apps, she started hosting IRL events: ‘I got to dating burnout’",https://www.cnbc.com/2025/08/09/dating-burnout-founder-fatigued-by-apps-started-hosting-irl-events.html,"Sat, 09 Aug 2025 02:14:31 GMT",
2025-08-10T02:06:41,CNBC Top News,Using my phone as a Paris guidebook cost me $50 — here's how to save on your bill when traveling abroad,https://www.cnbc.com/2025/08/09/how-to-save-on-your-phone-bill-when-traveling-abroad.html,"Sat, 09 Aug 2025 11:00:01 GMT",
2025-08-10T02:06:41,CNBC Top News,"Bed Bath & Beyond relaunches with first store in Nashville, plans dozens more",https://www.cnbc.com/2025/08/08/bed-bath-beyond-store-nashville.html,"Fri, 08 Aug 2025 17:36:12 GMT",
2025-08-10T02:06:41,CNBC Top News,Sweetgreen shares drop 23% after salad chain cuts outlook for the second time in two quarters,https://www.cnbc.com/2025/08/08/sweetgreen-cuts-outlook-stock-drops.html,"Fri, 08 Aug 2025 20:04:22 GMT",
2025-08-10T02:06:41,CNBC Top News,"EV sales soar as Trump axes $7,500 tax credit: 'People are rushing out' to buy, analyst says",https://www.cnbc.com/2025/08/08/ev-sales-trump-tax-credit.html,"Fri, 08 Aug 2025 18:37:38 GMT",
2025-08-10T02:06:41,CNBC Top News,OpenAI's Altman is still looking to spend after GPT-5 launch and is 'willing to run the loss',https://www.cnbc.com/2025/08/08/chatgpt-gpt-5-openai-altman-loss.html,"Fri, 08 Aug 2025 15:15:10 GMT",
2025-08-10T02:06:41,CNBC Top News,Tesla exec leading development of chip tech and Dojo supercomputer is leaving company,https://www.cnbc.com/2025/08/07/tesla-vp-pete-bannon-developing-chip-tech-dojo-supercomputer-leaving.html,"Thu, 07 Aug 2025 23:42:06 GMT",
2025-08-10T02:06:41,CNBC Top News,Government-backed MP Materials rises as loss narrows on record rare earth oxide production,https://www.cnbc.com/2025/08/08/government-backed-mp-materials-surges-as-loss-narrows-on-record-rare-earth-oxide-production.html,"Fri, 08 Aug 2025 20:25:18 GMT",
2025-08-10T02:06:41,CNBC Top News,Dodge unveils additions to 2026 muscle car lineup: 'It's about choice',https://www.cnbc.com/2025/08/08/dodge-durango-jailbrea-charger-sixpack.html,"Fri, 08 Aug 2025 15:00:01 GMT",
2025-08-10T02:06:41,CNBC Top News,"Crocs CEO says consumer environment is 'concerning,' will reduce orders in the second half",https://www.cnbc.com/2025/08/08/crocs-reducing-order-volume-second-half-cautious-consumer.html,"Fri, 08 Aug 2025 16:18:09 GMT",
2025-08-10T02:06:41,CNBC Top News,OpenStore’s demise marks endgame for once-booming e-commerce aggregator market,https://www.cnbc.com/2025/08/08/openstore-demise-endgame-for-once-booming-ecommerce-aggregator-market.html,"Fri, 08 Aug 2025 12:40:47 GMT",
2025-08-10T02:06:41,CNBC Top News,A major historical bitcoin cycle that dictates its price might be breaking,https://www.cnbc.com/2025/08/08/bitcoin-btc-price-cycle-might-be-breaking.html,"Fri, 08 Aug 2025 15:54:44 GMT",
2025-08-10T02:06:42,Investing.com All News,Russia shares lower at close of trade; MOEX Russia Index unchanged,https://uk.investing.com/news/stock-market-news/russia-shares-lower-at-close-of-trade-moex-russia-index-unchanged-4211710,2025-08-09 21:25:34,
2025-08-10T02:06:42,Investing.com All News,"5 big analyst AI moves: Buyers of AMD stock weakness, Monday.com upgraded",https://uk.investing.com/news/stock-market-news/5-big-analyst-ai-moves-buyers-of-amd-stock-weakness-mondaycom-upgraded-4211708,2025-08-09 16:35:02,
2025-08-10T02:06:42,Investing.com All News,Thumzup updates terms of proposed public offering,https://uk.investing.com/news/company-news/thumzup-updates-terms-of-proposed-public-offering-93CH-4211707,2025-08-09 16:22:07,
2025-08-10T02:06:42,Investing.com All News,William Blair reiterates Outperform rating on Centrus Energy stock,https://uk.investing.com/news/analyst-ratings/william-blair-reiterates-outperform-rating-on-centrus-energy-stock-93CH-4211704,2025-08-09 13:38:06,
2025-08-10T02:06:42,Investing.com All News,Mizuho raises Wynn Resorts stock price target to $126 on improved outlook,https://uk.investing.com/news/analyst-ratings/mizuho-raises-wynn-resorts-stock-price-target-to-126-on-improved-outlook-93CH-4211703,2025-08-09 13:22:06,
2025-08-10T02:06:42,Investing.com All News,CFRA lowers AIG stock price target to $90 on mixed top-line trends,https://uk.investing.com/news/analyst-ratings/cfra-lowers-aig-stock-price-target-to-90-on-mixed-topline-trends-93CH-4211702,2025-08-09 12:58:07,
2025-08-10T02:06:42,Investing.com All News,Truist Securities raises Celsius stock price target to $65 on strong outlook,https://uk.investing.com/news/analyst-ratings/truist-securities-raises-celsius-stock-price-target-to-65-on-strong-outlook-93CH-4211701,2025-08-09 12:58:06,
2025-08-10T02:06:42,Investing.com All News,Raymond James raises Pembina Pipeline stock price target to C$64,https://uk.investing.com/news/analyst-ratings/raymond-james-raises-pembina-pipeline-stock-price-target-to-c64-93CH-4211700,2025-08-09 12:54:07,
2025-08-10T02:06:42,Investing.com All News,Parkit Enterprise stock price target raised to C$0.70 by Raymond James,https://uk.investing.com/news/analyst-ratings/parkit-enterprise-stock-price-target-raised-to-c070-by-raymond-james-93CH-4211699,2025-08-09 12:54:06,
2025-08-10T02:06:42,Investing.com All News,Block shares surge 62% following InvestingPro's May Fair Value signal,https://uk.investing.com/news/investment-ideas/block-shares-surge-62-following-investingpros-may-fair-value-signal-93CH-4211690,2025-08-09 11:06:07,
2025-08-10T02:06:42,Investing.com Bond News,US 3-Year Auction Disappoints Slightly as Markets Question Rate Cut Path,https://uk.investing.com/analysis/us-3year-auction-disappoints-slightly-as-markets-question-rate-cut-path-200617956,"Aug 05, 2025 20:31 GMT",
2025-08-10T02:06:42,Investing.com Bond News,US Treasury Yields Tick Higher Ahead of Heavy Auction Week,https://uk.investing.com/analysis/us-treasury-yields-tick-higher-ahead-of-heavy-auction-week-200617942,"Aug 05, 2025 07:14 GMT",
2025-08-10T02:06:42,Investing.com Bond News,The Bond Market Is Pricing in a Softer Economy,https://uk.investing.com/analysis/the-bond-market-is-pricing-in-a-softer-economy-200617930,"Aug 04, 2025 22:17 GMT",
2025-08-10T02:06:42,Investing.com Bond News,Non-Farm Payrolls Ahead: Saving the Most Exciting for Last?,https://uk.investing.com/analysis/nonfarm-payrolls-ahead-saving-the-most-exciting-for-last-200617897,"Aug 01, 2025 06:50 GMT",
2025-08-10T02:06:42,Investing.com Bond News,Medium-Term Corporates Lead US Bond Market in 2025,https://uk.investing.com/analysis/mediumterm-corporates-lead-us-bond-market-in-2025-200617754,"Jul 23, 2025 11:53 GMT",
2025-08-10T02:06:42,Investing.com Bond News,Japan’s Election Results Could Send Shockwaves Through US Bond Market,https://uk.investing.com/analysis/japans-election-results-could-send-shockwaves-through-us-bond-market-this-week-200617701,"Jul 21, 2025 06:55 GMT",
2025-08-10T02:06:42,Investing.com Bond News,How Fed Could Inject Liquidity if Bond Yields Surge: What Investors Need to Know,https://uk.investing.com/analysis/how-fed-could-inject-liquidity-if-bond-yields-surge-what-investors-need-to-know-200617670,"Jul 17, 2025 13:37 GMT",
2025-08-10T02:06:42,Investing.com Bond News,US 10-Year Yield Holds Above Fair Value as Deficit and CPI Heat Up,https://uk.investing.com/analysis/us-10year-yield-holds-above-fair-value-as-deficit-and-cpi-heat-up-200617650,"Jul 16, 2025 11:56 GMT",
2025-08-10T02:06:42,Investing.com Bond News,Treasury Auction Shows Strength: Bid-to-Cover and Foreign Demand Surge,https://uk.investing.com/analysis/treasury-auction-shows-strength-bidtocover-and-foreign-demand-surge-200617554,"Jul 10, 2025 10:41 GMT",
2025-08-10T02:06:42,Investing.com Bond News,US 30-Year Yield Mispriced? Inflation and Deficits Point to Higher Rates,https://uk.investing.com/analysis/us-30year-yield-mispriced-inflation-and-deficits-point-to-higher-rates-200617522,"Jul 08, 2025 13:52 GMT",
2025-08-10T02:06:43,Google News Reuters,Europe stresses need to protect Ukrainian interests ahead of Trump-Putin talks - Reuters,https://news.google.com/rss/articles/CBMivgFBVV95cUxPVWgyNjlVM3VqQl9hV21Ldi1wdzBLLWVFdFhqVjdUZUxFSjM5U2VCRXpkRGxLNGtlWExBbDVyV3FUcndmS2ZzN3NKT084Y3poRm9ncVEtVFFZeW02eFREck82T1ZVN3lQbUV0QTIwVElKREpaWXpjMjU5YzFEWmFMR0RUQ0kwMkl6UGU5WXZ2ZjB1VFN0MDJZS3k4aFZUenVBRFhoRGQ5QjZBb3RFLW9yb3Z2ZFRFZkF5bVpyOHhB?oc=5,"Sun, 10 Aug 2025 00:05:00 GMT",
2025-08-10T02:06:43,Google News Reuters,UK police arrest more than 466 at protest for banned Palestine Action group - Reuters,https://news.google.com/rss/articles/CBMiswFBVV95cUxNeUlJeWpISHQyVjNZNjJnTzJRRVRSSGcwZWtWam1MWGtmSTFfZjE1RlVLQVMyZUhRVjk3bTFxNXFZaHFTbUhGVWxlWnRtRmtlLV9BU1RQZ3hENEdXT2s4OVNvXzRiSk94eHplLUtlcVJuanQ1dnNwamJDR2VGYV9IdnY3b19uNURJcEp4c2N3b1VhNlVhUjBTXzU0R1B1bTltYk5OR05HTDdtZjB2a2lNNlFxWQ?oc=5,"Sat, 09 Aug 2025 22:43:54 GMT",
2025-08-10T02:06:43,Google News Reuters,Mexico wants Adidas to pay up after Mexican-American designer launches Indigenous-inspired shoe - Reuters,https://news.google.com/rss/articles/CBMi3AFBVV95cUxQVElsSTZwMHE0WTVOd0xTMk9CVmwxYTVsUzRnSlNQSV9JX25ENU5RVmY5MXZadTc2dm5lYkpmZzA0WTlNaEJhS2JYZVZuQkpPUFUwcG5QdUxpdmpDWHdQY2dUSTdvdVpWREUwZm5JY0pBc2NsbWhab20wN2RyYVhycHMxYXVCNV84SERxMndkWWZPLURLLWRibmJ1aGU0QW5TS1N6dzJIcEJHdl9HemhsdElUaUpaRzZCZDVzYVVSQjdON2xqdnYzQ0JVWFdYT3M2Yi0xQ3JCbDZ5WlNY?oc=5,"Sat, 09 Aug 2025 21:13:04 GMT",
2025-08-10T02:06:43,Google News Reuters,Europe and Ukraine press US ahead of Trump-Putin talks - Reuters,https://news.google.com/rss/articles/CBMinAFBVV95cUxQR2ZZQ3VQbkJfeEh5VGVORi1EVW0tUkZBTWVRTzM2WnZUWHlEVkdIUEZ0QTgxZ0FRcHNLQm1NM25JRng1YVhLRFBfVi02bEtLamNzeTFLYVpwcEdFMU5tc3FRNkdXdzdnS2J4RXJ2b25VMkQ4SjF6VEVoeDNwUnY4dk1HNG5mZGxZaHZCWEtVS1RkRGlpTVlQNFpxWEY?oc=5,"Sat, 09 Aug 2025 22:08:28 GMT",
2025-08-10T02:06:43,Google News Reuters,Trump nominates State Dept spokeswoman Bruce as US deputy representative to UN - Reuters,https://news.google.com/rss/articles/CBMiuAFBVV95cUxQN0hfQjMtNkhhUmt5S2RVN2tiM1hpbWJLX2pzOVkyOE5KejdjM0dZeE1YRVZvNzFzcTl2amF2QTJQV193TFFscEFSZUwxVnl2SVVST3dXaE0xWU5ZNmdBdlJuckJ4alJneWswbUpja3AxZjJVVkt3clpkTG8yRzB5ejZ5anhsOTBrWHhSdGhKS2xsRkI0dWZybkdTX2dFaWd2UXUxZ2xWbEhWbUtNQWgtaDVQNlBSNElO?oc=5,"Sun, 10 Aug 2025 00:25:00 GMT",
2025-08-10T02:06:43,Google News Reuters,Iran threatens planned Trump corridor envisaged by Azerbaijan-Armenia peace deal - Reuters,https://news.google.com/rss/articles/CBMizwFBVV95cUxOMmdNbEtzeVUyNVpxaXk1TlpzNmx5cExmb3RQYldUWFgxaERnbE1BLWJxaTJTUTFsSmdxcUVxREx4WmFOc0ZTN1g2MHlManA4b3hJWVg1TldRVFZnZ1lOQVZxd3NHN1ZVdjRSZmk0cUZsQUd6S2tEZ1R4SVZOYmdkTTVmS2lkSE8xQzM3M0J4TEx0TTlJUDB1TWxXaVdUUFROMjZaSVJwTHFZU2tRWnNTLXNUbkZudklCWTdqZWcyVjdmN2hlb0dwb29ld0lzblU?oc=5,"Sat, 09 Aug 2025 16:51:44 GMT",
2025-08-10T02:06:43,Google News Reuters,Lula and Putin discuss peace in Ukraine before US summit - Reuters,https://news.google.com/rss/articles/CBMiogFBVV95cUxOREhHb0tPVEdjOGZNWWtKTkEyaktfRzRtd19IR3dqNW1ucGVOVnhEMUozUWpPakJrS3hLd2RCSXFERHRMQk1ua3dtSFZwcWxHVG51U3h1NXUzb28ybFprd2VUU3hPX3ZfQjlWcjVaaWxJb0VoMHU4MkhYdEVTaHBVOXB0OVF5LUJlUU11VGd5aEZ0Z0JnNU5nTVl4eWJYZG04elE?oc=5,"Sat, 09 Aug 2025 17:06:20 GMT",
2025-08-10T02:06:43,Google News Reuters,US Fed's Bowman: Latest jobs data stiffens support for three rate cuts in 2025 - Reuters,https://news.google.com/rss/articles/CBMiugFBVV95cUxOS082dnBCVW1OWlRseFE4bFJSS3Y2bmVhZlNsWHcxXzRPQnByTGRHdG5HR2ExMFdlclBOdjBaeFhkdFVqT1JNR3RFN3pMbllrYkN1bEQxUzVsdjhWVVhUOHV2bWtEbElnZE9Ud19FZ0hBWllSRTNFNnJnU0NjQ21ETTI0YzhnOWFNS3llYzNJbUN5azY4RklXZmF1Rm13NkM3bjZEZGFEbFdDaFoxX1pIWTNQa1BRRGF4Smc?oc=5,"Sat, 09 Aug 2025 16:16:21 GMT",
2025-08-10T02:06:43,Google News Reuters,"Ukraine's future cannot be decided without Ukrainians, France's Macron says - Reuters",https://news.google.com/rss/articles/CBMitAFBVV95cUxOa3NLRkFsbnd1S2xYR25XVTVpX0VBS0VfeWpmNE01LWo1alhtdlM2MnA3TWJXU21pWkRIM0JnZkpBd0dqa3ZsdjVEdmtNTURLa1F4RVdidlBJTWV4QS1PeXp0T2RIWWRtY3J1VXZNbXRvSWhnU2c0NWZCQ1pHR1dkQTVvaW1vNjBrcUZ1NFhWVE9ER21lcVpGN0l5Q1V1S2QxS092cXFURExQZUUyTnAxazZKRG4?oc=5,"Sat, 09 Aug 2025 15:56:50 GMT",
2025-08-10T02:06:43,Google News Reuters,"India shot down six Pakistani military aircraft in May, air force chief says - Reuters",https://news.google.com/rss/articles/CBMixgFBVV95cUxPR0pwWjdzR0VoaUVNeG50c2xRNUxHQnpqVU44bzBfSTFnUlY4XzQyN1FPMTZQcm1YQTJReFJKanQ0WVctTXM1RnY2TExGY3NpZE1DY0llYkd1WjdGT2d4RmRQdEpkM0FzR1dzajFCaDRVUURCWTdTemlpS0hzVWJoYkpkd3E5NjBXYWstTm9jUmFVall2OWpFWjVfNEZfbkluNEZ3cXlXT3VETW44VFI2aTN2M0xOWm8tNndDcG9WeS1rWUpKMWc?oc=5,"Sat, 09 Aug 2025 17:07:31 GMT",
2025-08-10T02:06:43,Google News Reuters,"US, EU, and Ukrainian officials to meet in UK on Saturday ahead of Trump-Putin meeting - Reuters",https://news.google.com/rss/articles/CBMiswFBVV95cUxNd19VaDlqcnFXTlB5MUJHOVRlODVBVURuZTFQTUxPNy04RVB5ZkhIbmh5SFYxejFpZng4VDJqbjZSbzBxLUU4ZV8zdG9DRElnWnFTM0hWUmFHYU1BOUwzYi1JYjctbFZhQ1ItS2VVQTgwMnY4NVBSYUNNbVg3SFBrRnJWTjJSbHFPalJhbUZId1V6ekJiZ196QkRBZDN6LXE5Nlk3eTZmUlVvdmtjQ0tZamI5Yw?oc=5,"Sat, 09 Aug 2025 11:44:57 GMT",
2025-08-10T02:06:43,Google News Reuters,Moscow warns of 'titanic efforts' to disrupt Putin-Trump meeting - Reuters,https://news.google.com/rss/articles/CBMiqAFBVV95cUxQelUxbmNMUUZjQUNXR2JqUkVGUFRnZkZlcWpyWEZ3MVJ6Vm8wOGMwdzZvZG92Tm54LWNldm1wLXZOQXFqYjh0T3RTTFpPbGI1WGJaOHV4dmZPUlVNQ0hjeURyVktBYm5wMXpaV3Bfb0lwTGZ1UEJVTjZOZklId0gxYnp5cXhfbThRV3VEZFZ1c1AxV1ZxeUE3T2lnZ3ZLb1Y1bTRQekd6d2Y?oc=5,"Sat, 09 Aug 2025 09:44:16 GMT",
2025-08-10T02:06:43,Google News Reuters,Three wounded in New York Times Square shooting - Reuters,https://news.google.com/rss/articles/CBMikwFBVV95cUxQS2drMzA1RTF2VkFpTmhtbzhrUm14VlZ1dElVeEVDa05pYWtOQzZha2tndHNQOFpLNS1qMlEteUc1VWtUU215Y3lIeHVGS1FkM1pHY1paV2llX3N0QlRITG8yTER2MVFzT2VPMndJSFdUbmcwZlV4dzBKY3pwOENqZ1pJazFlRmFqMzJvamhEQ2NpXzA?oc=5,"Sat, 09 Aug 2025 10:36:52 GMT",
2025-08-10T02:06:43,Google News Reuters,"Weigh in on Sydney Sweeney or run the world? Trump, for better or worse, attempts it all - Reuters",https://news.google.com/rss/articles/CBMitwFBVV95cUxQYWlTOVRldGxNYU5nTzZLNE01SzY2T0dCWXFOWE9yeUZTS2Qzc1oxMTVJbWxJVXlMSUhXLXBXc2xEWVhqNTVBbExYVXJMWENzR1NZUXlDY09GNEJKU0dCaFZMeDMyTHptVmxkcEFzOUdmTXRtLVMxLS1wZmU1VThSTDY0dzhLQlMxQllCTjhEQVlncEZ6MkF6Rk9UMW1mMHZ3LWlfeU1vWW92TnYwZERiTi1GQlNITHM?oc=5,"Sat, 09 Aug 2025 13:52:38 GMT",
2025-08-10T02:06:43,Google News Reuters,Portugal's top court blocks bill restricting immigration - Reuters,https://news.google.com/rss/articles/CBMingFBVV95cUxQQ2lnLWs0eEh5SkdkVy10Sm9SUlZBV2RiQ05Pa1JISDhvS3l6UERwMjRGT1JGRTZFZDBjTnNtN1hLZDRPUXJWdHlhaFRSSGhtWHlXa2ZqTHpzenZxUUFwZFpUZ3hqU0c4bzdIYk10X0s4UjlPOVJlNG00S2l3c1lZNlR5S0FRcnJZMnlqSjU3azM4VjVjbFpnT1g1ck5mZw?oc=5,"Sat, 09 Aug 2025 09:53:14 GMT",
2025-08-10T02:06:43,Google News Reuters,"White House considering inviting Zelenskiy to Alaska, NBC News reports - Reuters",https://news.google.com/rss/articles/CBMitgFBVV95cUxNalU2NjJOUV9iMXR2cWc4MHBTWWJjMUZwUkFCMjRzNTdDQ083YTA5cDh1OUtaOGloeXN2VThobkE2bUUxLW14UmE0WnR6QjhENEVWRTR6M0trOTFtdFl5TEh0T0VOZFhQd3M0azFlcEltOEdOZV9jZU9wT055Q1dEcFVhTmZrUEdYTk5mMUJTVmZMcDk1eHZfbGkxcGtRSkI4X0ViWVo3aUdkVWFvc25UZEszUXRXUQ?oc=5,"Sat, 09 Aug 2025 21:56:16 GMT",
2025-08-10T02:06:43,Google News Reuters,"North Korea starts dismantling some border loudspeakers, South Korea says - Reuters",https://news.google.com/rss/articles/CBMixgFBVV95cUxPUmlSMjhocl81cDVSWDJBRzgxRzV3TUVWMGFxWTRWTWtoVmwxSklGZEVZWkNVSDZZZnROWkljckdNWTFVUGx4RUtvRXp3YXROVndLQWNHMFF5WFlVbjdqUk9QUFBFTllkbjlpSkV6QUcxRVFsdjNJajd6RVloX1RDLTZXel9FdVQwSDRxUDNqdmZINFBZMjlfWS1WdEJ1dElEZTh1VHZ4WEU4bzY0Y21FbHlCSEdKdlhPTFE5ajN0dnNBRlhTdHc?oc=5,"Sat, 09 Aug 2025 07:51:45 GMT",
2025-08-10T02:06:43,Google News Reuters,"Ukraine will not cede land, Zelenskiy says, as Trump, Putin plan meeting - Reuters",https://news.google.com/rss/articles/CBMioAFBVV95cUxOYUdNUEhDeWEwZVB3UXk1R3NUSVJ0VkloM3E3a28xNGdkeGVEaHZ5R19iT3hRMFlGOUFOYVh5M1pPZ18yQ19qWVJsX3lJdFd0RzFfZjFiLWpDZVNGLVN5RGtLZnFYUDNFLU40UU54RmVyS3lKMXdrMm5SRG1jQy0wcE11S2lucXpCenhxTWw3blptVlNsZ3Vza2xOTFo3NEhS?oc=5,"Sat, 09 Aug 2025 12:28:44 GMT",
2025-08-10T02:06:43,Google News Reuters,"US retailer Best Buy weighs boosting India headcount, Subramanian says - Reuters",https://news.google.com/rss/articles/CBMi0gFBVV95cUxNcm5LV1J4UF9BdzlJcGM1SnA5ZFdCN0RrWVRPaDRxOUFsdGgyLVJlcVNqVGtUSXBZY1VORTRtOWJWa2dHamxpaWlBdTN6QTcyRXA1MGtvTlYyWWRVeWdwWV9HUnhnWkdtb21aSXMxNGVTdV9KWVU3Y1otODk1NU1UV2VVdHNweHc3bDVJY3Z1WE9WamRBc3RnYW5iVXFmNXlLaXdIWDNodlFoWWVZTW0zRW94ZTcwRDdEOWRDaWFlU2tBd2ExMzFOdy1QU252MXFyenc?oc=5,"Sat, 09 Aug 2025 10:21:42 GMT",
2025-08-10T02:06:43,Google News Reuters,How a CIA hit on al Qaeda ensnared a US citizen in Afghanistan - Reuters,https://news.google.com/rss/articles/CBMiqwFBVV95cUxQUlVqZ252YUJmMk1yOXowSzhQb3Vpdm1qN3ZmQ24zSGp2WDBUd0lBZGl1V01mb3RVNThZYXd2aGRsYWw2ZFZ1VzcxekVJMmlMMUNvaEg2REdnSXNmNEw3YXIxaDVZaXl4WXdLb2RMR2t3QWs5YTZ0M3VkSGdNdUN3MGFRSFZ2WmFmU2NDVDJRQUJjWGdZZnF4Q0RCYVN4M2tpbjB2dlpxdHFzYUU?oc=5,"Sat, 09 Aug 2025 15:40:41 GMT",
2025-08-10T02:06:43,Google News Reuters,From bootcamp to bust: How AI is upending the software development industry - Reuters,https://news.google.com/rss/articles/CBMirAFBVV95cUxNZUQ3Y1dhT2pna1pjR05vNzBHbTlIeGJyRnZzRHIzR0E0QV9pZkRIVGNVN3RQcDQ0aVVNZE5IT2g0ZHk1SEg2N0l6b2EzRUJ2dlcxVVZNeWNybGZhcWIxcXBuaVNLemItQnYwN18xUGkyODdhU2dyTGxXd29FR3VLZ3g0S29UYzZBRy0zVTM0Y25kbjZhZFdyR09UVG1vM21lYl92U0VDdF9vUXVm?oc=5,"Sat, 09 Aug 2025 10:00:00 GMT",
2025-08-10T02:06:43,Google News Reuters,Nagasaki mayor warns of nuclear war as city marks 80 years since A-bomb - Reuters,https://news.google.com/rss/articles/CBMiqwFBVV95cUxPQTVYdkVzNzJfUTdnODNRODVTUEozR2pXOWFiUU5RMTZKSDNMV2VOOE0yVkU1Q21mLVpuM0Rkbk9RTktOYnBWRzVaTXZ2dlBpc2lHY1l3cFhGTGVGU2c4dllCV3IydVdySzd4TVhSSkZZdThocDRKNVA1T3UyYkhQSVBPTnVIajJrb0k2V0daaUVfZHhPV05ndHhMTGpWdHU0dmxmTlNfcVYwY1U?oc=5,"Sat, 09 Aug 2025 10:01:09 GMT",
