timestamp,source,title,link,published,content
2025-09-05T01:19:03,MarketWatch Top,"Broadcom gives Wall Street plenty of reason to cheer, and its stock moves higher",https://www.marketwatch.com/story/broadcom-sees-63-growth-in-ai-sales-and-gives-a-rosy-forecast-why-isnt-its-stock-rising-more-e2c79ebe?mod=mw_rss_topstories,"Fri, 05 Sep 2025 00:15:00 GMT",
2025-09-05T01:19:03,MarketWatch Top,"Lululemon says it has gotten ‘too predictable,’ as tariffs, outlook sink its stock",https://www.marketwatch.com/story/lululemons-shares-slide-as-retailer-cuts-outlook-amid-industry-wide-challenges-b84253c5?mod=mw_rss_topstories,"Fri, 05 Sep 2025 00:15:00 GMT",
2025-09-05T01:19:03,MarketWatch Top,NFL fans can stream all games this season for the first time — and could end up paying less to do so,https://www.marketwatch.com/story/nfl-fans-can-stream-all-games-this-season-for-the-first-time-and-could-end-up-paying-less-to-do-so-5fbe6a42?mod=mw_rss_topstories,"Thu, 04 Sep 2025 23:28:00 GMT",
2025-09-05T01:19:03,MarketWatch Top,"After my father died, my stepsister transferred assets into her name. Do I have any legal recourse?",https://www.marketwatch.com/story/after-my-father-died-my-stepsister-transferred-assets-into-her-name-do-i-have-any-legal-recourse-9d7bb6ff?mod=mw_rss_topstories,"Thu, 04 Sep 2025 23:22:00 GMT",
2025-09-05T01:19:03,MarketWatch Top,‘Her kids will have no inheritance’: Will my friend lose her house to Medicaid if she goes into a nursing home?,https://www.marketwatch.com/story/her-kids-will-have-no-inheritance-will-my-friend-lose-her-house-to-medicaid-if-she-goes-into-a-nursing-home-e65e2ce4?mod=mw_rss_topstories,"Thu, 04 Sep 2025 22:50:00 GMT",
2025-09-05T01:19:03,MarketWatch Top,I am a 65-year-old single woman with 25 credit cards. How do I cancel them without hurting my credit score?,https://www.marketwatch.com/story/i-am-a-65-year-old-single-woman-with-25-credit-cards-how-do-i-cancel-them-without-hurting-my-credit-score-bd9fe4c7?mod=mw_rss_topstories,"Thu, 04 Sep 2025 22:47:00 GMT",
2025-09-05T01:19:03,MarketWatch Top,I’m about to inherit a lot of money. How do I make sure my husband doesn’t get any of it?,https://www.marketwatch.com/story/im-about-to-inherit-a-lot-of-money-how-do-i-make-sure-my-husband-doesnt-get-any-of-it-3cf1e1f2?mod=mw_rss_topstories,"Thu, 04 Sep 2025 22:30:00 GMT",
2025-09-05T01:19:03,MarketWatch Top,"‘She’s a very proud woman:’ My mother, 81, discovered her ‘millions’ in investments are gone. What can I do?",https://www.marketwatch.com/story/shes-a-very-proud-woman-my-mother-81-discovered-her-millions-in-investments-are-gone-what-can-i-do-444ad7da?mod=mw_rss_topstories,"Thu, 04 Sep 2025 22:13:00 GMT",
2025-09-05T01:19:03,MarketWatch Top,S&P 500 books record as falling rates bring ‘relief’ — but beware the ‘tale of two bond markets’,https://www.marketwatch.com/story/s-p-500-books-record-as-falling-rates-bring-relief-but-beware-the-tale-of-two-bond-markets-73165c57?mod=mw_rss_topstories,"Thu, 04 Sep 2025 22:10:00 GMT",
2025-09-05T01:19:03,MarketWatch Top,5 ways the Trump administration could use declaring a national housing emergency to help home buyers,https://www.marketwatch.com/story/5-ways-the-trump-administration-could-use-declaring-a-national-housing-emergency-to-help-home-buyers-4543abbe?mod=mw_rss_topstories,"Thu, 04 Sep 2025 21:03:00 GMT",
2025-09-05T01:19:03,CNBC Top News,Broadcom’s stock pops on mystery $10 billion AI customer,https://www.cnbc.com/2025/09/04/broadcom-avgo-q3-2025-earnings-report.html,"Thu, 04 Sep 2025 22:17:30 GMT",
2025-09-05T01:19:03,CNBC Top News,Trump asks Supreme Court to let him fire FTC Commissioner Rebecca Slaughter,https://www.cnbc.com/2025/09/04/trump-supreme-court-federal-trade-commission-slaughter.html,"Thu, 04 Sep 2025 20:52:21 GMT",
2025-09-05T01:19:03,CNBC Top News,Lululemon shares plunge as earnings guidance falls well short of estimates,https://www.cnbc.com/2025/09/04/lululemon-lulu-q2-2025-earnings.html,"Thu, 04 Sep 2025 22:29:51 GMT",
2025-09-05T01:19:03,CNBC Top News,"RFK Jr. casts doubts on vaccines, clashes with Democrats over Covid shot access",https://www.cnbc.com/2025/09/04/rfk-jr-spreads-vaccine-misinformation-during-congressional-testimony.html,"Thu, 04 Sep 2025 21:57:23 GMT",
2025-09-05T01:19:03,CNBC Top News,Asia-Pacific markets open higher after Trump formalizes lower Japanese auto tariffs,https://www.cnbc.com/2025/09/05/asia-pacific-markets-set-to-open-mixed-after-trump-formalizes-lower-japanese-auto-tariffs.html,"Fri, 05 Sep 2025 00:17:57 GMT",
2025-09-05T01:19:03,CNBC Top News,How Gen Z workers are reshaping corporate norms as they return to office,https://www.cnbc.com/2025/09/05/how-gen-z-are-reshaping-corporate-norms-as-they-return-to-office.html,"Thu, 04 Sep 2025 23:16:00 GMT",
2025-09-05T01:19:03,CNBC Top News,Internal NFL ticket report reveals 49ers at top and Titans at bottom,https://www.cnbc.com/2025/09/04/internal-nfl-ticket-report-reveals-49ers-at-top-titans-at-bottom.html,"Thu, 04 Sep 2025 21:14:20 GMT",
2025-09-05T01:19:03,CNBC Top News,Dallas Cowboys owner Jerry Jones says Micah Parsons trade was 'based on mathematics',https://www.cnbc.com/2025/09/04/dallas-cowboys-owner-jerry-jones-micah-parsons-trade-was-based-on-mathematics.html,"Thu, 04 Sep 2025 22:37:23 GMT",
2025-09-05T01:19:03,CNBC Top News,Palo Alto Networks CEO says the enterprise may not welcome agentic AI browsers,https://www.cnbc.com/2025/09/04/palo-alto-networks-ceo-says-the-enterprise-may-not-welcome-agentic-ai-browsers.html,"Thu, 04 Sep 2025 22:48:41 GMT",
2025-09-05T01:19:03,CNBC Top News,Boeing hires replacement workers as defense unit strike enters second month,https://www.cnbc.com/2025/09/04/boeing-replacement-workers-defense-unit-strike.html,"Thu, 04 Sep 2025 20:56:16 GMT",
2025-09-05T01:19:03,CNBC Top News,Waymo to begin testing at San Jose airport this fall,https://www.cnbc.com/2025/09/04/waymo-testing-san-jose-airport.html,"Thu, 04 Sep 2025 21:29:18 GMT",
2025-09-05T01:19:03,CNBC Top News,Friday's jobs report could confirm a slowing labor market. But will stocks care?,https://www.cnbc.com/2025/09/04/the-august-jobs-report-could-confirm-a-slowing-labor-market-but-will-stocks-care.html,"Thu, 04 Sep 2025 19:28:09 GMT",
2025-09-05T01:19:03,CNBC Top News,Senator introduces new bill to eliminate taxes on Social Security benefits,https://www.cnbc.com/2025/09/04/no-tax-on-social-security-benefits-bill.html,"Thu, 04 Sep 2025 19:06:32 GMT",
2025-09-05T01:19:03,CNBC Top News,Stephen Miran says he'll take unpaid leave from White House job while serving as Fed governor,https://www.cnbc.com/2025/09/04/stephen-miran-says-hell-take-unpaid-leave-from-white-house-job-while-serving-as-fed-governor.html,"Thu, 04 Sep 2025 18:43:03 GMT",
2025-09-05T01:19:03,CNBC Top News,Las Vegas travel is slumping. What does it mean for the rest of the U.S.?,https://www.cnbc.com/2025/09/04/mgm-resorts-ceo-las-vegas-slump-us-travel.html,"Thu, 04 Sep 2025 19:34:44 GMT",
2025-09-05T01:19:03,CNBC Top News,Honeywell's quantum computing firm inches closer to a pivotal step for investors,https://www.cnbc.com/2025/09/04/honeywells-quantinuum-inches-closer-to-a-pivotal-step-for-investors.html,"Thu, 04 Sep 2025 19:35:50 GMT",
2025-09-05T01:19:03,CNBC Top News,"As consumers rush to get EVs, Ford sees a bright spot with a big, gas-powered SUV",https://www.cnbc.com/2025/09/04/ford-expedition-sales-bright-spot.html,"Thu, 04 Sep 2025 18:42:59 GMT",
2025-09-05T01:19:03,CNBC Top News,New York AG appeals reversal of Trump's $500 million fraud penalty,https://www.cnbc.com/2025/09/04/trump-new-york-appeal-james-fraud.html,"Thu, 04 Sep 2025 21:25:28 GMT",
2025-09-05T01:19:03,CNBC Top News,Musk will not attend Trump tech CEO dinner at White House,https://www.cnbc.com/2025/09/04/trump-to-host-tech-ceos-over-dinner-for-inaugural-event-in-rose-garden.html,"Thu, 04 Sep 2025 18:38:42 GMT",
2025-09-05T01:19:03,CNBC Top News,Ex-Salesforce co-CEO Bret Taylor's Sierra is the latest $10 billion AI startup,https://www.cnbc.com/2025/09/04/bret-taylor-sierra-ai-startup-salesforce-openai.html,"Thu, 04 Sep 2025 19:33:18 GMT",
2025-09-05T01:19:03,CNBC Top News,"Labor market growth slows dramatically in August with U.S. adding just 54,000 jobs, ADP says",https://www.cnbc.com/2025/09/04/adp-jpb-data-august-2025.html,"Thu, 04 Sep 2025 20:19:05 GMT",
2025-09-05T01:19:03,CNBC Top News,Paramount mandates 5-day-a-week return to office ahead of major cost cuts,https://www.cnbc.com/2025/09/04/paramount-5-day-a-week-mandate.html,"Thu, 04 Sep 2025 19:02:18 GMT",
2025-09-05T01:19:03,CNBC Top News,DC sues Trump administration over National Guard deployment,https://www.cnbc.com/2025/09/04/trump-national-guard-lawsuit-dc.html,"Thu, 04 Sep 2025 19:10:06 GMT",
2025-09-05T01:19:03,CNBC Top News,Pulte refuses to say where he got Lisa Cook mortgage fraud ‘tip’,https://www.cnbc.com/2025/09/04/pulte-fed-cook-mortgage-powell.html,"Thu, 04 Sep 2025 19:03:21 GMT",
2025-09-05T01:19:03,CNBC Top News,Salesforce slump deepens as stock drops nearly 5% on weak guidance,https://www.cnbc.com/2025/09/04/salesforce-stock-guidance-earnings.html,"Thu, 04 Sep 2025 20:01:44 GMT",
2025-09-05T01:19:03,CNBC Top News,Record numbers of retirement savers are now 401(k) or IRA millionaires,https://www.cnbc.com/2025/09/04/ira-401k-millionaires-hit-record-highs.html,"Thu, 04 Sep 2025 18:49:30 GMT",
2025-09-05T01:19:03,CNBC Top News,Orsted sues to save offshore wind farm from Trump administration axe,https://www.cnbc.com/2025/09/04/trump-offshore-wind-lawsuit-orsted.html,"Thu, 04 Sep 2025 18:59:52 GMT",
2025-09-05T01:19:03,CNBC Top News,Figma's stock slumps almost 20% after first earnings report to lowest since IPO,https://www.cnbc.com/2025/09/04/figma-stock-first-earnings-report.html,"Thu, 04 Sep 2025 20:03:30 GMT",
2025-09-05T01:19:03,CNBC Top News,T. Rowe Price shares jump after deal where Goldman will invest $1 billion in asset manager,https://www.cnbc.com/2025/09/04/t-rowe-price-shares-rocket-higher-after-deal-where-goldman-will-invest-1-billion-in-asset-manager.html,"Thu, 04 Sep 2025 20:23:45 GMT",
2025-09-05T01:19:03,CNBC Top News,This airline is bringing back its $299 ‘all you can fly’ pass for a limited time: Here's what to know,https://www.cnbc.com/2025/09/04/frontier-airlines-all-you-can-fly-pass-deal.html,"Thu, 04 Sep 2025 16:02:24 GMT",
2025-09-05T01:19:03,Investing.com All News,Ionis Pharmaceuticals director Klein sells $1.68 million in shares,https://uk.investing.com/news/insider-trading-news/ionis-pharmaceuticals-director-klein-sells-168-million-in-shares-93CH-4251438,2025-09-05 01:14:08,
2025-09-05T01:19:03,Investing.com All News,Ionis Pharma director Klein sells $1.68 million in shares,https://uk.investing.com/news/insider-trading-news/ionis-pharma-director-klein-sells-168-million-in-shares-93CH-4251437,2025-09-05 01:10:08,
2025-09-05T01:19:03,Investing.com All News,Ionis Pharmaceuticals CEO Monia sells $12.3 million in IONS stock,https://uk.investing.com/news/insider-trading-news/ionis-pharmaceuticals-ceo-monia-sells-123-million-in-ions-stock-93CH-4251436,2025-09-05 01:08:08,
2025-09-05T01:19:03,Investing.com All News,Ionis director Parshall sells $1 million in stock,https://uk.investing.com/news/insider-trading-news/ionis-director-parshall-sells-1-million-in-stock-93CH-4251435,2025-09-05 01:04:08,
2025-09-05T01:19:03,Investing.com All News,Ionis Pharmaceuticals director sells $1.6m in IONS stock,https://uk.investing.com/news/insider-trading-news/ionis-pharmaceuticals-director-sells-16m-in-ions-stock-93CH-4251434,2025-09-05 01:02:08,
2025-09-05T01:19:03,Investing.com All News,Ionis EVP Swayze sells $552k in IONS stock,https://uk.investing.com/news/insider-trading-news/ionis-evp-swayze-sells-552k-in-ions-stock-93CH-4251433,2025-09-05 01:00:09,
2025-09-05T01:19:03,Investing.com All News,Fabrinet EVP Archer sells $1.18 million in shares,https://uk.investing.com/news/insider-trading-news/fabrinet-evp-archer-sells-118-million-in-shares-93CH-4251432,2025-09-05 00:56:08,
2025-09-05T01:19:03,Investing.com All News,OpenAI to produce its own AI chip with Broadcom from 2026- FT,https://uk.investing.com/news/stock-market-news/openai-to-produce-its-own-ai-chip-with-broadcom-from-2026-ft-4251431,2025-09-05 00:46:09,
2025-09-05T01:19:03,Investing.com All News,Reddit CFO vollero sells $6.5m in RDDT stock,https://uk.investing.com/news/insider-trading-news/reddit-cfo-vollero-sells-65m-in-rddt-stock-93CH-4251429,2025-09-05 00:36:08,
2025-09-05T01:19:03,Investing.com All News,"Japanese stocks resilient amid political uncertainty, Morgan Stanley Says",https://uk.investing.com/news/stock-market-news/japanese-stocks-resilient-amid-political-uncertainty-morgan-stanley-says-4251428,2025-09-05 00:34:09,
2025-09-05T01:19:03,Investing.com Bond News,Rates Spark: A Beige Book That Smells a Tariff Stutter,https://uk.investing.com/analysis/rates-spark-a-beige-book-that-smells-a-tariff-stutter-200618517,"Sep 04, 2025 05:22 GMT",
2025-09-05T01:19:03,Investing.com Bond News,Treasury’s Firebreak or Fuel? The Bond Market’s Hidden Inferno,https://uk.investing.com/analysis/treasurys-firebreak-or-fuel-the-bond-markets-hidden-inferno-200618475,"Sep 03, 2025 05:37 GMT",
2025-09-05T01:19:03,Investing.com Bond News,Rates Spark: Dealing with Eurozone Disinflation,https://uk.investing.com/analysis/rates-spark-dealing-with-eurozone-disinflation-200618453,"Sep 02, 2025 07:18 GMT",
2025-09-05T01:19:03,Investing.com Bond News,Rates Spark: No Brain Steepeners Exposed to Reversals,https://uk.investing.com/analysis/rates-spark-no-brain-steepeners-exposed-to-reversals-200618401,"Aug 29, 2025 09:26 GMT",
2025-09-05T01:19:03,Investing.com Bond News,Bond Market Flashes Fiscal Dominance Warning as Yields Diverge,https://uk.investing.com/analysis/bond-market-flashes-fiscal-dominance-warning-as-yields-diverge-200618384,"Aug 28, 2025 16:37 GMT",
2025-09-05T01:19:03,Investing.com Bond News,Rates Spark: The Lisa Cook Affair and the Curve,https://uk.investing.com/analysis/rates-spark-the-lisa-cook-affair-and-the-curve-200618367,"Aug 28, 2025 07:03 GMT",
2025-09-05T01:19:03,Investing.com Bond News,Eurozone Bond Spreads Face a Jittery Autumn,https://uk.investing.com/analysis/eurozone-bond-spreads-face-a-jittery-autumn-200618345,"Aug 27, 2025 11:42 GMT",
2025-09-05T01:19:03,Investing.com Bond News,Credit Spreads at 25-Year Lows Highlight Investors’ Volatility Blind Spot,https://uk.investing.com/analysis/credit-spreads-at-25year-lows-highlight-investors-volatility-blind-spot-200618336,"Aug 26, 2025 13:28 GMT",
2025-09-05T01:19:03,Investing.com Bond News,Rates Spark: The Bottoming Out of the 2-Year Bund,https://uk.investing.com/analysis/rates-spark-the-bottoming-out-of-the-2year-bund-200618326,"Aug 26, 2025 08:18 GMT",
2025-09-05T01:19:03,Investing.com Bond News,Even the Worst Foreign Bonds Are Beating US Treasuries Thanks to a Weak Dollar,https://uk.investing.com/analysis/even-the-worst-foreign-bonds-are-beating-us-treasuries-thanks-to-a-weak-dollar-200618307,"Aug 25, 2025 12:28 GMT",
2025-09-05T01:19:04,Google News Reuters,"Trump to rename Department of Defense the 'Department of War,' official says - Reuters",https://news.google.com/rss/articles/CBMiqAFBVV95cUxNVHdvZXZnNEN5MTZlWW5BQjRpdHJTLXh3b3ppS0Y4dW1fTndFRl9vamZDTUJMOEtYUk1RXzJsXzlaSDZqUHR2NW9OMXFmbEJNdUpOMV9iTWlNVkdMTmlDYVZSUzF4Ukhrd3lQMkFqTnAzZWljOWpuZ3VqalM4ck16QlJTaVZtMy1ieGV3LUtHblkwWHFUM2NSaWkydjdad1BtVTE2dG9hanc?oc=5,"Thu, 04 Sep 2025 23:47:22 GMT",
2025-09-05T01:19:04,Google News Reuters,"Kim tells Xi that North Korea will support China's interests, KCNA reports - Reuters",https://news.google.com/rss/articles/CBMivAFBVV95cUxOSVRDN3JxRGlMR3JCYl9id3k2SVFNekpCSmpybzUzSlBENW9EY1AtSVoxNFVVSUNxTVFEejE1cFJhbUlLTEVTZFJ6b2ZLaGpLSXlZWHQtR0wtcktOUGZfSm12MGEteTA1TWhvVUo2MFlhT3dybGVBZlFrZjRmMHVvaXhGYnJzcDNtVmdPYlE0WXhZSGdaV190Ui1BMlJ3d0VGSERwOWw1SEZLc3Y5cFBjU0hXbXBNd3Y1dk0zaQ?oc=5,"Thu, 04 Sep 2025 23:20:14 GMT",
2025-09-05T01:19:04,Google News Reuters,Exclusive: Trump signs order to bring lower Japanese auto tariffs into effect - Reuters,https://news.google.com/rss/articles/CBMirAFBVV95cUxQVE1pNXI3dU44Z3JnR0VHak1qcEZsd21NM3hxTkVxM092V3QzQ05DamhqRG5FUV83QURWaG5nUG01TTBQZFRPNlNyYmVfN0Rpa1BpZTlSYWZPR1dxTFp2b1pDYkNIeXJkczRhLTczMFhoWGJyVjNra3dtMmVneHVJRUM3SXl2dTMyMHBnMzBrS3BOTVhUdlFnOWxHVWxKVkNWTWRoVmpmRENpQmcw?oc=5,"Thu, 04 Sep 2025 22:57:38 GMT",
2025-09-05T01:19:04,Google News Reuters,"Rate cut anticipation boosts stocks, bonds as US labor market chills - Reuters",https://news.google.com/rss/articles/CBMie0FVX3lxTE5PYURPaEM5RjVUOVlYWFlnMzRmaEtOSWtqeTdRUVJkbXZpN2NDbHpINkI3WmZHWU1fczhELWpqT1dLd3FGRlJXalBoX3ZrUGxoWGZxUDZFc1N6TlhIenhGNGotQmJTUEJrNTQyVkZMZU9GV1MxcnZtRFZNYw?oc=5,"Thu, 04 Sep 2025 23:20:59 GMT",
2025-09-05T01:19:04,Google News Reuters,S&P 500 registers record-high close as data keeps rate cut views intact - Reuters,https://news.google.com/rss/articles/CBMisgFBVV95cUxOU2xKd2RsUXVMUnBvMldxckdfMFhoYVFiMzJpdXVSdk5SWHV3X0tUWGlZWXJDSVZYdDJFcmJHUW1oLXZIYWhXeEk5dnlqbGViYUJ4bnNUVGFpak1xN3NaV0ZDLUkwOUFUQVZUZTBORzNhb0pMWUdGdW5aVldoS2tUNEhXQXRGU1IzUEg4UDlNT3hCWUhwUm8xdXRhb3NRbkFoY2tPOXQzSFJWa1h6eDVaY2Rn?oc=5,"Thu, 04 Sep 2025 23:18:23 GMT",
2025-09-05T01:19:04,Google News Reuters,"Trump pressures European leaders over Russian oil purchases, White House official says - Reuters",https://news.google.com/rss/articles/CBMizAFBVV95cUxPWDZERmVUQnhjUFM4SEpReHBWZ0hzaHp5MGk3TGNnUXltNFJITmp6LXJIX0FSZE1JTjlOWGo1SzR1NG1MWFhhRldXNERHLVZuMEJyNVMtZFJKMkhlcUJRcW9oakpPWHhpcFFaanRlX2N0cUF0dmtmbDVYbVFRRUhGbGNRd3BPaVVPOUQ1bmluZmVPYmFGLVFRSDVSVDJ3eG4tRWtqdGpiZjJJN19hdXpEYXpSZGh4VDRkRmhCd3VXaS1fWUMza3BqdWhoZzE?oc=5,"Thu, 04 Sep 2025 20:12:22 GMT",
2025-09-05T01:19:04,Google News Reuters,After Armani: what becomes of the fashion empire he built? - Reuters,https://news.google.com/rss/articles/CBMipAFBVV95cUxOelFPNUZWcVZrclhoNFQtZXZvc0duU1BYZkxybzl5U21aQ3RwT3BiRHRWTGpoX2R5X2MyOEs4NEN5M0RITDhQU2FLclpZWGpmdTYzcWw3MWxuRlJIWFpWNExtUldsTFNxMUlic3ctYnREVHM2NVdhejdkckxjZUJfRHdWWnpIMUlONHdaNHg4a0Jkai1JY2JFTE5naG83b2o0UUpiSQ?oc=5,"Thu, 04 Sep 2025 21:34:03 GMT",
2025-09-05T01:19:04,Google News Reuters,US senators pit Kennedy against Trump on vaccine policy - Reuters,https://news.google.com/rss/articles/CBMiwgFBVV95cUxNd3ZkRU9XVjhEQU81TllKZ2FGbjRiRkx5akxMMTQzTlo3VkwtNi05VHRkTGUtUU9OTW9ianR4YUxHNDUySXh4TDV4TGd2bTJLd1VmQ21qZ3hfUlZvQ2EzYnBFR3RxdHptWEFfX2N0dG5Lc3lCLXNESnp2YllBUGdWVzFGTUJjNkR0VGVEcXk2WkFyZ2N4OUxDN2c2YjM5TDVPRDJ6WHpHODNIQXZGUDFQYy10Q21ucFRZdGFQSnR6ckV5Zw?oc=5,"Fri, 05 Sep 2025 00:33:38 GMT",
2025-09-05T01:19:04,Google News Reuters,"Third quake strikes southeastern Afghanistan after series that killed over 2,200 - Reuters",https://news.google.com/rss/articles/CBMi0gFBVV95cUxQSDRXSVhGZ3ZObEhjaFAwMG1VUzhwRVRzamxjY29ZaXNFMFdCVV80WXlWNW1vcHVYbGE0MXlZMGdpY21SYThndS00RkZPam9pSW1vTGlNYmRZN1hNOEt0bE42T2stY0Q4VXFUb3BYNEhlYkl6eXl0aGRnenFzMFFBb0lDbU1NSWJWRUJIT3pUNWlsVjUxQ2kzaFRzUU1Oc0E2TWN0SWgwVjZPNFRNUk1XV0RYVFZYMDU4T1lxMjlabW5FVUU5bmUyZVVYYUZmR0hPNGc?oc=5,"Thu, 04 Sep 2025 18:39:27 GMT",
2025-09-05T01:19:04,Google News Reuters,Fed nominee Miran tells Senate panel he's 'not at all' Trump's puppet - Reuters,https://news.google.com/rss/articles/CBMiugFBVV95cUxOUk5KaDF6ZU5FVUFyMGhXQlQ4d0dERjQtRjByZy11SlhXRVRWNW1IZllrWk5uZlJ0anZCWmx0YXVhUEVOd05FRldDUExSOXEtRGM4YzJ6QnIzLTNuZTYyVnBjbVpONkMxWDNHaDNPa1A4Nm55U29VYlkwUDRPaXpvM000UHprSXZnUkY4YTVZUkh4Y1VETWhlMzZfRkRWNXJLR3dmeGxoeV96b2szek8xdEMzdWRpbndWbEE?oc=5,"Thu, 04 Sep 2025 22:38:13 GMT",
2025-09-05T01:19:04,Google News Reuters,"Nasdaq unveils new listing rules to clamp down on stock manipulation, Chinese firms - Reuters",https://news.google.com/rss/articles/CBMi5wFBVV95cUxOb1dPV2RRaHhWYm1zNkx3dFJkb0JqeHh6YmdETmZ4bVhpd0FabVBncU5Zb245VmNnWUQ1Q3RGR2pnTDdYWUN5cllvNWRkSTFmaXA5OHdsSWdtYXA0d2dKQWJmbVVpTHk5UUtHYU5MSS04RGlISWpXZDdOeUpMYVlvTXlDdzRUXzJLZEQyUXYxVVFnWDhJbG1CSjBpRUplc1hOY01nWjVqdG1aN0Y1ZGdKbE1qaDcxanZjU0ZCMEl2ZW5GTHlsdi14TEE0cEIyM2V2alVtOWgzazdKQ2JuYmR1OFgtaGFiNEU?oc=5,"Thu, 04 Sep 2025 19:57:35 GMT",
2025-09-05T01:19:04,Google News Reuters,Italian fashion designer Giorgio Armani has died at 91 - Reuters,https://news.google.com/rss/articles/CBMisgFBVV95cUxObW5nUFVhVE5tcE5xekIwSVZBUklPVEJMUmV0S18wSncxc1lRM0dZYVg2RkZfZ25QWU4wakdxRUtWMmhzMVotQUtNeGJESTVMTFRyRzdsOTVycGlpTUJHVTVIa3FEOW45TFFKLThjMzZHelZIMnludTFIX2ROUUVlWllCeDNiUkRodE9LOFpnQV9QeUlXQ0F4c1d6ZnllQWZaNzRXNFJZZTY2NlF1elp5aWVB?oc=5,"Thu, 04 Sep 2025 14:17:55 GMT",
2025-09-05T01:19:04,Google News Reuters,Wall Street indexes rise as data keeps rate cut views intact - Reuters,https://news.google.com/rss/articles/CBMipAFBVV95cUxPTUVySzZfMTJLcVJVNVJmRzJwR0NUQTdVX2lKX3BkXzlIckJNN2RnZnFPZk9WbDRNc1VCS0oyNzdmclJXV1QxVUpscjVMU0ZfbUxreDRQMFZqeWJzN2RONlBSSFpMNUZDRERlYnJFRVc4UXZPUEMxbVEwMnY0TC1hX3ZhT2hQMlltTEU3eGFvc1k4bDJaOFZLeGRqc0dQTzNYZm9QOA?oc=5,"Thu, 04 Sep 2025 18:41:20 GMT",
2025-09-05T01:19:04,Google News Reuters,"Israeli military says it controls 40% of Gaza City, plans to expand operation in coming days - Reuters",https://news.google.com/rss/articles/CBMiygFBVV95cUxQTlpQS20tTkZoSmdzeHl3OU1jYUpUYnM4RUxzZzRWV0RmT0p5SXJmVWMxZU9ZWFVoYTVkU2pyb21LbHhfRWU2S3VqbkxfUVQ4ci1pOFhZMzQ2MTJuaVE5d2k1YWVNRlFkNnVxSV9LN2dKcWxCcDR1cjlrdTZ3TkJvNGJnaTdvRTgtc2hSVl9rQWRwdE84a2hzeVJDVGJMdl9nQWx1eDY1QkFTUXh1dzh5dnZPMnh6WHh4b0RJdnpEVDRZdXBzS1p0eEx3?oc=5,"Thu, 04 Sep 2025 17:50:03 GMT",
2025-09-05T01:19:04,Google News Reuters,Italian fashion designer Giorgio Armani has died - Reuters,https://news.google.com/rss/articles/CBMirgFBVV95cUxNTDhNWXh6a0JtQ2dSTnU3Tm1FTlZIaF85ZWRIczdmRDFUY2FudzJZZXhUMUtkc2N2bE1hVGJ5cUhFQWx1dkZCSHhsRnRzZUtfTDZaR2dkTkFicFBzb1U2bXFPQWw4bFF3cW1qcVl0OGExR1FudHdQOWU1ZTBicWp3TEluc0FwTmxxMHpDak1pZGl3TV9qbjhrME54UWNrMDdBMl9oelBhVnlkQ1N4LWc?oc=5,"Thu, 04 Sep 2025 13:25:52 GMT",
2025-09-05T01:19:04,Google News Reuters,"26 nations vow to give Ukraine postwar security guarantees, Macron says - Reuters",https://news.google.com/rss/articles/CBMitwFBVV95cUxNNWpoVFF2TGhKbmdoUHF1UE4wUzJxaE56XzBzRklLRFlxcm9UOVZCWDdDV1E0TXpBRVd5QktrSEVPcnpWbTBJRGs1WlAwQVl0NGRkVXB6endpeWd2SVEzVVhONjJoRG12emRVcUVZeng1YzBnYlQtQVhzbDZLd3B3cndfUFp0MkEtbnJ6NUViSjlXNVEwRGVDZU9Xd2ZaRHdSZkVMbkNfV255cHVYcE5DXzFHWDNhbW8?oc=5,"Fri, 05 Sep 2025 00:01:00 GMT",
2025-09-05T01:19:04,Google News Reuters,Wall St muted after soft labor data; Salesforce weighs on Dow - Reuters,https://news.google.com/rss/articles/CBMipAFBVV95cUxNLV9veXhiYk1HMXktaEJkNWJWN1FpaEpoWEtHeXhnZlpyZGtqcWVHZktxNkZHRWR1RmpIUnZNeTc0bVdpMlg4dm1PTk5QNkNZTjZzaHRDWnZrQTdadHlRQ01IcGNYUTN5ZE8tOGhrYlpJN09hRHV6dmEtSHJxb1RyR2FNLXNOZ1h4YldxamhER182T3R3NTM0VjFacDdBZHEyVGxXZA?oc=5,"Thu, 04 Sep 2025 14:22:39 GMT",
2025-09-05T01:19:04,Google News Reuters,"Indonesian student protesters meet ministers, set out complaints - Reuters",https://news.google.com/rss/articles/CBMiugFBVV95cUxQRU9rUkJLNDl5TnJPZEV0cmhmQVJUc2dSOU5Rc0FiM21YNHhrbE5qdFdtVWlZMzgyTG1ESTdOM0tKbl9tdjBrQ01pVERLZEF5N093RDM3aFJtZ0t1RlhDWWgyVFdOS194T2ZZOXFFalJJTjM1NkhCdUM2MThtQkhhaDFCZ3BKM0hlQ1pmdF83Sm5DNHp6TlNHNk5iVWFyZDhVZDhqelpiTG9jSmR0dnhVd19Mb3dad0JkSlE?oc=5,"Thu, 04 Sep 2025 16:41:37 GMT",
2025-09-05T01:19:04,Google News Reuters,Shares shake off China selloff as bond markets brighten - Reuters,https://news.google.com/rss/articles/CBMie0FVX3lxTFBwUlBBc0dvelVMQW5yUFIxMmhGZE9XUVdKcmJwckpwc1FrMDljNWNfcjc1b3NDcHZhS08zVGtFeXc3QWJWem1SMllHU0oyTHZqQnBmbEJJYjBPRVJ1aHhWT0l3NlBrVk4tN3lMYzVyU0lUSjVNbThnT1poWQ?oc=5,"Thu, 04 Sep 2025 16:58:35 GMT",
2025-09-05T01:19:04,Google News Reuters,"Oil prices ease on surprise build in US crude stockpiles, OPEC+ to consider output hike - Reuters",https://news.google.com/rss/articles/CBMixwFBVV95cUxPeDRsZDE3X24wQ21SbEkxcm80SzlHR0lqUVhwMmE1UmxoWklmamVOb2lkNjdmQXdtQnNRX1NUSnhDbjNTcVdQRHBsRTVtdkxEWHA2Y0lxX2syejdlb3hIeEFzTEtCYURJM2J3X3BsR0ZUeGF5TFZnbE5XMURJVFdKZURaWTFsbHZLWlpfSGtFc0FjbDdxQlhzMFQzTHUyN3p5Qy1WbWx3UFNuNFJFN3RKYnVEVW94UmpKdHBMNU1QZ0h4OUhHQXln?oc=5,"Thu, 04 Sep 2025 19:02:42 GMT",
2025-09-05T01:19:04,Google News Reuters,"Warner Bros Discovery sues AI photo generator Midjourney for stealing Superman, Scooby-Doo - Reuters",https://news.google.com/rss/articles/CBMixgFBVV95cUxPbXlDbUtpTl9ZSVRKLXF0TVRaam1sSzRoOTVEU1pYTFNZaktZZE8yS0t2cEFudHFMMFhCUUp6TTNIUm9JQ3NhQmdKN2cyQkZ2OVloZnhSQTdJTTJ4akhnZkZlQ0FIQ2FZeHV6X2dpSkFSNVRjTFhORGptZndxRFBwTmptNzJ5QjNjZV9RaGRsd1JpYk5UWkJpRTZSX2trVjA2bjgtUEg2ajZHVE84cFVjMlRjUWxnZ0Vlb2JHV3IzWlh2UGgtUUE?oc=5,"Thu, 04 Sep 2025 20:26:18 GMT",
2025-09-05T01:19:04,Google News Reuters,"Floating oil facility arrives in Venezuela for China Concord's project, sources say - Reuters",https://news.google.com/rss/articles/CBMixAFBVV95cUxOR1p3M0l6RFlfVEZxQU9HOFdPWlh6S1Y0MTNjNmZ4MEQzcDdlSE1mcjY0T1lBZVNVWVNXRDZxNjRQMFlXemJoNTRacFExbGJ6bElESUV2b2xianRKbFlEVW42SnRnRjJWcEt6cEdZZzdIOXQ5ekV2MDJSQkd2Qm13QjQ4Z1ZGTUpyNGxHVWVWclNWSUJ2Q1RHX19qVnJNd29aOU84dk9IYjEteXFFVl9hNVpkNjNqRWlfd0l0XzlBNGNtT3ho?oc=5,"Thu, 04 Sep 2025 16:28:13 GMT",
2025-09-05T01:19:04,Google News Reuters,Oil prices dip with OPEC+ to consider another output hike - Reuters,https://news.google.com/rss/articles/CBMiqAFBVV95cUxPcDFjLUlnTXNBOU84a2dzWXdMajFYeWZOeXpxQzFNU3R3czhyWGtWbTZyUi1Mc2xJLV9QSnBIdU1TUnpqcDhZMUJvTHhYcWs1WFJCbXFfdlQtS09pd0dYeWhHU1c2RUNKU09JdG5MczFGTy1tcExYNElqSEs0MzRpNjBwWFdYNnBJZ04yRUZCanpQbEgtUmZzbnliU3E1Ym5XSVNINTNESnU?oc=5,"Thu, 04 Sep 2025 15:45:20 GMT",
2025-09-05T01:19:04,Google News Reuters,Italian fashion designer Giorgio Armani dies at 91 - Reuters,https://news.google.com/rss/articles/CBMirAFBVV95cUxOUGNJMEI0NXlzeVdvMVFJNHZHNEFna01SVnA5TnpDYmxCeElBZDJDNklCUWdyNmxmNFRmNHQ1Y2ZHQlprWXdUbDViVU9HMXFQYklEbHllNHIzaGtyRTE3bzRYYmpsN1BKekVXaVJfQVU4UTJuaDJYQ2NyTDRnN0s2OW0xRElub3c5bkZud1ZjLVRVei1qcm9RZzZGcGVaMm1yUE92RGVSMnhLZkRV?oc=5,"Thu, 04 Sep 2025 17:07:38 GMT",
