timestamp,source,title,link,published,content
2025-08-01T01:53:22,MarketWatch Top,"Coinbase misses the mark on quarterly sales, including this all-important revenue stream",https://www.marketwatch.com/story/coinbase-misses-the-mark-on-quarterly-sales-including-this-all-important-revenue-stream-17418f3e?mod=mw_rss_topstories,"Fri, 01 Aug 2025 00:38:00 GMT",
2025-08-01T01:53:22,MarketWatch Top,MicroStrategy just posted a huge profit. It’s the second time riding on an accounting rule change.,https://www.marketwatch.com/story/microstrategy-just-posted-a-huge-profit-its-the-second-time-riding-on-an-accounting-rule-change-9116302f?mod=mw_rss_topstories,"Fri, 01 Aug 2025 00:37:00 GMT",
2025-08-01T01:53:22,MarketWatch Top,Lumen says it has a new asset in tow as it chases more AI business,https://www.marketwatch.com/story/lumen-says-it-has-a-new-asset-in-tow-as-it-chases-more-ai-business-925ea5d6?mod=mw_rss_topstories,"Fri, 01 Aug 2025 00:36:00 GMT",
2025-08-01T01:53:22,MarketWatch Top,Reddit’s stock is soaring after earnings. This is why.,https://www.marketwatch.com/story/reddits-stock-is-soaring-after-earnings-this-is-why-7086fff3?mod=mw_rss_topstories,"Fri, 01 Aug 2025 00:35:00 GMT",
2025-08-01T01:53:22,MarketWatch Top,"Apple’s earnings were good, but the initial stock move implies Wall Street is wary",https://www.marketwatch.com/story/apples-earnings-were-good-but-the-initial-stock-move-implies-wall-street-is-wary-5e63f640?mod=mw_rss_topstories,"Fri, 01 Aug 2025 00:15:00 GMT",
2025-08-01T01:53:22,MarketWatch Top,"Here’s what’s worth streaming in August 2025 on Netflix, Hulu, HBO Max, Disney+ and more",https://www.marketwatch.com/story/heres-whats-worth-streaming-in-august-2025-on-netflix-hulu-hbo-max-disney-and-more-2654312a?mod=mw_rss_topstories,"Thu, 31 Jul 2025 23:02:00 GMT",
2025-08-01T01:53:22,MarketWatch Top,‘He spent every dime’: My daughter’s husband is in prison. Is she responsible for his debts?,https://www.marketwatch.com/story/he-is-currently-in-jail-my-daughters-husband-has-bipolar-i-disorder-can-he-sign-divorce-papers-ecd23e32?mod=mw_rss_topstories,"Thu, 31 Jul 2025 22:02:00 GMT",
2025-08-01T01:53:22,MarketWatch Top,My therapist said he was in-network. The insurer says he’s not. Am I obliged to pay full rates for all prior sessions?,https://www.marketwatch.com/story/my-therapist-said-he-was-in-network-hes-not-am-i-obliged-to-pay-out-of-network-rates-for-all-prior-sessions-ab570bed?mod=mw_rss_topstories,"Thu, 31 Jul 2025 21:38:00 GMT",
2025-08-01T01:53:22,MarketWatch Top,‘I told him that wouldn’t fly’: My 90-year-old mother’s adviser pushed her to change her beneficiaries. What is going on?,https://www.marketwatch.com/story/i-told-him-that-wouldnt-fly-my-90-year-old-mothers-adviser-changed-the-beneficiaries-on-her-accounts-what-is-going-on-dbba0312?mod=mw_rss_topstories,"Thu, 31 Jul 2025 21:34:00 GMT",
2025-08-01T01:53:22,MarketWatch Top,How Figma’s soaring stock made for a historic IPO — and what may come next,https://www.marketwatch.com/story/figma-prices-ipo-at-33-a-share-raising-1-2-billion-b8df6eca?mod=mw_rss_topstories,"Thu, 31 Jul 2025 21:21:00 GMT",
2025-08-01T01:53:22,CNBC Top News,"Trump rejigs tariff rates ahead of deadline, levies 40% duties on all transshipped goods",https://www.cnbc.com/2025/08/01/trump-rejigs-tariff-rates-ahead-of-deadline-levies-40percent-duties-on-all-transshipped-goods.html,"Fri, 01 Aug 2025 01:26:06 GMT",
2025-08-01T01:53:22,CNBC Top News,Figma's top VCs are sitting on $24 billion worth of stock after massive IPO pop,https://www.cnbc.com/2025/07/31/figmas-top-vcs-sitting-on-20-billion-in-stock-after-ipo-pop.html,"Fri, 01 Aug 2025 01:42:15 GMT",
2025-08-01T01:53:22,CNBC Top News,Tesla Autopilot plaintiffs seek $345 million in damages over fatal crash in Florida,https://www.cnbc.com/2025/07/31/tesla-autopilot-plaintiffs-seek-345-million-over-fatal-florida-crash.html,"Fri, 01 Aug 2025 00:21:32 GMT",
2025-08-01T01:53:22,CNBC Top News,Apple's killer quarter buys more time for the company to deliver clarity on AI,https://www.cnbc.com/2025/07/31/apples-killer-quarter-buys-more-time-for-the-company-to-deliver-clarity-on-ai.html,"Fri, 01 Aug 2025 00:53:37 GMT",
2025-08-01T01:53:22,CNBC Top News,Amazon's gloomy earnings forecast overshadows better-than-expected results,https://www.cnbc.com/2025/07/31/amazon-amzn-q2-earnings-report-2025.html,"Thu, 31 Jul 2025 22:46:35 GMT",
2025-08-01T01:53:22,CNBC Top News,Apple reports biggest revenue growth since December 2021,https://www.cnbc.com/2025/07/31/apple-aapl-q3-earnings-report-2025.html,"Thu, 31 Jul 2025 22:42:34 GMT",
2025-08-01T01:53:22,CNBC Top News,Why we're keeping our buy rating on Amazon — even as shares tumble after earnings,https://www.cnbc.com/2025/07/31/were-reiterating-our-rating-on-amazon-as-shares-fall-in-the-after-hours.html,"Fri, 01 Aug 2025 00:12:36 GMT",
2025-08-01T01:53:22,CNBC Top News,How wealthy yacht buyers plan to avoid the European tariffs,https://www.cnbc.com/2025/07/31/europe-yacht-buyers-tariffs.html,"Thu, 31 Jul 2025 18:50:38 GMT",
2025-08-01T01:53:22,CNBC Top News,'Gateway drug': Labubus are getting U.S. consumers hooked on Pop Mart and driving up business,https://www.cnbc.com/2025/07/31/labubu-pop-mart-china-us-fashion.html,"Thu, 31 Jul 2025 20:20:55 GMT",
2025-08-01T01:53:22,CNBC Top News,The words investors are betting will be said tonight on Apple's earnings call,https://www.cnbc.com/2025/07/31/you-can-bet-on-the-words-that-will-be-said-on-apples-earnings-call.html,"Thu, 31 Jul 2025 18:45:59 GMT",
2025-08-01T01:53:22,CNBC Top News,"Facing questions on AI strategy, Tim Cook says Apple is 'very open' to acquisitions",https://www.cnbc.com/2025/07/31/tim-cook-apple-ai-acquisitions.html,"Thu, 31 Jul 2025 23:36:37 GMT",
2025-08-01T01:53:22,CNBC Top News,Figma more than triples in NYSE debut after selling shares at $33,https://www.cnbc.com/2025/07/31/figma-fig-starts-trading-on-nyse-after-ipo.html,"Thu, 31 Jul 2025 20:57:20 GMT",
2025-08-01T01:53:22,CNBC Top News,Amazon's cloud business records 18% growth in second quarter,https://www.cnbc.com/2025/07/31/aws-q2-2025-earnings-report-amazon-cloud.html,"Thu, 31 Jul 2025 22:39:35 GMT",
2025-08-01T01:53:22,CNBC Top News,"FICO CEO defends credit score pricing amid FHFA criticism, says cost isn't blocking home ownership",https://www.cnbc.com/2025/07/31/fico-ceo-defends-credit-score-pricing-amid-fhfa-criticism.html,"Thu, 31 Jul 2025 23:29:54 GMT",
2025-08-01T01:53:22,CNBC Top News,"The S&P 500 fades despite tech rally — plus, the crosscurrents driving Lilly's volatile day",https://www.cnbc.com/2025/07/31/the-sp-500-fades-despite-tech-rally-plus-the-crosscurrents-driving-lillys-volatile-day.html,"Thu, 31 Jul 2025 18:47:20 GMT",
2025-08-01T01:53:22,CNBC Top News,Reddit shares jump as much as 20% on second-quarter sales and guidance beat,https://www.cnbc.com/2025/07/31/reddit-rddt-q2-2025.html,"Thu, 31 Jul 2025 22:34:51 GMT",
2025-08-01T01:53:22,CNBC Top News,Coinbase shares tumble as second-quarter revenue disappoints,https://www.cnbc.com/2025/07/31/coinbase-coin-earnings-q2-2025.html,"Thu, 31 Jul 2025 21:18:28 GMT",
2025-08-01T01:53:22,CNBC Top News,Trump says he asked 17 drugmakers to take steps to cut U.S. prices within 60 days,https://www.cnbc.com/2025/07/31/trump-drug-prices-eli-lilly.html,"Thu, 31 Jul 2025 20:58:30 GMT",
2025-08-01T01:53:22,CNBC Top News,Trump extends Mexico's 25% tariffs for 90 days as talks continue,https://www.cnbc.com/2025/07/31/trump-tariffs-mexico-extension.html,"Thu, 31 Jul 2025 18:30:07 GMT",
2025-08-01T01:53:22,CNBC Top News,"Coinbase says it's launching tokenized stocks, predictions markets for U.S. users in coming months",https://www.cnbc.com/2025/07/31/coinbase-to-launch-tokenized-stocks-predictions-markets-in-us-in-coming-months.html,"Thu, 31 Jul 2025 20:11:33 GMT",
2025-08-01T01:53:22,CNBC Top News,SEC debuts 'Project Crypto' to bring U.S. financial markets 'on chain',https://www.cnbc.com/2025/07/31/sec-debuts-project-crypto-to-bring-us-financial-markets-on-chain.html,"Thu, 31 Jul 2025 19:08:26 GMT",
2025-08-01T01:53:22,CNBC Top News,Appeals court skeptical of Trump tariff authority,https://www.cnbc.com/2025/07/31/trump-trade-tariffs-lawsuit-hearing.html,"Thu, 31 Jul 2025 17:46:38 GMT",
2025-08-01T01:53:22,CNBC Top News,Elon Musk's plan to build Boring Co. tunnels in Nashville sparks partisan feud,https://www.cnbc.com/2025/07/30/elon-musks-boring-company-to-build-10-miles-of-tunnels-in-nashville.html,"Thu, 31 Jul 2025 01:28:00 GMT",
2025-08-01T01:53:22,CNBC Top News,Trump’s tariff deadline is near. Here’s a look at countries that have a deal — and those that don't,https://www.cnbc.com/2025/07/31/trumps-aug-1-tariff-deadline-those-who-have-and-havent-signed-deal.html,"Thu, 31 Jul 2025 05:25:34 GMT",
2025-08-01T01:53:22,CNBC Top News,Trump's 50% copper tariff includes a major exemption. That won't halt price rises,https://www.cnbc.com/2025/07/31/why-us-copper-tariff-exemption-wont-fully-ease-price-rises.html,"Thu, 31 Jul 2025 15:06:38 GMT",
2025-08-01T01:53:22,CNBC Top News,"Microsoft officially tops $4 trillion in market cap, joining Nvidia in exclusive club",https://www.cnbc.com/2025/07/30/microsoft-market-cap-tops-4-trillion-after-hours-on-earnings-beat.html,"Thu, 31 Jul 2025 14:03:29 GMT",
2025-08-01T01:53:22,CNBC Top News,"Meta, Microsoft roar higher on strong earnings as AI spending booms",https://www.cnbc.com/2025/07/31/meta-microsoft-stock-earnings-ai.html,"Thu, 31 Jul 2025 20:05:55 GMT",
2025-08-01T01:53:22,CNBC Top News,"JPMorgan marks 1,000th branch opening since 2018 expansion plans",https://www.cnbc.com/2025/07/31/jpmorgan-1000th-branch-opening-expansion-plans.html,"Thu, 31 Jul 2025 19:57:45 GMT",
2025-08-01T01:53:22,CNBC Top News,Arm stock tumbles on chip designer's muted profit forecast,https://www.cnbc.com/2025/07/31/arm-stock-tumbles-on-chip-designers-muted-profit-forecast.html,"Thu, 31 Jul 2025 17:59:38 GMT",
2025-08-01T01:53:22,CNBC Top News,"Roblox stock soars 10% after revenue beat, strong user growth",https://www.cnbc.com/2025/07/31/roblox-rblx-stock-earnings.html,"Thu, 31 Jul 2025 20:01:33 GMT",
2025-08-01T01:53:23,Investing.com All News,Earnings call transcript: LPL Financial Q2 2025 beats EPS expectations,https://uk.investing.com/news/transcripts/earnings-call-transcript-lpl-financial-q2-2025-beats-eps-expectations-93CH-4195941,2025-08-01 01:42:06,
2025-08-01T01:53:23,Investing.com All News,"Earnings call transcript: Rocket Companies beats Q2 2025 forecasts, stock rises",https://uk.investing.com/news/transcripts/earnings-call-transcript-rocket-companies-beats-q2-2025-forecasts-stock-rises-93CH-4195939,2025-08-01 01:22:06,
2025-08-01T01:53:23,Investing.com All News,VICI Properties Q2 2025 slides: EPS surges 60% as experiential REIT expands,https://uk.investing.com/news/company-news/vici-properties-q2-2025-slides-eps-surges-60-as-experiential-reit-expands-93CH-4195938,2025-08-01 01:20:10,
2025-08-01T01:53:23,Investing.com All News,"Earnings call transcript: Socket Mobile Q2 2025 misses EPS, stock drops 3.94%",https://uk.investing.com/news/transcripts/earnings-call-transcript-socket-mobile-q2-2025-misses-eps-stock-drops-394-93CH-4195937,2025-08-01 01:20:09,
2025-08-01T01:53:23,Investing.com All News,Earnings call transcript: AppFolio's Q2 2025 earnings beat expectations,https://uk.investing.com/news/transcripts/earnings-call-transcript-appfolios-q2-2025-earnings-beat-expectations-93CH-4195936,2025-08-01 01:18:08,
2025-08-01T01:53:23,Investing.com All News,Earnings call transcript: Savers Value Village Q2 2025 misses EPS forecasts,https://uk.investing.com/news/transcripts/earnings-call-transcript-savers-value-village-q2-2025-misses-eps-forecasts-93CH-4195935,2025-08-01 01:12:10,
2025-08-01T01:53:23,Investing.com All News,"Earnings call transcript: ICF International Q2 2025 beats EPS, misses revenue",https://uk.investing.com/news/transcripts/earnings-call-transcript-icf-international-q2-2025-beats-eps-misses-revenue-93CH-4195934,2025-08-01 01:12:09,
2025-08-01T01:53:23,Investing.com All News,"Earnings call transcript: Fortune Brands beats Q2 2025 EPS forecast, stock rises",https://uk.investing.com/news/transcripts/earnings-call-transcript-fortune-brands-beats-q2-2025-eps-forecast-stock-rises-93CH-4195933,2025-08-01 01:08:08,
2025-08-01T01:53:23,Investing.com All News,PYC Therapeutics Q3 2025 slides: multiple clinical readouts expected amid financial headwinds,https://uk.investing.com/news/company-news/pyc-therapeutics-q3-2025-slides-multiple-clinical-readouts-expected-amid-financial-headwinds-93CH-4195932,2025-08-01 01:04:09,
2025-08-01T01:53:23,Investing.com All News,"Illumina Q2 2025 slides: revenue declines 3% while margins expand, SomaLogic acquisition announced",https://uk.investing.com/news/company-news/illumina-q2-2025-slides-revenue-declines-3-while-margins-expand-somalogic-acquisition-announced-93CH-4195930,2025-08-01 00:58:09,
2025-08-01T01:53:23,Investing.com Bond News,Medium-Term Corporates Lead US Bond Market in 2025,https://uk.investing.com/analysis/mediumterm-corporates-lead-us-bond-market-in-2025-200617754,"Jul 23, 2025 11:53 GMT",
2025-08-01T01:53:23,Investing.com Bond News,Japan’s Election Results Could Send Shockwaves Through US Bond Market,https://uk.investing.com/analysis/japans-election-results-could-send-shockwaves-through-us-bond-market-this-week-200617701,"Jul 21, 2025 06:55 GMT",
2025-08-01T01:53:23,Investing.com Bond News,How Fed Could Inject Liquidity if Bond Yields Surge: What Investors Need to Know,https://uk.investing.com/analysis/how-fed-could-inject-liquidity-if-bond-yields-surge-what-investors-need-to-know-200617670,"Jul 17, 2025 13:37 GMT",
2025-08-01T01:53:23,Investing.com Bond News,US 10-Year Yield Holds Above Fair Value as Deficit and CPI Heat Up,https://uk.investing.com/analysis/us-10year-yield-holds-above-fair-value-as-deficit-and-cpi-heat-up-200617650,"Jul 16, 2025 11:56 GMT",
2025-08-01T01:53:23,Investing.com Bond News,Treasury Auction Shows Strength: Bid-to-Cover and Foreign Demand Surge,https://uk.investing.com/analysis/treasury-auction-shows-strength-bidtocover-and-foreign-demand-surge-200617554,"Jul 10, 2025 10:41 GMT",
2025-08-01T01:53:23,Investing.com Bond News,US 30-Year Yield Mispriced? Inflation and Deficits Point to Higher Rates,https://uk.investing.com/analysis/us-30year-yield-mispriced-inflation-and-deficits-point-to-higher-rates-200617522,"Jul 08, 2025 13:52 GMT",
2025-08-01T01:53:23,Investing.com Bond News,Bond Market May Struggle to Price in Conflicting Risk Factors,https://uk.investing.com/analysis/bond-market-may-struggle-to-price-in-conflicting-risk-factors-200617504,"Jul 07, 2025 12:20 GMT",
2025-08-01T01:53:23,Investing.com Bond News,How the Fed’s SLR Tweak Could End the Bond Bear Market,https://uk.investing.com/analysis/how-the-feds-slr-tweak-could-end-the-bond-bear-market-200617413,"Jun 30, 2025 10:24 GMT",
2025-08-01T01:53:23,Investing.com Bond News,US 10-Year Treasury Yield Stays Above Fair Value as Tariff Impact Looms,https://uk.investing.com/analysis/us-10year-treasury-yield-stays-above-fair-value-as-tariff-impact-looms-200617167,"Jun 12, 2025 11:18 GMT",
2025-08-01T01:53:23,Investing.com Bond News,The Case for Bond Yield Chasing,https://uk.investing.com/analysis/the-case-for-bond-yield-chasing-200617101,"Jun 09, 2025 14:00 GMT",
2025-08-01T01:53:23,Google News Reuters,"Apple revenue forecast beats estimates, tariff costs projected at $1.1 billion - Reuters",https://news.google.com/rss/articles/CBMixgFBVV95cUxPZkJNZlB5WjBSY3BlRjdKS3ktZUpmdmg0RTYyaVpNS3F1eEcwdHlaQU8zdjJmNXBaOWpVYzhXd0kxMU9YaWEtTGlXdUFpcmJ6VE1UcHFQQW15Q2pwUlhMU3JLZS05WXRwU3phSGFfUEFBRFlaY0tVZ3ladVVWUlluUGxPdDRyLXRfMW1IUkNHOVB4ZGJXYkhobDV5bmt2VFVTVzF6LWRTdm1iM1RzSjI4UDg0cy12Ry1qRVItdG9DT1o4b1dPREE?oc=5,"Fri, 01 Aug 2025 00:03:00 GMT",
2025-08-01T01:53:23,Google News Reuters,"Trump increases tariff on Canada to 35% from 25%, cites fentanyl - Reuters",https://news.google.com/rss/articles/CBMiowFBVV95cUxQZGtSM1dIbGk0YlljeXhBWV9mdGJBTFRoMGVfa0pzc2VWeEw2b3VpV2dVOGlRZ1MzUHZpaWcwMDdpMy1RcWcyRUV5ZWxoT3h6X1ZZNXhVMHY3NUt4RGtjUS1TbGZUUmVmYWlDRG5fTkxhZ3V1ellEd1lhM2hzdjNuSUxjTG9BNVR3NWt0b1hvQ2RWTHc0a1lvT1Myd3BLdl9ndzRn?oc=5,"Fri, 01 Aug 2025 00:25:00 GMT",
2025-08-01T01:53:23,Google News Reuters,Trump sets 10% to 41% 'reciprocal' tariffs on dozens of countries' exports - Reuters,https://news.google.com/rss/articles/CBMiqAFBVV95cUxQd0xZMlRYdDJuaFFiVVpQcF9FRWhOY2lzNnNOcGtBQ2tqOWV2aWtEU05xN2VXbTNnd1ZUaG9aWmxoMEIwWWFYVHRHSGI0UFd0LWprX0dJS3JRRnhmQ0ZndjMteFNqTnlySUNIVEh4MlJRR2ZUQ0wzUmxoVUNZZ0VLWFgxVVNDVGxLc3VDRTN4MXYycm45Wk42ZEFqaWhIRzdIWnlibVIza1Y?oc=5,"Fri, 01 Aug 2025 00:19:00 GMT",
2025-08-01T01:53:23,Google News Reuters,"Trump increases tariff on Canada to 35%, White House says - Reuters",https://news.google.com/rss/articles/CBMimgFBVV95cUxPS2J6eThickxiUGFRbGF0SW1pTjJzWjA4LThGTmZocFNuR0N2RkJPVHJ1bExDUW9nSVp6cEZhNEdVYjBMYXpiT0FLemU3NnUxSlltQ20tS0N2bDlycVFLRjd2QUQ4QkczZkxTQm14SktCYkV2MHJhTHVyWU1zbFZrRk52R3JPeUhlMTBhZ0tVc0tBQWdpUWlwMGl3?oc=5,"Thu, 31 Jul 2025 23:25:17 GMT",
2025-08-01T01:53:23,Google News Reuters,"Trump hits dozens of countries with steep tariffs, including 35% for Canadian goods - Reuters",https://news.google.com/rss/articles/CBMiwwFBVV95cUxNUDBrN3BDUlRpOU5BSm9ZWHhveXpuZ1ZvaHN6OGFJTmtHLWI4YzM2NkVkZVRDWE4yd09VRjJlSHlXc3JqOVdoMTh2VnNxWGdWSEpXcm55dmFYaGJjR3BTZVFlUGZHQXpDRU4xTl9jQ2tVenNteHJNUm9XRWJtektpRWVUSkMyNGRxeWVWQzhHNjJjTXV6NW9xYWpoQ0xUZ19CajBzRmdHeFp5aEdrcWY2Qzc3NDR5UXFZNGhkNjA2WDh4Tlk?oc=5,"Fri, 01 Aug 2025 01:00:00 GMT",
2025-08-01T01:53:23,Google News Reuters,"Russian strikes kill 16 people in Kyiv, including two children - Reuters",https://news.google.com/rss/articles/CBMiogFBVV95cUxPMTNKNEZ4U3NhdWdWd2ZsMTZlTk9xMm9zZ0lPLV81T0ZncXVqa3BHMFlWZzl1bkQzM1o0Q2JrSy1rdXdYSTJrREVGbDFpRHBKZEdFQ0oxT2o1YmYwaVBiWGpLRlFVN21IMTJJWjlRa0x2M1NkakZ2b0k3YWlvYjBsNHNKWTBCeHhjUDNHU1FaQllmenBuaDJSX0pxM3A1SDlpQlE?oc=5,"Thu, 31 Jul 2025 22:20:36 GMT",
2025-08-01T01:53:23,Google News Reuters,"Amazon cloud computing results fail to impress, shares dive - Reuters",https://news.google.com/rss/articles/CBMitwFBVV95cUxQUVptaHFxOVNQeTdxYnlGT3BoVXZLcEpfY1M3VmMzckJMNXB0M0tiOW5NR0hBd01IRFZzTFY4enVlTXd1dnJIcldZdVdhakZEX25CWW0xV3dMbFQ1NFJ0aTlXM0Y4MGw4Y1dkVjBvdEgtX2VqUjYxeFBIRGZHaXNJMGpDSTE5M0Roa25XQl9sZlZ1a3Y3bG9xN3YyTDU4cGNSZkhpYTk2TERoSmpHODFPM0VlTlJGTVU?oc=5,"Thu, 31 Jul 2025 22:39:38 GMT",
2025-08-01T01:53:23,Google News Reuters,Trump to start building $200 million White House ballroom in September - Reuters,https://news.google.com/rss/articles/CBMirAFBVV95cUxQU05IblU3ZjgzUm4ybDlscGpUdVZ5aUJUN2lyazI3V1ZUdjktbTFnZlVvVk5pd2NlcmNtMTdzRTFhQkIwY1ljZVNfbkdSOHFRZVMzR1dTQkItakw5a3pock1WVGdxaWtvU19waU9vMm5DVU1GWllFZkxZNFRvNTc1bkdsVEhvd3k5MXpQSHhBYlVDYzNnWEl6NzBndWFBRS1QY1A0TlZQTTVrSmpM?oc=5,"Thu, 31 Jul 2025 22:00:06 GMT",
2025-08-01T01:53:23,Google News Reuters,"Amazon cloud computing results fail to impress, shares slide after hours - Reuters",https://news.google.com/rss/articles/CBMiyAFBVV95cUxOSU03WmNKWHBKczM0VklKczdHYmZBMnhoRVJiUE44MldMM3E3QmNpaUllVWFmel9HQUlHLWc5dmdneHRCdWxBOUlCa25keWE5WU5YejNneU5WS3B5SzJacGdodzBoNWV1bHIzLUhNamtiZTlQZF8yMGF3SHJrUUI5bzNWRHdwZnRPMy1hN3Q0V1dnLWxibU9qUjU5SVhYZWdlSDRuRmVHam1scEJ2eW1LRWxDV082VklQWmFJMXRqWmlUU1ppc0NlbQ?oc=5,"Thu, 31 Jul 2025 21:16:58 GMT",
2025-08-01T01:53:23,Google News Reuters,"US Senate committee backs more Ukraine funding, following Trump shift on aid - Reuters",https://news.google.com/rss/articles/CBMiuAFBVV95cUxQMzdBSWtWSGlteS05ZWlfaGpwRXRsc2RGVUNpZEdlenR6RFo0YlFsWjRYZHFpbmhZTENfZHRrLWo3YS1kSk9xdlJyTkhUbWU2ZFNab0wwZFF6ZGRBdGowQXg2ZnZjVzBmZ0RfMG5qQnByNnFWYnNOcnRLM1pnd0Z0Q3A5UGs3UVlETEZtQ0k5Y2VzZDhxLTNmZ3g3akY2aE9WT0JhSDRqbVEtdlZka2VneVlJV2tXSzg2?oc=5,"Thu, 31 Jul 2025 20:49:24 GMT",
2025-08-01T01:53:23,Google News Reuters,US Army pools contracts into up to $10 billion Palantir deal - Reuters,https://news.google.com/rss/articles/CBMiowFBVV95cUxNT2dhTVB4X1UwWElTNFM0M0J0MlZBdzV6RHFGUzQ0a29zXzREYUlPdzR1blpXWGQtR3BDLU5VZHVxSkFTMkY5ZjYzWjhjOUxnYkdhZElXTkVCel9ETWJmYW9xeTJNcWItVUJLc2JXSmUxai1uclVveVpPR2NMZndJZ19Xby1sS2pEV2dacE5UdGhzeGZLaTVhMTZ1Q3BZWXltVjdv?oc=5,"Thu, 31 Jul 2025 21:56:18 GMT",
2025-08-01T01:53:23,Google News Reuters,"Equities stall as early enthusiasm ebbs; Amazon, Apple earnings due - Reuters",https://news.google.com/rss/articles/CBMiqwFBVV95cUxPQTBTVmF1X0ZQTXQ3NXpjLVV4WWoxRXVyUWk0NjRDWUN0UjRmNVpEUFJ0WW9zOU05MmRrVkFqcGlNalhlNTFmN1JpWGgtVC12T0RFa1dZTHJxTS0xYnNIMUVtU1k4S0V4Q0lidmRqdWJRSlJCVVN2VWJWUFFzZmJnWnhEd2FDcS15MnhQcEIzaXVUT0F6a1N0ZExvdW9ZNGZmd0tJUWpSakQzSG8?oc=5,"Thu, 31 Jul 2025 23:51:15 GMT",
2025-08-01T01:53:23,Google News Reuters,"Exclusive: Trump administration to expand price support for US rare earths projects, sources say - Reuters",https://news.google.com/rss/articles/CBMi5AFBVV95cUxNSnlqZnRKWG1sbEVkaEU2azBxWXI3LTZKdElwSzFUa01wRlJZaXhnOTF4d0s0Qko3SnBGUnJJSW0xU1ZzajNrT0ItOUxqZXU4d0dDbnJLUXc4Uzlta3YxclZHWE04bHlUNjByaTBNS2xQb2tSYm5vQ0R1Q2RoWHY4c29TYXpMU2czWmp0aWFuZlNjbkZyQ2hjYVo3N2xhX3lqVHMxeDhteVRPaU5Cb3duaWF2dmNfOVBHc2pmWUJPSnFseDZDaDdHZk5GYlNaVHJjcmFEbzlMNldyTkVaeU14WWgxMGY?oc=5,"Thu, 31 Jul 2025 19:47:48 GMT",
2025-08-01T01:53:23,Google News Reuters,Oil prices fall as Trump's Aug 1 trade tariff deadline looms - Reuters,https://news.google.com/rss/articles/CBMirAFBVV95cUxOc1ZLbTN6al9SWHhrSVplWkY2aHV2Si02UzFHWkJJLUlqakxwZkRGcEg3dGhvaGhudXpDd2pxa3pHbnhQamxKOWtWQjhFMWhJRkdBMEJ4Tk1TODFSZ2ROYnhZeTlPRmVhUm1QdzBHbmJnejZDenVUaVFPeVV3S25ta3RveGpQRlJNdkI1b2Q5MTZLMFVNb2UxZURVcVg5N0ZrbG15Q25MQjlaYlNR?oc=5,"Thu, 31 Jul 2025 19:16:03 GMT",
2025-08-01T01:53:23,Google News Reuters,Dollar rises while global stock index falls; inflation and tariffs in focus - Reuters,https://news.google.com/rss/articles/CBMie0FVX3lxTE5YbmprOWhoeC1qblNXNHZ4dVBqTUNoZU11ZmZHdkJ0MkxQSmpQdWhoN05GMVZBT1JUVkN6a01TS1c3MDlRNGxySHp6OHVFNEhoeTJBUjJ0ZGhhV2JfUXM0THhWcjY4V0VWMld0LWkzV2V4OG1EeGRkQ1Zabw?oc=5,"Thu, 31 Jul 2025 21:21:46 GMT",
2025-08-01T01:53:23,Google News Reuters,Dollar set for first monthly gain of 2025 as trade deals ease uncertainty - Reuters,https://news.google.com/rss/articles/CBMisgFBVV95cUxQUWdXaTFwZ2E2QkdVUXBBTlF2QTl3OHp0anNKMi1seFl5V25pVEtQMmFaRnNGaGpKX1BHYzNpb0Z6ZVRYZmlBN2gxdDdCSm1JYVg0UVEzeUZfQ1Zaa0RiSnhIRjZxcF82cU5JYndpS2Q2X1JZc2V6bDJiajRraTJ3aGpkWkR6WURtVDBjWENORjFCX2pZZ3hfa0lhT0JfVlFBRUZNSVhsNExZNXRIZm1ZQ2N3?oc=5,"Thu, 31 Jul 2025 19:41:36 GMT",
2025-08-01T01:53:23,Google News Reuters,Trump pressures 17 pharma CEOs to cut US drug prices - Reuters,https://news.google.com/rss/articles/CBMivgFBVV95cUxOamphSnNvUHVaUS1KZmVvb0wxdnI3NVZJcFo5UjI5VmlHWWpaWmo3dHlIUk16UE5GaU5LNFZJODdhVVdOZ2Y1TWY1R25iOGZqYzlhUjZiRWRtaXhLLTgwTkMyUlE3NmtyVWIzVGc1aEk5TGdocTE5RndCTUJqLVdlQVVXdVNZNEw4WktfdnBVbDQzTkhxcnptNTc0SDZTTktNSW0tWW1pQUJvVXFtdE9NMFJrUzZ6WXY4dDc3NWhB?oc=5,"Thu, 31 Jul 2025 22:00:32 GMT",
2025-08-01T01:53:23,Google News Reuters,UnitedHealth replaces CFO Rex in another management shake-up - Reuters,https://news.google.com/rss/articles/CBMiyAFBVV95cUxQSGpiVmNRT3lONW5GY01IZkxrMldTYTBPTE9EU1gzRG91NEcwVWFjbE5OakJncU5XcU8yVkV1bEVVZ0VhN0hZejZNclhHTUdFV2FhbF8zVlU1Zlc1amRSOTVUakR4THhja2huNmlSN3hLWGQ5cGo4WFMzR3BQSmgxekRsZFphTVd1eUMwWXUwNU13WmpGY1hDMGpERVBScFNSVXlkb3JUdlJOSm5yQU1wR1o3RFRoaHFDQ1B6UHFROXdGS25vTEI2eg?oc=5,"Thu, 31 Jul 2025 22:19:05 GMT",
2025-08-01T01:53:23,Google News Reuters,Design software maker Figma's shares surge 158% in blowout market debut - Reuters,https://news.google.com/rss/articles/CBMiswFBVV95cUxQVmJWd1pPU09oQWJKOWdoSkcxc0JSNGtDN3VuSG9CTWhkYklhMHNFTzE1NmNURmQyb29GN0Jfd0pSWnNFZWxOSy1pYkF0Z0picTlGeThBNll3NDFLUFd0UGJaQndDajRiaVdVLTZHYnBNdkxkTWNJVXZpbHUxN3RTb0RLRThUS2JsaDIyZ3Q5aWM1bng2ODNpdy1JRlBWRTNvLWthNEh3YzlPM1RTMFNzV01uMA?oc=5,"Thu, 31 Jul 2025 18:59:57 GMT",
2025-08-01T01:53:23,Google News Reuters,Microsoft reaches $4 trillion valuation after solid results - Reuters,https://news.google.com/rss/articles/CBMiuwFBVV95cUxOSGlLc2psemtyVDlGN01rWk51Umk5TWs1a3ZMc1ZVUmZXckdNQ3ppMUluc2kycFVnMzc2bHNIZlN5S0lKS3dIc2ZxUFl4S2ZGRWY4ME9ZNjdnZzZiWTRxREZ0SzZNb1QzQko2NklQZ3M5N0l3dl9qV211NDBQWjJGcElvWkxzc0Y0SXExRU5yRFVxWVRtbU41TjA2TV84QVliRUhNQUlvTnlWWE5ENEx4dVRnM2UzenRaOUd3?oc=5,"Thu, 31 Jul 2025 17:51:45 GMT",
2025-08-01T01:53:23,Google News Reuters,"Canada plans to recognize Palestinian state, raising allies' pressure on Israel - Reuters",https://news.google.com/rss/articles/CBMiwwFBVV95cUxOYUNQTXVZa0p3U3JSUVpRX3hxYXdUVWRZbXBpSHFUaEl4dHNJVlRROFBhc1J3dERCRU9LSUl6aGw2ampUT3RGRlhsV0c2NFR5T2RDTmp5NVVuTG5LYWdsS1k0REFBeWp6RTctLUY0SjRNVHFMeDZBQXBOMU44Qy1ucFZva1hpSWFpeVdUZTZmdHhWXzFkOE82NjJRNENrU3ROby1XdGw1dE4yYnVmeGcwdGJZUklmRVcwdGtYcDBPNXZYcVU?oc=5,"Thu, 31 Jul 2025 17:11:25 GMT",
2025-08-01T01:53:23,Google News Reuters,US appeals court scrutinizes Trump's use of tariffs as trade deadline looms - Reuters,https://news.google.com/rss/articles/CBMivgFBVV95cUxPUkdRRWh3OWRIRUF2c00xX0c4VEVYRTU5X1B5WVhmcXpmckxxRW1SeFkyZ1VYOE1xWUlFZm5PV3BlVlpTVmJyMlNCREhCbjNrT01DdFNfbGFRcGR4U3NFMzd6dlpTUVRrbjQ1QlcxNHk4QXN2TGtjSkpYcGdBN1BZTzMzdEFJVmZqZkZZLUxqeFNEUkxOdjE1QTJJT1FhMGdKX3JpSFY5R0ZuZnR4UlJyWlh2U0VITFpTZmEtV0ZR?oc=5,"Thu, 31 Jul 2025 17:13:58 GMT",
2025-08-01T01:53:23,Google News Reuters,Google loses US appeal over app store reforms in Epic Games case - Reuters,https://news.google.com/rss/articles/CBMitAFBVV95cUxPWEY2dnJtU0ZKRnoyZkdqQ2owaW9HdVlrcTh5aXhsX3dHSGUwdmJEdDFiQXphOHZuSHEtZEV3dG44NkFQMWstWmtJNUtHTWI5cFBITmNOTi1QcWY5TjJhSF81a0MzMzFCV2ZwRGJOVEdadWQtc3RQRm9SU2cyQkV2VFNBeGJVYVpCLTdnM2xYUG1ZZ2N3VklVMTZ3b2tpNDY3c1NYNEdZVjZOWllZcVBFam01OUI?oc=5,"Thu, 31 Jul 2025 20:49:02 GMT",
