timestamp,source,title,link,published,content
2025-08-15T01:50:41,MarketWatch Top,Here’s what it’s like to invest in private equity — and why you don’t want it in your 401(k),https://www.marketwatch.com/story/heres-what-its-like-to-invest-in-private-equity-and-why-you-dont-want-it-in-your-401-k-2df14f91?mod=mw_rss_topstories,"Fri, 15 Aug 2025 00:52:00 GMT",
2025-08-15T01:50:41,MarketWatch Top,"Soros, Appaloosa boost their Nvidia stake. They also bought this beaten-down stock, and it’s rallying.",https://www.marketwatch.com/story/soros-appaloosa-boost-their-holdings-in-this-mag-7-stock-amid-ai-spending-boom-514807d8?mod=mw_rss_topstories,"Fri, 15 Aug 2025 00:19:00 GMT",
2025-08-15T01:50:41,MarketWatch Top,"Warren Buffett places new bets on UnitedHealth and a major homebuilder, sending their stocks soaring",https://www.marketwatch.com/story/warren-buffett-places-new-bets-on-unitedhealth-and-a-major-homebuilder-sending-their-stocks-soaring-7b49d7f5?mod=mw_rss_topstories,"Fri, 15 Aug 2025 00:17:00 GMT",
2025-08-15T01:50:41,MarketWatch Top,Intel’s stock pops. Will Trump come to the rescue with unprecedented government help?,https://www.marketwatch.com/story/intels-stock-pops-will-trump-come-to-the-rescue-with-unprecedented-financial-help-27c6501b?mod=mw_rss_topstories,"Fri, 15 Aug 2025 00:15:00 GMT",
2025-08-15T01:50:41,MarketWatch Top,"Netflix, Alibaba and this financial-sector ETF are worth a closer look right now",https://www.marketwatch.com/story/the-stock-market-still-has-broad-shoulders-to-support-investors-even-at-record-highs-560aa266?mod=mw_rss_topstories,"Thu, 14 Aug 2025 23:20:00 GMT",
2025-08-15T01:50:41,MarketWatch Top,"What has Trump done to save Social Security? Sadly, nothing.",https://www.marketwatch.com/story/what-has-done-trump-done-to-save-social-security-sadly-nothing-c110a264?mod=mw_rss_topstories,"Thu, 14 Aug 2025 22:36:00 GMT",
2025-08-15T01:50:41,MarketWatch Top,"Bullish’s stock is still rallying, as the IPO market refuses to take a summer break this year",https://www.marketwatch.com/story/bullishs-stock-is-still-rallying-as-the-ipo-market-refuses-to-take-a-summer-break-this-year-506e1a1b?mod=mw_rss_topstories,"Thu, 14 Aug 2025 22:33:00 GMT",
2025-08-15T01:50:41,MarketWatch Top,Google’s unlikely new ally in the AI race is a bitcoin miner,https://www.marketwatch.com/story/googles-unlikely-new-ally-in-the-ai-race-is-a-bitcoin-miner-f32a16dd?mod=mw_rss_topstories,"Thu, 14 Aug 2025 22:27:00 GMT",
2025-08-15T01:50:41,MarketWatch Top,"‘I am a senior citizen’: My car needs $3,500 for repairs, but only has a trade-in value of $6,000. Do I bother fixing it?",https://www.marketwatch.com/story/i-am-retired-and-not-wealthy-my-car-needs-3-500-for-repairs-but-only-has-a-trade-in-value-of-6-000-do-i-bother-fixing-it-e81d225e?mod=mw_rss_topstories,"Thu, 14 Aug 2025 21:55:00 GMT",
2025-08-15T01:50:41,MarketWatch Top,‘I’m tired of corporate America’: My wife and I have $1.65 million. I’m 61. Can I retire already?,https://www.marketwatch.com/story/im-tired-of-corporate-america-my-wife-and-i-have-1-65-million-im-61-can-i-retire-already-b125f48a?mod=mw_rss_topstories,"Thu, 14 Aug 2025 21:51:00 GMT",
2025-08-15T01:50:41,CNBC Top News,Warren Buffett's Berkshire Hathaway reveals new stake in beleaguered insurer UnitedHealth,https://www.cnbc.com/2025/08/14/warren-buffetts-berkshire-hathaway-unh.html,"Thu, 14 Aug 2025 21:19:11 GMT",
2025-08-15T01:50:41,CNBC Top News,Applied Materials shares sink 10% on light forecast amid macroeconomic uncertainties,https://www.cnbc.com/2025/08/14/applied-materials-q3-2025-results.html,"Thu, 14 Aug 2025 21:59:18 GMT",
2025-08-15T01:50:41,CNBC Top News,Intel stock climbs 7% on report Trump administration is considering stake in chipmaker,https://www.cnbc.com/2025/08/14/intel-stock-climbs-trump-admin-stake.html,"Thu, 14 Aug 2025 20:12:15 GMT",
2025-08-15T01:50:41,CNBC Top News,Japan's economy expands more than expected in second quarter as net exports remain resilient,https://www.cnbc.com/2025/08/15/japans-gdp-expands-more-than-expected-in-second-quarter-as-tariffs-take-hold.html,"Fri, 15 Aug 2025 01:26:54 GMT",
2025-08-15T01:50:41,CNBC Top News,"DOJ fires sandwich thrower after he's charged with assaulting officer in Washington, DC",https://www.cnbc.com/2025/08/14/sandwich-washington-doj-subway-bondi-.html,"Thu, 14 Aug 2025 19:34:14 GMT",
2025-08-15T01:50:41,CNBC Top News,Tariff-driven price hikes may be hidden by products stuck in 'the middle mile',https://www.cnbc.com/2025/08/14/tariff-driven-higher-prices-may-be-hidden-by-products-stuck-in-the-middle-mile.html,"Thu, 14 Aug 2025 18:49:14 GMT",
2025-08-15T01:50:41,CNBC Top News,Social Security marks its 90th anniversary — here’s what could happen to future benefits,https://www.cnbc.com/2025/08/14/social-security-90-anniversary-future-changes.html,"Thu, 14 Aug 2025 20:33:14 GMT",
2025-08-15T01:50:41,CNBC Top News,"'Don't quit the market' when it's frothy, says Jim Cramer. Here's why",https://www.cnbc.com/2025/08/14/dont-quit-the-market-when-its-frothy-says-jim-cramer-heres-why.html,"Thu, 14 Aug 2025 22:43:37 GMT",
2025-08-15T01:50:41,CNBC Top News,"GPT-5's rollout fell flat for consumers, but the AI model is gaining where it matters most",https://www.cnbc.com/2025/08/14/gpt-5-openai-ai-enterprise.html,"Thu, 14 Aug 2025 21:51:18 GMT",
2025-08-15T01:50:41,CNBC Top News,Potential Fed chair pick David Zervos of Jefferies backs aggressive interest rate cuts,https://www.cnbc.com/2025/08/14/potential-fed-chair-pick-david-zervos-of-jefferies-backs-aggressive-interest-rate-cuts.html,"Thu, 14 Aug 2025 19:40:58 GMT",
2025-08-15T01:50:41,CNBC Top News,Palantir's astronomical growth in 3 charts,https://www.cnbc.com/2025/08/14/palantir-ai-charts-revenue.html,"Thu, 14 Aug 2025 21:12:12 GMT",
2025-08-15T01:50:41,CNBC Top News,"Wholesale prices rose 0.9% in July, much more than expected",https://www.cnbc.com/2025/08/14/ppi-inflation-report-july-2025-.html,"Thu, 14 Aug 2025 16:33:12 GMT",
2025-08-15T01:50:41,CNBC Top News,Apple Watch getting redesigned blood oxygen feature following legal dispute,https://www.cnbc.com/2025/08/14/apple-watch-blood-oxygen.html,"Thu, 14 Aug 2025 16:20:53 GMT",
2025-08-15T01:50:41,CNBC Top News,Tom Dundon to buy the Portland Trail Blazers from Paul Allen's estate,https://www.cnbc.com/2025/08/13/tom-dundon-to-buy-portland-trail-blazers-from-paul-allen-estate.html,"Thu, 14 Aug 2025 11:40:31 GMT",
2025-08-15T01:50:41,CNBC Top News,"Monterey classic car auctions kick off, and sales expectations are tepid",https://www.cnbc.com/2025/08/14/monterey-car-week-classic-car-auction-sales-expectations.html,"Thu, 14 Aug 2025 17:37:43 GMT",
2025-08-15T01:50:41,CNBC Top News,"Economist Sumerlin confirms he's in the running for Fed chair, backs big interest rate cut",https://www.cnbc.com/2025/08/14/economist-sumerlin-confirms-hes-in-the-running-for-fed-chair-backs-big-interest-rate-cut.html,"Thu, 14 Aug 2025 16:07:08 GMT",
2025-08-15T01:50:41,CNBC Top News,Cadillac unveils 'Elevated Velocity' electric crossover concept car,https://www.cnbc.com/2025/08/14/cadillac-elevated-velocity-concept-car-ev.html,"Thu, 14 Aug 2025 13:00:01 GMT",
2025-08-15T01:50:41,CNBC Top News,"DOJ, SEC charge two men in $200 million water vending machine Ponzi scheme",https://www.cnbc.com/2025/08/14/doj-water-ponzi-fraud-sec.html,"Thu, 14 Aug 2025 20:33:06 GMT",
2025-08-15T01:50:41,CNBC Top News,"Why investors shouldn’t try to be a 'hero' in this economy, analyst says",https://www.cnbc.com/2025/08/14/why-investors-shouldnt-try-to-be-a-hero-in-this-economy.html,"Thu, 14 Aug 2025 19:15:38 GMT",
2025-08-15T01:50:41,CNBC Top News,Tapestry shares plunge nearly 16% as Coach parent says tariffs will bite into profits,https://www.cnbc.com/2025/08/14/tapestry-tpr-q4-2025-earnings-.html,"Thu, 14 Aug 2025 20:55:03 GMT",
2025-08-15T01:50:41,CNBC Top News,Nike co-founder Phil Knight to donate $2 billion to OHSU's Knight Cancer Institute,https://www.cnbc.com/2025/08/14/nike-phil-knight-ohsu-cancer-institute-donation.html,"Thu, 14 Aug 2025 17:51:02 GMT",
2025-08-15T01:50:41,CNBC Top News,John Deere forecasts $600 million in tariff impacts this year,https://www.cnbc.com/2025/08/14/john-deere-de-q3-2025-earnings.html,"Thu, 14 Aug 2025 16:33:01 GMT",
2025-08-15T01:50:41,CNBC Top News,Perplexity AI’s $34.5 billion bid for Chrome underscores Google's hurdles ahead of IPO anniversary,https://www.cnbc.com/2025/08/13/google-antitrust-chrome-perplexity-ai-youtube.html,"Thu, 14 Aug 2025 16:39:34 GMT",
2025-08-15T01:50:41,CNBC Top News,We are exiting a position that no longer works in this economic environment,https://www.cnbc.com/2025/08/14/we-are-exiting-a-position-that-no-longer-works-in-this-economy.html,"Thu, 14 Aug 2025 18:04:51 GMT",
2025-08-15T01:50:41,CNBC Top News,Ulta and Target will end deal for in-store beauty shops next year,https://www.cnbc.com/2025/08/14/ulta-and-target-end-deal-for-in-store-shops.html,"Thu, 14 Aug 2025 20:52:57 GMT",
2025-08-15T01:50:41,CNBC Top News,Eli Lilly hikes price of diabetes drug Mounjaro in UK as Trump pressures pharma to align drug costs,https://www.cnbc.com/2025/08/14/eli-lilly-hikes-price-of-mounjaro-in-uk-amid-trump-pressure.html,"Thu, 14 Aug 2025 16:00:37 GMT",
2025-08-15T01:50:41,CNBC Top News,"Former Goldman, JPMorgan exec gambled away investor funds for his online casino company: Feds",https://www.cnbc.com/2025/08/13/goldman-jpmorgan-galaxy-kim-indicted-gambling-casino-fraud.html,"Thu, 14 Aug 2025 13:47:45 GMT",
2025-08-15T01:50:41,CNBC Top News,"Trump's Washington, DC, crime crackdown exposes gap between perception and reality",https://www.cnbc.com/2025/08/13/trump-crime-washington-dc-.html,"Thu, 14 Aug 2025 15:50:01 GMT",
2025-08-15T01:50:41,CNBC Top News,Kodak faces financial struggles even as Gen Z sparks a film resurgence,https://www.cnbc.com/2025/08/14/kodak-going-concern-gen-z-film.html,"Thu, 14 Aug 2025 14:31:58 GMT",
2025-08-15T01:50:41,CNBC Top News,What's behind the $8 billion hit to Saudi Arabia's massive wealth fund,https://www.cnbc.com/2025/08/14/saudi-arabia-pif-fund-sees-8-billion-writedown-in-megaprojects.html,"Thu, 14 Aug 2025 18:53:17 GMT",
2025-08-15T01:50:41,Investing.com All News,Unitil prices public offering of 1.39 million common shares at $46.65,https://uk.investing.com/news/company-news/unitil-prices-public-offering-of-139-million-common-shares-at-4665-93CH-4223573,2025-08-15 01:42:07,
2025-08-15T01:50:41,Investing.com All News,KeyCorp’s SWOT analysis: stock outlook amid strategic moves and market challenges,https://uk.investing.com/news/swot-analysis/keycorps-swot-analysis-stock-outlook-amid-strategic-moves-and-market-challenges-93CH-4223572,2025-08-15 01:42:06,
2025-08-15T01:50:41,Investing.com All News,Form 13G SuperCom Ltd For: 14 August,https://uk.investing.com/news/filings/form-13g-supercom-ltd-for-14-august-93CH-4223571,2025-08-15 01:40:07,
2025-08-15T01:50:41,Investing.com All News,Alto Ingredients CCO Sneed buys $3364 in stock,https://uk.investing.com/news/insider-trading-news/alto-ingredients-cco-sneed-buys-3364-in-stock-93CH-4223570,2025-08-15 01:40:06,
2025-08-15T01:50:41,Investing.com All News,Paulson John buys $312 million in Bausch Health (BHC) shares,https://uk.investing.com/news/insider-trading-news/paulson-john-buys-312-million-in-bausch-health-bhc-shares-93CH-4223569,2025-08-15 01:38:07,
2025-08-15T01:50:41,Investing.com All News,Form 13G MAINZ BIOMED N.V. For: 14 August,https://uk.investing.com/news/filings/form-13g-mainz-biomed-nv-for-14-august-93CH-4223568,2025-08-15 01:38:06,
2025-08-15T01:50:41,Investing.com All News,Zions Bancorporation’s SWOT analysis: stock faces headwinds amid loan quality concerns,https://uk.investing.com/news/swot-analysis/zions-bancorporations-swot-analysis-stock-faces-headwinds-amid-loan-quality-concerns-93CH-4223567,2025-08-15 01:34:06,
2025-08-15T01:50:41,Investing.com All News,Form 13G Processa Pharmaceuticals For: 14 August,https://uk.investing.com/news/filings/form-13g-processa-pharmaceuticals-for-14-august-93CH-4223566,2025-08-15 01:34:06,
2025-08-15T01:50:41,Investing.com All News,Form 13G Orthofix Medical Inc. For: 14 August,https://uk.investing.com/news/filings/form-13g-orthofix-medical-inc-for-14-august-93CH-4223565,2025-08-15 01:32:06,
2025-08-15T01:50:41,Investing.com All News,Form 13G CNS PHARMACEUTICALS INC For: 14 August,https://uk.investing.com/news/filings/form-13g-cns-pharmaceuticals-inc-for-14-august-93CH-4223564,2025-08-15 01:30:06,
2025-08-15T01:50:42,Investing.com Bond News,"Treasury Yields Remain Stable Despite Tariffs, Rising Debt Risks",https://uk.investing.com/analysis/treasury-yields-remain-stable-despite-tariffs-rising-debt-risks-200618105,"Aug 13, 2025 12:03 GMT",
2025-08-15T01:50:42,Investing.com Bond News,Rates Spark: Tuesday’s Fiscal and CPI Data Can Prove Troubling,https://uk.investing.com/analysis/rates-spark-tuesdays-fiscal-and-cpi-data-can-prove-troubling-200618070,"Aug 12, 2025 05:13 GMT",
2025-08-15T01:50:42,Investing.com Bond News,US 3-Year Auction Disappoints Slightly as Markets Question Rate Cut Path,https://uk.investing.com/analysis/us-3year-auction-disappoints-slightly-as-markets-question-rate-cut-path-200617956,"Aug 05, 2025 20:31 GMT",
2025-08-15T01:50:42,Investing.com Bond News,US Treasury Yields Tick Higher Ahead of Heavy Auction Week,https://uk.investing.com/analysis/us-treasury-yields-tick-higher-ahead-of-heavy-auction-week-200617942,"Aug 05, 2025 07:14 GMT",
2025-08-15T01:50:42,Investing.com Bond News,The Bond Market Is Pricing in a Softer Economy,https://uk.investing.com/analysis/the-bond-market-is-pricing-in-a-softer-economy-200617930,"Aug 04, 2025 22:17 GMT",
2025-08-15T01:50:42,Investing.com Bond News,Non-Farm Payrolls Ahead: Saving the Most Exciting for Last?,https://uk.investing.com/analysis/nonfarm-payrolls-ahead-saving-the-most-exciting-for-last-200617897,"Aug 01, 2025 06:50 GMT",
2025-08-15T01:50:42,Investing.com Bond News,Medium-Term Corporates Lead US Bond Market in 2025,https://uk.investing.com/analysis/mediumterm-corporates-lead-us-bond-market-in-2025-200617754,"Jul 23, 2025 11:53 GMT",
2025-08-15T01:50:42,Investing.com Bond News,Japan’s Election Results Could Send Shockwaves Through US Bond Market,https://uk.investing.com/analysis/japans-election-results-could-send-shockwaves-through-us-bond-market-this-week-200617701,"Jul 21, 2025 06:55 GMT",
2025-08-15T01:50:42,Investing.com Bond News,How Fed Could Inject Liquidity if Bond Yields Surge: What Investors Need to Know,https://uk.investing.com/analysis/how-fed-could-inject-liquidity-if-bond-yields-surge-what-investors-need-to-know-200617670,"Jul 17, 2025 13:37 GMT",
2025-08-15T01:50:42,Investing.com Bond News,US 10-Year Yield Holds Above Fair Value as Deficit and CPI Heat Up,https://uk.investing.com/analysis/us-10year-yield-holds-above-fair-value-as-deficit-and-cpi-heat-up-200617650,"Jul 16, 2025 11:56 GMT",
2025-08-15T01:50:42,Google News Reuters,"AI startup Cohere valued at $6.8 billion in latest fundraising, hires Meta exec - Reuters",https://news.google.com/rss/articles/CBMitgFBVV95cUxNOWR6Q3Q1azdiTkFud1MzQ1VmbU9BcUVZdk1PYml0Wk5EVlJJbFFnZHB2cTVoZ1J4bWpUODV5V1U1STQ0SFMxMmJkekRGOTlTa25WcElhLUh1N0h3aUROWDNRN0VvWDBwY3AxMERHcnZXeHl6TXBSOU9YVXlBblJvMUtWYW91ZFFMOGZNMHllV01fSFloVkRSeVh5MUp2R0x3V1hEc2p6RFRNTXJVeVd4WWlKVm1kUQ?oc=5,"Thu, 14 Aug 2025 22:20:51 GMT",
2025-08-15T01:50:42,Google News Reuters,Air Canada to cancel most of its 700 flights by Friday as strike looms - Reuters,https://news.google.com/rss/articles/CBMivAFBVV95cUxORlNkaE56RERjakY4OEc5RXdrQ1l2amlZSDktNDdDYjV3Qlo1ai02Ym5wdzZUNVdESE5sSU5KRElDMTJORF91cThzTUJnS0pYZW5oS1JubEx2TnVjM1M3VnFLNEdZRXhNNFAyOFJuaFZCWXlHZnNRTjNvczQ3WWt6OW9tUWFTM0FBYzVlQkw3QnJWd2JXMUpVSXJUQkdHMkdhZ1V3amxmMmx3Q1JiQW42bmRrSVZ6cWx4TlU0dw?oc=5,"Thu, 14 Aug 2025 20:58:26 GMT",
2025-08-15T01:50:42,Google News Reuters,"Berkshire invests in UnitedHealth, trims Apple stake - Reuters",https://news.google.com/rss/articles/CBMiowFBVV95cUxOaGVXY1NmcWhnTUoweXZTVU1vZjhFS0M0cDlCV01yVEwySmVlRXBPb1FDelViaW90NUNmWXczNjN2VnpEMXk1VWN1OFpWSW1SYXdIdDh5SlhyQWNCMzdiN2NvUEtLS2N5bzh6M01RRElzNVdud3ozdWkyM0QyYjBrLUt2MlRvSWtuTlNNNXNNbjhUeDJDUGVUSHc5RHhDMDZZN08w?oc=5,"Thu, 14 Aug 2025 22:07:55 GMT",
2025-08-15T01:50:42,Google News Reuters,"US weighs taking stake in Intel, Bloomberg News reports - Reuters",https://news.google.com/rss/articles/CBMioAFBVV95cUxQZjVlbjRDWlFld0F1Rm5nc3k1cVlQSmZKX2VnZVlleERuYzlzR05zZS1HSU5NQ195VlZ2dkJKTFZydncwOFdhbmdZcllnYVhLZmtSajgwdmxaR2MzMWRJMjZkQ2o1QzdmUlcyOFRTUldhcGtWQ1lOQkhpM2ZlaTZfTnFhcDlOTl9mLWRwWWlXNUVfMXdqenczN3BWbk9CMUZq?oc=5,"Thu, 14 Aug 2025 21:03:01 GMT",
2025-08-15T01:50:42,Google News Reuters,"Wall Street ends flat, but S&P hits another closing high as rate-cut bets waver - Reuters",https://news.google.com/rss/articles/CBMitgFBVV95cUxPczVGd2F5QnU0Wk5ZazBia1ZzQm1oaUlUNWdoemx2Z1FxUjdlODVUQ09ja01ZNnY1NFhsQmc2Q19QVXlFVnNDSlhUUnYxM0xzWl9NQ0pDeVBvbVZ2UEZYWUcwQ24wSV94b1lJLTdMRElIX3VkNTFLVk9iSU8zY0F6V3lkakctN2dabF9zbGhBZHN0YXJBdGlxdjNwck1PRF9US09pbHQxZ3U1WGJiRFU0djRCeUlEdw?oc=5,"Thu, 14 Aug 2025 22:43:26 GMT",
2025-08-15T01:50:42,Google News Reuters,Brazilian digital lender Nubank posts 42% profit boost; shares jump - Reuters,https://news.google.com/rss/articles/CBMiugFBVV95cUxPV0REUmY1VUcyRDB6dHZHSC1SN0FVOTV2VXN6YzZLVmFIdG1iTmVlM3FlMmpQRk9QUmgwYU54eFFjYm9YMmctQ2loY0RKWEtBbWxZNk9uaDRpZlpMNnJ0akcxMEJNazBFZHoyYWJfRFdxUHZ4ZHJzWEdseVJucWh5aXJqMzZSa0xMZkJKcFdXbXJPMGlvajU3MVVHUFlQd1FVMGpNbVlidk5naFdYX1RybHlzNGxhc3ZsMXc?oc=5,"Fri, 15 Aug 2025 00:06:00 GMT",
2025-08-15T01:50:42,Google News Reuters,US senators call for Meta probe after Reuters report on its AI policies - Reuters,https://news.google.com/rss/articles/CBMiuAFBVV95cUxQTklqdVRNd3BVajM0Z1BQS05zS0VCekIzQjgxZ3NRMkxyak9QV0Zkb0VlWjRhT1NEa2d2QnJHcjZPZ1FMM0Z4a1hUWGJmV0xFQUllenRBMzR5Tm4yZnVDbFdDc0JIT0ZfVjE5X0U1SkxjZzdmRzVRb0o1dW13cGxubXFvVEFRb3lEeVJHWkJtcEVDZDFQQ2w0dUlaaV9sQk82SlNHd1lDNHZpUmNqUjJKMXJkVUlvdTV5?oc=5,"Thu, 14 Aug 2025 22:02:20 GMT",
2025-08-15T01:50:42,Google News Reuters,Dollar up as US producer prices surge in July - Reuters,https://news.google.com/rss/articles/CBMikgFBVV95cUxOaEJmY2pPWE90cWt0czUwQ2ZjeFNmTmVmVVJWNHRvOVZMV3Q0RzhrRHhzX3NpbTJkQlh5STIzNEF2VVZMWDJFUUREMllpZWx3Y05hS2t1ZXN4cVNHN0k3b2pMNG45SGtlT3pfYm51YlUxTkFwc0I2YkVxLXNiU3p4WEplRTN1bGFjWXRLM3A0Q1V4dw?oc=5,"Thu, 14 Aug 2025 19:25:20 GMT",
2025-08-15T01:50:42,Google News Reuters,"Trump told Norwegian minister he wants Nobel Prize, newspaper says - Reuters",https://news.google.com/rss/articles/CBMivAFBVV95cUxOVEZleTdFMi1wS1hGbjF0VHcxaFI2azh3YmptWGdRN21SNEI0OFlsek1jOW94OUZfSWFxeTR5Rk5ETXd5YXgwY3B0aDFRa0xxR3A0Tm5OQ3JkWWJhV3JCOVR3X2dydUZCSjVITTkxRE1RTzNfV29VdXZucmVGSVNrc2Z2VzB0cmJ1YXdJOWs4WllXemVVbGtFUXVuTHM4dzc5bFVveHRIbGloU2lSZlFvUHdrSTVheDFnMGZXNA?oc=5,"Thu, 14 Aug 2025 18:19:37 GMT",
2025-08-15T01:50:42,Google News Reuters,Buffett's Berkshire acquires 5 million shares in UnitedHealth - Reuters,https://news.google.com/rss/articles/CBMiyAFBVV95cUxOVGhvVnZOaFVYTDRNQUVrWU9kRGFNdE5aZ3FCdHZTM094NnNFYTJseFZLUFl4TWttTjR2b2lsNmw2SGxKN0ZrWkFjNHBWYXprVHp4NlhVZE1qQ21IMkxvY0k4VFRuc2FzRG5WRlVUcGhkTFRyd0c1V0FRV0JXYmpWU0VxdlRFNUUzaUhOYWhqYUJJNHFmcTk5My1uc2c3ZEZTQ2VLTzRycHA0YmY3TzVVTVZUXzBic3MwZkNVN05Ya1JMbEVMQXR0Sg?oc=5,"Thu, 14 Aug 2025 20:25:56 GMT",
2025-08-15T01:50:42,Google News Reuters,Trump: Journalists should be allowed into Gaza - Reuters,https://news.google.com/rss/articles/CBMipwFBVV95cUxNTWE3YVVuNWdETEE4Y19lNlJOTEFEVmF0cDFCQkdnZUxOVGwwOGJROUdXbmdIQlozU25lZUc0N1VjRllDUnFOWlN3S3FyNzZwTTcwMWxIRERRTlljSXg4Vzc1SjhCY0NJUnpqQkRBRUtaSk80QS1XVGlwVW5mRVVtRWlNNVVEblJmS2hZZ2tqb2dWTUxTamxFZnV2ZWFHMkduN2lpcW1EOA?oc=5,"Thu, 14 Aug 2025 18:31:49 GMT",
2025-08-15T01:50:42,Google News Reuters,"Oil prices climb 2% to 1-week high as Fed rate cut, Trump-Putin talks loom - Reuters",https://news.google.com/rss/articles/CBMiugFBVV95cUxQbGJhREpnUUhkR3Z6cHg1ejhqRXZDLU5QVW1rTVlmZXhKM2JxR1o2N0I4TmZWeDYtbjFoc3NFWkJYNG5YTjdZOG1PMkRfV20yR3k3TkhaTUhIU2xIalRJYWhkZlNVOVNmcmRGMlpwVTVsYUFDSnVyQS1MWWQ4SEpQMVpwV2FwWVA1NGsyS3R3NG9lQWVfZ3dPbk9XdXpYQXRDaTZDOUlGMnhxUW5jVWsyb2I1R2VBUWw1bGc?oc=5,"Thu, 14 Aug 2025 19:26:21 GMT",
2025-08-15T01:50:42,Google News Reuters,Man charged with throwing sandwich at US agent was Justice Dept staffer - Reuters,https://news.google.com/rss/articles/CBMivgFBVV95cUxQREtrU3ZSajBxT2ZzaTJLZl9oMWtPV2xFZ2g1aE9RUlhfZjhHeXB2eEtnQW9NVzZjRER6WF9tSkVOUzFoWWpGYkRrRE92VXk0SVVCZW5zS3BxUFNNdV80aThQeWhGbnphaGpGdGI3WFpOc1IwT0l0aWhSQ1RqMHhnaXFTa0ZiUnI3VExtaWUxSnZxRDdqekZmeUFxSUxEU2tPMklrelVzZGpXNFNDNkdvMl9Ta0pZQmZKQUstRFhR?oc=5,"Thu, 14 Aug 2025 17:43:56 GMT",
2025-08-15T01:50:42,Google News Reuters,Exclusive: Trump ally Erik Prince plans to keep personnel in Haiti for 10 years to fight gangs and collect taxes - Reuters,https://news.google.com/rss/articles/CBMiyAFBVV95cUxQdTJ4alJFamRZSW9ReEd3VnVuSDI2cTlleXZCdmlrTllKODRDdlV3Rmp5dW82Z09RRUluaFVhSV9LaXN6YmxzaWpiV3FqMjVnQWxUTHkyU0N6MllWQVdrTVgzaGVFVmVZREs3OWpSdWJ2MGZ4OEFLdElrOXUtRVVVZHhxSWlJLWFRbkFNcU5zX1JCVzFrSW85Nnc1RTU0QnJXNjQzVGlFaXlmMHBQd3BqYm4ybDY2eVF6T1pfcTIzMG1jdzdOUHdXRg?oc=5,"Thu, 14 Aug 2025 17:00:15 GMT",
2025-08-15T01:50:42,Google News Reuters,Costco to stop selling abortion pill mifepristone at its US pharmacy stores - Reuters,https://news.google.com/rss/articles/CBMi2AFBVV95cUxPSGlRSzRlVGhsMmRkTHZpZkhIWjZPU0FibElrakh3VWFIQzFCU2JTU3JDTGtBbjgwUjFzT3BFVTR3SGFSWEFnbGc2WlNHdUZBNG5wOGFiUmFMUVJhZl8yRVlyeW9oWkduTnJfenp5ckZndXJaWXRQakdjbzYzNzRyejd5dmJ0ZmdqeERaSVhoVkFZSkxzbFlDNjRWWnF3MWxYRzhhQllmS01GRWVjN045QllOX3huUTA0d09LTnloQlZmQnhrTXpJSmpzbVR1blZ2d3U0djR2UEs?oc=5,"Thu, 14 Aug 2025 22:23:29 GMT",
2025-08-15T01:50:42,Google News Reuters,US Supreme Court declines for now to block Mississippi social media age-check law - Reuters,https://news.google.com/rss/articles/CBMixgFBVV95cUxOeWFKajFwQTBGQkFTQ2hZR3o2SjRvVVVXYU9IZEF4Vl9nZDZkVU96NzVkXzctUkowY0J1clhiamFyQWlCUWNQaS01TEY0SVJfQlhweEhDc3U3czd3WFFRNFQxTVpVX1NuYjUwejBkTFhxRmt0VVdIa2dkLXQtNEFPTTFWNlo5NElOcmsxeWx5eGFDMGVNc1pOUDQ3QjZMQ1F0UlNhRDVMdXFSdGJBblFoR3VhWVpiaGtyR3psMzVObUhqVjROTlE?oc=5,"Thu, 14 Aug 2025 20:56:25 GMT",
2025-08-15T01:50:42,Google News Reuters,"US producer inflation heats up as goods, services prices soar - Reuters",https://news.google.com/rss/articles/CBMipAFBVV95cUxOZXJiaFBjenpIYzRfd044YmF5RjJCVnBnVDBEV0RwdjZINjZkeWliUWhXeElQdk5GdTY4WlpOdjVtNDNZSGEtblNYQmhWRGNMYW90WmlUM2hZN0NFeGN6SDRIYk1nRXc1eDJweTYzUm9IMVBiX2J5RDIyTS1EUnpTYWZaRUhEdGVGdHpsOFJYYXlmcWdITUhiNzZldVpoczl1Smk2Nw?oc=5,"Thu, 14 Aug 2025 21:32:32 GMT",
2025-08-15T01:50:42,Google News Reuters,"Trump says Putin ready to make deal on Ukraine, US hopes to include Zelenskiy - Reuters",https://news.google.com/rss/articles/CBMisgFBVV95cUxNWllNOENSUzl5a3BMb1gzMEgtVy01a2tNenNkTVBKUXRkVzU0Y2NMMjNrSWlub2JzTTRWZ3B0TkdhZkhrb2hONWdVQjFLUE1NLXk5NFB5VW1pZHB6dkpSOTJYRmFCYzJ3RzRxNUxLZEVYTVRlMmNHOUpFWjF3dmhsNGlzV05sMDhJNnM2OVk5eGRkY1hqQlFtZXBUelExdzN1SXQzbGtwbTZGRHBlQVBVbHVn?oc=5,"Thu, 14 Aug 2025 19:14:51 GMT",
2025-08-15T01:50:42,Google News Reuters,"Citigroup considers custody and payment services for stablecoins, crypto ETFs - Reuters",https://news.google.com/rss/articles/CBMivgFBVV95cUxOVTQwRlpncU9YTXFMU2ktWDNyMjl0c21xWS1lUmttbnBaaDIxcjEyeU85RnhXbTAweTVKS0dVb2Rsek1QcU5odlpJR3I2ckxLanh4d0dsaE4wQ19aVXFGdzliNUZxVEhsWG9PSlZzaW81Z3JKdWp0MktWTjkzS3liRFFWSmlxM1RBTW52b2VKZE5EaXJNNWVkTnhxdEJKeVJWUU5nTzBKOVlmWGY4eG1meGV1Qm1jLXhabEJZWW5R?oc=5,"Thu, 14 Aug 2025 17:54:23 GMT",
2025-08-15T01:50:42,Google News Reuters,"Stocks ease, US yields rise after hot US inflation data shakes confidence in Fed rate cut - Reuters",https://news.google.com/rss/articles/CBMigwFBVV95cUxNNC1xVHBSdXNqRGo4OGl2WW9MbFJCd21EalB3T3lidVpZVGl6bzN0b2VKV0c3VmhBWHBrU0xZRWFRc3dra3Uta2dLVUpaYnJSTU02Tzk2N1VVOGZOYUN3eFZPU3NvcDVhWWQzRklCeTh0Z2p4TEQ1RzIzeVZDRzd1R3FiWQ?oc=5,"Thu, 14 Aug 2025 21:26:42 GMT",
2025-08-15T01:50:42,Google News Reuters,"Sudden, heavy rain in Indian Kashmir leaves 46 dead, more than 200 missing - Reuters",https://news.google.com/rss/articles/CBMiuAFBVV95cUxQYkIycTZidkJoX0lGWmJNNm1SdHZIeEwtWXU3TzRLY1hLekcyQkNyTU1zd1oyVXpTT1lGRFhQQjFqZEhfUUpnd05KeVJjYU5oNS1zTVFLTTlKQzBYVkV1RDBVcThiVWh1cUpibXJQM1VTZ0lEVVRJNXZIakUzemptNVRCbkxZX1dpNnRwSHM5b0VPY183akxSTzZuWnhjZDV5amNZNDVSdEtSd2xuMnlzTzg0eThPaEd0?oc=5,"Thu, 14 Aug 2025 17:11:50 GMT",
2025-08-15T01:50:42,Google News Reuters,"Hack at UnitedHealth's tech unit impacted 192.7 million people, US health dept website shows - Reuters",https://news.google.com/rss/articles/CBMiwwFBVV95cUxQc0tCNUhwYWVPN3U3TTZGRVFhVU5lUXhjdUpIQVRnc3FjVnFYQUlRcFBpc2tBSF8wRl9UN1dOMWM2cVhZOENqQ2I1ZERORlFMaGptOUNoZDRob042dk9CWm8yUEdDd2F3X3NBYlZxOVFLcXhoNUY1b3RoUVkzU3lBVVJYajNTV3lTS2tTa2ZmV3BOdGFnNjJlODZhNnRnR2RCTG1HdXU5MWp2N3dzdnd3cVJFTEpHTGRsbVNYMEVuYV90R3M?oc=5,"Thu, 14 Aug 2025 18:31:21 GMT",
2025-08-15T01:50:42,Google News Reuters,"Gold falls as hot US data lifts dollar, yields; cools hopes for jumbo Fed cut - Reuters",https://news.google.com/rss/articles/CBMitwFBVV95cUxPd0g5bUNteTkzQ245dk12S1N6VWtKcXctV0N2TzdKYV9GVFdyM3pObzhIaHo3V3hvZmljNzRvV3phaWpla2ZlaXVUODR0ZXJOYU9JaGN6UF9SbEhTenhFV080U21yREpJT0ZnTkNhRzU0OC1nSTZuR3RtZFFxSXFpNVJJYkNYMjJnUk9yY3I3Ykp1SG1IcHdWZ2o4dG9scGtjX3VKYVhNdGNiSjF2WTZTajVIcDdNVk0?oc=5,"Thu, 14 Aug 2025 17:55:31 GMT",
2025-08-15T01:50:42,Google News Reuters,Hot wholesale prices data puts wrinkle in Fed's rate-cut roadmap - Reuters,https://news.google.com/rss/articles/CBMiqAFBVV95cUxNeGp6dmNUZG5BckF1Y2JhTlRmWEYwb0ptdlRWd3NtSnFGRVpCZEV5Q3o5dE1QM1d0UlpjamhqVFphRnBVcFBVMFZjc2paRzNyd1F2TlZBcTYwM1ZZWjRROXU1TmNqNkpBeUVMbzNDUTEzZ0xuUkhKZFhabkRfWlFaM2RpanZPSFQ3WlZrOFgzNTNPdWd1bkJ6NzlMWTZqUWN0aDd2dThMNFg?oc=5,"Thu, 14 Aug 2025 21:12:40 GMT",
