timestamp,source,title,link,published,content
2025-08-20T01:26:45,MarketWatch Top,How restaurant chains are competing on in-store vibes to win back customers,https://www.marketwatch.com/story/restaurant-chains-are-competing-on-in-store-vibes-to-win-back-customers-6b4a1eb5?mod=mw_rss_topstories,"Wed, 20 Aug 2025 01:18:00 GMT",
2025-08-20T01:26:45,MarketWatch Top,Are you willing to take big risks for big returns? You may be a newbie investor.,https://www.marketwatch.com/story/are-you-willing-to-take-big-risks-for-big-returns-you-may-be-a-newbie-investor-b54fdd33?mod=mw_rss_topstories,"Wed, 20 Aug 2025 01:16:00 GMT",
2025-08-20T01:26:45,MarketWatch Top,Palo Alto Networks’ earnings beat sparks investor confidence in the cybersecurity industry,https://www.marketwatch.com/story/palo-alto-networks-earnings-beat-sparks-investor-confidence-in-the-cybersecurity-industry-81d9087d?mod=mw_rss_topstories,"Tue, 19 Aug 2025 23:43:00 GMT",
2025-08-20T01:26:45,MarketWatch Top,Nexstar-Tegna deal puts Trump move to eliminate broadcast ownership rules to the test,https://www.marketwatch.com/story/nexstar-tegna-deal-puts-trump-move-to-eliminate-broadcast-ownership-rules-to-the-test-9f301986?mod=mw_rss_topstories,"Tue, 19 Aug 2025 23:39:00 GMT",
2025-08-20T01:26:45,MarketWatch Top,‘I can only rely on me’: How do I protect myself from my parents’ nursing-home bills?,https://www.marketwatch.com/story/i-can-only-rely-on-myself-how-do-i-protect-myself-from-my-parents-nursing-home-bills-db37b021?mod=mw_rss_topstories,"Tue, 19 Aug 2025 22:49:00 GMT",
2025-08-20T01:26:45,MarketWatch Top,My aunt barely spends any money. Will we receive the contents of her safe-deposit box when she dies?,https://www.marketwatch.com/story/i-personally-dont-care-about-her-money-what-happens-to-my-aunts-safe-deposit-box-after-she-dies-e35546ad?mod=mw_rss_topstories,"Tue, 19 Aug 2025 22:00:00 GMT",
2025-08-20T01:26:45,MarketWatch Top,"I’m a senior who barely survives on $1,300 a month. No way could I live on $1,000.",https://www.marketwatch.com/story/im-a-senior-who-barely-survives-on-1-300-a-month-no-way-could-i-live-on-1-000-dfe42c83?mod=mw_rss_topstories,"Tue, 19 Aug 2025 21:54:00 GMT",
2025-08-20T01:26:45,MarketWatch Top,Venus Williams says she returned to tennis for the health insurance — even after earning $42 million,https://www.marketwatch.com/story/despite-42-million-in-earnings-venus-williams-couldnt-afford-to-stay-retired-d420b932?mod=mw_rss_topstories,"Tue, 19 Aug 2025 21:51:00 GMT",
2025-08-20T01:26:45,MarketWatch Top,"Home Depot says tariffs will lead to price increases, but they won’t be across the board",https://www.marketwatch.com/story/home-depots-stock-falls-after-another-profit-miss-but-home-improvement-projects-increase-ac3742c1?mod=mw_rss_topstories,"Tue, 19 Aug 2025 21:35:00 GMT",
2025-08-20T01:26:45,MarketWatch Top,My friend’s father gifted her Tesla and Google stock. They could be worth millions. Will they be split 50/50 in her divorce?,https://www.marketwatch.com/story/are-tesla-and-google-stocks-received-as-a-gift-subject-to-division-in-a-divorce-18834c76?mod=mw_rss_topstories,"Tue, 19 Aug 2025 21:30:00 GMT",
2025-08-20T01:26:45,CNBC Top News,Lutnick says Intel has to give government equity in return for CHIPS Act funds,https://www.cnbc.com/2025/08/19/lutnick-intel-stock-chips-trump.html,"Tue, 19 Aug 2025 20:09:19 GMT",
2025-08-20T01:26:45,CNBC Top News,Asia markets track Wall Street declines; Japan exports notch steepest drop in over four years,https://www.cnbc.com/2025/08/20/asia-pacific-markets-today-live-updates-china-lpr-japan-trade-data.html,"Wed, 20 Aug 2025 00:32:17 GMT",
2025-08-20T01:26:45,CNBC Top News,"Japan's July exports clock steepest plunge in over four years, dropping by a more than expected 2.6%",https://www.cnbc.com/2025/08/20/japan-july-exports-imports-us-shipments-goods-trade-auto-reciprocal-tariffs-trump.html,"Wed, 20 Aug 2025 00:44:31 GMT",
2025-08-20T01:26:45,CNBC Top News,The senior living market can't keep up with demand as boomers age,https://www.cnbc.com/2025/08/19/senior-living-housing-market-cant-keep-up-with-demand.html,"Tue, 19 Aug 2025 19:23:40 GMT",
2025-08-20T01:26:45,CNBC Top News,Trump expands 50% steel and aluminum tariffs to include 407 additional product types,https://www.cnbc.com/2025/08/19/trump-trade-steel-aluminum-tariffs-.html,"Tue, 19 Aug 2025 21:07:45 GMT",
2025-08-20T01:26:45,CNBC Top News,"Palantir stock slumps 9%, falling for a fifth straight day from record",https://www.cnbc.com/2025/08/19/palantir-stock-down.html,"Tue, 19 Aug 2025 20:00:38 GMT",
2025-08-20T01:26:45,CNBC Top News,Crypto stocks tumble as investors go into risk-off mode,https://www.cnbc.com/2025/08/19/crypto-market-today.html,"Tue, 19 Aug 2025 20:07:58 GMT",
2025-08-20T01:26:45,CNBC Top News,"Trump vows to target 'woke' museums with same playbook used on Columbia, Harvard",https://www.cnbc.com/2025/08/19/trump-smithsonian-museum-college-woke.html,"Tue, 19 Aug 2025 20:40:25 GMT",
2025-08-20T01:26:45,CNBC Top News,Why Tesla Cybertruck sales are falling short of expectations,https://www.cnbc.com/2025/08/19/tesla-cybertruck-sales-musk.html,"Tue, 19 Aug 2025 14:55:52 GMT",
2025-08-20T01:26:45,CNBC Top News,Tesla Optimus rival Unitree shines at the 'World Humanoid Robot Games' in China,https://www.cnbc.com/2025/08/18/world-humanoid-robot-games-china-tesla-unitree.html,"Mon, 18 Aug 2025 19:16:19 GMT",
2025-08-20T01:26:45,CNBC Top News,"From sweet treats to protein boosts, chains are banking on beverages to drive sales",https://www.cnbc.com/2025/08/19/mcdonalds-dunkin-starbucks-dutch-bros-release-new-drinks.html,"Tue, 19 Aug 2025 20:28:01 GMT",
2025-08-20T01:26:45,CNBC Top News,Databricks says it's valued at over $100 billion in latest funding round,https://www.cnbc.com/2025/08/19/databricks-valuation-over-100-billion.html,"Tue, 19 Aug 2025 19:18:28 GMT",
2025-08-20T01:26:45,CNBC Top News,Healthy Returns: New study casts doubts on RFK Jr.'s reasons for gutting key vaccine panel,https://www.cnbc.com/2025/08/19/healthy-returns-new-study-casts-doubts-on-rfk-jrs-reasons-for-gutting-vaccine-panel.html,"Tue, 19 Aug 2025 20:03:01 GMT",
2025-08-20T01:26:45,CNBC Top News,"Trump tariff revenue expected to offset tax bill impact, S&P says in US credit rating hold",https://www.cnbc.com/2025/08/19/us-credit-rating-trump-tariff-revenue-tax-.html,"Tue, 19 Aug 2025 19:28:26 GMT",
2025-08-20T01:26:45,CNBC Top News,Silicon Valley's AI deals are creating zombie startups: 'You hollowed out the organization',https://www.cnbc.com/2025/08/19/how-ai-zombie-deals-work-meta-google.html,"Wed, 20 Aug 2025 00:09:34 GMT",
2025-08-20T01:26:45,CNBC Top News,"'Stranger Things' creators, the Duffer Brothers, ink 4-year deal with Paramount Skydance",https://www.cnbc.com/2025/08/19/stranger-things-duffer-brothers-paramount-skydance.html,"Tue, 19 Aug 2025 18:23:58 GMT",
2025-08-20T01:26:45,CNBC Top News,Tariffs are a wrinkle in back-to-school shopping. That's why we like these 3 retail stocks,https://www.cnbc.com/2025/08/19/tariffs-are-a-wrinkle-in-back-to-school-shopping-thats-why-we-like-these-3-retail-stocks.html,"Tue, 19 Aug 2025 19:43:59 GMT",
2025-08-20T01:26:45,CNBC Top News,Nvidia says it's evaluating a 'variety of products' after report of new AI chip for China,https://www.cnbc.com/2025/08/19/nvidia-ai-china-chip.html,"Tue, 19 Aug 2025 20:10:14 GMT",
2025-08-20T01:26:45,CNBC Top News,Apple reportedly ups iPhone production in India as country's Russia ties roil White House,https://www.cnbc.com/2025/08/19/apple-india-iphone-russia-trump.html,"Tue, 19 Aug 2025 18:18:24 GMT",
2025-08-20T01:26:45,CNBC Top News,Trump promised Ukraine 'security guarantees': Here's what they could look like,https://www.cnbc.com/2025/08/19/security-guarantees-are-coming-for-ukraine-putting-europe-on-the-hook.html,"Tue, 19 Aug 2025 08:56:16 GMT",
2025-08-20T01:26:45,CNBC Top News,Sam Altman on GPT-6: 'People want memory',https://www.cnbc.com/2025/08/19/sam-altman-on-gpt-6-people-want-memory.html,"Tue, 19 Aug 2025 12:51:07 GMT",
2025-08-20T01:26:45,CNBC Top News,"Chinese national living in U.S. gets 8 years in prison for smuggling weapons, tech to North Korea",https://www.cnbc.com/2025/08/19/chinese-national-prison-north-korea-smuggling-tech-weapons.html,"Tue, 19 Aug 2025 18:33:16 GMT",
2025-08-20T01:26:45,CNBC Top News,Robinhood launches NFL and college football prediction markets,https://www.cnbc.com/2025/08/19/robinhood-nfl-college-football-prediction-markets.html,"Tue, 19 Aug 2025 17:57:31 GMT",
2025-08-20T01:26:45,CNBC Top News,Bessent says interviews for 'incredible group' of potential Fed chairs will start after Labor Day,https://www.cnbc.com/2025/08/19/bessent-says-interviews-for-incredible-group-of-potential-fed-chairs-will-start-after-labor-day.html,"Tue, 19 Aug 2025 17:40:15 GMT",
2025-08-20T01:26:45,CNBC Top News,Viking Therapeutics shares fall 40% on disappointing obesity pill trial data,https://www.cnbc.com/2025/08/19/viking-therapeutics-obesity-pill-data.html,"Tue, 19 Aug 2025 15:45:23 GMT",
2025-08-20T01:26:45,CNBC Top News,Home Depot stock rises 3% as retailer maintains full-year forecast,https://www.cnbc.com/2025/08/19/home-depot-hd-earnings-q2-2025.html,"Tue, 19 Aug 2025 20:58:20 GMT",
2025-08-20T01:26:45,CNBC Top News,U.S. accuses India of profiteering from Russian oil during Ukraine war,https://www.cnbc.com/2025/08/19/us-accuses-india-of-profiteering-from-russian-oil.html,"Tue, 19 Aug 2025 15:56:16 GMT",
2025-08-20T01:26:45,CNBC Top News,Analysts downplay AI bubble worries as Altman says some investors will be left 'very burnt',https://www.cnbc.com/2025/08/18/altman-ai-bubble-openai.html,"Tue, 19 Aug 2025 00:51:21 GMT",
2025-08-20T01:26:45,CNBC Top News,Best Buy launches third-party marketplace as it looks for sales drivers,https://www.cnbc.com/2025/08/19/best-buy-launches-third-party-marketplace.html,"Tue, 19 Aug 2025 14:04:32 GMT",
2025-08-20T01:26:45,CNBC Top News,"The key to being confident in an uncertain market, according to a CFP: 'Always be calibrating'",https://www.cnbc.com/2025/08/19/diversified-portfolio-investor-confidence.html,"Tue, 19 Aug 2025 13:30:25 GMT",
2025-08-20T01:26:45,Investing.com All News,Ares management CEO Arougheti sells $51.7 million in shares,https://uk.investing.com/news/insider-trading-news/ares-management-ceo-arougheti-sells-517-million-in-shares-93CH-4229348,2025-08-20 01:00:08,
2025-08-20T01:26:45,Investing.com All News,"Klaviyo CFO Whalen sells $469,800 in stock",https://uk.investing.com/news/insider-trading-news/klaviyo-cfo-whalen-sells-469800-in-stock-93CH-4229347,2025-08-20 00:56:07,
2025-08-20T01:26:45,Investing.com All News,Atara biotherapeutics (ATRA) director Huang buys $670k in stock,https://uk.investing.com/news/insider-trading-news/atara-biotherapeutics-atra-director-huang-buys-670k-in-stock-93CH-4229346,2025-08-20 00:50:07,
2025-08-20T01:26:45,Investing.com All News,"Sosin Clifford sells Cardlytics (CDLX) stock worth $452,760",https://uk.investing.com/news/insider-trading-news/sosin-clifford-sells-cardlytics-cdlx-stock-worth-452760-93CH-4229345,2025-08-20 00:48:07,
2025-08-20T01:26:45,Investing.com All News,"Hill, Replimune CFO, sells $49k in REPL stock",https://uk.investing.com/news/insider-trading-news/hill-replimune-cfo-sells-49k-in-repl-stock-93CH-4229344,2025-08-20 00:44:08,
2025-08-20T01:26:45,Investing.com All News,Archer Aviation CTO Muniz sells $846k in shares,https://uk.investing.com/news/insider-trading-news/archer-aviation-cto-muniz-sells-846k-in-shares-93CH-4229343,2025-08-20 00:38:07,
2025-08-20T01:26:45,Investing.com All News,Tan Aik Na sells Wave Life Sciences (WVE) shares for $194k,https://uk.investing.com/news/insider-trading-news/tan-aik-na-sells-wave-life-sciences-wve-shares-for-194k-93CH-4229342,2025-08-20 00:30:08,
2025-08-20T01:26:45,Investing.com All News,"Blend Labs head of revenue Kneafsey sells $71,872 in stock",https://uk.investing.com/news/insider-trading-news/blend-labs-head-of-revenue-kneafsey-sells-71872-in-stock-93CH-4229341,2025-08-20 00:28:08,
2025-08-20T01:26:45,Investing.com All News,Trump slams Powell over rate cuts ahead of Jackson Hole,https://uk.investing.com/news/economy-news/trump-slams-powell-over-rate-cuts-ahead-of-jackson-hole-4229310,2025-08-20 00:26:08,
2025-08-20T01:26:45,Investing.com All News,"Wheels up experience chief accounting officer sells $34,980 in stock",https://uk.investing.com/news/insider-trading-news/wheels-up-experience-chief-accounting-officer-sells-34980-in-stock-93CH-4229340,2025-08-20 00:24:08,
2025-08-20T01:26:45,Investing.com Bond News,How Treasury's Cash Balance Rebuild Could Drain Liquidity and Impact Markets,https://uk.investing.com/analysis/how-treasurys-cash-balance-rebuild-could-drain-liquidity-and-impact-markets-200618194,"Aug 19, 2025 06:53 GMT",
2025-08-20T01:26:45,Investing.com Bond News,Rates Spark: Heavier Treasuries Despite the Buying,https://uk.investing.com/analysis/rates-spark-heavier-treasuries-despite-the-buying-200618199,"Aug 19, 2025 05:48 GMT",
2025-08-20T01:26:45,Investing.com Bond News,Eurozone Long-Term Yields Under Pressure as Debt Supply Builds,https://uk.investing.com/analysis/eurozone-longterm-yields-under-pressure-as-debt-supply-builds-200618172,"Aug 18, 2025 08:04 GMT",
2025-08-20T01:26:45,Investing.com Bond News,The Index Isn’t Always Accurate: Factors Influencing Yields,https://uk.investing.com/analysis/the-index-isnt-always-accurate-factors-influencing-yields-200618100,"Aug 16, 2025 10:00 GMT",
2025-08-20T01:26:45,Investing.com Bond News,Yield Gap Tightening Between US Treasuries and JGBs May Disrupt Carry Trades,https://uk.investing.com/analysis/yield-gap-tightening-between-us-treasuries-and-jgbs-may-disrupt-carry-trades-200618151,"Aug 15, 2025 11:27 GMT",
2025-08-20T01:26:45,Investing.com Bond News,"Treasury Yields Remain Stable Despite Tariffs, Rising Debt Risks",https://uk.investing.com/analysis/treasury-yields-remain-stable-despite-tariffs-rising-debt-risks-200618105,"Aug 13, 2025 12:03 GMT",
2025-08-20T01:26:45,Investing.com Bond News,Rates Spark: Tuesday’s Fiscal and CPI Data Can Prove Troubling,https://uk.investing.com/analysis/rates-spark-tuesdays-fiscal-and-cpi-data-can-prove-troubling-200618070,"Aug 12, 2025 05:13 GMT",
2025-08-20T01:26:45,Investing.com Bond News,US 3-Year Auction Disappoints Slightly as Markets Question Rate Cut Path,https://uk.investing.com/analysis/us-3year-auction-disappoints-slightly-as-markets-question-rate-cut-path-200617956,"Aug 05, 2025 20:31 GMT",
2025-08-20T01:26:45,Investing.com Bond News,US Treasury Yields Tick Higher Ahead of Heavy Auction Week,https://uk.investing.com/analysis/us-treasury-yields-tick-higher-ahead-of-heavy-auction-week-200617942,"Aug 05, 2025 07:14 GMT",
2025-08-20T01:26:45,Investing.com Bond News,The Bond Market Is Pricing in a Softer Economy,https://uk.investing.com/analysis/the-bond-market-is-pricing-in-a-softer-economy-200617930,"Aug 04, 2025 22:17 GMT",
2025-08-20T01:26:46,Google News Reuters,Trump says US may provide air support to back a Ukraine peace deal - Reuters,https://news.google.com/rss/articles/CBMirwFBVV95cUxNM0R4VVNSRWxJcFEta0Y2M1FXYnJzQ2I3dmxRbGg0bU5lSGdHcVNIdVlJUnlnQmxlVzhReFBKN1FwTHQzTk1weDBIRkNjcWV5UEdLUDliMTZnT2wta281cVNXejBZYlYtUUdjOWxkek5HSFdnZ09udDlpT3JPX0M1Ym5GOW9RcUtScW12UThsR0hkaldTZEVQUU9pQ0gzZGJaQXU3NEpmLXgyb282am4w?oc=5,"Tue, 19 Aug 2025 23:37:55 GMT",
2025-08-20T01:26:46,Google News Reuters,"US, NATO planners start to craft Ukraine security guarantee options - Reuters",https://news.google.com/rss/articles/CBMisgFBVV95cUxNSEF5RjBRNFNZeWl2OFhzdVIxWG5TS09FZGMtZVY5LXBPamI4Nm1qd3JnUDVmLUt5WjBfSllSLVhEY19laGtFMkNIbkhETzJnR0ZTdXlSVGNIX1RMZEh2SjRVMXQxNGlUOHRGQTZVaUhGWGdJdmsxVVkyOUY4aXdQSUhZUUNkWHhWNmJKRkFTaGl1U3FoYXA4NXFiX2RpRWhLX3U5U1dTUUs2UDVJSG84M01R?oc=5,"Tue, 19 Aug 2025 23:34:16 GMT",
2025-08-20T01:26:46,Google News Reuters,Exclusive: White House launches TikTok account with Trump saying 'I am your voice' - Reuters,https://news.google.com/rss/articles/CBMitAFBVV95cUxQaFFyamNGanJJX1dWY21LV1NwNGFTQ29ubHFtel9vSlEyYXJjaU40QWoxbThPRzFGN1VmTG4yb3cyNF80SUhVVXMwbEdFQXctWUhCM09fUDg4dnBBNmFrWTV4ZkdHWjFwNHQyOC12aXJtaDVlMF9rS1h6VXBVSHdXbTdvNm9CZjBLUDdySFRmSWlCcXlWT2dSb3BRN2RFbTh6c3JwSkd2aFplNGxMeFFDY0t4UVc?oc=5,"Tue, 19 Aug 2025 23:28:44 GMT",
2025-08-20T01:26:46,Google News Reuters,California Republicans sue to block Democratic redistricting plan - Reuters,https://news.google.com/rss/articles/CBMitgFBVV95cUxPREdmRkV6bzVZZnZjMWFfUXAxdnh2T085bF9LeUpZcHB2NHVYd0U5QXBpWGxnVHVYVTlPOFdrYzQ3UXd0aVdtRTdPWFNrU2ZKYUkwdXhkTTk1SDBQM0RqVDZVYXB6QlFyMU5vSjRqQmIxRzMxdjBCc3ZDM3VMTm50MXVUdHFGREJYakF1WFJENXptYWkxS3VranJaRnVBa0pHeGtfTU4wSzJYZTU4V1ZXanliQ0lwUQ?oc=5,"Tue, 19 Aug 2025 23:09:38 GMT",
2025-08-20T01:26:46,Google News Reuters,"Trump eyes US government stakes in other chip makers that received CHIPS Act funds, sources say - Reuters",https://news.google.com/rss/articles/CBMizAFBVV95cUxOcGliYWZXdFQzQmk0VmthemlHWGJlMmUwbDkwX0dITEdmcXd6cUQzMjdEUmFZRWphLXBFdV9BYTVESm9FZER2ME9HZURrVnlDWk1DUkZJLVhWdXlRcW9BWGdET0ZwLVpuSGZGMU53aXRTQmstLUo1YU81UC1JbURCdV9RV25maU9XaU1OOVNuaUR4U2dfRXZwNTkzTS1fN3BQeTVVV0xoT3ljQmlPM3ZoenpVWXUyLXdsNVlZcDR4OVRPeGwzNFdCQjJFdEQ?oc=5,"Tue, 19 Aug 2025 22:35:31 GMT",
2025-08-20T01:26:46,Google News Reuters,"US hikes steel, aluminum tariffs on imported appliances, railcars, EV parts - Reuters",https://news.google.com/rss/articles/CBMitAFBVV95cUxPNHlnbUF0TjFfdGx1NG5NbExDb0k0WjJpMTdOdTFVcXVNTnhRQTJxTkdKeU05OGJjLXN0ZGJxeTYwOFNuOGZSM19tY3RFWmhGbFUwMHZfcGc1cXBuaEZZUHpzSHBjaHlQbm1Lekd0M3NWNV95bXBnY1BqQnpmc2dhdkx1cEEyUS1OTDhFREhiS3NNclMyT0tFY2RlTThOMmRxQ0FGREdBcGZuMV9rXzNObGs0Qzg?oc=5,"Tue, 19 Aug 2025 22:06:55 GMT",
2025-08-20T01:26:46,Google News Reuters,"Gabbard revokes security clearances of 37 current, former US intelligence professionals - Reuters",https://news.google.com/rss/articles/CBMitAFBVV95cUxPTVljdDNXRVRXN1BIYkdSanFWM0hmSGpwS3JtbWJzMkZuT2k5VzFDVi1yMGszclJLaEVSOFpQUXo5ZldRMjFrcktCb01ucEt0bm1BSm13SVRVRG1INFJXaGs1TjRtcWNhMllqZkNCVDZvVmJjQVI4cWYwZXJiY3pqZHNDVjk0MktPdXhvQXA5b3pZS0tyeE12WmZQQUtneGpseHRCdUM1cTFFa285STRhRl9DNko?oc=5,"Tue, 19 Aug 2025 22:51:33 GMT",
2025-08-20T01:26:46,Google News Reuters,Exclusive: White House launches official TikTok account - Reuters,https://news.google.com/rss/articles/CBMikwFBVV95cUxOSEJnNjlnWjlQSWRPTHlWY0xmaDdhU3BYekFOSVlfWS1zcEI0T2lGY3FqRDMzOVlEZGpvNWFTRFdOTzNPVU9WQnExNUt2SWpnY2FtNDEydndDd185VTNJdkRnWTE2aThwRnhEelJiWWxMQi1TWndHdmtqenhCRlZ6a0NveUtYbklRd0pjN2ttaU4zUEU?oc=5,"Tue, 19 Aug 2025 23:14:02 GMT",
2025-08-20T01:26:46,Google News Reuters,Nasdaq tumbles as Jackson Hole jitters hit tech stocks - Reuters,https://news.google.com/rss/articles/CBMinAFBVV95cUxPOEFsMXJpVkp1UlJ1dk85eWdCOGJyRkxjTWdaVmJyOWpkZHN2eUh5TkZEb2xNLWRFTEp5VFYtZ2xzVHFLd3JfczhjUVRxMjlOcW44Y2FVWUUyZ3U3T2h4R1MzeWlwdHliSS11UUdDT0ZEM0NaNFMyLXZqclEzZElyUExuN1BVdUZpcS1KS1hTRHBHSk93ZktEUW9ZUGc?oc=5,"Tue, 19 Aug 2025 22:37:19 GMT",
2025-08-20T01:26:46,Google News Reuters,"Delta, United sued for selling windowless 'window seats' - Reuters",https://news.google.com/rss/articles/CBMiwwFBVV95cUxQcGlrQW1FX2ZGZ3ljeWZjZVpBMzJpOVc2ZUlXRDVMSTkydmEwQ0QtTktwYWh3LVBldm9FZWRQMTZoOGltYU1IaXZSOWRod1JSM2s2bERmLXdCZUZISVlHYzAzaTJ1X0hzd3IzWEVNYWRJTGd0cnVCclZMZXpkTURkNWJSWWpmbjJpMThqd2lseld1M2EzYWVCc2hvSm1xSkV4NHJ2ZkR4OEM1VUR2OVktWXZZLUtUVW5aV05VZXVuQ2xvNDQ?oc=5,"Tue, 19 Aug 2025 21:20:05 GMT",
2025-08-20T01:26:46,Google News Reuters,"Nasdaq tumbles, European shares rise as investors digest Ukraine peace efforts - Reuters",https://news.google.com/rss/articles/CBMie0FVX3lxTE1QZHZ6MWczX240S2NRNFpJZkJFOUtwdVl3NnZ3bm9hU3FrWmhJbExZU3ZRVlZkdzZVT21sME1LdVRBRE5QTmEzbzJZM21LWS1jRGZjY2M0UldoZkJabkg2cGdJQllNSkpYUUNkOV8tZ3JnWlFUbEVHaHgzbw?oc=5,"Tue, 19 Aug 2025 20:23:17 GMT",
2025-08-20T01:26:46,Google News Reuters,Oil prices fall on talks to end Russian invasion of Ukraine - Reuters,https://news.google.com/rss/articles/CBMipAFBVV95cUxOWEhFUl9NUVhGNW42R3NqV2dOQWhrSDhNcmRjaTJGOW96dl9NVlpsRk5LUFZnOExNcVVxNGt1QlMwQmRZSHZBbEEyMWJRc2t2bm92Y3NLUHJNemY0a0xlTzllN3JLbm1DU1VMYzlRbnhoMGlTREZEYU9OMktRc2RoQ1dHSjA1eTYtWjhqV0N6U25MOThhc1loaF9MSF9jNU5rRVlueA?oc=5,"Tue, 19 Aug 2025 19:55:47 GMT",
2025-08-20T01:26:46,Google News Reuters,"Nasdaq, S&P end lower as Jackson Hole jitters hit tech stocks - Reuters",https://news.google.com/rss/articles/CBMiowFBVV95cUxPandtbHIwVnlFWF93ZEJIbTRUa2l0XzFUYzdNUU81S1JnYklCWlA1ZW1aZGtjMFppVXB6V0FfV2JYUk5PS2kxQlNVUnk0SG5vdVl5b2E5eHc3SXRwZ1VoQ3Nua3VmVnlXSTlYQ2xSSW8wc08zbTUyU05DRExNbnZ0VkJ6OWJYVzZZX3hSUlZkYjJhMDN3a0VycVU1UFZqRFlCQTFR?oc=5,"Tue, 19 Aug 2025 20:18:20 GMT",
2025-08-20T01:26:46,Google News Reuters,"Trump says no ground troops, but maybe air support, to back Ukraine peace deal - Reuters",https://news.google.com/rss/articles/CBMiugFBVV95cUxOa2hLeFpsR0llNFp2MjRhSDBpWnVOOTZpcWF0cWIzQWotaU0yZ0FoUGZnNG01bnEybUJOTVJPalBBMEhYaWQ4SzhrejFWMTBybzFGcjFGTTlEa2NYeUF3cS1iNVl5dnROV1RQa0JSU2FVRVdLQ1dkYTVBbGc4WUl4dkhNeFlrSE1SM0xFVVJld2tKRm9haGplRTljWXo4VUd6V0hsWHlBVjZieU1UMm9oRWhqbWUyMlZ3YXc?oc=5,"Tue, 19 Aug 2025 23:37:55 GMT",
2025-08-20T01:26:46,Google News Reuters,Dollar mixed as traders wait on Jackson Hole - Reuters,https://news.google.com/rss/articles/CBMilwFBVV95cUxNUEpNTTRKcDBOcUhjRHJNX0Rva1BGX3pUZml4MzBFQVo0elNSbXE0VU05Vk1rbEN4Zmh2ZWtPaTFtQVIwT0R0QzRVQTg1VjNqQmhxcmM0WU5hWWV2VXEtcjF5TmdDMXlOZ25YTlhyTW9mY3lyellQVGtaSGxtdEtfSmZiZFBTV3ZLdUFSZW96OVhtOEQtaEw0?oc=5,"Tue, 19 Aug 2025 19:05:24 GMT",
2025-08-20T01:26:46,Google News Reuters,US treasury chief says status quo with China 'working pretty well' - Reuters,https://news.google.com/rss/articles/CBMisgFBVV95cUxQdkExOTVDN2x5Z0NtRk9sSE9wREVrdHNaUGZZa01zMmtZWHFGSkpySWtCMWVqM0ZMSjFSM285NVpwLVoxS0pGXzl6d29jb2VWLUZianp1d1JfU1k0U0NmTk9GQUItb3lwWFZQS2tUV0lPazVnVV83X0YxYjdaOXRidWlXTlRQSENhZlhOeWhJRVJHRVJEOUhlMWhESlRWc0czQ1pUM2hQaEQwbjlWVmFHcXFn?oc=5,"Wed, 20 Aug 2025 00:16:00 GMT",
2025-08-20T01:26:46,Google News Reuters,Trump shock spurs Japan to think about the unthinkable: nuclear arms - Reuters,https://news.google.com/rss/articles/CBMisAFBVV95cUxQNVg5SzVlTVdZMmc1RVFJdm1McjBTQWtKV092SDFXai1fX2s3MzNwcXVXV1J1Wm9oc0VJUXEtVXZMWllkdVVENkpYMGppRlJFX3dxTTdEamlsbWxwdERjR25COENPa1ppRDlpSDZUcGxET0NYWXVIV2lkYmZwS1hKODJNeTNteWhuS05rSEVXV3pQNWZxY0J2c3JVLXcxOGRXV1gyODVveVBHTHI1d1E2Ug?oc=5,"Tue, 19 Aug 2025 21:22:19 GMT",
2025-08-20T01:26:46,Google News Reuters,"India, China agree to resume direct flights, boost business links - Reuters",https://news.google.com/rss/articles/CBMirAFBVV95cUxNZ1RVUFQ2YThWbTliRGtBNDZ4NG1nWlVWUjZnb25OUjQ2R2pnVG9qbVphU2I4d0xkcVFxZGQwUmdIdlM0U1hDZmhieUtoaDhGMjFHZ2x1eFpQSTh0QWJCVVhxZFFsSHltemxnWGFxWm5wejhiY0laQ21rWWhhdmM5Y0pQWEJLMG1zN0R5VkFjYVVibFRDek5GTUo2ajdTM3pUTEpmMjJONEMyTkpy?oc=5,"Wed, 20 Aug 2025 00:14:18 GMT",
2025-08-20T01:26:46,Google News Reuters,Israel weighs Hamas offer of 60-day Gaza truce and hostage release - Reuters,https://news.google.com/rss/articles/CBMiswFBVV95cUxOQ1VqOGFkTUx2QnhsMWZpMFdaeWhqS0F3YUVDcmI1VnQ3aTV1S1M2UldPNHYxbXQ3THU1N1BVbFJ0Rl9QUDlKdDg2cUdxYWJqYWFvNWhCa2JuUVo2LThhakFtUXB4eVdMU2llWkRwalhNbHl0TVlHY1ZNZjFaaktFUmtVWVIzLTJneHhvRW5RcV9DOVJBTTFjcGgwdFBEc0pkTHUyTml4dWVLLVVndnVQN1NLOA?oc=5,"Tue, 19 Aug 2025 19:40:31 GMT",
2025-08-20T01:26:46,Google News Reuters,Wall Street falls on Jackson Hole jitters - Reuters,https://news.google.com/rss/articles/CBMiiwFBVV95cUxNajJ5VGVGQ3k0UXJ0LVh1dzVBcTJ5YkNLWFByeFl0LUgtaVQ4MkY0QnpVQnpDU1NhLVM5Wm93TUdDWDFJWVkyaDhkaFc1cG90LXF0VzRPbEhjd1RmR0hYUy1jSXJXVGZpN1g5TU1MTFJYQTZBWVlsQVNESEwxNFFMTWVGa1JFWElLdDRv?oc=5,"Tue, 19 Aug 2025 18:16:47 GMT",
2025-08-20T01:26:46,Google News Reuters,"Exclusive: Toms Capital seeks CSX meeting after buying stake, sources say - Reuters",https://news.google.com/rss/articles/CBMi2gFBVV95cUxQUW5SVGFaYk1BWk1tb1BMaWRoLWdHZmdmSGZqbVdoRmNwZlV0WWZEWlJ1RC1oRU5iSFZHMG13anN4NDV4Q3p1NEFzc1p0ZXRvcDJocHBfUWdkcFlWa3h1UnJ6aGI2N2dHZG9SRjN2QmRFenE3ZkM4R2k5T2VNa0k2OWtQZFFCMzBQS2FEeEM3WHpxZTNmZlVMOW9vNFFWdHZ6TGlSSkxGX0daUkcwNDJyWVF2UE91VUhhRFlFRElQMlZPVXV2Qk95NlR3dlNEdDdMdUtHdFI3OHh1Zw?oc=5,"Tue, 19 Aug 2025 20:19:26 GMT",
2025-08-20T01:26:46,Google News Reuters,"Trump administration to seek federal charges against people snared in DC crackdown, sources say - Reuters",https://news.google.com/rss/articles/CBMiyAFBVV95cUxOLWxMV2RPMEV3LXgzOGczUHl1Sm5wMEFkb0ZEOG9HeVlDamhiMUY2R195eEltekk2dnZxUVByaFFZX20yNGhISHMxRkxOUWNHX1JxUnFrckNSY0d6RW9KZFZsODhMR1JjaV9WdjVnZFAyQlNoVUdIUXNSYWY1TEc0Sml6aC0wQXRPeXJPT1NrUkZRZ2dsUngzakxOcXF4SHk2YUNpTDBBV2Z2Q3Z1TG45V2NYNUxVRnVWV2lxV1J1b3l4dmZJcWc1UA?oc=5,"Tue, 19 Aug 2025 18:38:52 GMT",
2025-08-20T01:26:46,Google News Reuters,"S&P affirms 'AA+' credit rating for US, cites impact of tariff revenue - Reuters",https://news.google.com/rss/articles/CBMipgFBVV95cUxQeG43d0dGOVhzMU5IZnc5ZkFnbGZUeUNkdTZhVEpWTDRhXzhMN1VYQXhxVDFxMW5xa0NZaUdOb25YMTdGRTE0NWF2eC1sWXRaY0RqQWgzeXBGN21SQWY0LUNLMVVrOE02YjIzb1pYUDM4UmVFR040MWlodkJGZkZSMldIc2t4cVNPM0FrSU9KWkt4YUFrcHdUc0hIdWpSTWMzbnpOa2pn?oc=5,"Tue, 19 Aug 2025 17:17:08 GMT",
2025-08-20T01:26:46,Google News Reuters,How a Ukrainian designer helped Zelenskiy dress for Trump diplomacy - Reuters,https://news.google.com/rss/articles/CBMirwFBVV95cUxQckMtWG9sVi1JSXg2M0RWX0JyQVlmdGRhVi1iRVI1QnhYMTNIX1NvRFZtbUN5X0lTOFdpeGZFQXloNGVwMWdyQ2VzNkZPVFFQSUtoenh1OWs5RjJFSEUzUVpJZWlmYThwRUNSWDhjNE8xZ2Y1aEI2cHVhWWlGUXpONVlTMGVEaFI2WEZlYWx6cFg0WDRVb3lHa19ObUU5Yk0yNll1VWNrc2QyRlBQNDZR?oc=5,"Tue, 19 Aug 2025 22:30:22 GMT",
2025-08-20T01:26:46,Google News Reuters,NATO military leaders to meet on Wednesday to discuss Ukraine as Trump teases air support - Reuters,https://news.google.com/rss/articles/CBMixAFBVV95cUxONlR0c19KQ3dBZmo2WmZxT1R1SG9DOTAxdVBvTkdhT19FOC1XbnJqLTZwSjVSQ3Rkc05aWUFVcHlzV2VSNnRNbnNOU1VNeGM3RFoxR3NZV01KUWdrTkxZUVhMa0t5VWlkS2NDUmw3Y0lRbUxpTnN5Q2NUcVFsMk55bjJPMTRwOXhXNzlEd2UzMmVIT09iZ244c01WbFdRNGNCOFdBMHozbmFsRU1VY2lnZzIzNFdfN0NFNTV6Qy1pOFFUcEp0?oc=5,"Tue, 19 Aug 2025 17:49:56 GMT",
