timestamp,source,title,link,published,content
2025-08-07T01:46:40,MarketWatch Top,"Trump’s new tariffs start tomorrow. Here’s who’s getting hit, and by how much.",https://www.marketwatch.com/story/trumps-new-tariffs-start-tomorrow-heres-whos-getting-hit-and-by-how-much-3adc3dc4?mod=mw_rss_topstories,"Thu, 07 Aug 2025 00:56:00 GMT",
2025-08-07T01:46:40,MarketWatch Top,Why Nvidia and other chip stocks are shrugging off Trump’s latest tariff threat,https://www.marketwatch.com/story/why-nvidia-and-other-chip-stocks-are-shrugging-off-trumps-latest-tariff-threat-11e104ba?mod=mw_rss_topstories,"Thu, 07 Aug 2025 00:25:00 GMT",
2025-08-07T01:46:40,MarketWatch Top,Upstart’s stock takes a mysterious dive after earnings. What’s behind the move.,https://www.marketwatch.com/story/upstarts-stock-takes-a-mysterious-dive-after-earnings-whats-behind-the-move-c033d54e?mod=mw_rss_topstories,"Thu, 07 Aug 2025 00:20:00 GMT",
2025-08-07T01:46:40,MarketWatch Top,DraftKings’ profit doubles expectations as people are betting — and losing — more,https://www.marketwatch.com/story/draftkings-profit-doubles-expectations-as-people-are-betting-and-losing-more-1e367723?mod=mw_rss_topstories,"Thu, 07 Aug 2025 00:18:00 GMT",
2025-08-07T01:46:40,MarketWatch Top,Airbnb is wading deeper into politics. It could weigh on profits.,https://www.marketwatch.com/story/airbnb-is-wading-deeper-into-politics-it-could-weigh-on-profits-01e68489?mod=mw_rss_topstories,"Thu, 07 Aug 2025 00:17:00 GMT",
2025-08-07T01:46:40,MarketWatch Top,"Consumers are ordering more deliveries, says DoorDash. The stock is surging.",https://www.marketwatch.com/story/consumers-are-ordering-more-deliveries-says-doordash-the-stock-is-surging-08fa35fb?mod=mw_rss_topstories,"Thu, 07 Aug 2025 00:15:00 GMT",
2025-08-07T01:46:40,MarketWatch Top,"Lyft shares struggle to keep up with Uber following mixed results. ‘Comparison is the thief of joy,’ analyst says.",https://www.marketwatch.com/story/lyft-shares-struggle-to-keep-up-with-uber-following-mixed-quarterly-results-7e541a7d?mod=mw_rss_topstories,"Thu, 07 Aug 2025 00:14:00 GMT",
2025-08-07T01:46:40,MarketWatch Top,My therapist said he was in-network. The insurer says he’s not. Am I obliged to pay full rates for all prior sessions?,https://www.marketwatch.com/story/my-therapist-said-he-was-in-network-hes-not-am-i-obliged-to-pay-out-of-network-rates-for-all-prior-sessions-ab570bed?mod=mw_rss_topstories,"Wed, 06 Aug 2025 22:12:00 GMT",
2025-08-07T01:46:40,MarketWatch Top,‘I’m scared to lose’: I have $140K in a 401(k) and earn $45K a year. Can I retire in 20 years?,https://www.marketwatch.com/story/im-scared-to-lose-too-much-in-risky-investments-i-have-140k-in-a-401-k-and-earn-45k-a-year-can-i-retire-in-20-years-239aaf81?mod=mw_rss_topstories,"Wed, 06 Aug 2025 22:02:00 GMT",
2025-08-07T01:46:40,MarketWatch Top,"My relative, 80, was about to be scammed out of $40,000. Here’s how I stopped it.",https://www.marketwatch.com/story/heres-how-i-talked-my-80-year-old-relative-out-of-giving-40-000-to-scammers-in-the-nick-of-time-1fed265d?mod=mw_rss_topstories,"Wed, 06 Aug 2025 21:50:00 GMT",
2025-08-07T01:46:40,CNBC Top News,"Trump vows 100% tariff on chips, unless companies are building in the U.S.",https://www.cnbc.com/2025/08/06/trump-tariffs-chips-companies.html,"Wed, 06 Aug 2025 22:36:29 GMT",
2025-08-07T01:46:40,CNBC Top News,Airbnb beats on top and bottom lines for second quarter,https://www.cnbc.com/2025/08/06/airbnb-beats-on-top-and-bottom-lines-for-second-quarter.html,"Wed, 06 Aug 2025 23:58:05 GMT",
2025-08-07T01:46:40,CNBC Top News,E.l.f. Beauty's profits fall 30% as China tariffs weigh on bottom line,https://www.cnbc.com/2025/08/06/elf-beauty-elf-earnings-q1-2026.html,"Wed, 06 Aug 2025 21:21:16 GMT",
2025-08-07T01:46:40,CNBC Top News,"DoorDash shares rise on earnings, revenue beat",https://www.cnbc.com/2025/08/06/doordash-dash-stock-q2-earnings.html,"Wed, 06 Aug 2025 23:58:27 GMT",
2025-08-07T01:46:40,CNBC Top News,"Firefly Aerospace prices shares at $45, above the expected range",https://www.cnbc.com/2025/08/06/firefly-aerospace-fly-stock-ipo.html,"Wed, 06 Aug 2025 21:55:16 GMT",
2025-08-07T01:46:40,CNBC Top News,Why India is in Trump’s crosshairs when crude is not even sanctioned,https://www.cnbc.com/2025/08/06/why-india-is-in-trumps-crosshairs-when-crude-is-not-even-sanctioned.html,"Wed, 06 Aug 2025 15:29:23 GMT",
2025-08-07T01:46:40,CNBC Top News,Switzerland is in a uniquely difficult position when it comes to tariffs. Here's why,https://www.cnbc.com/2025/08/06/trump-tariffs-why-switzerland-faces-a-unique-struggle.html,"Wed, 06 Aug 2025 14:43:02 GMT",
2025-08-07T01:46:40,CNBC Top News,Jim Cramer on Wednesday's action: 'We have a market that’s all over the map',https://www.cnbc.com/2025/08/06/cramer-on-wednesday-action-we-have-a-market-thats-all-over-the-map.html,"Wed, 06 Aug 2025 23:06:55 GMT",
2025-08-07T01:46:40,CNBC Top News,Trump faces a variety of choices as he seeks to fill Fed vacancies,https://www.cnbc.com/2025/08/06/trump-faces-a-variety-of-choices-as-he-seeks-to-fill-fed-vacancies.html,"Wed, 06 Aug 2025 19:22:42 GMT",
2025-08-07T01:46:40,CNBC Top News,"These 2 stocks are still on our shopping list, and what Eli Lilly needs to deliver on earnings",https://www.cnbc.com/2025/08/06/these-2-stocks-are-still-on-our-shopping-list-and-what-eli-lilly-needs-to-deliver-on-earnings.html,"Wed, 06 Aug 2025 18:44:55 GMT",
2025-08-07T01:46:40,CNBC Top News,Trump global trade deal energy export wins are at odds with domestic shipbuilding reality,https://www.cnbc.com/2025/08/06/trump-trade-deals-energy-exports-lng-tanker-ships.html,"Wed, 06 Aug 2025 20:08:13 GMT",
2025-08-07T01:46:40,CNBC Top News,OpenAI is giving ChatGPT to the government for $1,https://www.cnbc.com/2025/08/06/openai-is-giving-chatgpt-to-the-government-for-1-.html,"Wed, 06 Aug 2025 17:29:51 GMT",
2025-08-07T01:46:40,CNBC Top News,Trump contorts timeline of jobs report revisions in effort to justify firing BLS chief,https://www.cnbc.com/2025/08/06/trump-bls-jobs-revisions-election.html,"Wed, 06 Aug 2025 23:47:12 GMT",
2025-08-07T01:46:40,CNBC Top News,"Amazon's Zoox robotaxi unit clears regulatory hurdle, safety probe",https://www.cnbc.com/2025/08/06/amazon-zoox-robotaxi.html,"Wed, 06 Aug 2025 19:48:52 GMT",
2025-08-07T01:46:40,CNBC Top News,Trump raises India tariffs to 50% over Russian oil purchases,https://www.cnbc.com/2025/08/06/trump-trade-india-tariffs-russia.html,"Wed, 06 Aug 2025 18:54:44 GMT",
2025-08-07T01:46:40,CNBC Top News,How will Trump's 50% tariffs on India impact its economy?,https://www.cnbc.com/2025/08/06/how-will-trumps-50percent-tariffs-on-india-impact-its-economy.html,"Wed, 06 Aug 2025 23:42:31 GMT",
2025-08-07T01:46:40,CNBC Top News,Match Group pops 10% as dating company shows early signs of a turnaround,https://www.cnbc.com/2025/08/06/match-group-mtch-earnings-q2-2025.html,"Wed, 06 Aug 2025 20:08:06 GMT",
2025-08-07T01:46:40,CNBC Top News,Candy giant Mars partners with biotech firm to gene-edit cocoa supply,https://www.cnbc.com/2025/08/06/candy-giant-mars-partners-with-biotech-firm-to-gene-edit-cocoa-supply.html,"Wed, 06 Aug 2025 18:03:58 GMT",
2025-08-07T01:46:40,CNBC Top News,"Super Micro stock sinks 18% after earnings, outlook disappoint",https://www.cnbc.com/2025/08/06/super-micro-smci-stock-earnings.html,"Wed, 06 Aug 2025 19:57:28 GMT",
2025-08-07T01:46:40,CNBC Top News,"The 10 worst U.S. cities for jobs and earning potential, according to new report",https://www.cnbc.com/2025/08/06/the-10-worst-us-cities-for-jobs-and-earning-potential-according-to-new-report.html,"Wed, 06 Aug 2025 13:22:01 GMT",
2025-08-07T01:46:40,CNBC Top News,Trump views foreign investment pledges as gifts. Trade partners say that's way off the mark,https://www.cnbc.com/2025/08/06/trump-trade-tariffs-investment-pledge.html,"Wed, 06 Aug 2025 14:47:02 GMT",
2025-08-07T01:46:40,CNBC Top News,Student loan borrowers face new challenges trying to get Public Service Loan Forgiveness,https://www.cnbc.com/2025/08/06/student-loan-borrowers-and-changes-to-public-service-loan-forgiveness-pslf.html,"Wed, 06 Aug 2025 18:40:36 GMT",
2025-08-07T01:46:40,CNBC Top News,Tim Cook to join Trump at White House for Apple investment announcement,https://www.cnbc.com/2025/08/06/tim-cook-trump-apple-white-house.html,"Wed, 06 Aug 2025 16:58:11 GMT",
2025-08-07T01:46:40,CNBC Top News,"AMD stock slumps 6% on earnings miss, China AI chip concerns",https://www.cnbc.com/2025/08/06/amd-stock-china-ai-chips-earnings.html,"Wed, 06 Aug 2025 20:08:26 GMT",
2025-08-07T01:46:40,CNBC Top News,"Sergeant ID'd as gunman who shot 5 soldiers at Fort Stewart in Georgia, Army says",https://www.cnbc.com/2025/08/06/fort-stewart-shooting-army-georgia.html,"Wed, 06 Aug 2025 20:29:42 GMT",
2025-08-07T01:46:40,CNBC Top News,Tween accessories retailer Claire's files for bankruptcy again as debt pile looms,https://www.cnbc.com/2025/08/06/claires-files-for-bankruptcy-again-as-debt-pile-looms.html,"Wed, 06 Aug 2025 17:07:23 GMT",
2025-08-07T01:46:40,CNBC Top News,"From jobs to safety, biggest railroad union fears 'meltdowns' from Union Pacific-Norfolk Southern merger",https://www.cnbc.com/2025/08/06/largest-labor-group-union-pacific-norfolk-southern-merger-job-losses.html,"Wed, 06 Aug 2025 15:50:09 GMT",
2025-08-07T01:46:40,CNBC Top News,Sen. Warren asks FTC to consider blocking Dick's-Foot Locker merger over antitrust concerns,https://www.cnbc.com/2025/08/06/warren-asks-ftc-to-consider-blocking-dicks-foot-locker-merger.html,"Wed, 06 Aug 2025 15:39:55 GMT",
2025-08-07T01:46:40,CNBC Top News,Shopify stock soars 21% on rosy guidance as CFO says tariff hit 'did not materialize',https://www.cnbc.com/2025/08/06/shopify-shop-stock-earnings-q2-2025.html,"Wed, 06 Aug 2025 20:02:51 GMT",
2025-08-07T01:46:40,CNBC Top News,"Disney earnings top expectations as streaming, parks offset TV headwinds",https://www.cnbc.com/2025/08/06/disney-dis-earnings-q3-2025.html,"Wed, 06 Aug 2025 13:00:28 GMT",
2025-08-07T01:46:40,Investing.com All News,United Airlines grounds flights at US airports amid IT glitch,https://uk.investing.com/news/stock-market-news/united-airlines-grounds-flights-at-us-airports-amid-it-glitch-4205396,2025-08-07 01:22:10,
2025-08-07T01:46:40,Investing.com All News,"Trump’s 15% tariffs on Japan not a ceiling, media reports say",https://uk.investing.com/news/economy-news/trumps-15-tariffs-on-japan-not-a-ceiling-media-reports-say-4205395,2025-08-07 00:58:09,
2025-08-07T01:46:40,Investing.com All News,Rio Tinto to invest $180 mln in Amrun bauxite mine expansion,https://uk.investing.com/news/stock-market-news/rio-tinto-to-invest-180-mln-in-amrun-bauxite-mine-expansion-4205394,2025-08-07 00:56:08,
2025-08-07T01:46:40,Investing.com All News,"Root earnings beat by $0.77, revenue topped estimates",https://uk.investing.com/news/earnings/root-earnings-beat-by-077-revenue-topped-estimates-4205393,2025-08-07 00:30:50,
2025-08-07T01:46:40,Investing.com All News,"American Coastal Insurance earnings beat by $0.14, revenue fell short of estimates",https://uk.investing.com/news/earnings/american-coastal-insurance-earnings-beat-by-014-revenue-fell-short-of-estimates-4205392,2025-08-07 00:30:50,
2025-08-07T01:46:40,Investing.com All News,"Phenixfin earnings missed by $1.57, revenue fell short of estimates",https://uk.investing.com/news/earnings/phenixfin-earnings-missed-by-157-revenue-fell-short-of-estimates-4205391,2025-08-07 00:30:48,
2025-08-07T01:46:40,Investing.com All News,"Capital Southwest earnings missed, revenue topped estimates",https://uk.investing.com/news/earnings/capital-southwest-earnings-missed-revenue-topped-estimates-4205390,2025-08-07 00:30:43,
2025-08-07T01:46:40,Investing.com All News,"MBIA earnings missed by $0.03, revenue topped estimates",https://uk.investing.com/news/earnings/mbia-earnings-missed-by-003-revenue-topped-estimates-4205389,2025-08-07 00:30:42,
2025-08-07T01:46:40,Investing.com All News,"Triplepoint Venture earnings missed by $0.02, revenue fell short of estimates",https://uk.investing.com/news/earnings/triplepoint-venture-earnings-missed-by-002-revenue-fell-short-of-estimates-4205388,2025-08-07 00:30:39,
2025-08-07T01:46:40,Investing.com All News,"Stellus Capital Investment earnings missed, revenue fell short of estimates",https://uk.investing.com/news/earnings/stellus-capital-investment-earnings-missed-revenue-fell-short-of-estimates-4205387,2025-08-07 00:30:36,
2025-08-07T01:46:40,Investing.com Bond News,US 3-Year Auction Disappoints Slightly as Markets Question Rate Cut Path,https://uk.investing.com/analysis/us-3year-auction-disappoints-slightly-as-markets-question-rate-cut-path-200617956,"Aug 05, 2025 20:31 GMT",
2025-08-07T01:46:40,Investing.com Bond News,US Treasury Yields Tick Higher Ahead of Heavy Auction Week,https://uk.investing.com/analysis/us-treasury-yields-tick-higher-ahead-of-heavy-auction-week-200617942,"Aug 05, 2025 07:14 GMT",
2025-08-07T01:46:40,Investing.com Bond News,The Bond Market Is Pricing in a Softer Economy,https://uk.investing.com/analysis/the-bond-market-is-pricing-in-a-softer-economy-200617930,"Aug 04, 2025 22:17 GMT",
2025-08-07T01:46:40,Investing.com Bond News,Non-Farm Payrolls Ahead: Saving the Most Exciting for Last?,https://uk.investing.com/analysis/nonfarm-payrolls-ahead-saving-the-most-exciting-for-last-200617897,"Aug 01, 2025 06:50 GMT",
2025-08-07T01:46:40,Investing.com Bond News,Medium-Term Corporates Lead US Bond Market in 2025,https://uk.investing.com/analysis/mediumterm-corporates-lead-us-bond-market-in-2025-200617754,"Jul 23, 2025 11:53 GMT",
2025-08-07T01:46:40,Investing.com Bond News,Japan’s Election Results Could Send Shockwaves Through US Bond Market,https://uk.investing.com/analysis/japans-election-results-could-send-shockwaves-through-us-bond-market-this-week-200617701,"Jul 21, 2025 06:55 GMT",
2025-08-07T01:46:40,Investing.com Bond News,How Fed Could Inject Liquidity if Bond Yields Surge: What Investors Need to Know,https://uk.investing.com/analysis/how-fed-could-inject-liquidity-if-bond-yields-surge-what-investors-need-to-know-200617670,"Jul 17, 2025 13:37 GMT",
2025-08-07T01:46:40,Investing.com Bond News,US 10-Year Yield Holds Above Fair Value as Deficit and CPI Heat Up,https://uk.investing.com/analysis/us-10year-yield-holds-above-fair-value-as-deficit-and-cpi-heat-up-200617650,"Jul 16, 2025 11:56 GMT",
2025-08-07T01:46:40,Investing.com Bond News,Treasury Auction Shows Strength: Bid-to-Cover and Foreign Demand Surge,https://uk.investing.com/analysis/treasury-auction-shows-strength-bidtocover-and-foreign-demand-surge-200617554,"Jul 10, 2025 10:41 GMT",
2025-08-07T01:46:40,Investing.com Bond News,US 30-Year Yield Mispriced? Inflation and Deficits Point to Higher Rates,https://uk.investing.com/analysis/us-30year-yield-mispriced-inflation-and-deficits-point-to-higher-rates-200617522,"Jul 08, 2025 13:52 GMT",
2025-08-07T01:46:41,Google News Reuters,Trump says US will levy 100% tariff on some chip imports - Reuters,https://news.google.com/rss/articles/CBMiogFBVV95cUxNNkxNMWRDS1lXVkVrYk0zRlpnYTNlbzNnUnpkbEdDZjJDb2l3Q2o0b3ZEeTlSMFJFUVRybWt2RTlKZE44dHIwc2hkMG9fTHRpTzM1c2VqdHBLZHNiNVlMQmlMZmFHMXYxRl8yQmhWc3VxMzFyMzE5V21TN0xzZkxObVhqamRxTUZ2QUpxdk1FWVZxMkRvb1BOTEF6X1YyRFpqWkE?oc=5,"Thu, 07 Aug 2025 00:32:00 GMT",
2025-08-07T01:46:41,Google News Reuters,Trump announces $100 billion new investment pledge from Apple - Reuters,https://news.google.com/rss/articles/CBMitwFBVV95cUxNSW9OZVJReUY4cWhWb2JJVmttVzFwVFZUZ2lYX0YxT3Z6eFdReXlZYUlDVmZfemRCVl8xT010TThiWmtGeXQtdHZ4YlVHSXUtd2REUFNRQzQ5blZvbUpSUU1pbjZSVHlMTFpQeU1nSXNGS0JyNXZHM0VJVTdFeDdPOEFCbVFTQXhBdllDb3oxT1pGcXRROW04emVQRjlUaW04RkwxclEyVFREQ2x5REZ1UkpDSGFrZVE?oc=5,"Wed, 06 Aug 2025 23:53:01 GMT",
2025-08-07T01:46:41,Google News Reuters,Apple says Samsung will supply chips from Texas factory - Reuters,https://news.google.com/rss/articles/CBMimwFBVV95cUxQX2dkbk1HdV9fMDlIc3RHRE1JOU1Pc1o4bkhocld2RXhYeUQ2c1F3algwaHdHbWRhVDZsVFN0dWJpQ1ZNVXAxcWp6ZTdBNm5faE9jNWVKdGt3bUVNdkFSWTlEUDVoT0VMcVpUU21zS3hMMUFkRV9VYmxsSDhibzdRX0M1TGk3RUF5VC13UnRGSElKLXEtUnhvQmpiSQ?oc=5,"Wed, 06 Aug 2025 22:53:50 GMT",
2025-08-07T01:46:41,Google News Reuters,"Trump could meet Putin over Ukraine as soon as next week, official says - Reuters",https://news.google.com/rss/articles/CBMiswFBVV95cUxQSUlUS3ZTRHQ1OVVsQnFoaG5XcVU3OVNUZHBHM2ZMNTR2Z2FUMzJOMEVQTDZIZ0liSmtkTzhJbzlMallPUlhDTDI3QjhGOWZkRVhWSFN0WmlxcGcwcXdoX2dzNHZ6aGprWHBzdmNjWFBOWnh0Z2dWb2VEM0h0RnRLdGJndkxhVGJwMVBvQ2thZlhVRktfeTZKUGtaM2ZDc0p3WnBRSExDdG1NNUduMjIwRzlDTQ?oc=5,"Wed, 06 Aug 2025 23:10:24 GMT",
2025-08-07T01:46:41,Google News Reuters,"U.S. Army sergeant suspected of shooting, wounding five soldiers at Fort Stewart in Georgia - Reuters",https://news.google.com/rss/articles/CBMiwgFBVV95cUxQbHZ4d0JURUpseE5BOExQRjBtTlBNT190dTFEWUl6U0syVGZwZkNTbHFXcmdmZVU0dlJtTmtHdVlSVF9xNGhLbWtrcTl1bXhhR3VGeGFXQ19WWEhfTzVmUXJYYWRfWkgxdHItT3FLOGxwN21CU05GS3U4emZzLS1zdkhSOGY3TGtRNjNyT2JoT2g1aG91VnU2WTF1M0dhWGFUQmhtWmYxZXdQNGxFd1VDQkFBVUlJdEQ1aXYyYTRLOGdYUQ?oc=5,"Wed, 06 Aug 2025 21:48:10 GMT",
2025-08-07T01:46:41,Google News Reuters,US Army soldier accused of attempting to share tank infomation with Russia - Reuters,https://news.google.com/rss/articles/CBMivgFBVV95cUxOSzJ5eWZyZzIyekJhdlA0YVZvcVQ5NzYwZXgyenMxWUlWWFhLWjllcm1jc3hPcHJLMHVIelNiWjZEVEQ0MGh2blVnTWZxR01GSE9kTExQWmJZM2gtTWc2eEVnTHdZMmhVY1N0bXlmOTNOXzVXMXk1SS02R1BfaldoMUN2QlZzV2pEblJxWU9HaXpwd294N3AtYnR0YWpuRG12VDAxdkZLYWkxVHlxVjc2X015MG1KWDNQS2xXU1JB?oc=5,"Wed, 06 Aug 2025 22:32:33 GMT",
2025-08-07T01:46:41,Google News Reuters,"Wall Street ends higher with Nasdaq up more than 1%, led by Apple - Reuters",https://news.google.com/rss/articles/CBMirAFBVV95cUxOdmg2Vkl2OEJZcmhmYkF6X0VuNG95UW9lQkNBQkFuVXNEbUlCM2J3U3VQbDZDVnIxQ3RjVURzeGFuT2hyNEdibmxoN0F4Vk5MMU0wN0ZESFVJY2VuMWZkS0JIVllKd0tRdWhYWXZBSnlWUlVKYUU1aDVTS0J1a0xVdUpRdC1XX3BuT250dHZDeXBLcjZlUmw5dGZTVEdzM1lPMWhYeVkzQk1PT19z?oc=5,"Wed, 06 Aug 2025 22:30:10 GMT",
2025-08-07T01:46:41,Google News Reuters,"Trump could meet Putin as early as next week, White House official says - Reuters",https://news.google.com/rss/articles/CBMiswFBVV95cUxOdXVDdGxTaGo3SEJVVVVQemFJVjlxaFJMZ1BMZzA2aVpzWk9xSzBiUGN6Nmw1WWNrZHhYOXJydzdjYk9nUzhEMlNveHVkbWlVLXU1MW5EdHduQWJSa1Z6QkdlSXZsSDJMY2ItTEVqTlkzajBPem1rZTF1TkdTWjItQ3JVMDlWbElnTWVwRVFlMUdMT1VFSjNCZDFHMnF6UUFrMWdTaUpFbzZzVDBEaGtoRkMxZw?oc=5,"Wed, 06 Aug 2025 21:02:48 GMT",
2025-08-07T01:46:41,Google News Reuters,"Wall Street gains, as oil ends lower in volatile trade - Reuters",https://news.google.com/rss/articles/CBMihwFBVV95cUxNUUJ1X0pWN29JMUVGaThlZnloVncwcUNSZlJQdl82Tnlfa0RoSE5MVW56UXI2LTlTNlZkdWNMRFhwRTVMWXdtLWQySzh1ZzhuRTdYVDVQV3BzM2FyOGJkNm1WVEMzWDhfbDQ4SGhlZ0FUZzNuY0NoVzFCOGZuLU8wcUg1N3hZU1k?oc=5,"Wed, 06 Aug 2025 21:07:04 GMT",
2025-08-07T01:46:41,Google News Reuters,"Trump met Citi, BofA CEOs to discuss plans for Fannie and Freddie, sources say - Reuters",https://news.google.com/rss/articles/CBMi2AFBVV95cUxPZUp5QnM1TmQ1bVJSVld6dkJRY0ktS1J5Vm5RSHVtQ1V4TzBHemszY0UtSDRwZEZCRVNjelhRdlJ3VkdEOTNnOEdIRWxabW82SzFWVHJhSVhkRDdnem1nMHlPZ2NWOWVSQWVrSWZPTW5TQVNMOWRUOUhzc0U1VzBUdTNoa1lpQi04U192OXBab1pLbE1ud2xPOWs3TDMxb1pXTGw3cmdGZ0RZTmxPMlk2VVNMOU5pcE5OOXpVeVE4RjQ4aG10RXQ3dlNsZkQ1a3l6ZTRpaXg3NzM?oc=5,"Wed, 06 Aug 2025 21:56:57 GMT",
2025-08-07T01:46:41,Google News Reuters,"Nasdaq leads gains on Wall Street, helped by Apple - Reuters",https://news.google.com/rss/articles/CBMilgFBVV95cUxPLVkyTHRvTXF5azFJOGJlQ3pLUUpWbEtBU3Q3WFp2N2dxMzQ1ZmFySktpdjFsRHgxNkljei1hX0hPWnFkNm9kdUV2VVhhNmM5RGpFNXpBVWlaYko2WnVHQUtmVW5hTklpSnJDbFppZ0tJUEZ6ZEF4U05vV0MtQTRzdDJSejZFWWx3ZGpadllrUE5iR3Itc2c?oc=5,"Wed, 06 Aug 2025 20:00:49 GMT",
2025-08-07T01:46:41,Google News Reuters,UCLA says Trump administration froze $584 million of its federal funding - Reuters,https://news.google.com/rss/articles/CBMivgFBVV95cUxOUDJDeVRwYzh6TGdodl9UZGJBaXBmYjVyTTFaMFZWaW9zOXE1WmRzQ0x0Q0VKdXlVZGM1SzFOU3NJNEMyNWk1UDhMVVh5bmtBbmtlUkxEd05KWGRpYkpUT1FZYXRkTFB4VHVYMUxWUG8xNEJsekRnN2ZDVHRQSUM5aTRLSlNOcXlhQ1EzeXp6NTR0OU9LNEUxbnFJY05KVm9ReEJQa3ZDdW5BYmItV1VGZGc0SEZUeVhuSXhmVTRR?oc=5,"Wed, 06 Aug 2025 21:59:29 GMT",
2025-08-07T01:46:41,Google News Reuters,Exclusive: 'I won't humiliate myself': Brazil's president sees no point in tariff talks with Trump - Reuters,https://news.google.com/rss/articles/CBMiygFBVV95cUxPclAyVUFqQmpYbEpYTUtpUEZQWUdzX2JpQjlnZUZCLV9qN2FuQW0yNHhNclAzSE1KNk14eENuWFFSNzhHTUU3aHViS1JjdjJBalhncEVtWC1yN1FmWVhoYV9LWjZPQjczaEwxSGhtSlFONUdZdWVzeDRiV3FJQ1o0ZE5EdmxpQU4zZTZTNklHSXE1cGNkM2hzeTlqdklDbXh5LTFJNmhyXzBYd2xxMzZxNDExR3JEVUVhVDN2S1dWWGRfRmFwOC1pWHRn?oc=5,"Wed, 06 Aug 2025 20:36:20 GMT",
2025-08-07T01:46:41,Google News Reuters,Oil prices slide to 8-week low as US-Russia talks stir sanction uncertainty - Reuters,https://news.google.com/rss/articles/CBMivgFBVV95cUxNeWlJcjJLYzRqQ01aRExGdXpkSkJJdWVhTW1idjEtVmN0RnRLNHhRQnBnSmdYVzVobEg0RTJZZXhSX3I1RjZMM2VDQUk3UjJocFJzbkdNZlNueTJKUWJia3ppRjFVYjBkcmt4SXk2SVE0R0c5MDdIXzRBV1BXT0JQRmwwU1RpaVRsU1ExUDNRUGFsblJmTmVoUDhlU3ZNSjg5M0ZzNWFBNndCekR0UHlfQ1BiUm5XSWJnbW0zc2l3?oc=5,"Wed, 06 Aug 2025 19:28:15 GMT",
2025-08-07T01:46:41,Google News Reuters,Trump says progress made in US envoy Witkoff's meeting with Putin - Reuters,https://news.google.com/rss/articles/CBMirwFBVV95cUxQOVNuZW9fanNuNG1yQU5GNUd6SE81THhNYXVoWUZ3MWo0anR6TkNUZXhSQTdlOFFWY1NVTDBYZGdPeFdianEzOTBlN1NrVEh2U0lHcVppaW9tNDFuVmZXeVp6MnplYzcxMzJFQzdqSWJKc0dvSGtiUHVSWXRVSXhxOEsydkl2ejNiYXp4Y0VVNFZrVVQzSm9lMzB3TUdzTGs2Mjl0N3M0UHpQR3NDSXhB?oc=5,"Wed, 06 Aug 2025 19:01:48 GMT",
2025-08-07T01:46:41,Google News Reuters,"General Motors, Hyundai to develop five vehicles amid rising competition - Reuters",https://news.google.com/rss/articles/CBMizwFBVV95cUxObHNmV3lUby1BcmlYWDhoN3Y1QVFzdklQY2FrTjlhYUE2Y19mbzdncm9pOXROeW94TzlQNkoyZWlXbS1WNkIzdkxFTURQdzlfc1Fsb2VYZ1BnQ1dEUTZyY0k1eFVmbm9DMk13eE9qdkxTTjBLUWpIRDdpaHEyZjh2VGJHbnhoMWJZQ3dBb3FqdDJDNWJVVDJOcGxlUVY2UmJFS1l4REhhNHRNdnJ4S1kwZE01cFJ2UlB1UjdMMHRwT2ZhRXBuQ3ROMGJ6WXlSbE0?oc=5,"Wed, 06 Aug 2025 23:51:33 GMT",
2025-08-07T01:46:41,Google News Reuters,Exclusive: Brazil's Lula says he will discuss Trump tariffs with BRICS group - Reuters,https://news.google.com/rss/articles/CBMisgFBVV95cUxOQlNOcTQ2cms0akVuUF96Z0ZhM213c3AtMjRFTVp2X2NlR2FuRW9iX0FQR3FwTmdiUW5oMXo0Zmg5QlhmNnRfNzUwaWgwVXJZdzhYTGp3WTAwQlRBQXd0MF9EcmRNUlh5VEN0UGRQc3ZoeEQyaHhpdGxhSzcxVnFDS2VqbXRNbzFkMWNVT25xTXlfZFNpNG4wRmhDS3RyMUlLTGpFeDhQT09EcTRtTWFLbU53?oc=5,"Wed, 06 Aug 2025 20:10:45 GMT",
2025-08-07T01:46:41,Google News Reuters,Trump says US will levy 100% tariff on some chip imports - Reuters,https://news.google.com/rss/articles/CBMiuAFBVV95cUxNc2h3V3ZKdHM5WllWT2MwMjJZTG5xQzRmSDc4aHdYSGNIcFhqLTliTVZqckdsb3RaWXFEMk5ZaTZsOE50SjBtVjBPNmpwdm5nRTc0bjUwOER0WUxvX2RNQm1USkhOa3ZrdU05MDRsQ0VjWHYzX2I3dUZHRDhQSjVObC1jN0NkYUVJRkVrMUhwdjNJX0puYTRIYzRKNFZkTUxVakpBTTZUYnlCOXdXVFhFR19SckU0andu?oc=5,"Thu, 07 Aug 2025 00:28:32 GMT",
2025-08-07T01:46:41,Google News Reuters,Switzerland facing 39% US tariff as president leaves Washington empty-handed - Reuters,https://news.google.com/rss/articles/CBMivgFBVV95cUxOTDRHMV9BQk9saVZEOE1UNkVhQlplMFBmOW1HUVdMa2NHd0Vnb0kwZ2FoMzgtMEVOTjRiZE5rMW9hVzdYVk1jUFFtUzlWRkJGWVhhdTJkYzdObXVXLUxDZzlZUXBHRTFXLVFGWmVrdDBwbm1PUmRnYkQyOVBHdGpOaXpVTFExVGQ2V1dYMS1xZGdUOUtHc2lkN1lLRnhQUjZaSE5rTXYxQ2JCT0IzYy1JWmFQSmdsOEswMU9iVnF3?oc=5,"Wed, 06 Aug 2025 19:42:33 GMT",
2025-08-07T01:46:41,Google News Reuters,Exclusive: Lula rejects 'humiliation' of calling Trump over US-Brazil tariff - Reuters,https://news.google.com/rss/articles/CBMisAFBVV95cUxPZV9Bei1KS19lUVAwSXZkU2lUTmtDaTFuakxEcG5qYmJpNnA3cmNjT1phbGFuUlRoVC1iR3VFRE40TkxOakxMMnM2TFlyLTJLdmhUb3l6Ylg3YVFhR3JMXzJrX0VDcmF5NUVlRjJHd0tMcjhjOEhUTVRqTy1fOGRVVWxFY2Rsc1J3UjdDQllYck1BdE5Yc09MbEktbTFwVjRzZFRxVy1LVnZ1WEU2VnRUNA?oc=5,"Wed, 06 Aug 2025 18:42:37 GMT",
2025-08-07T01:46:41,Google News Reuters,"VP Vance meeting to discuss Epstein fallout canceled, source says - Reuters",https://news.google.com/rss/articles/CBMiqgFBVV95cUxPYmczMjBCTUNKN3NxUWJranpyb1h5c3JxTEFEQjUtRFRDVk52Wkxqd09LelAwUmgtcjhjanJRTERYYWszNmh6STFONUR0M3lUbHhKQXhySGpmNExaY0duMkhiRGhBNlN2em0xVWNjYV9seV9fYXpld0szQ3pHMWVSQWJITTJmOWV2Z3dXSUo2eTVXVmdSWUdHNkNwek5CeTU1TzI1ZXc4eE8tdw?oc=5,"Wed, 06 Aug 2025 18:35:26 GMT",
2025-08-07T01:46:41,Google News Reuters,Zelenskiy says Russia seems more inclined now to a ceasefire - Reuters,https://news.google.com/rss/articles/CBMipwFBVV95cUxNLUstZVVtZ3YtZDdqUlo0YjF2YWpyT2dRVWFMajFickhmYVZrNEdCUThhLW1IUHFKclRsVUQ2Tm14OW5KR2xVcG1MVERYZ2xvck1MbkJYeFFURWFwTmI0RzRSU0xISklpTk9VVmREMUxYQ2JEN2h1dkMxOHlBTUUxRmdXUHE2SnNFeE1ucFBOSHl0VkZuMWQ1Y1JyU0JOOTNJOVctRmJ5Yw?oc=5,"Wed, 06 Aug 2025 18:44:38 GMT",
2025-08-07T01:46:41,Google News Reuters,India-US spat over trade and oil threatens wider fallout - Reuters,https://news.google.com/rss/articles/CBMipwFBVV95cUxPM0cwWC1RbG9pZWpJNy1uNHhTWkNpSzZISzR4cDNFWUZ1S05aSEZZdGwzRUswZlpjWGFYSGNsRHNNVFBKcHRKNmRudVFYX3NnS1hLU0t1amZjeGJUTDkxNkh2WHVpeDVGdmVLeGRzUFhfYUprYUlfUFdXTFZsbFN2cHVEbUxKY0NfYXZqNm83TUUzY1pTYjVxX2xSQjZTYklQcE9ZTmxOWQ?oc=5,"Wed, 06 Aug 2025 18:43:03 GMT",
2025-08-07T01:46:41,Google News Reuters,Duolingo raises 2025 revenue forecast as AI tools boost user engagement - Reuters,https://news.google.com/rss/articles/CBMiswFBVV95cUxNb0Z4NnRGd05iVjl2X25lXzFiUXgwVkhmQVk4c18xbXlMR09xNXdNb0lnMWVCc2pxazdNZjlqQ0xRaUFzeUI4bFdqdzJ0NGtLVDBHWWVXR2VoamtOWmtzTUMxY3JPVmlGV1lWUFBFQjcxd252allRUzl6a2RiaDRjQXJYTmJCRVZjZTNIWXVuMC1qclNOMUJyZzNkTVIxVnZvTlZ1S0syd2JrVFVOcUxZSGV1VQ?oc=5,"Wed, 06 Aug 2025 20:05:36 GMT",
2025-08-07T01:46:41,Google News Reuters,Exclusive: Lula plans new 'national sovereignty' policy for strategic minerals - Reuters,https://news.google.com/rss/articles/CBMiswFBVV95cUxNTGVRaGM4MWp1cGJndE5nQXNxeTUxMldtdFFUNmNlREl2c2lYeDdlbFV1QlY0aDlhYkg2QjJXNVAyTENRUjQyWm1WS0k4THloanpMM0trX3IxdHJUWHd4Skd4WEFWb1E0OUVpaVNzU3NSOHFRaVNEZFJVTzc0U213QTFQVDVYYUZrX2h0a3BvTFN0bWw2UFctZ2V1a1NGbWJSa2U3Tk1TVVRIa3ZUWG5pUU83TQ?oc=5,"Wed, 06 Aug 2025 19:01:46 GMT",
