timestamp,source,title,link,published,content
2025-08-19T01:55:19,MarketWatch Top,Intel’s stock rallies after $2 billion investment by Japan’s SoftBank,https://www.marketwatch.com/story/intels-stock-rallies-after-2-billion-investment-by-japans-softbank-5313aa50?mod=mw_rss_topstories,"Tue, 19 Aug 2025 01:24:00 GMT",
2025-08-19T01:55:19,MarketWatch Top,Opendoor’s stock is rocketing again. What can make it keep going?,https://www.marketwatch.com/story/opendoors-stock-is-rocketing-again-what-can-make-it-keep-going-d1c4a01a?mod=mw_rss_topstories,"Tue, 19 Aug 2025 00:56:00 GMT",
2025-08-19T01:55:19,MarketWatch Top,Palo Alto Networks’ stock rises as earnings point to future sales boom,https://www.marketwatch.com/story/palo-alto-networks-stock-rises-as-earnings-point-to-future-sales-boom-58c56871?mod=mw_rss_topstories,"Tue, 19 Aug 2025 00:21:00 GMT",
2025-08-19T01:55:19,MarketWatch Top,"I’m a senior who barely survives on $1,300 a month. No way could I live on $1,000.",https://www.marketwatch.com/story/im-a-senior-who-barely-survives-on-1-300-a-month-no-way-could-i-live-on-1-000-dfe42c83?mod=mw_rss_topstories,"Mon, 18 Aug 2025 23:27:00 GMT",
2025-08-19T01:55:19,MarketWatch Top,My friend’s father gifted her Tesla and Google stock. They could be worth millions. Will they be split 50/50 in her divorce?,https://www.marketwatch.com/story/are-tesla-and-google-stocks-received-as-a-gift-subject-to-division-in-a-divorce-18834c76?mod=mw_rss_topstories,"Mon, 18 Aug 2025 23:21:00 GMT",
2025-08-19T01:55:19,MarketWatch Top,"The bull case for Nvidia just got stronger, according to these Wall Street analysts",https://www.marketwatch.com/story/the-bull-case-for-nvidia-just-got-stronger-according-to-these-wall-street-analysts-79af8615?mod=mw_rss_topstories,"Mon, 18 Aug 2025 22:25:00 GMT",
2025-08-19T01:55:19,MarketWatch Top,"I’m single, 75, and living with kidney disease and a pacemaker. I’ve no long-term care insurance. Will I be OK?",https://www.marketwatch.com/story/im-single-75-and-living-with-kidney-disease-and-a-pacemaker-ive-no-long-term-care-insurance-will-i-be-ok-fcf4b87d?mod=mw_rss_topstories,"Mon, 18 Aug 2025 22:00:00 GMT",
2025-08-19T01:55:19,MarketWatch Top,‘I’ve been kept in poverty’: Do I take a $70K job at 74 and lose my Section 8 housing allowance?,https://www.marketwatch.com/story/should-i-apply-for-a-70k-a-year-job-at-74-and-risk-losing-my-section-8-housing-allowance-9932217d?mod=mw_rss_topstories,"Mon, 18 Aug 2025 21:50:00 GMT",
2025-08-19T01:55:19,MarketWatch Top,"Why a ‘wall of money’ is unlikely to flood into stocks when the Fed cuts rates, this Goldman strategist says",https://www.marketwatch.com/story/why-a-wall-of-money-is-unlikely-to-flood-into-stocks-when-the-fed-cuts-rates-this-goldman-strategist-says-c38a8792?mod=mw_rss_topstories,"Mon, 18 Aug 2025 21:29:00 GMT",
2025-08-19T01:55:19,MarketWatch Top,Palantir’s stock is sliding. Here’s why this short-seller thinks even a $40 price tag is ‘generous.’,https://www.marketwatch.com/story/palantirs-stock-is-sliding-heres-why-this-short-seller-thinks-even-a-40-price-tag-is-generous-35e041a0?mod=mw_rss_topstories,"Mon, 18 Aug 2025 20:45:00 GMT",
2025-08-19T01:55:19,CNBC Top News,Analysts downplay AI bubble worries as Altman says some investors will be left 'very burnt',https://www.cnbc.com/2025/08/18/altman-ai-bubble-openai.html,"Tue, 19 Aug 2025 00:51:21 GMT",
2025-08-19T01:55:19,CNBC Top News,Intel is getting a $2 billion investment from SoftBank,https://www.cnbc.com/2025/08/18/intel-is-getting-a-2-billion-investment-from-softbank.html,"Tue, 19 Aug 2025 00:42:06 GMT",
2025-08-19T01:55:19,CNBC Top News,"Bitcoin sinks to $115,000 after hitting its newest record, as macro concerns spark liquidation wave",https://www.cnbc.com/2025/08/18/crypto-market-today.html,"Mon, 18 Aug 2025 20:13:03 GMT",
2025-08-19T01:55:19,CNBC Top News,Asia-Pacific markets mostly track Wall Street declines ahead of U.S. Fed meeting,https://www.cnbc.com/2025/08/19/asia-stock-markets-today-live-updates-nikkei-225-asx-200-kospi-hang-seng-csi-300-sensex-nifty-50html.html,"Tue, 19 Aug 2025 01:00:34 GMT",
2025-08-19T01:55:19,CNBC Top News,"Palo Alto Networks reports earnings beat, says founder Nir Zuk retiring from company",https://www.cnbc.com/2025/08/18/palo-alto-panw-earnings-q4-2025.html,"Mon, 18 Aug 2025 21:33:26 GMT",
2025-08-19T01:55:19,CNBC Top News,"Versant to rename MSNBC, drop famed peacock logos in Comcast separation",https://www.cnbc.com/2025/08/18/comcast-versant-rename-msnbc-peacock-logos.html,"Mon, 18 Aug 2025 14:28:42 GMT",
2025-08-19T01:55:19,CNBC Top News,Tesla Optimus rival Unitree shines at the 'World Humanoid Robot Games' in China,https://www.cnbc.com/2025/08/18/world-humanoid-robot-games-china-tesla-unitree.html,"Mon, 18 Aug 2025 19:16:19 GMT",
2025-08-19T01:55:19,CNBC Top News,California legislature passes bill that gives interest on insurance payouts to homeowners,https://www.cnbc.com/2025/08/18/california-insurance-natural-disasters-newsom.html,"Mon, 18 Aug 2025 22:11:19 GMT",
2025-08-19T01:55:19,CNBC Top News,Musk's Starlink suffers apparent outage as SpaceX launches more satellites,https://www.cnbc.com/2025/08/18/starlink-outage-spacex-launch-satellites-musk.html,"Mon, 18 Aug 2025 19:51:15 GMT",
2025-08-19T01:55:19,CNBC Top News,When 'invest like the 1%' fails: How Yieldstreet's real estate bets left customers with massive losses,https://www.cnbc.com/2025/08/18/yieldstreet-real-estate-bets-customer-losses.html,"Mon, 18 Aug 2025 12:27:56 GMT",
2025-08-19T01:55:19,CNBC Top News,Novo Nordisk offers diabetes drug Ozempic for less than half the price for cash-paying U.S. patients,https://www.cnbc.com/2025/08/18/novo-nordisk-offers-diabetes-drug-ozempic-for-steep-cash-discount.html,"Mon, 18 Aug 2025 15:19:46 GMT",
2025-08-19T01:55:19,CNBC Top News,OpenAI's Altman warns the U.S. is underestimating China's next-gen AI threat,https://www.cnbc.com/2025/08/18/openai-altman-china-ai.html,"Tue, 19 Aug 2025 00:41:41 GMT",
2025-08-19T01:55:19,CNBC Top News,"Meta shares fall on AI restructuring report, while Lilly shrugs off Novo's Ozempic price move",https://www.cnbc.com/2025/08/18/meta-shares-fall-on-ai-restructuring-report-while-lilly-shrugs-off-novos-ozempic-price-move.html,"Mon, 18 Aug 2025 18:52:53 GMT",
2025-08-19T01:55:19,CNBC Top News,"Working longer to afford retirement is a risky plan, economists say — but some employees are counting on it",https://www.cnbc.com/2025/08/18/working-longer-retirement-plan.html,"Mon, 18 Aug 2025 12:00:01 GMT",
2025-08-19T01:55:19,CNBC Top News,How retail accounting could distort profitability as tariffs take effect,https://www.cnbc.com/2025/08/18/retail-earnings-how-accounting-could-change-profitability-amid-tariffs.html,"Mon, 18 Aug 2025 19:38:31 GMT",
2025-08-19T01:55:19,CNBC Top News,"'Job hugging' has replaced job-hopping, consultants say, as workers cling to current roles",https://www.cnbc.com/2025/08/18/job-hugging-job-hopping.html,"Mon, 18 Aug 2025 17:31:17 GMT",
2025-08-19T01:55:19,CNBC Top News,TeraWulf stock gains more than 4% as Google boosts stake in data center operator,https://www.cnbc.com/2025/08/18/terawulf-stock-google-stake-datacenter.html,"Mon, 18 Aug 2025 20:01:29 GMT",
2025-08-19T01:55:19,CNBC Top News,"Google, Kairos Power plan advanced nuclear plant for Tennessee Valley Authority grid by 2030",https://www.cnbc.com/2025/08/18/google-kairos-nuclear-smr-tennessee-valley-authority-tva-data-center-ai.html,"Mon, 18 Aug 2025 14:50:39 GMT",
2025-08-19T01:55:19,CNBC Top News,OpenAI's Sam Altman sees AI bubble forming as industry spending surges,https://www.cnbc.com/2025/08/18/openai-sam-altman-warns-ai-market-is-in-a-bubble.html,"Mon, 18 Aug 2025 18:24:29 GMT",
2025-08-19T01:55:19,CNBC Top News,Trump administration moves to 'prevent benefits' for some under popular student loan forgiveness program,https://www.cnbc.com/2025/08/18/trump-public-service-loan-forgiveness-pslf-eligibility.html,"Mon, 18 Aug 2025 16:38:43 GMT",
2025-08-19T01:55:19,CNBC Top News,Novo Nordisk shares pop after Wegovy receives U.S. approval for liver disease,https://www.cnbc.com/2025/08/18/novo-nordisk-shares-pop-5percent-after-wegovy-receives-us-approval-for-liver-disease.html,"Mon, 18 Aug 2025 13:26:32 GMT",
2025-08-19T01:55:19,CNBC Top News,Trump puts onus on Zelenskyy to end conflict with Russia ahead of meeting,https://www.cnbc.com/2025/08/18/trump-putin-zelenskyy-russia-ukraine-war-moscow-kyiv-nato-crimea-europe-us-alaska-washington-meeting.html,"Mon, 18 Aug 2025 04:27:54 GMT",
2025-08-19T01:55:19,CNBC Top News,China's EV industry is spending more on factories abroad than at home for the first time,https://www.cnbc.com/2025/08/18/chinas-electric-car-industry-invests-more-overseas-than-at-home.html,"Mon, 18 Aug 2025 13:01:01 GMT",
2025-08-19T01:55:19,CNBC Top News,Modi gives tax boon to India's economy amid Trump tariff tensions,https://www.cnbc.com/2025/08/18/modi-gives-tax-boon-to-indias-economy-amid-trump-tariff-tensions.html,"Mon, 18 Aug 2025 12:21:22 GMT",
2025-08-19T01:55:19,CNBC Top News,Trump advisor Peter Navarro slams India’s ‘opportunistic’ purchases of Russian crude,https://www.cnbc.com/2025/08/18/trump-advisor-peter-navarro-says-india-must-stop-buying-russian-oil.html,"Mon, 18 Aug 2025 13:51:56 GMT",
2025-08-19T01:55:19,CNBC Top News,These two charts show Walmart and Target's front-loading strategy,https://www.cnbc.com/2025/08/18/these-two-charts-show-walmart-and-targets-front-loading-strategy.html,"Mon, 18 Aug 2025 11:25:08 GMT",
2025-08-19T01:55:19,CNBC Top News,White House envoy claims Russia agreed to 'Article 5-like' security guarantees for Ukraine,https://www.cnbc.com/2025/08/17/trump-putin-steve-witkoff-ukraine-security-guarantees.html,"Sun, 17 Aug 2025 18:31:36 GMT",
2025-08-19T01:55:19,CNBC Top News,"Bill Gates meets Willy Wonka: How Epic's 82-year-old billionaire CEO, Judy Faulkner, built her software factory",https://www.cnbc.com/2025/08/16/how-epics-82-year-old-ceo-judy-faulkner-built-her-software-factory.html,"Sat, 16 Aug 2025 15:58:36 GMT",
2025-08-19T01:55:19,CNBC Top News,Trump warned by top Senate Democrats to rethink advanced AI chip sales to China,https://www.cnbc.com/2025/08/16/senate-democrats-letter-trump-advanced-ai-chip-sales-china.html,"Sat, 16 Aug 2025 18:39:59 GMT",
2025-08-19T01:55:19,CNBC Top News,Samsung taking market share from Apple in U.S. as foldable phones gain momentum,https://www.cnbc.com/2025/08/16/samsungs-us-market-share-apple-rivalry-foldable-phones.html,"Sat, 16 Aug 2025 20:50:56 GMT",
2025-08-19T01:55:19,Investing.com All News,Earnings call transcript: Brightstar Lottery Q2 2025 misses EPS expectations,https://uk.investing.com/news/transcripts/earnings-call-transcript-brightstar-lottery-q2-2025-misses-eps-expectations-93CH-4227396,2025-08-19 01:38:06,
2025-08-19T01:55:19,Investing.com All News,Form 13G Listed Funds Trust For: 18 August,https://uk.investing.com/news/filings/form-13g-listed-funds-trust-for-18-august-93CH-4227395,2025-08-19 01:32:06,
2025-08-19T01:55:19,Investing.com All News,Earnings call transcript: HUYA beats Q2 2025 expectations with 31.25% EPS surprise,https://uk.investing.com/news/transcripts/earnings-call-transcript-huya-beats-q2-2025-expectations-with-3125-eps-surprise-93CH-4227394,2025-08-19 01:28:06,
2025-08-19T01:55:19,Investing.com All News,"Sinclair offers to merge TV business with Tegna, WSJ reports",https://uk.investing.com/news/stock-market-news/sinclair-offers-to-merge-tv-business-with-tegna-wsj-reports-4227393,2025-08-19 01:24:09,
2025-08-19T01:55:19,Investing.com All News,Earnings call transcript: TEGNA Inc. Q2 2025 results show revenue decline,https://uk.investing.com/news/transcripts/earnings-call-transcript-tegna-inc-q2-2025-results-show-revenue-decline-93CH-4227392,2025-08-19 01:18:08,
2025-08-19T01:55:19,Investing.com All News,"US stock futures muted with Jackson Hole, retail earnings on tap",https://uk.investing.com/news/stock-market-news/us-stock-futures-muted-with-jackson-hole-retail-earnings-on-tap-4227391,2025-08-19 01:14:08,
2025-08-19T01:55:19,Investing.com All News,Australia consumer sentiment surges in Aug on RBA rate cut cheer - Westpac,https://uk.investing.com/news/economic-indicators/australia-consumer-sentiment-surges-in-aug-on-rba-rate-cut-cheer--westpac-4227390,2025-08-19 01:12:08,
2025-08-19T01:55:19,Investing.com All News,"Tenaya therapeutics SVP, finance sells $3.7k in stock",https://uk.investing.com/news/insider-trading-news/tenaya-therapeutics-svp-finance-sells-37k-in-stock-93CH-4227388,2025-08-19 01:10:08,
2025-08-19T01:55:19,Investing.com All News,"Earnings call transcript: Youdao Q2 2025 sees first profitable quarter, stock reacts",https://uk.investing.com/news/transcripts/earnings-call-transcript-youdao-q2-2025-sees-first-profitable-quarter-stock-reacts-93CH-4227387,2025-08-19 01:08:08,
2025-08-19T01:55:19,Investing.com All News,Lindblad Expeditions announces early results of notes tender offer,https://uk.investing.com/news/company-news/lindblad-expeditions-announces-early-results-of-notes-tender-offer-93CH-4227386,2025-08-19 01:06:08,
2025-08-19T01:55:20,Investing.com Bond News,Eurozone Long-Term Yields Under Pressure as Debt Supply Builds,https://uk.investing.com/analysis/eurozone-longterm-yields-under-pressure-as-debt-supply-builds-200618172,"Aug 18, 2025 08:04 GMT",
2025-08-19T01:55:20,Investing.com Bond News,The Index Isn’t Always Accurate: Factors Influencing Yields,https://uk.investing.com/analysis/the-index-isnt-always-accurate-factors-influencing-yields-200618100,"Aug 16, 2025 10:00 GMT",
2025-08-19T01:55:20,Investing.com Bond News,Yield Gap Tightening Between US Treasuries and JGBs May Disrupt Carry Trades,https://uk.investing.com/analysis/yield-gap-tightening-between-us-treasuries-and-jgbs-may-disrupt-carry-trades-200618151,"Aug 15, 2025 11:27 GMT",
2025-08-19T01:55:20,Investing.com Bond News,"Treasury Yields Remain Stable Despite Tariffs, Rising Debt Risks",https://uk.investing.com/analysis/treasury-yields-remain-stable-despite-tariffs-rising-debt-risks-200618105,"Aug 13, 2025 12:03 GMT",
2025-08-19T01:55:20,Investing.com Bond News,Rates Spark: Tuesday’s Fiscal and CPI Data Can Prove Troubling,https://uk.investing.com/analysis/rates-spark-tuesdays-fiscal-and-cpi-data-can-prove-troubling-200618070,"Aug 12, 2025 05:13 GMT",
2025-08-19T01:55:20,Investing.com Bond News,US 3-Year Auction Disappoints Slightly as Markets Question Rate Cut Path,https://uk.investing.com/analysis/us-3year-auction-disappoints-slightly-as-markets-question-rate-cut-path-200617956,"Aug 05, 2025 20:31 GMT",
2025-08-19T01:55:20,Investing.com Bond News,US Treasury Yields Tick Higher Ahead of Heavy Auction Week,https://uk.investing.com/analysis/us-treasury-yields-tick-higher-ahead-of-heavy-auction-week-200617942,"Aug 05, 2025 07:14 GMT",
2025-08-19T01:55:20,Investing.com Bond News,The Bond Market Is Pricing in a Softer Economy,https://uk.investing.com/analysis/the-bond-market-is-pricing-in-a-softer-economy-200617930,"Aug 04, 2025 22:17 GMT",
2025-08-19T01:55:20,Investing.com Bond News,Non-Farm Payrolls Ahead: Saving the Most Exciting for Last?,https://uk.investing.com/analysis/nonfarm-payrolls-ahead-saving-the-most-exciting-for-last-200617897,"Aug 01, 2025 06:50 GMT",
2025-08-19T01:55:20,Investing.com Bond News,Medium-Term Corporates Lead US Bond Market in 2025,https://uk.investing.com/analysis/mediumterm-corporates-lead-us-bond-market-in-2025-200617754,"Jul 23, 2025 11:53 GMT",
2025-08-19T01:55:20,Google News Reuters,"US would help assure Ukraine's security in a peace deal, Trump tells Zelenskiy - Reuters",https://news.google.com/rss/articles/CBMizwFBVV95cUxNNDFsblRzUl9adUtiVmRqUUVTTnBjbGsyZUhyd3VQYTg0d1UyakRmblZtbFRLR2NwWHNnS1B4Q083TEpoOEd6Y0pHU1hmR2JiNFZPc2k4cHBjSU11cHBXY19TbVo0Sm9VVTNyWlo5czBUY3pIa19ybDFyQ1M4LU1Hc1RJeWZVbHFCeWdoSjQ3azlvQ29ZZEU1NmIxRVpQWXh4eEhqVGE3ZWJxT1RxVWpOQm9HX08yd3lBZndGcnYtSTN5ZXFTN2RZWnV1UmNWbVU?oc=5,"Tue, 19 Aug 2025 01:08:40 GMT",
2025-08-19T01:55:20,Google News Reuters,SoftBank to invest $2 billion in Intel to become a top-10 shareholder - Reuters,https://news.google.com/rss/articles/CBMitwFBVV95cUxOYzFzN0tqaHh6TW9DM01GRzVPYTdSQzZoM3d4VUFCODAwNHJRS1k5RjBLdWV5ZDN4ZGE5UWZMcnE0U1E3TDdfNEpVb2p5ZFdlR1I3MUlQalgxcFE0VVQ2RWdXY21pWkp6dXIzenEwbHhHWlNRWkNFaGpMVHVpV293eXZOTm1qUWpnekNINV9mN3d5dXJObnNmSFY3UGYxTjdydGFrd0NtSHI4bVVEdXNlVVc4eUUyYUE?oc=5,"Tue, 19 Aug 2025 00:39:47 GMT",
2025-08-19T01:55:20,Google News Reuters,"US deploys warships near Venezuela to combat drug threats, sources say - Reuters",https://news.google.com/rss/articles/CBMiuAFBVV95cUxQS0VLSXhCYUVkQzFjU1l4X1JTaHJWR0pzUXlLU3NKeHc1MlJGMUsyeU5VSkQ0VGtFNjhVczM0VlZMRTc0Wm5TdjFFbGd1bjVGNlhoTHRiWUxVV1c1OTkyMVBZMV90NlY1RUpDdTdZN01vYndjamxpU0h5Q2JRd1o5NzJYd0p3aEp6TXdkQUU3dUM4Nzc4SjdkcHp6dUxMWjFFdjNJS0pLeUdubUNHd25SdXBnWFNFa3Fk?oc=5,"Tue, 19 Aug 2025 00:19:00 GMT",
2025-08-19T01:55:20,Google News Reuters,Air Canada CEO sees big gap with striking union as minister orders airline pay probe - Reuters,https://news.google.com/rss/articles/CBMizwFBVV95cUxQTDZac2o3UlIxbzRLNC1HWXlEUXBDUUVKUDRtTkRxRk5maDA0SWV1VlJZeUFFa0V1ZjJ5NEJ6RlVEbzZ1cWhFUWhyTmJaUC1Bb0JPVU96VkVBT2d1UTN1NXFvNDJWYVVuNVFpdGZqVlJGbGJDM1BZSndvTllUMjVBNjRZS0VXRlh0c1JmTVNPUmNlOHZBRlVObkcxdmxGNU9uZkFmaDJ2MjBnNE5CTmZ4LXNIMWR5UnV5ekpFLVdHWFlucl8wMHdJVl9RbGZxRE0?oc=5,"Tue, 19 Aug 2025 01:13:00 GMT",
2025-08-19T01:55:20,Google News Reuters,"Tesla launches Model Y L in China from around $47,200 - Reuters",https://news.google.com/rss/articles/CBMirgFBVV95cUxNWmZkOW1fNGZ3ejZSZlNaekNPRHNHYW11SVBicEZ2LUxfU1ZGRjgtZmVvc0FPdmhmeUZPSm1WNVV0SGVtV1o3X3RqR0J6THV4eEswRHk0am9CVXM5dFhWSmw5ekpJQk51eERpOHRhLWJXbVpNYU1UejZWX0NQRnA4cS1hdVJZSV9NUEVKUEJRcmt0enpQWHB3Mm5HWkRuUVNCOVg2T0E4MHhwbERXWGc?oc=5,"Tue, 19 Aug 2025 00:19:00 GMT",
2025-08-19T01:55:20,Google News Reuters,"Ukraine offers $100 billion weapons deal to obtain US security guarantees, FT reports - Reuters",https://news.google.com/rss/articles/CBMiyAFBVV95cUxOWHNiRkpPVDEybkJ1TENQYTFWanhDclNWZzc2X3FXZjd0WlZqMUEySjR0b3MwT1k4Ylp0c1hQVnZITlhtMlBnbXRoUEFCNFlHRk43MzZQbXEzaGRKOVh0MTFFcjY2bE93aFhDNGg0bWQyU29KXzBhSWhsakQyVmxocTZxRTY0TWY4TTlJWUxrR0hHbjN4amdFNEJXcjdpUFl4OE10d3hPNGV5ZlAzVWtxSFNuMmpZZUkwS0VmbXRULUFkcGVlVGg1LQ?oc=5,"Mon, 18 Aug 2025 21:44:21 GMT",
2025-08-19T01:55:20,Google News Reuters,"Trump approval holds at 40%, lowest level of his term, Reuters/Ipsos poll finds - Reuters",https://news.google.com/rss/articles/CBMitAFBVV95cUxNZDFNSjFEaDNkZVBGY2FiYXVaZlM4bUI1M2d1QTVYdjg2cFJGeVljSnlCWHgySTVGckZoY1FJV2NUbmhGQnhuQ0NDcG5MaWxxcWg2YVNEaDM5OGRZd05Ub1hTdnV3NW0xUGUtUU9rdk1PanBlNy11Nm43U0MwcENQNzlDYkt4RmVIODdudVBnZXhyTXYwY2hnd1hBOVVrZllLTG1vcEVOWDVzSkZOUWFUWjZ2YjI?oc=5,"Mon, 18 Aug 2025 21:08:33 GMT",
2025-08-19T01:55:20,Google News Reuters,"Trump interrupts talks with European leaders to call Putin, says EU diplomat - Reuters",https://news.google.com/rss/articles/CBMivgFBVV95cUxQT2pqbHhnOUh3Z2RhVmMzUm4yTXMzYTJVVnJTaXN5dTZjdFV1a210dDg0OVN6R3BldDc4Wk1WaUx4bi1vR2Y3R2dfdkJxc1JrRUZiMm5wSmo4cjJKSE1rY1h3WS01RlJDS0lfanQyOTRndEdNZ08wXzdrOU1udnlVd1ZwRGxlcFEzaGlTM3ZKMG9RcmdpRHM5aEd4TFZGQXdiVWJRdHczc3dhUzJrLWtIVW1VSnBnYmVya2VHb3R3?oc=5,"Mon, 18 Aug 2025 21:08:06 GMT",
2025-08-19T01:55:20,Google News Reuters,"Global shares flat amid Ukraine talks, ahead of Jackson Hole - Reuters",https://news.google.com/rss/articles/CBMihwFBVV95cUxNbTBVOFRGUHhyZ201NnNXQW9iMVB6Sms1M3dZNlpBUkZwMEo5X3RQRGgzT1JucWtCSEl0TVZwY255a2ZSNDZhanlZM0NMU0p6MnNYTFpocGI0OW02Tkk4ZU1ULUxFNHJSeFlsYmhfYXJ1eEhZaTJRMXZFTVp4OHN1LUNQT01jZnM?oc=5,"Mon, 18 Aug 2025 20:53:41 GMT",
2025-08-19T01:55:20,Google News Reuters,Blockchain lender Figure Technology reveals revenue surge in US IPO filing - Reuters,https://news.google.com/rss/articles/CBMitwFBVV95cUxQSEpMTVpmc0c0UXNtT0xhZmQtcl9qbHFOc25RblFBSUFCSWJNLUxfaDZMTTZJTllzWjVZSFVYUVFvTzdyVDg4b3VybjlINUtBWURJQmlfbVRYRjNrQV83NjliNnR1b2tPRGk3N3VXdDJZWmlSY1N6MWdhNV9kdGJXS2FQVkJYR3BDWnhjcTladjdUZUJmSHhhVjhXVGxocjF4Sk85aWlvX3d4TzhSTklYVU9lX3JqUnM?oc=5,"Mon, 18 Aug 2025 22:15:45 GMT",
2025-08-19T01:55:20,Google News Reuters,Trump vows to end use of mail-in ballots ahead of 2026 midterm election - Reuters,https://news.google.com/rss/articles/CBMiqwFBVV95cUxORk5MZl9EUmp6MkxRVm1kVHRMb3R4bWxUX2tsTE9ZeXloZHpQX3E3dXVadG5OSEE0aTNneWF4MUJxNV81RVBuMGxHbGlQczNtVkNDNVRkMHNiSjFnTTY2dy1oMTJWTkhtejNKZHJkU20xN3RFMDFnSnA2RWJkeWhqQzNiNmZLMGxKMTdFV0wzTG5lNDBYbDljYTJSMzVPeGRZN2FEQTNMWGdpczQ?oc=5,"Mon, 18 Aug 2025 20:06:25 GMT",
2025-08-19T01:55:20,Google News Reuters,"Wall Street ends on muted note ahead of Jackson Hole summit, retailers' earnings - Reuters",https://news.google.com/rss/articles/CBMiuAFBVV95cUxOV0IzTEpjaG5va2RXa1h0UDdqa3gzTHNQT2dNZUROY21DQUU4R0F6dWdTSXljVmZBVExjZ3RRV1FoODltYmV0N1pQeWtRaDJXQWxOcGtXdTJpWTdpa01YUHZKeXFkSi1PVmxKLUc0bTBxV0FjVlB1Qk9KSUlKREZ2bENYb0o0N05BMXZuTlMwX0liNk1Bc2xhZnBwYkJ2cW5QYjF3cGw3dGFsRnp5N2NsN1BvREk0NE1f?oc=5,"Mon, 18 Aug 2025 22:46:16 GMT",
2025-08-19T01:55:20,Google News Reuters,Exclusive: Arm hires Amazon AI exec to boost plans to build its own chips - Reuters,https://news.google.com/rss/articles/CBMiuAFBVV95cUxOdDJFWkhZdHJFdXFZNWFpREtWNGN6c1hlWTlBcmltZmozRWlyTTd2SW93TzVhbFhBejlMczNLN1N1WVFRaWxUaDFBZFBIQ3JxZy1LY2Z6V3BoYnY2UWl2bGNZWVd2UF9hZ2laX3FaMU5oa0dpNWtDSUlvQkVJYWExOFl5bXNrakZwd1htT0dqcEpCLWVkaXkyS3R4MGpwS3FaS1g1WnpxRktuODVfcTdfOVpzOE9DX1Qy?oc=5,"Mon, 18 Aug 2025 22:12:58 GMT",
2025-08-19T01:55:20,Google News Reuters,Oil prices settle higher as investors focus on Trump-Zelenskiy meeting - Reuters,https://news.google.com/rss/articles/CBMitwFBVV95cUxPREhlZ25kT3EtLWZIakpQN0RDQVNZNVlwMzdjSHdKb1htSklIRnM5UXNkTXZaaG5LS004ZVNlOHdQRDNnSkw1QUQ3M3UwVFJVVExiNWZ5OEFYU29CUjdWN3V0V2F3dWlld3lreTdjOV9KV3hhZzBhaDhfQTk5bG5za0czSlA3VmpIRnhMcXNkaGI5VV9EMV93TVVtajlIT1FPN0s0QndobG5kVmEzTkVTY0dGT0xJdkE?oc=5,"Mon, 18 Aug 2025 19:23:12 GMT",
2025-08-19T01:55:20,Google News Reuters,Zelenskiy dons more formal attire for high-stakes meeting with Trump - Reuters,https://news.google.com/rss/articles/CBMiqgFBVV95cUxNNUlQWDRJMmR3UXRKaFllWjlVM0dINkhCMGFFamJIQS1qYjNESkJKVjNDa201ckVoS1JSRGpHazBOVnFRT0lfS3Y4UHE1eU1ndnJXZ0tKYVpCQ0ZHNkRTMXBuREZFdGViRGtIVEtIZTVSWi1ZM0tiM3NqSGdWblpSRGt6MEZNM2VGSWZKOE5GS3ktdHFxNWxMLTJLWnh5U3NVNnBJTzFNMjJoQQ?oc=5,"Mon, 18 Aug 2025 19:38:43 GMT",
2025-08-19T01:55:20,Google News Reuters,Dollar gains as Trump hosts Ukraine talks - Reuters,https://news.google.com/rss/articles/CBMilwFBVV95cUxORGZnRVl1OHRGeFBsMmFaQlM1T0lteF9zNk4tMXc1TjFhcmRyMG01ajZDVFo0ZFp2SFhOTFRJN2RWWnpBMFhDSjlMazdzZnRDVmUwNW5JdmVMZ3dwM3pmU2Q0RV9oQmczLTJLYWRhLVlwR3RzMnNDaXFaQjh6MmhiQjItZXdQT0liQS1GanZCVnoxT24zNkpB?oc=5,"Mon, 18 Aug 2025 18:58:03 GMT",
2025-08-19T01:55:20,Google News Reuters,"Germany's Merz says Putin, Zelenskiy to meet within next two weeks - Reuters",https://news.google.com/rss/articles/CBMirwFBVV95cUxOenZoYXh1OS1fLVVDMkZFNjRhWUh4LXE3R1pGZy1UNUt6RDYtYkIxZ1h1TGNNaGNUMVpXeE9WZm9ONFRMSVhxUUtRa2haOUdRQkJWWG9SZnc2cFRNUlJvaEZnZlpETXBRZC1sMUVLWU5UbzJBXzhiaktHU3QxdjJDTEVveExWOFQ0cTMyc2haaHVnUTN5dG93YmFZckxjZzNUM18zRUppY3V6bExZaW9B?oc=5,"Mon, 18 Aug 2025 23:16:54 GMT",
2025-08-19T01:55:20,Google News Reuters,Trump tells Zelenskiy US would help with Ukraine's security in a peace deal - Reuters,https://news.google.com/rss/articles/CBMizAFBVV95cUxQZG9xWWd1Z21NajFKV3NLcjlFX2hLZGlySF8xbVhWS1VwNHlJVW1KUFEyVDNudWRGOEFsYVhsOGJTWi1lQzhsWGllZTF5RXZNVDdZc1U0Z0tUTHdOdjFDYXQtTS1Qcnh5V2h6QkN6SVVMQl94ZXM1eE5UWE5NTnpBNC1jZUVDdnhGR1h5czZuSF9MU181YlJ0aDhDSzRWSUQ3MXF2am5YU2drTm1PNl9MeGp0Y3c1Q1U0QklHTmotcWRJc2ZsYUdsX2xWcWE?oc=5,"Mon, 18 Aug 2025 23:24:26 GMT",
2025-08-19T01:55:20,Google News Reuters,Union leader says he would take jail over forced end to Air Canada strike - Reuters,https://news.google.com/rss/articles/CBMiyAFBVV95cUxONnhkamF6Qlh4WHRfUEdUUGI5QXlRQjByREdGNmlubm85azZ0ZzJ6WmpGa3F5QU1sdmhmdjRtekpwc0NRVGRDN29nLVp4T3k4QVZsTGZKbnpVdGxDQnMtTGhUT01WWFFwZldpZ2lJRTJ3WkdfUWpOQWFKYkxTSmktYU1SQVA4YVhVWU1XeUc0Q3JfOE81MW1xTTRQZU5EUXN6Mmw5SGlRTDA2ME9MUW00YV9la2Y5SVlCRW1UUUVLd0dXcmJKc2FXTQ?oc=5,"Mon, 18 Aug 2025 20:00:30 GMT",
2025-08-19T01:55:20,Google News Reuters,"Starbucks to give all North America salaried employees 2% raise this year, company says - Reuters",https://news.google.com/rss/articles/CBMi0gFBVV95cUxPRkdpNWhmdjRUQ1BseVFFRlZKUkVHQlE4WWdUakN2X2Z2YzY2dmxWOVNkdVJrOUI4d2t4NmtGV296NkJEbnZIQ21idWlod1NNZU9oUmdVanRsaDhpMjNENzF2TTlRMUVndHBZSXFGLWpiXzNyQ3E3Ri1DNldSN2NUazJ0dXpDU0RfVDVqTFphSWRNUWg4NWlacm5COUlTUkFzc2o0TWJFQ2ttQnRGQ0kzODhoUWNmNjFVdEtxcDJIT3BucTEzYXptUjVadnozbjVSSXc?oc=5,"Mon, 18 Aug 2025 19:27:02 GMT",
2025-08-19T01:55:20,Google News Reuters,Zelenskiy arrives at White House for high-stakes Trump meeting - Reuters,https://news.google.com/rss/articles/CBMiugFBVV95cUxOa09OeVo3cm1zNFFHR2g0Z2lBdHBicmdSQVluQ09IVi1sS0RHVkV2T280bWc2Vi1sZ3dPQmd5REhIUUxfZ2l3djdubm1qbWZoR295N202MEF5cmdjcDZyOXRIdkIwYnZ3Z1N2ZWhhLWppSnh5UlZGdlE2UVZaWDZoMnNPV2ZxcVRUODhyb1EySXlrYlBDeDJFSXo5dE1FalpIQkhYWVFzaWNlWVJpMmhqM1BOVl9JRzFLY2c?oc=5,"Mon, 18 Aug 2025 17:50:11 GMT",
2025-08-19T01:55:20,Google News Reuters,Hurricane Erin could bring dangerous seas as it grows near the Bahamas - Reuters,https://news.google.com/rss/articles/CBMivAFBVV95cUxOVVJsQThhRmgyM0hqcXZ5WDVpbC1WRlprTVJiYXhoVWxEOTcyVk5kcmwyazFjdmxJaEpvWWRpZUpZM1FhR08tWEljT01SbDZHYVVucHA0d1FjSlQyb2RYSWI2dDk3MlE5cG1abGFlbFpwTzFWNjlaYkZrd1lSZDhvdzVQUkVMT0lwSDA0TEdEUVpyT2ZhLW5ZeTdBVXltWnlHbFA0M0pXS1RndmY1YjhxNEtqUHJIZlFSYmVmbw?oc=5,"Tue, 19 Aug 2025 00:40:29 GMT",
2025-08-19T01:55:20,Google News Reuters,Gold prices steady as investors assess Trump–Zelenskiy meeting - Reuters,https://news.google.com/rss/articles/CBMiqgFBVV95cUxOcGFuU3E3QTcwTDR2RjRqS1hoeHBfbzBvdmFibzJ0YzdqNEp1ckhJVXpDa2NrcnU5dlJyUEFWNGdEdnlMcHhlZEQwOVAtbUE3d3RwSjVLblZoX01paURkc2VISUx4dmRaWmxKU0RNRW12LVJMLVAtV3pSVDA5ckNtUk1CMWF2amIwVXNwNzdfS1BhTVBLX191bFBfajg5ZEItOVR1TFlSV09Hdw?oc=5,"Mon, 18 Aug 2025 18:11:44 GMT",
