timestamp,source,title,link,published,content
2025-08-16T01:43:06,MarketWatch Top,Why the Trump-Putin summit is no ‘magic lever’ to unleash global oil supplies,https://www.marketwatch.com/story/why-the-trump-putin-summit-is-no-magic-lever-to-unleash-global-oil-supplies-cf589403?mod=mw_rss_topstories,"Sat, 16 Aug 2025 00:30:00 GMT",
2025-08-16T01:43:06,MarketWatch Top,‘I’m tired of corporate America’: My wife and I have $1.65 million. I’m 61. Can I retire already?,https://www.marketwatch.com/story/im-tired-of-corporate-america-my-wife-and-i-have-1-65-million-im-61-can-i-retire-already-b125f48a?mod=mw_rss_topstories,"Fri, 15 Aug 2025 23:36:00 GMT",
2025-08-16T01:43:06,MarketWatch Top,"Opendoor bulls are getting what they want, and the stock is surging again",https://www.marketwatch.com/story/opendoor-bulls-are-getting-what-they-want-and-the-stock-is-surging-again-b99dcea2?mod=mw_rss_topstories,"Fri, 15 Aug 2025 21:49:00 GMT",
2025-08-16T01:43:06,MarketWatch Top,My father was worth millions. I suspect my mother is stealing my inheritance. What can I do?,https://www.marketwatch.com/story/she-kicked-us-to-the-curb-my-father-was-worth-millions-i-suspect-my-mother-is-stealing-my-inheritance-what-can-i-do-69625204?mod=mw_rss_topstories,"Fri, 15 Aug 2025 21:40:00 GMT",
2025-08-16T01:43:06,MarketWatch Top,My wife and I are in our 50s and have $11 million. We’re not leaving it to our kids. Is that wrong?,https://www.marketwatch.com/story/am-i-delusional-my-wife-and-i-are-in-our-50s-and-have-11-million-were-not-leaving-it-to-our-kids-is-that-wrong-198022f2?mod=mw_rss_topstories,"Fri, 15 Aug 2025 21:34:00 GMT",
2025-08-16T01:43:06,MarketWatch Top,Intel has 18 months to determine its future — or Qualcomm and Arm will,https://www.marketwatch.com/story/intel-has-18-months-to-determine-its-future-or-qualcomm-and-arm-will-6fc0098b?mod=mw_rss_topstories,"Fri, 15 Aug 2025 21:24:00 GMT",
2025-08-16T01:43:06,MarketWatch Top,‘I’ve been kept in poverty’: Do I take a $70K job at 74 and lose my Section 8 housing allowance?,https://www.marketwatch.com/story/should-i-apply-for-a-70k-a-year-job-at-74-and-risk-losing-my-section-8-housing-allowance-9932217d?mod=mw_rss_topstories,"Fri, 15 Aug 2025 21:22:00 GMT",
2025-08-16T01:43:06,MarketWatch Top,This is how important Taylor Swift’s ‘The Life of a Showgirl’ is to an entire industry,https://www.marketwatch.com/story/this-is-how-important-taylor-swifts-the-life-of-a-showgirl-is-to-an-entire-industry-f5689ef3?mod=mw_rss_topstories,"Fri, 15 Aug 2025 21:22:00 GMT",
2025-08-16T01:43:06,MarketWatch Top,"In this economy, here’s what it takes to get people to spend on summer fun",https://www.marketwatch.com/story/americans-who-make-over-100-000-are-still-propping-up-the-economy-but-how-long-can-they-keep-doing-it-b9535f3e?mod=mw_rss_topstories,"Fri, 15 Aug 2025 21:09:00 GMT",
2025-08-16T01:43:06,MarketWatch Top,The rich already know how private equity mints money — and it’s not from a 401(k),https://www.marketwatch.com/story/the-rich-already-know-how-private-equity-mints-money-and-its-not-from-a-401-k-c9699cff?mod=mw_rss_topstories,"Fri, 15 Aug 2025 21:06:00 GMT",
2025-08-16T01:43:06,CNBC Top News,Why Bezos-backed Slate Automotive says it has cracked the code to affordable EVs,https://www.cnbc.com/2025/08/15/why-slate-automotive-says-it-has-cracked-the-code-to-affordable-evs.html,"Fri, 15 Aug 2025 22:23:27 GMT",
2025-08-16T01:43:06,CNBC Top News,Tech IPOs are roaring after 'years of Prohibition' — it may be too good,https://www.cnbc.com/2025/08/15/tech-ipos-bullish-figma-circle-roaring-after-years-of-prohibition-.html,"Fri, 15 Aug 2025 22:44:18 GMT",
2025-08-16T01:43:06,CNBC Top News,OpenAI in talks to sell around $6 billion in stock at roughly $500 billion valuation,https://www.cnbc.com/2025/08/15/openai-6-billion-stock-500-billion-valuation.html,"Fri, 15 Aug 2025 21:57:35 GMT",
2025-08-16T01:43:06,CNBC Top News,UnitedHealth shares log best day since 2020 after Buffett's new stake is revealed,https://www.cnbc.com/2025/08/15/unitedhealth-shares-soar-after-warren-buffetts-new-stake-provides-a-vote-of-confidence.html,"Fri, 15 Aug 2025 21:50:52 GMT",
2025-08-16T01:43:06,CNBC Top News,"FBI Director Patel and foundation win defamation lawsuit against blogger, awarded $250,000",https://www.cnbc.com/2025/08/15/fbi-kash-patel-lawsuit-stewartson.html,"Fri, 15 Aug 2025 20:49:04 GMT",
2025-08-16T01:43:06,CNBC Top News,Fed's Goolsbee sees 'note of unease' as central bank looks to next interest rate move,https://www.cnbc.com/2025/08/15/goolsbee-sees-note-of-unease-as-fed-looks-to-next-interest-rate-move.html,"Fri, 15 Aug 2025 16:00:19 GMT",
2025-08-16T01:43:06,CNBC Top News,China's booming bubble tea industry faces a test: Is it here to stay or just a fad?,https://www.cnbc.com/2025/08/15/chinas-bubble-tea-industry-is-it-here-to-stay-or-just-a-fad.html,"Fri, 15 Aug 2025 23:00:01 GMT",
2025-08-16T01:43:06,CNBC Top News,"Student loan forgiveness program has a 72,730-person backlog. Here's what borrowers need to know",https://www.cnbc.com/2025/08/15/public-service-loan-forgiveness-buyback-has-a-72730-person-backlog.html,"Fri, 15 Aug 2025 20:59:33 GMT",
2025-08-16T01:43:06,CNBC Top News,46-year-old woman is weeks away from student loan forgiveness but stuck in Trump-era backlog,https://www.cnbc.com/2025/08/15/student-loan-forgiveness-trump-pslf-backlog.html,"Fri, 15 Aug 2025 20:59:05 GMT",
2025-08-16T01:43:06,CNBC Top News,Summer travel isn't as easy as it used to be for airlines,https://www.cnbc.com/2025/08/15/airlines-summer-travel-changes-american-delta-united-southwest-jetblue.html,"Fri, 15 Aug 2025 18:00:59 GMT",
2025-08-16T01:43:06,CNBC Top News,Trump meets Putin in Alaska for summit on Ukraine war,https://www.cnbc.com/2025/08/15/nothing-is-off-the-table-as-trump-and-putin-set-to-meet.html,"Fri, 15 Aug 2025 20:23:02 GMT",
2025-08-16T01:43:06,CNBC Top News,Sen. Hawley to probe Meta AI bot policies for children following damning report,https://www.cnbc.com/2025/08/15/meta-ai-bot-child-investigation.html,"Fri, 15 Aug 2025 18:23:51 GMT",
2025-08-16T01:43:06,CNBC Top News,Opendoor CEO resigns following investor pressure campaign,https://www.cnbc.com/2025/08/15/opendoor-stock-ceo-resignation.html,"Fri, 15 Aug 2025 20:45:24 GMT",
2025-08-16T01:43:06,CNBC Top News,States where residents could see the biggest tax benefit from Trump's 'big beautiful bill',https://www.cnbc.com/2025/08/15/trump-big-beautiful-bill-who-benefits.html,"Fri, 15 Aug 2025 18:17:16 GMT",
2025-08-16T01:43:06,CNBC Top News,"Government's Intel intervention is 'essential' for national security, tech analyst says",https://www.cnbc.com/2025/08/15/intel-trump-stake.html,"Fri, 15 Aug 2025 20:07:34 GMT",
2025-08-16T01:43:06,CNBC Top News,"Fewer young adults reach key life, money milestones — Census Bureau notes ‘significant drop’",https://www.cnbc.com/2025/08/15/census-young-adults-milestones.html,"Fri, 15 Aug 2025 11:10:01 GMT",
2025-08-16T01:43:06,CNBC Top News,Why a landmark ruling from the world’s top court puts financial markets on notice,https://www.cnbc.com/2025/08/15/climate-why-a-landmark-icj-ruling-puts-financial-markets-on-notice.html,"Fri, 15 Aug 2025 05:11:29 GMT",
2025-08-16T01:43:06,CNBC Top News,Who will Trump pick for Fed chair? Hear from all the candidates in their own words,https://www.cnbc.com/2025/08/15/what-trumps-fed-chair-candidates-have-had-to-say-in-cnbc-interviews.html,"Fri, 15 Aug 2025 14:55:51 GMT",
2025-08-16T01:43:06,CNBC Top News,Judge sets hearing Friday on lawsuit challenging Trump takeover of DC police force,https://www.cnbc.com/2025/08/15/dc-sues-trump-police.html,"Fri, 15 Aug 2025 18:46:52 GMT",
2025-08-16T01:43:06,CNBC Top News,Applied Materials sinks 14% on weak guidance due to China demand,https://www.cnbc.com/2025/08/15/applied-materials-stock-china-demand-earnings.html,"Fri, 15 Aug 2025 20:01:10 GMT",
2025-08-16T01:43:06,CNBC Top News,Is the activist heat on Salesforce ramping back up? The market sure thinks so,https://www.cnbc.com/2025/08/15/is-the-activist-heat-on-salesforce-ramping-back-up-the-market-sure-thinks-so.html,"Fri, 15 Aug 2025 19:10:30 GMT",
2025-08-16T01:43:06,CNBC Top News,U.S. shoppers fuel jewelry splurge despite tariff headwinds,https://www.cnbc.com/2025/08/15/us-shoppers-fuel-jewelry-splurge-despite-tariff-headwinds.html,"Fri, 15 Aug 2025 16:28:21 GMT",
2025-08-16T01:43:06,CNBC Top News,"Insurance firm Gallagher taps pro athletes for summer internships, preparing them for life off the field",https://www.cnbc.com/2025/08/15/gallagher-taps-pro-athletes-for-summer-insurance-internships.html,"Fri, 15 Aug 2025 14:00:02 GMT",
2025-08-16T01:43:06,CNBC Top News,"Mortgage rates have made a 'substantial improvement,' economist says — here’s what to know",https://www.cnbc.com/2025/08/15/how-to-know-its-time-to-refinance-a-mortgage.html,"Fri, 15 Aug 2025 13:37:32 GMT",
2025-08-16T01:43:06,CNBC Top News,Palantir's astronomical growth in 3 charts,https://www.cnbc.com/2025/08/14/palantir-ai-charts-revenue.html,"Thu, 14 Aug 2025 21:12:12 GMT",
2025-08-16T01:43:06,CNBC Top News,Potential Fed chair pick David Zervos of Jefferies backs aggressive interest rate cuts,https://www.cnbc.com/2025/08/14/potential-fed-chair-pick-david-zervos-of-jefferies-backs-aggressive-interest-rate-cuts.html,"Thu, 14 Aug 2025 19:40:58 GMT",
2025-08-16T01:43:06,CNBC Top News,Friday's stock market rotation gives a further boost to an out-of-favor sector,https://www.cnbc.com/2025/08/15/fridays-stock-market-rotation-gives-a-further-boost-to-an-out-of-favor-sector.html,"Fri, 15 Aug 2025 15:37:53 GMT",
2025-08-16T01:43:06,CNBC Top News,"AI is moving into the apartment market, taking over work orders, lease renewals, showings and more",https://www.cnbc.com/2025/08/15/ai-apartment-market.html,"Fri, 15 Aug 2025 12:00:01 GMT",
2025-08-16T01:43:06,CNBC Top News,Family offices flock to private markets with allocations surging over 500% in nearly a decade,https://www.cnbc.com/2025/08/15/family-offices-private-markets.html,"Fri, 15 Aug 2025 11:00:01 GMT",
2025-08-16T01:43:06,CNBC Top News,How home equity has changed in every U.S. state since 2020—West Virginia ranks No. 1 for growth,https://www.cnbc.com/2025/08/15/home-equity-changes-for-all-50-states-in-the-last-5-years.html,"Fri, 15 Aug 2025 13:20:04 GMT",
2025-08-16T01:43:06,Investing.com All News,Theodore Leonsis sells Tempus AI (TEM) shares worth $3.07 million,https://uk.investing.com/news/insider-trading-news/theodore-leonsis-sells-tempus-ai-tem-shares-worth-307-million-93CH-4225258,2025-08-16 01:28:06,
2025-08-16T01:43:06,Investing.com All News,"Casdin funds buys Standard Biotools (LAB) shares worth $443,032",https://uk.investing.com/news/insider-trading-news/casdin-funds-buys-standard-biotools-lab-shares-worth-443032-93CH-4225257,2025-08-16 01:24:07,
2025-08-16T01:43:06,Investing.com All News,Hagerty holding sells shares worth $11 million,https://uk.investing.com/news/insider-trading-news/hagerty-holding-sells-shares-worth-11-million-93CH-4225256,2025-08-16 01:14:08,
2025-08-16T01:43:06,Investing.com All News,Snap CEO Evan Spiegel sells $10.2 million in shares,https://uk.investing.com/news/insider-trading-news/snap-ceo-evan-spiegel-sells-102-million-in-shares-93CH-4225255,2025-08-16 01:10:08,
2025-08-16T01:43:06,Investing.com All News,IonQ director Singh sells $2.17 million in shares,https://uk.investing.com/news/insider-trading-news/ionq-director-singh-sells-217-million-in-shares-93CH-4225254,2025-08-16 01:08:08,
2025-08-16T01:43:06,Investing.com All News,Adma Biologics CEO Adam Grossman sells $354k in shares,https://uk.investing.com/news/insider-trading-news/adma-biologics-ceo-adam-grossman-sells-354k-in-shares-93CH-4225253,2025-08-16 01:06:08,
2025-08-16T01:43:06,Investing.com All News,Stovesand buys Community West Bancshares (CWBC) stock worth $8546,https://uk.investing.com/news/insider-trading-news/stovesand-buys-community-west-bancshares-cwbc-stock-worth-8546-93CH-4225252,2025-08-16 00:56:08,
2025-08-16T01:43:06,Investing.com All News,SmartRent CEO Martell buys $161k in shares,https://uk.investing.com/news/insider-trading-news/smartrent-ceo-martell-buys-161k-in-shares-93CH-4225250,2025-08-16 00:50:09,
2025-08-16T01:43:06,Investing.com All News,Prime Drink Group receives extension for annual financial filings,https://uk.investing.com/news/company-news/prime-drink-group-receives-extension-for-annual-financial-filings-93CH-4225249,2025-08-16 00:50:08,
2025-08-16T01:43:06,Investing.com All News,Patrick Industries’ president Rodino sells $2.47 million in stock,https://uk.investing.com/news/insider-trading-news/patrick-industries-president-rodino-sells-247-million-in-stock-93CH-4225248,2025-08-16 00:44:08,
2025-08-16T01:43:07,Investing.com Bond News,Yield Gap Tightening Between US Treasuries and JGBs May Disrupt Carry Trades,https://uk.investing.com/analysis/yield-gap-tightening-between-us-treasuries-and-jgbs-may-disrupt-carry-trades-200618151,"Aug 15, 2025 11:27 GMT",
2025-08-16T01:43:07,Investing.com Bond News,"Treasury Yields Remain Stable Despite Tariffs, Rising Debt Risks",https://uk.investing.com/analysis/treasury-yields-remain-stable-despite-tariffs-rising-debt-risks-200618105,"Aug 13, 2025 12:03 GMT",
2025-08-16T01:43:07,Investing.com Bond News,Rates Spark: Tuesday’s Fiscal and CPI Data Can Prove Troubling,https://uk.investing.com/analysis/rates-spark-tuesdays-fiscal-and-cpi-data-can-prove-troubling-200618070,"Aug 12, 2025 05:13 GMT",
2025-08-16T01:43:07,Investing.com Bond News,US 3-Year Auction Disappoints Slightly as Markets Question Rate Cut Path,https://uk.investing.com/analysis/us-3year-auction-disappoints-slightly-as-markets-question-rate-cut-path-200617956,"Aug 05, 2025 20:31 GMT",
2025-08-16T01:43:07,Investing.com Bond News,US Treasury Yields Tick Higher Ahead of Heavy Auction Week,https://uk.investing.com/analysis/us-treasury-yields-tick-higher-ahead-of-heavy-auction-week-200617942,"Aug 05, 2025 07:14 GMT",
2025-08-16T01:43:07,Investing.com Bond News,The Bond Market Is Pricing in a Softer Economy,https://uk.investing.com/analysis/the-bond-market-is-pricing-in-a-softer-economy-200617930,"Aug 04, 2025 22:17 GMT",
2025-08-16T01:43:07,Investing.com Bond News,Non-Farm Payrolls Ahead: Saving the Most Exciting for Last?,https://uk.investing.com/analysis/nonfarm-payrolls-ahead-saving-the-most-exciting-for-last-200617897,"Aug 01, 2025 06:50 GMT",
2025-08-16T01:43:07,Investing.com Bond News,Medium-Term Corporates Lead US Bond Market in 2025,https://uk.investing.com/analysis/mediumterm-corporates-lead-us-bond-market-in-2025-200617754,"Jul 23, 2025 11:53 GMT",
2025-08-16T01:43:07,Investing.com Bond News,Japan’s Election Results Could Send Shockwaves Through US Bond Market,https://uk.investing.com/analysis/japans-election-results-could-send-shockwaves-through-us-bond-market-this-week-200617701,"Jul 21, 2025 06:55 GMT",
2025-08-16T01:43:07,Investing.com Bond News,How Fed Could Inject Liquidity if Bond Yields Surge: What Investors Need to Know,https://uk.investing.com/analysis/how-fed-could-inject-liquidity-if-bond-yields-surge-what-investors-need-to-know-200617670,"Jul 17, 2025 13:37 GMT",
2025-08-16T01:43:07,Google News Reuters,Trump-Putin summit yields no deal on ending war in Ukraine - Reuters,https://news.google.com/rss/articles/CBMiowFBVV95cUxPa2F1Qkl1VjFGSzliUHlZanNhY1FvMm9zSmcwek1iZjNGblJzTGtTUG5DSVM3d2txRmtuS3NWMDB0ME1HWTRWd2pXS3pOSF84SWVvTy1mZ2NfRV9ETTRhXzhOb0xHRFdYV240ZWdWb3lQUjNtNTA0NVM3UHZnbUMwZHZoZlZmano5QjJPOWJJTVJIeU81Q0lJV2tNZlpHRHdfUW04?oc=5,"Sat, 16 Aug 2025 01:04:00 GMT",
2025-08-16T01:43:07,Google News Reuters,D.C. police chief remains in command under deal with Trump administration - Reuters,https://news.google.com/rss/articles/CBMivgFBVV95cUxOQmJMcXR2cHZHc0I3bjlwSTNVVExXNTVpaW9MQ0o0ZUc4NkFUdVVULVRYRnpabDZsYjBuWmVmd1dxakZOcld0YTRsUkhEa3ZnNEtFa3ZqUmFwUkYyblYtSDBkdjdzM2pzX1FpanUxZThoN0pQX0JnbmltOXhtcnViOEtoLVdwTi1ucUlBM0pqRWhzSlVFVE03SUxwNGU4UVlWa0MwdE9iTnY4cWRGOGhYWlZXa1lIb01qc3Jidjl3?oc=5,"Fri, 15 Aug 2025 23:38:19 GMT",
2025-08-16T01:43:07,Google News Reuters,Investors react to US-Russia summit reaching no agreement - Reuters,https://news.google.com/rss/articles/CBMiqgFBVV95cUxQUjVmUmx2VUdiZEFqNDBuUEQwNkxXamZXdFJrcVdlVks4b1lISkRPTm44VmhtRU5Ib014UnNJU1FwQjV5R0I4U2lSeURoN3RBZmdTeFRCSlBBSnJtRE5pT0hzbFdGZTdNbmdGcjhEaFVUNFVVWGFBVG93T3dEREY3dDRXcjU0UDVWNktvYVppazFPSm0xdWJtMGhpZEZHXzA1WmJQYWtabVNqUQ?oc=5,"Sat, 16 Aug 2025 00:55:00 GMT",
2025-08-16T01:43:07,Google News Reuters,"Meta plans fourth restructuring of AI efforts in six months, The Information reports - Reuters",https://news.google.com/rss/articles/CBMiugFBVV95cUxQeWRtUVUzblRDcDZDcXNTQnYwWWVvYjBORkkzOUlXNjhfVzc5d1VzRTd0TWdxeEl2NDBIYV9XZG1uRXFZLUNZTzk4bXN3Tkx0b3R6cFFaNlFOVkJBeDkyZ0RPbUwwVm43dlFPc05WUHpRT3lPWXBzNW1WVmU5amgwM3FGMGhEajlldWhMUDNfM2VUS0pRR1drcUpGUW56S05TVlVudm1BQmFzOEpwV3l3Mldsajd3ek5WSVE?oc=5,"Fri, 15 Aug 2025 22:34:04 GMT",
2025-08-16T01:43:07,Google News Reuters,Winklevoss twins' Gemini reveals lower revenue and wider loss in US IPO filing - Reuters,https://news.google.com/rss/articles/CBMiwAFBVV95cUxOWDZlVEtBU0NfTjIwZDNUdUEtbnp1OGhNUTRhM2xsb1JVWldDVHNna3Myd0hIdnpPTzQtNXhBdDFIRndYV3RsVDRTVmpmUEtIZ3F0WHdsM01MMUJhVFFTNDdHY0tsb3RKYUlIc2hYcXhXUjRaSUlBamwwUUhKanRaV05BV18wdlhWU0t3Q2FLcm5VMEV0UndaNTRVb0hjMUxOV2RTUm5MY1hHdkNMeVZzMXZhcHd2TTBjV3JCcF9SSE0?oc=5,"Fri, 15 Aug 2025 22:22:15 GMT",
2025-08-16T01:43:07,Google News Reuters,"Putin, Trump discuss fate of Ukraine as summit gets under way - Reuters",https://news.google.com/rss/articles/CBMipgFBVV95cUxQMzRTdmJ0V3dja3JkTDJPdFQyblpLd2lhQURDVVMwWlBVa0RMRDhkVFFya05PQjg0NFJWWEtQWmNmdWQ0bzFLSlhHenBibXRtbTVSV1hlZ3hqc0dHNUtaNTdBNFk1bWV6a1VILTVVU2YwUzZJRUg3WWpYM2VmME5oSnJkam5RemFEcEZ5dVpoU0M2bHlHSTBpRTFSN1lYcFI3ai1xS0tn?oc=5,"Fri, 15 Aug 2025 22:09:16 GMT",
2025-08-16T01:43:07,Google News Reuters,"World equities flat, crude oil prices fall as Trump, Putin hold high-stakes talks - Reuters",https://news.google.com/rss/articles/CBMie0FVX3lxTFBsdFFFbk9PVGoxdWo4RzJTQkFlZDBhRUFTTXhuOU00cW5pc0NlSFZvRFpzQ1RDYXppOWpNaG1IZUFYVHJkVkh1LXF3VHBULVFfVHNQNWRzTXBUOXFZUGZLVmpMcVhoYVhSMTUtb2NOOHNiWFZSMHhEdmdHdw?oc=5,"Fri, 15 Aug 2025 20:58:04 GMT",
2025-08-16T01:43:07,Google News Reuters,"Putin-Trump talks in Alaska have ended, Kremlin says - Reuters",https://news.google.com/rss/articles/CBMingFBVV95cUxOYURDVkhZV0RRTFEwdTlQMC1sYWVfc1Y5ZXBlOFl5U1RfM2dRS2RBNEVXQWxPMEdORXVibGVkUEY3WmJBb284SWZuY2VxOFc1d2xQaFkzZUVwME5UQ2VBcldWUDlKNC1SSEhxS01MNE1SMDhOTkEzYmg5aWE0WEtuOGNTQ0UyQjBmbFp4amlBWFpyek8xN1F2T25HaXUzQQ?oc=5,"Fri, 15 Aug 2025 22:21:22 GMT",
2025-08-16T01:43:07,Google News Reuters,Novo Nordisk's Wegovy gets accelerated US approval for liver disease MASH - Reuters,https://news.google.com/rss/articles/CBMi1wFBVV95cUxPZEVCMFY3OEs3Nk9kZ0Fkd2M3NG9uVHhrLU9wN3JHUnBsRmRDSGhYS0d6UldTZVgtdms1ZzVMMGduNTlWLVcxSnhhRVhTOUJBRzROVjlKNWZ5cmRIV0dhV0hfa2hpTHp2Y25CMFRrWlhGaG9tY0E1RDQ5dVctV3JBOU1PNkt4NV9aajlYR1RmcksyMlZqNHB3eG1Cc1kzVk9KTG1KTnRNWHFHWFdXREx0QUpZTUtrVDJudXRSdTdKMnhHaEVDVmlPWjZYUVRyY2FSRUFmOE9oUQ?oc=5,"Sat, 16 Aug 2025 00:23:00 GMT",
2025-08-16T01:43:07,Google News Reuters,Trump-Putin direct talks over Ukraine conclude as summit stretches on - Reuters,https://news.google.com/rss/articles/CBMisgFBVV95cUxOSWQxdzB1V2xSSFc0SUlTTEgwMVNTT1c4V1pzS00tTDlDb2hfYjNhTG9UdTVrLW9tODkydzNkX0ZXaE14Wk5RQ0hWak5va1RvaVJMQW9RQm1ncUpNUFpRelRZa2o0NEZBejFoR2tvWTVEQ2p5X1pqVEVnQWRsUUVXWlpRZDh0dnBzVXJCVklkbVFBYWpsblZSZ1A1cUJrVTZVbDJTOGQyTzBweHRzTy1UR1JB?oc=5,"Fri, 15 Aug 2025 22:38:32 GMT",
2025-08-16T01:43:07,Google News Reuters,Russia decree opens door for Exxon return to Sakhalin-1 project - Reuters,https://news.google.com/rss/articles/CBMirAFBVV95cUxOUXhqeGtfeWN4X2ZXci1QdkZPOTg5RkkweVJJUzlIUFc2SkRGSFFrVDhZX3RHZ0NmdVI0aGgzb192XzBTajBvVjhtUmtSdHAtWTRKM2lGTVcyRGxLSms0NGh1RkYyQS02bF9RRmUxMWZpTHRIRTljdEE4NU52R3RaZ3o5Q3ktcWh0QjFRbFBGSkhDdFV5cUM3bjFqdFg1ZXdxZ0ZfUml4bG0wc2lk?oc=5,"Fri, 15 Aug 2025 20:07:27 GMT",
2025-08-16T01:43:07,Google News Reuters,"Putin, Trump share greeting as critical summit on war in Ukraine war starts - Reuters",https://news.google.com/rss/articles/CBMitAFBVV95cUxQb3h4d1NxX2dmZEtvTTRaQUh6UDhhVWpCcmRORDlHVkZ4MlVhT1dqUjEyUnhpdElpWG9LYS00UVRtakgzOWJkalEzUzhxSXpjMllyWnhhbWpsWVRBUmtrTG50eGg5TkFQdTRFSGIwRkN5VklmQUM2YnVlOUZJUEhoMWlRTVMzaHI2Q3l0aUljeTRBUldvaFVOOHpXdDBtY0NJdFZBNnB4eDIwLWR4eS00VEFVaWM?oc=5,"Fri, 15 Aug 2025 19:20:18 GMT",
2025-08-16T01:43:07,Google News Reuters,"Air Canada, flight attendants deadlocked with strike looming - Reuters",https://news.google.com/rss/articles/CBMiugFBVV95cUxNNXdORUcwZkFyNkZtd28wclNCZHlqOXJDOTEzeDF3VWdWZl9ucjQwS0FDSDVxc1duVHZxSFhlZzNUUG1iQmNOYlB3UmZxMjRZV1EzaWY5b3l3WlBiZGR4OXQ2VVBFZDR3WWZvUVJhRzAyN0ZkSlpGODQwdmx1XzZLeTlHYlZQN2stU1p3Y0xSTVlGNTltRUtfSF95ajlBMy1ZS0ZlWlNnVGdRc09BM1pRZ3cxNGtaWmlEd1E?oc=5,"Sat, 16 Aug 2025 01:10:00 GMT",
2025-08-16T01:43:07,Google News Reuters,Oil settled nearly $1 lower as Trump-Putin talks loom - Reuters,https://news.google.com/rss/articles/CBMiowFBVV95cUxNc1M4RXpDRUNaa2d0T2lVSEl1WTRjZkFpcXhCdy05X2YyN21rNzM1cU9HNWhOdjBaalUyQ3RYM3l3OEw5cWtvSjY5RnFNZjR3UjRwMWJlTFR2cFIyc2JoVVBjdmd2MjN2SGR1LWhGZEFGNy0xekdCV29WX1JvQTNDc2d5amZ1WFVmNHhKVkN6ci1CZGx0eDNBRzlBTU1tNzJTd0FJ?oc=5,"Fri, 15 Aug 2025 19:08:20 GMT",
2025-08-16T01:43:07,Google News Reuters,Exclusive: US mulled use of Russia icebreakers for gas development ahead of summit-sources - Reuters,https://news.google.com/rss/articles/CBMivgFBVV95cUxOaVFfdW1abFQwWHVJb3N3RmhwdlphX09PUGV3Z2Yyc2hseU1DaGliRExUUFhVTWswcmFoMjc2SVk3MjJ0WkVldGs0dElKTVJ5V3diNHloOW1pR0JMOG94ZEtyMU1ZdDJ1V2FtUFV0U3NHZFhFZE14MlRMVFYyNWVXd3ppWHd2cDZzU0d3eFlVNEV6MFR6bTI2bThnTEk4bXZFVWlUUGdZcDZRa1B5Wm9TWnZPcXdGTFVGWlpUNHZn?oc=5,"Fri, 15 Aug 2025 19:23:26 GMT",
2025-08-16T01:43:07,Google News Reuters,"Dow ends higher after UnitedHealth gains, other indexes slip on rate cut uncertainty - Reuters",https://news.google.com/rss/articles/CBMiwwFBVV95cUxPYnplR1k1dXQxamVQX01aZ2I4WnczeVVlWXBDVFRQblJFS0pvY01NRi00cmVRTWhSbUpfd25BMzV6RWFKQ21mTGh0Sk1nNDNlc3hUWG5jeGE2MUEzOW93NDVQemt5LU5ULW91NnY4c2JodDdaSE40V3Mtek4wU2VHUGpuQlppd25jS21tSEVUV01XUTlpeFN4Wk85ZDBmTy1xZlEySmFTSElkbkFWRmpVeFB4d21kN2NucHFhdHROZm1xRm8?oc=5,"Fri, 15 Aug 2025 23:02:02 GMT",
2025-08-16T01:43:07,Google News Reuters,U.S. Senator Hawley launches probe into Meta AI policies - Reuters,https://news.google.com/rss/articles/CBMioAFBVV95cUxQOEx5V1pYWWY2X3BsaVNHTW5wdEltLTU0bHpWYzZOTlhTeFltWXl5TWluYUFfLXFwbEV1UWdIVzYtMS1qcjFtOUtpck5hMVJJcndiX1g2emlFUDk5NUFURnM2QXJNV0h4U2lXOE4zMFVXSHVTSnBBN0ZBU3oxNUJwanR5aUJyaGVoc1dqQWYyZmlUTzVfa05ka3ZSUFJXb2JC?oc=5,"Fri, 15 Aug 2025 18:47:15 GMT",
2025-08-16T01:43:07,Google News Reuters,"One killed, several injured after train derails in Denmark - Reuters",https://news.google.com/rss/articles/CBMipgFBVV95cUxNNkpFTXBQMmNzYjBsTTU1SXFjQ00xa01QUktTTWtKSjljLTF4TXNLT0hlV2lXay1ZWDNXSENmQmhkT2g5Ri1xandsRmhvbXItaURFMnJJc3ZaTUtHR3JKRm9ib2FSVkpGbUpScXcwWlVHTXdYNDFqS25fY3ZUdDJlTTBQSkJDM1Y1OThxNDllV0cwQ2p0LWxVUUc2My04Y1pfSTZubWln?oc=5,"Fri, 15 Aug 2025 19:10:44 GMT",
2025-08-16T01:43:07,Google News Reuters,"Trump heads to Alaska summit with Putin, says he wants Ukraine ceasefire 'today' - Reuters",https://news.google.com/rss/articles/CBMiwAFBVV95cUxQS3J3Xy1fQUFCQjRDNHJwUG5ra1NNWkp5Y0x2d1RjclQ1M0MxcVdidXZ3a0UycXlrVlU3a1p5VXp6WnFteTlQcmI3eW85bjVKdU1LMExVTmZIRFF4eUt6eWpYRHlPZjRNVU1sZ0VzTm1nd3V2QjZJTlBNYmJtME1HNV9iWFJ4YzZfeHdVN0xoVXVYN1NKWkZWazNPUXdzNFJrdWRUS0d1TEZyWkNORHFVVXJLbVpibzlqaE55VUZZd1k?oc=5,"Fri, 15 Aug 2025 17:23:22 GMT",
2025-08-16T01:43:07,Google News Reuters,"Brazil is open for business, Lula says at Chinese factory opening - Reuters",https://news.google.com/rss/articles/CBMiwAFBVV95cUxQbHhtYlJqR2pqTHI5VXhhWmtuY01pQkhiR3c0VktWR2VjNHFwNkllMkd5bnJFa0Vfc2c5RGROcFYxX0EwR3U1T2RaTFpEZjlEdU5RM3hYZ0xJa0RneWFiZU9NMjFvNGdwYXNUZzhLNy1uRnZtZ3R3dEtLeTBZSkZWUS1HWmotaEx5MndhcWpuUF9IUk1JRGlQRXBJZ2lfNXRIS3BKZHRkWXExUE04cTVZVDB6Z1BSdGQ3a2FNaGJidVA?oc=5,"Fri, 15 Aug 2025 22:11:20 GMT",
2025-08-16T01:43:07,Google News Reuters,Highlights of Putin statement after summit with Trump - Reuters,https://news.google.com/rss/articles/CBMioAFBVV95cUxQVFVJRlhxYzRXaUFqVlE1SmNrb1ZMNHBiaWMzR0hwYTdRYnNEcU9iWFhnc2t2VVo1aGt0aUNlR3EwUVJ5YkVRMG1KM1FGdWZGRlJBc3J5SHJZeldWc3VBNnVWWFJqTE1HZENKWjZ5VHZEaE5zX3ItbTVLMnJLZWxkTEE5cTVXUGxabE1mc29nU3V1SUE2RVVrVXF6TTd4Qno2?oc=5,"Sat, 16 Aug 2025 00:29:00 GMT",
2025-08-16T01:43:07,Google News Reuters,Dollar eases as data keep September rate cut on track; eyes on Trump-Putin meeting - Reuters,https://news.google.com/rss/articles/CBMixAFBVV95cUxNdWd4YVZLWWdMekRMQk5sSDZfclNvdHpNRlFESERYLW5uVXktekd3NlZ4Ujc2d01PTmdyd2J2d1Fxb2FzX0FKb3JsbHdfQUdJTUFYRm5US2pPd2ZKaTB6Z2dwUWdmX1pWRWlZU2RXYU5iUGJtdG9JUnVHeWV5U3dMSjNRUGR2dEhYaVpaYnhuNXNpUTBfdU5JclQybGtxQmswMTJXZnNheTJ0dGJoOTZ3Uzc3dEFVVUt6cjJmWEtpYXlQdTFn?oc=5,"Fri, 15 Aug 2025 19:27:23 GMT",
2025-08-16T01:43:07,Google News Reuters,"European shares log second weekly gain, focus on Trump-Putin talks - Reuters",https://news.google.com/rss/articles/CBMiswFBVV95cUxOV0Nlc28xTk1WQVI1NG15R1A2LTRYNDFRTGg3MkRLb29NdzhnWHZ2R2ltczVwbFhwZWtycnF3RUs0N3c2al9UU3VKQUFLS0JEcXczUTVScXlpUVh6cTMyZnFOUlhob0Uxc1EtdGZ3MVg1Q3JkNmxWNjgtVkMzdXZIbnk1SGNsWWs0QW1BMGkyS0tUNDMxU0gyTWpLQktnSjJYTG5DNFkzT1l6UXNGd3VMSWdSQQ?oc=5,"Fri, 15 Aug 2025 17:00:59 GMT",
2025-08-16T01:43:07,Google News Reuters,Chinese diplomat appears at Beijing event after Reuters report of questioning - Reuters,https://news.google.com/rss/articles/CBMiuwFBVV95cUxNQ2dlakVLYnFsX3FJS0hWX3RUOGZNeEhqOFBoeXFIVENQQzVhUzNMZ0RSWDJPQUxQNUJFX0Z2d1N4ZldyUlhoX20zNG5LUVNZbVgxd096d2E4bEZiNDhhS2FQUkt2RXNIOWVHa0dSeENlTDNlTlpfbGZWUWM4cFJZMEh0TXlZZEYxbG5CM0JMQkgwNVBacGNLWG1ZM2tOQ0YyaDlFZ0VmajZCbV9vLXNUSk1tc0EtUXBSV0Nj?oc=5,"Fri, 15 Aug 2025 16:46:29 GMT",
